 रत्नगुणसंचयगाथा । ॐ नमो भगवत्यै आर्यप्रज्ञापारमितारत्नगुणसंचयगाथायै । नमो आर्यमञ्जुश्रिये ।	༄༡༨༩ཨ་། །རྒྱ་གར་སྐད་དུ་། ཨའརྱ་པྲ་ཛཉའ་པ་ར་མི་ཏ་སཉཙ་ཡ་ག་ཐའ་། བོད་སྐད་དུ་། འཕགས་པ་ཤེས་རབ་ཀྱི་ཕ་རོལ་ཏུ་ཕྱིན་པ་སྡུད་པ་ཚིགས་སུ་བཅད་པ་། སངས་རྒྱས་དང་བྱང་ཆུབ་སེམས་དཔའ་ཐམས་ཅད་ལ་ཕྱག་འཚལ་ལོ་༎
 ये चापि पञ्च इमि पारमिता जिनानाम् एते ऽपि धर्म परिकीर्तित नाममात्राः । परिणामयाति न च मन्यति बोधिसत्त्वो न च हीयते स्पृशति उत्तमबुद्धबोधिम् ॥ र्ग्स्_१८।८ ॥ भगवत्यां रत्नगुणसंचयगाथायां शून्यतापरिवर्तो नामाष्टादशमः	ཆོས་དེ་རྣམས་ཀྱང་མིང་ཙམ་དུ་ནི་ཡོངས་སུ་བསྒྲགས་༎ ཡོངས་བསྔོ་རློམ་སེམས་མེད་པའི་བྱང་ཆུབ་སེམས་དཔའ་ནི་༎ ཉམས་པ་མེད་ཅིང་སངས་རྒྱས་བྱང་ཆུབ་མཆོག་རེག་འགྱུར༏་འབྲུ་མར་སྙིང་པོ་འབར་བ་འཕྲད་པ་དང་པོ་ཡིས་༎ སྙིང་པོ་ཚིག་མིན་དེ་མེད་པར་ཡང་དེ་མི་ཚིག་།
 तैलस्य वर्ति ज्वलिता प्रथमे निपाते न च दग्ध वर्ति असता न विना य दग्धा । न हि अर्चि पश्चिमनिपात स वर्ति दग्धा असता पि पश्चिम न दह्यति दीपवर्ति ॥ र्ग्स्_१९।१ ॥	མེ་ལྕེ་ཕྲད་པ་ཐམས་སྙིང་པོ་ཚིག་མིན་ལ་༎ མེ་ལྕེ་ཐ་མ་མེད་པར་སྙིང་པོ་ཚིག་མིན་ལྟར་༎
 प्रथमेव चित्त स्पृशती न च अग्रबोधिम् असता न तस्य स्पृशता पुन शक्य भोन्ति ।	དང་པོའི་སེམས་ཀྱིས་བྱང་ཆུབ་མཆོག་རེག་མ་ཡིན་ལ་༎ དེ་མེད་པར་ཡང་དེ་ལ་རེག་པར་ནུས་མ་ཡིན་༎ ཐ་མའི་སེམས་ཀྱིས་བྱང་ཆུབ་ཞི་བ་ཐོབ་མིན་ལ་༎
 न च चित्त पश्चिम शिवामनुप्रापुणाति असता न तस्य पुन प्रापणनाय शक्यम् ॥ र्ग्स्_१९।२ ॥	དེ་མེད་པར་ཡང་དེ་འཐོབ་ནུས་པ་མ་ཡིན་ནོ་༎
 बीजातु स्तम्ब फल पुष्प समागमन्ति सो वानिरुद्ध असतो न हि तस्य वृक्षो ।	ས་བོན་ལས་ནི་མྱུ་གུ་མེ་ཏོག་འབྲས་བུ་འབྱུང༏་༏དེ་ཡང་འགག་ལ་ཤིང་ཡང་མེད་པ་དེ་མིན་ལྟར་༎ 
 एमेव चित्त प्रथमं तु निदान बोधेः सो वा निरुद्ध असतो न हि तस्य बोधिः ॥ र्ग्स्_१९।३ ॥ बीजं प्रतीत्य च भवेद्यवशालिकादेस् तत्तत्फलं न च तदस्ति न चापि नास्ति । उत्पत्तितो भवति बोधिरियं जिनानां भावस्वभावविगता भवतीह माया ॥ र्ग्स्_१९।४ ॥	དེ་བཞིན་དང་པོའི་སེམས་ཀྱང་བྱང་ཆུབ་རྒྱུ་ཡིན་ཏེ་༎ དེ་ཡང་འགག་ལ་བྱང་ཆུབ་མེད་པ་དེ་མ་ཡིན་༎
 उदकबिन्दु कुम्भ परिपूर्यति स्तोकस्तोकं प्रथमे निपाति अनुपूर्व स पश्चिमेन ।	ཆུ་ཡི་ཐིགས་པས་བུམ་པ་དང་པོ་ཐ་མའི་བར་༎ རིམ་གྱིས་ཉུང་དུ་ཉུང་དུས་དེ་ཡོངས་འགེངས་པ་ལྟར་༎
 एमेव चित्त प्रथमं वरबोधिहेतुर् अनुपूर्व शुक्लगुणपूर्ण भवन्ति बुद्धाः ॥ र्ग्स्_१९।५ ॥	དེ་བཞིན་དང་པོའི་སེམས་ཀྱང་བྱང་ཆུབ་མཆོག་རྒྱུ་སྟེ་༎ རིམ་གྱིས་དཀར་པོའི་ཡོན་ཏན་རྫོགས་པའི་སངས་རྒྱས་འགྱུར་༎
 शून्यानिमित्तप्रणिधिं चरमाणु धर्मा न च निर्वृतिं स्पृशति नो च निमित्तचारी ।	སྟོང་པ་མཚན་མེད་སྨོན་པ་མེད་པར་ཆོས་སྤྱོད་ཅིང་༎ མྱ་ངན་འདས་ལ་མི་རེག་མཚན་མར་མི་སྤྱོད་པ་༎ དཔེར་ན་མཉན་པ་༄༢༠༣ཨ་༌༎
 यथ नाविको कुशल गच्छति आरपारम् उभयान्ति अस्थितु न तिष्ठति अर्णवेस्मिन् ॥ र्ग्स्_१९।६ ॥	མཁས་པ་ཕར་འགྲོ་ཚུར་འགྲོ་ཡང་༎ མཐའ་གཉིས་མི་གནས་རྒྱ་མཚོར་གནས་པ་མེད་པ་བཞིན་༎ དེ་ལྟར་སྤྱོད་པའི་བྱང་ཆུབ་སེམས་དཔའ་འདི་སྙམ་བདག་།
 एवं चरन्तु न च मन्यति बोधिसत्त्वो अहु व्याकृतो दशबलेहि स्पृशेय बोधिम् ।	སྟོབས་བཅུས་ལུང་བསྟན་བྱང་ཆུབ་རེག་འགྱུར་རློམ་སེམས་མེད་༎
 न च त्रासु बोधि भवते न इहास्ति किंचिद् एवं चरन्तु चरती सुगतान प्रज्ञाम् ॥ र्ग्स्_१९।७ ॥	འདི་ལ་ཅི་ཡང་མེད་ཅེས་བྱང་ཆུབ་སྐྲག་པ་མེད་༎ དེ་ལྟར་སྤྱོད་པ་བདེ་གཤེགས་ཤེས་རབ་སྤྱོད་པ་ཡིན་༎
 कान्तारमार्गि दुरभिक्षि सव्याधि लोकां पश्यित्व नास्ति भय उत्तरि संनहन्ते ।	འཇིག་རྟེན་དགོན་པའི་ལམ་དང་མུ་གེ་ནད་བཅས་པར་༎ མཐོང་ནས་སྐྲག་པ་མེད་ཅིང་དེ་ནས་གོ་གྱོན་ཏེ་༎
 अपरान्तकोटि सद युक्त प्रजानमानो अणुमात्र खेद मनसो न उपादियाति ॥ र्ग्स्_१९।८ ॥ भगवत्यां रत्नगुणसंचयगाथायां गङ्गदेवाभगिनीपरिवर्तो नामैकान्नविंशतिमः ॥	ཕྱི་མའི་མུ་མཐར་རྟག་ཏུ་བརྩོན་ཞིང་རབ་ཤེས་ནས་༎ ཡོངས་སུ་སྐྱོ་བའི་ཡིད་ནི་རྡུལ་ཙམ་སྐྱེད་མི་བྱེད་༎
 पुन बोधिसत्त्व चरमाणु जिनान प्रज्ञां अनुपाद स्कन्ध इमि जानति आदिशून्यान् ।	བྱང་ཆུབ་སེམས་དཔའ་རྒྱལ་པའི་ཤེས་རབ་སྤྱོད་བྱེད་ཅིང་༎ ཕུང་པོ་འདི་དག་གདོད་ནས་སྟོང་ཞིང་སྐྱེ་མེད་ཤེས་༎
 असमाहितो करुण प्रेक्षति सत्त्वधातुम् अत्रान्तरे न परिहायति बुद्धधर्मान् ॥ र्ग्स्_२०।१ ॥	མཉམ་པར་མ་བཞག་སེམས་ཅན་ཁམས་ལ་སྙིང་རྗེ་འཇུག་། བར་སྐབས་དེར་ཡང་སངས་རྒྱས་ཆོས་ལས་ཡོངས་མི་ཉམས་༎
 पुरुषो यथा कुशल सर्वगुणैरुपेतो बलवान् दुधर्षु कृतयोग्य कलाविधिज्ञो ।	དཔེར་ན་སྐྱེས་བུ་མཁས་པ་ཡོན་ཏན་དང་ལྡན་ཞིང་༎ སྟོབས་ལྡན་མི་ཐུབ་བརྩོན་བྱས་སྒྱུ་རྩལ་ཆོག་ཤེས་༎
 इष्वस्त्रपारमिगतो पृथुशिल्पयुक्तो मायाविधिज्ञपरमो जगदर्थकामो ॥ र्ग्स्_२०।२ ॥	འཕོང་དང་བཟོ་གནས་མང་པོའི་ཕ་རོལ་ཕྱིན་གྱུར་ཅིང་༎ སྒྱུ་མ་སྒྲུབ་ཤེས་འགྲོ་དོན་རབ་ཏུ་འདོད་པ་ཞིག་།
 माता पिता च परिगृह्य सपुत्रदारं कान्तारमार्गि प्रतिपद्य बहूअमित्रो ।	ཕ་དང་མ་དང་ཆུང་མར་བཅས་པ་ཡོངས་བསྡུས་ནས་༎
 सो निर्मिणित्व पुरुषान् बहु शूरवीरान् क्षेमेण गत्व पुन गेहमुपागमेय्या ॥ र्ग्स्_२०।३ ॥	དག་བྱེད་མང་བ་དགོན་པའི་ལམ་དུ་ཕྱིན་པ་དང་༎ དེ་ཡིས་དཔའ་ཞིང་རྟུལ་ཕོད་སྐྱེས་བུ་མང་?་སྤྲུལ་ཏེ་༎ བདེ་བར་སོང་ཞིང་ཕྱིར་ཡང་ཁྱིམ་དུ་འོང་བ་ལྟར་༎
 एमेव यस्मि समये विदु बोधिसत्त्वो महमैत्रि सर्वि उपबन्धति सत्त्वधातौ ।	དེ་བཞིན་དེ་ཚེ་བྱང་ཆུབ་སེམས་དཔའ་མཁས་པ་ཡང་༎ ༄༢༠༣བ་སེམས་ཅན་ཁམས་རྣམས་ཀུན་དུ་སྙིང་རྗེ་ཆེ་བསྐྱེད་ཅིང་༎
 चतुरो स मार अतिक्रम्य द्वये च भूमिम् अस्मिन् समाधि स्थितु नो च स्पृशाति बोधिम् ॥ र्ग्स्_२०।४ ॥	བདུད་བཞི་དག་དང་ས་གཉིས་ལས་ཀྱང་རབ་འདས་ནས་༎ ཏིང་འཛིན་མཆོག་ལ་གནས་ཤིང་བྱང་ཆུབ་རེག་མི་བྱེད་༎
 आकाशनिश्रित समीरण आपस्कन्धो त हि निश्रिता इह महापृथिवी जगच्च ।	མཁའ་ལ་རླུང་བརྟེན་དེ་ལ་ཆུ་ཡི་ཕུང་པོ་བརྟེན་༎ དེ་ལ་ས་ཆེན་འདི་བརྟེན་དེ་ལ་འགྲོ་བ་བརྟེན་༎ སེམས་ཅན་ལས་ལ་སྤྱོད་པའི་རྒྱུ་ནི་དེ་འདྲ་སྟེ་༎
 सत्त्वान कर्मौपभोगनिदानमेव आकाशस्थानु कुतु चिन्तयि एतमर्थम् ॥ र्ग्स्_२०।५ ॥	ནམ་མཁའ་གང་ལ་གནས་ཡིན་དོན་འདི་བསམ་པར་གྱིས་༎ དེ་བཞིན་བྱང་ཆུབ་སེམས་དཔའ་སྟོང་པ་ཉིད་གནས་པ་༎ འགྲོ་ལ་སེམས་ཅན་ཤེས་པའི་སྨོན་ལམ་བརྟེན་ཅན་གྱི་༎
 एमेव शून्यतप्रतिष्ठितु एष सत्त्वो जगति क्रियां विविध दर्शयते विचित्राम् । सत्त्वान ज्ञानप्रणिधानअधिष्ठानमेव न च निर्वृतिं स्पृशति शून्यत नास्ति स्थानम् ॥ र्ग्स्_२०।६ ॥	བྱ་བ་རྣམ་པ་སྣ་ཚོགས་དུ་མ་སྟོན་བྱེད་ཅིང་༎ མྱ་ངན་འདས་ལ་མི་རེག་སྟོང་པར་གནས་པ་མེད་༎
 यस्मिंश्च कालि विदु पण्डितु बोधिसत्त्वो चरती इमां प्रवर शून्य समाधि शान्ताम् ।	གང་གི་ཚེ་ན་བྱང་ཆུབ་སེམས་དཔའ་མཁས་གསལ་བ་༎ སྟོང་པ་ཞི་བའི་ཏིང་འཛིན་དམ་པ་འདི་སྤྱོད་པ་༎ བར་སྐབས་དེར་ནི་མཚན་མ་རབ་ཏུ་སྒོམ་མི་བྱེད་༎
 अत्रान्तरे न च निमित्त प्रभावितव्यो न च आनिमित्तस्थितु शान्त प्रशान्तचारी ॥ र्ग्स्_२०।७ ॥	མཚན་མ་མེད་པར་གནས་ཤིང་ཞི་ལ་རབ་ཞི་སྤྱོད་༎ བར་སྣང་འཕུར་བའི་བྱ་ལ་གནས་ཡོད་མ་ཡིན་ཏེ་༎
 पक्षिस्य नास्ति पदु गच्छत अन्तरीक्षे नो चापि तत्र स्थितु नो च पताति भूमौ ।	དེ་ན་གནས་པ་མ་ཡིན་ས་ལ་ལྷུང་མི་འགྱུར་༎
 तथ बोधिसत्त्व चरमाणु विमोक्षद्वारे न च निर्वृतिं स्पृशति नो च निमित्तचारी ॥ र्ग्स्_२०।८ ॥	དེ་ལྟར་བྱང་ཆུབ་སེམས་དཔའ་རྣམ་ཐར་སྒོར་སྤྱོད་པ༏་༏མྱ་ངན་འདས་ལ་མི་རེག་མཚན་མར་སྤྱོད་མ་ཡིན་༎ 
 इष्वस्त्रशिक्षित यथा पुरुषोध काण्डं क्षेपित्व अन्य पुन काण्ड परस्परेण ।	དཔེར་ན་འཕོང་བསླབ་སྐྱེས་བུས་གནམ་དུ་མདའ་འཕངས་ཏེ་༎ མདའ་གཞན་དག་ནི་ཕྱི་བཞིན་བརྒྱུད་མར་ཡོང་བཏགས་ཏེ་༎
 पतनाय तस्य पुरिमस्य न देय भूमिम् आकाङ्क्षमाण पुरुषस्य पतेय काण्डम् ॥ र्ग्स्_२०।९ ॥	སྔ་མའི་མདའ་དེ་ས་ལ་ལྟུང་བའི་སྐབས་མི་འབྱེད་༎ མི་དེ་འདོད་ན་མདའ་དེ་ས་ལ་ལྟུང་བར་འགྱུར་༎ དེ་ལྟར་ཤེས་རབ་ཕ་རོལ་ཕྱིན་པ་མཆོག་སྤྱོད་པ་༎
 एमेव प्रज्ञवरपारमितां चरन्तो प्रज्ञा उपाय बल ऋद्धि विचारमाणो ।	ཤེས་རབ་ཐབས་སྟོབས་རྫུ་འཕྲུལ་གྱིས་༄༢༠༤ཨ་༌༎ ནི་རྣམ་སྤྱོད་པ་༎
 तावन्न तां परमशून्यत प्रापुणोति यावन्न ते कुशलमूल भवन्ति पूर्णाः ॥ र्ग्स्_२०।१० ॥	དེ་དག་དགེ་བའི་རྩ་བ་ཇི་སྲིད་མ་རྫོགས་པ་༎ དེ་སྲིད་སྟོང་ཉིད་དམ་པ་དེ་ནི་ཐོབ་མི་བྱེད་༎ དཔེར་ན་དགེ་སློང་རྫུ་འཕྲུལ་སྟོབས་མཆོག་ལྡན་པ་ཞིག་།
 भिक्षू यथा परमऋद्धिबलेनुपेतो गगने स्थितो यमक कुर्वति प्रातिहार्यां ।	ནམ་མཁར་གནས་ཏེ་གཅིག་ཅར་ཆོ་འཕྲུལ་རྣམ་པར་འཕྲུལ་༎
 गतिचंक्रमं शयनिषद्य निदर्शयाति न निवर्तते न पि च खिद्यति याव तत्र ॥ र्ग्स्_२०।११ ॥	འགྲོ་དང་འཆག་པ་དང་ནི་ཉལ་དང་འདུག་པ་སྟོན་༎ དེ་ནི་སྐྱོ་བ་མེད་ཅིང་དེ་ལ་དུབ་པ་མེད་༎
 एमेव शून्यतस्थितो विदु बोधिसत्त्वो ज्ञानर्द्धिपारमिगतो अनिकेतचारी ।	དེ་བཞིན་བྱང་ཆུབ་སེམས་དཔའ་མཁས་པ་སྟོང་གནས་ཤིང་༎ ཡེ་ཤེས་རྫུ་འཕྲུལ་ཕ་རོལ་སོན་ལ་གནས་པ་མེད་༎ འགྲོ་བ་དག་ལ་བྱ་བ་རྣམ་པ་མཐའ་ཡས་སྟོན་༎
 विविधां क्रियां जगति दर्शयते अनन्तां न च भज्यती न पि च खिद्यति कल्पकोटी ॥ र्ग्स्_२०।१२ ॥	བསྐལ་པ་བྱེ་བར་སྐྱོ་བ་མེད་ཅིང་དུབ་པ་མེད༏་༏དཔེར་ན་མི་འགའ་ག-ཡང་ས་ཆེན་པོར་འདུག་བྱེད་ཅིང་༎ 
 पुरुषा यथा महप्रपाति स्थिहित्व केचिद् उभि पाणि छत्रद्वय गृह्ण उपक्षयेय्या ।	ལག་པ་གཉི་གས་གདུགས་གཉིས་འཛིན་ཅིང་ནམ་མཁའ་ལ་༎ མཆོང་བར་བྱེད་ཅིང་ག-ཡང་ས་ཆེན་པོར་ལུས་བོར་ན་།
 आकालि वायुरवसृज्य महाप्रपाते नो च प्रपात पतियाति न याव तत्र ॥ र्ग्स्_२०।१३ ॥	ལྟུང་བར་མི་འགྱུར་ཇི་སྲིད་དེར་ནི་འགྲོ་བར་འགྱུར་༎
 एमेव स्थित्व करुणां विदु बोधिसत्त्वो प्रज्ञाउपायद्वयछत्रपरिगृहीतो ।	དེ་བཞིན་བྱང་ཆུབ་སེམས་དཔའ་མཁས་པ་སྙིང་རྗེར་གནས་༎ ཐབས་དང་ཤེས་རབ་གཉིས་ཀྱི་གདུགས་ནི་ཡོངས་བཟུང་སྟེ་༎ ཆོས་རྣམས་སྟོང་པ་མཚན་མེད་སྨོན་པ་མེད་རྟོག་ཅིང་༎
 शून्यानिमित्तप्रणिधिं विमृषाति धर्मान् न च निर्वृतिं स्पृशति पश्यति धर्मचारी ॥ र्ग्स्_२०।१४ ॥	མྱ་ངན་འདས་ལ་རེག་པ་མེད་ལ་ཆོས་ཀྱང་མཐོང་༎
 रतनार्थिको यथ व्रजित्वन रत्नद्वीपं लब्ध्वान रत्न पुन गेहमुपागमेय्या ।	དཔེར་ན་རིན་ཆེན་འདོད་པ་རིན་ཆེན་གླིང་སོང་སྟེ་༎ རིན་ཆེན་རྙེད་ནས་ཕྱིར་ཡང་ཁྱིམ་དུ་འོངས་འགྱུར་བ་༎
 किंचापि तत्र सुख जीवति सार्थवाहो अपि दुःखितो मनसि भोति स जातिसंघो ॥ र्ग्स्_२०।१५ ॥	དེར་ནི་དེད་དཔོན་འབའ་ཞིག་བདེ་བར་འཚོ་བྱེད་ཅིང་༎ གཉེན་བཤེས་ཚོགས་ཡིད་མི་བདེར་འཇོག་པ་མིན་པ་ལྟར་༎
 एमेव शून्यत व्रजित्वन रत्नद्वीपं लब्ध्वान ध्यान बल इन्द्रिय बोधिसत्त्वो ।	དེ་བཞིན་བྱང་ཆུབ་སེམས་དཔའ་སྟོང་ཉིད་རིན་༄༢༠༤བ་གྱི༏་༏གླིང་དུ་སོང་སྟེ་བསམ་གཏན་དབང་པོ་སྟོབས་ཐོབ་པ་༎ 
 किंचापि निर्वृति स्पृशेदभिनन्दमानो अपि सर्वसत्त्व दुखिता मनसी भवन्ति ॥ र्ग्स्_२०।१६ ॥	མྱ་ངན་འདས་ལ་རེག་པ་འབའ་ཞིག་མངོན་དགའ་ཞིང་༎ སེམས་ཅན་སྡུག་བསྔལ་ཡིད་དུ་འཇོག་པར་འགྱུར་མ་ཡིན༏་༏་དཔེར་ན་དོན་གཉེར་ཚོང་པ་རྒྱུས་ཤེས་བྱ་བའི་ཕྱིར་༎ 
 अभ्यन्तरे य नगरे निगमे च ग्रामे कामार्थ वाणिजु यथा गमि जाननाय ।	བར་གྱི་གྲོང་ཁྱེར་གྲོང་རྡལ་གང་ཡིན་བདེ་བར་འགྲོ་།
 नो चापि तत्र स्थिहती न च रत्नद्वीपे न च गेह मार्गि कुशलो पुन भोति विज्ञो ॥ र्ग्स्_२०।१७ ॥	དེར་ཡང་མི་གནས་རིན་ཆེན་གླིང་དུའང་མི་གནས་ལ་༎ རིག་པ་ཁྱིམ་དུ་མི་གནས་མ་ལ་མཁས་པར་འགྱུར་༎
 तथ ज्ञान श्रावकविमुक्तिसप्रत्ययानां सर्वत्र भोति कुशलो विदु बोधिसत्त्वो ।	དེ་བཞིན་བྱང་ཆུབ་སེམས་དཔའ་གསལ་དེ་ཉན་ཐོས་དང་༎ རང་རྒྱལ་རྣམས་ཀྱི་ཤེས་པ་རྣམ་གྲོལ་ཀུན་ལ་མཁས་༎
 नो चापि तत्र स्थिहते न च बुद्धज्ञाने न च संस्कृते भवति मार्गविदू विधिज्ञो ॥ र्ग्स्_२०।१८ ॥	དེ་ལ་མི་གནས་སངས་རྒྱས་ཡེ་ཤེས་གནས་མ་ཡིན་༎ འདུས་མ་བྱས་ལ་མི་གནས་ལམ་གྱི་ཚུལ་ཤེས་ཡིན་༎
