 रत्नगुणसंचयगाथा । ॐ नमो भगवत्यै आर्यप्रज्ञापारमितारत्नगुणसंचयगाथायै । नमो आर्यमञ्जुश्रिये ।	༄༡༨༩ཨ་། །རྒྱ་གར་སྐད་དུ་། ཨའརྱ་པྲ་ཛཉའ་པ་ར་མི་ཏ་སཉཙ་ཡ་ག་ཐའ་། བོད་སྐད་དུ་། འཕགས་པ་ཤེས་རབ་ཀྱི་ཕ་རོལ་ཏུ་ཕྱིན་པ་སྡུད་པ་ཚིགས་སུ་བཅད་པ་། སངས་རྒྱས་དང་བྱང་ཆུབ་སེམས་དཔའ་ཐམས་ཅད་ལ་ཕྱག་འཚལ་ལོ་༎
 एमेव बोधिवरप्रस्थित रत्नतुल्यो प्रज्ञाय पारमित योगु न रिञ्चितव्यो ।	དེ་ལྟར་བྱང་ཆུབ་མཆོག་ཞུགས་རིན་ཆེན་ལྟ་བུ་ཡི་༎ ཤེས་རབ་ཕ་རོལ་ཕྱིན་༄༢༠༧ཨ་༌༎ ལ་རྣལ་འབྱོར་དོར་མི་བྱ་༎
 रतनं व लब्ध्व गृहमाणु अभिन्नसत्त्वो अनुबुद्धयति त्वरितो शिवमभ्युपैति ॥ र्ग्स्_२२।१३ ॥ भगवत्यां रत्नगुणसंचयगाथायां कल्याणमित्रपरिवर्तो नाम द्वाविंशतितमः ॥	རིན་ཆེན་རྙེད་ནས་བླངས་ཏེ་རབ་ཏུ་བརྩོན་བཀྲིས་ནས་༎
 उदयाति सूर्यु विगताश्च मरीचिमाला विधमित्व सर्व तमसाकुलमन्धकारम् ।	མྱུར་དུ་འགྲོ་བར་བྱེད་པ་ཞི་བར་འགྱུར་བ་བཞིན་༎ ཉི་མ་སྤྲིན་དང་བྲལ་བའི་འོད་ཟེར་དྲ་བ་ཅན་༎ མུན་ནག་ཐིབས་པོའི་མུན་པ་ཐམས་ཅད་འཇོམས་འཆར་བ་༎
 अविभोन्ति सर्व क्रिमिजोतिकप्राणभूतां सर्वांश्च तारकगणानपि चन्द्रआभाम् ॥ र्ग्स्_२३।१ ॥ एमेव प्रज्ञवरपारमितां चरन्तो विधमित्व दृष्टिगहनं विदु बोधिसत्त्वो ।	སྲིན་བུ་མེ་ཁྱེར་སྲོག་ཆགས་འབྱུང་པོ་ཐམས་ཅད་དང་༎ སྐར་མའི་ཚོགས་དང་ཟླ་བའི་འོད་ཀུན་ཟིལ་གྱིས་གནོན་༎
 अभिभोन्ति सर्वजगती रहप्रत्ययांश्च शून्यानिमित्तचरितो पृथु बोधिसत्त्वो ॥ र्ग्स्_२३।२ ॥	དེ་བཞིན་བྱང་ཆུབ་སེམས་དཔའ་ཤེས་རབ་ཕ་རོལ་ཕྱིན་༎ མཆོག་སྤྱོད་སྟོང་བ་དང་ནི་མཚན་མ་མེད་སྤྱོད་པ་༎ མཁས་པས་ལྟ་བའི་ཐིབས་པོ་བཅོམ་ནས་འགྲོ་ཀུན་དང་༎ དགྲ་བཅོམ་རང་རྒྱལ་བྱང་ཆུབ་སེམས་མང་ཟིལ་གྱིས་གནོན་༎
 यथ राजपुत्र धनदायकु अर्थकामो सर्वेषु श्रेष्ठ भवते अभिगामिनीये ।	དཔེར་ན་རྒྱལ་པོའི་བུ་ཞིག་ནོར་སྟེར་དོན་འདོད་པ་༎ ཀུན་གྱི་གཙོ་བོར་གྱུར་ཏེ་མངོན་པར་འགྲོ་བྱ་འོས་༎
 स ह्येष एतरहि सत्त्व प्रमोचयाति प्रागेव राज्यस्थितु भेष्यति पट्टधारी ॥ र्ग्स्_२३।३ ॥	འདི་ནི་ད་ལྟར་ན་ཡང་སེམས་ཅན་མང་དགའ་བྱེད་༎ ཐབས་ཐོབ་གྱུར་ཏེ་རྒྱལ་སྲིད་གནས་ན་སྨོས་ཅི་དགོས་༎
 एमेव प्रज्ञचरितो विदु बोधिसत्त्वो अमृतस्य दायकु प्रियो मरुमानुषाणाम् । अयु एष एषति हि सत्त्वसुखाभियुक्तो प्रागेव याव स्थितु भेष्यति धर्मराजो ॥ र्ग्स्_२३।४ ॥ भगवत्यां रत्नगुणसंचयगाथायां शक्रपरिवर्तो नाम त्रयोविंशतितमः ॥	དེ་ལྟར་ཤེས་རབ་སྤྱོད་མཁས་བྱང་ཆུབ་སེམས་དཔའ་ཡང་༎ བདུད་རྩི་སྦྱིན་པར་བྱེད་ཅིང་ལྷ་དང་མི་རྣམས་དགའ༎ འདི་ནི་ད་ལྟར་ན་ཡང་སེམས་ཅན་མང་ཕན་བརྩོན་༎ ཆོས་ཀྱི་རྒྱལ་པོར་གནས་པར་གྱུར་ན་སྨོས་ཅི་དགོས་༎
 मारो ऽपि तस्मि समये भवते सशल्यो शोकातु दुःखितु अनन्तमनो ऽल्पस्थामो ।	དེ་ཡི་ཚེ་ན་བདུད་ནི་ཟུག་རྡུ་ལྡན་པར་འགྱུར་༎ མྱ་ངན་ཉམ་ཐག་སྡུག་བསྔལ་ཡིད་བདེ་ཉམ་ཆུང་བ་༎
 दिशदाह उल्क क्षिपते भयदर्शनार्थं कथमेष दीनमनसो भवि बोधिसत्त्वो ॥ र्ग्स्_२४।१ ॥	ཇི་ལྟར་བྱང་ཆུབ་སེམས་དཔའ་འདི་ཡིད་ནུར་འགྱུར་ཞེས་༎ འཇིགས་པ་བསྟན་ཕྱིར་ཕྱོགས་རྣམས་སྲེག་ཅིང་སྐར་མདའ་གཏོང་༎ ༄༢༠༧བ་གང་ཚེ་མཁས་པ་དེ་དག་བསམ་པ་རབ་ལྡན་ཞིང་༎
 [यथ ते भवन्ति विदु आशयसंप्रयुक्ता दिवरात्रि प्रज्ञवरपारमितार्थदर्शी] । तद कायचित्त खगपक्षिसतुल्यभूता अवतारु सो कुतु लभिष्यति कृष्णबन्धुः ॥ र्ग्स्_२४।२ ॥	ཉིན་མཚན་ཤེས་རབ་ཕ་རོལ་ཕྱིན་པ་མཆོག་དོན་ལྟ༏་༏དེ་ཚེ་ལུས་སེམས་དག་ནི་མཁའ་འགྲོ་བྱ་ལྟར་གྱུར་༎ ནག་པོའི་རྩ་ལག་རྣམས་ཀྱིས་གླགས་རྙེད་ག་ལ་འགྱུར་༎ གང་ཚེ་བྱང་ཆུབ་སེམས་དཔའ་འཐབ་དང་རྩོད་གྱུར་ཅིང་༎
 कलहाविवादुपगता यद बोधिसत्त्वा भोन्ति परस्परविरुद्धक रुष्टचित्ताः ।	ཕན་ཚུན་མི་མཐུན་ཁྲོས་པའི་སེམས་དང་ལྡན་གྱུར་པ་༎
 तद मार तुष्टु भवती परमं उदग्रो उभि एति दूर भविष्यन्ति जिनान ज्ञाने ॥ र्ग्स्_२४।३ ॥	དེ་ཚེ་བདུད་ནི་དགའ་ཞིང་མཆོག་ཏུ་ཉམས་བདེར་འགྱུར་༎ དེ་གཉིས་རྒྱལ་བའི་ཡེ་ཤེས་ལས་ནི་རིང་འགྱུར་སྙམ་༎ དེ་གཉིས་རིང་དུ་འགྱུར་ཞིང་ཤ་ཟ་འདྲ་བར་འགྱུར་༎ གཉི་ག་རང་གི་དམ་བཅས་ཉམས་པར་བྱེད་པར་འགྱུར་༎ སྡང་ཞིང་བཟོད་དང་བྲལ་ལ་བྱང་ཆུབ་ག་ལ་ཡོད་༎
 उभि एति दूरि भविष्यन्ति पिशाचतुल्या उभि एति आत्म करिष्यन्ति प्रतिज्ञहानिम् । दुष्टान क्षान्तिविकलान कुतो ऽस्ति बोधि तद मारु तुष्टु भवती नमुचीसपक्षो ॥ र्ग्स्_२४।४ ॥	དེ་ཚེ་བདུད་རྣམས་ཕྱོགས་དང་བཅས་ཏེ་དགའ་བར་འགྱུར་༎ ལུང་བསྟན་མ་ཐོབ་བྱང་ཆུབ་སེམས་དཔའ་གང་ཞིག་གིས་༎
 यो बोधिसत्त्व अयु व्याकृतु व्याकृतस्मिं चित्तं प्रदूषयि विवादु समारभेय्या ।	ལུང་བསྟན་ཐོབ་ལ་སེམས་ཁྲོས་རྩོད་པ་རྩོམ་བྱེད་ན་༎
 यावन्ति चित्तक्षणिका खिलदोषयुक्तास् तावन्त कल्प पुन संनहितव्य भोन्ति ॥ र्ग्स्_२४।५ ॥	ཐ་བ་སྐྱོན་ལྡན་སེམས་ཀྱི་སྐད་ཅིག་ཇི་སྙེད་པ་༎ དེ་སྙེད་བསྐལ་པར་གཞི་ནས་གོ་ཆ་བགོ་དགོས་སོ་༎
 अथ तस्युपद्यति मतीति अशोभना ति क्षान्तीय पारमित बोधि स्पृशन्ति बुद्धाः ।	སངས་རྒྱས་བཟོད་པའི་ཕ་རོལ་ཕྱིན་པས་བྱང་ཆུབ་རེག་། སེམས་འདི་བཟང་བ་མིན་སྙམ་དྲན་པ་སྐྱེད་བྱེད་ཅིང་༎
 प्रतिदर्शयाति पुन आयति संवराणि अपयाति वा स इह शिक्षति बुद्धधर्मे ॥ र्ग्स्_२४।६ ॥ भगवत्यां रत्नगुणसंचयगाथायामभिमानपरिवर्तो नाम चतुर्विंशतितमः ॥	སོ་སོར་འཆགས་པར་བྱེད་ཅིང་ཕྱིས་ཀྱང་སྡོམ་བྱེད་ལ་༎
 यो शिक्षमाणु न उपैति कहिंचि शिक्षां न च शिक्षकं लभति नापि च शिक्षधर्मान् ।	དགའ་བར་མི་བྱེད་འདི་ནི་སངས་རྒྱས་ཆོས་འདིར་སློབ་༎ གང་ཞིག་སློབ་ཚེ་བསླབ་པ་གང་ཡང་ཁས་མི་ལེན་༎
 शिक्षा अशिक्ष उभयो अविकल्पमानो यो शिक्षते स इह शिक्षति बुद्धधर्मे ॥ र्ग्स्_२५।१ ॥	སློབ་པ་པོ་དང་བསླབ་པའི་ཆོས་རྣམས་མི་དམིགས་ཤིང་༎ བསླབ་དང་བསླབ་པ་མ་ཡིན་འདི་གཉིས་མི་རྟོག་པ་༎ དེ་ལྟར་གང་སློབ་དེ་ནི་སངས་རྒྱས་ཆོས་འདིར་༄༢༠༨ཨ་༌༎ སློབ༏་༏བྱང་ཆུབ་སེམས་དཔའ་གང་ཞིག་དེ་ལྟའི་བསླབ་འདི་ཤེས་༎
 यो बोधिसत्त्व इमु जानति एव शिक्षां न स जातु शिक्षविकलो भवते दुशीलो ।	དེ་ནི་གཞན་ཡང་བསླབ་ཉམས་ཚུལ་ཁྲིམས་འཆལ་མི་འགྱུར་༎ དེ་ནི་སངས་རྒྱས་ཆོས་བརྙེས་བྱ་ཕྱིར་འདི་ལ་སློབ་༎
 आराधितेषु इह शिक्षति बुद्धधर्मं शिक्षातिशिक्षकुशलो ति निरूपलम्भो ॥ र्ग्स्_२५।२ ॥	དེ་ནི་བསླབ་ལ་མཁས་ཏེ་དེ་ནི་དམིགས་པ་མེད་༎ མཁས་པ་འོད་བྱེད་རྣམས་ཀྱིས་ཤེས་རབ་དེ་ལྟར་སློབ་༎
 शिक्षन्तु एव विदु प्रज्ञ प्रभंकराणां नोत्पद्यते अकुशलमपि एकचित्तम् ।	དགེ་བ་མ་ཡིན་སེམས་གཅིག་ཙམ་ཡང་སྐྱེད་མི་བྱེད་༎ ཉི་མ་མཁའ་ལ་འགྲོ་བའི་ཟེར་གྱིས་ཟིལ་གནོན་པའི་༎
 सूर्ये यथा गगनि गच्छति अन्तरीक्षे रश्मीगते न स्थिहते पुरतो ऽन्धकारम् ॥ र्ग्स्_२५।३ ॥	མདུན་གྱི་བར་སྣང་ལ་ནི་མུན་པ་མི་གནས་བཞིན་༎
 प्रज्ञाय पारमित शिक्षित संस्कृतानां सर्वेष पारमित भोन्तिह संगृहीताः ।	ཤེས་རབ་ཕ་རོལ་ཕྱིན་ལ་བསླབ་པ་བྱས་རྣམས་ཀྱི་༎ ཕ་རོལ་ཕྱིན་པ་ཐམས་ཅད་འདིར་ནི་འདུས་པར་འགྱུར་༎
 सत्कायदृष्टि यथ षष्टि दुवे च दृष्टी अन्तर्गतास्तथमि पारमिता भवन्ति ॥ र्ग्स्_२५।४ ॥	འཇིག་ཚོགས་ལྟ་བར་ལྟ་བ་དྲུག་ཅུ་གཉིས་འདུས་ལྟར་༎ དེ་བཞིན་ཕ་རོལ་ཕྱིན་པ་འདི་དག་འདུས་པར་གསུངས་༎
 यथ जीवितेन्द्रिय निरुद्धि य केचिदन्ये भोन्ती निरुद्ध पृथु इन्द्रिय यावदस्ति ।	དཔེར་ན་སྲོག་གེ་དབང་པོ་འགག་ན་དབང་པོ་གཞན་༎ གང་དག་ཇི་སྙེད་ཡོད་པ་ཐམས་ཅད་འགག་པར་འགྱུར་༎
 एमेव प्रज्ञचरिते विदु उत्तमानां सर्वेत पारमित उक्त य संगृहीता ॥ र्ग्स्_२५।५ ॥	དེ་ལྟར་ཤེས་རབ་སྤྱོད་པ་མཁས་པ་མཆོག་རྣམས་ཀྱི་༎ ཕ་རོལ་ཕྱིན་པ་ཐམས་ཅད་འདིར་ནི་འདུས་པར་གསུངས་༎
 ये चापि श्रावकगुणा तथ प्रत्ययानां सर्वेषु भोन्ति विदु शिक्षितु बोधिसत्त्वा ।	བྱང་ཆུབ་སེམས་མཁས་ཉན་ཐོས་ཡོན་ཏན་གང་དག་དང་༎ དེ་བཞིན་རང་རྒྱལ་ཡོན་ཏན་ཀུན་ལ་སློབ་བྱེད་ཅིང་༎
 नो चापि तत्र स्थिहतान स्पृहेति तेषाम् अयु शिक्षितव्यमति शिक्षति एतमर्थम् ॥ र्ग्स्_२५।६ ॥ भगवत्यां रत्नगुणसंचयगाथायां शिक्षापरिवर्तो नाम पञ्चविंशतिमः ॥	དེ་དག་དེ་ལ་མི་གནས་འདོད་པ་མི་བསྐྱེད་དེ་༎ འདི་ནི་བདག་གིས་བསླབ་བྱ་ཡིན་སྙམ་དེ་ཕྱིར་སློབ་༎
 अविवर्तियस्य वरबोधयि प्रस्थितस्य यो चित्तुपादु अनुमोदितु आशयेन ।	མི་ལྡོག་བྱང་ཆུབ་མཆོག་ལ་རབ་ཏུ་ཞུགས་པ་ཡི་༎ སེམས་བསྐྱེད་པ་ལ་བསམ་པ་ཐག་པས་ཡི་༄༢༠༨བ་རང་བ༏་༏སྟོང་གསུམ་རི་རབ་སྲང་ལ་གཞལ་བས་ཚད་གཟུང་རུང་༎ རྗེས་སུ་ཡི་རང་དགེ་བ་དེ་ནི་དེ་ལྟ་མིན་༎ དགེ་བ་དོན་གཉེར་ཕན་འདོད་སེམས་ཅན་ཇི་སྙེད་པ་༎
 त्रिसहस्र मेरु तुलयित्व सियाप्रमाणो न त्वेव तस्य कुशलस्यनुमोदनाये ॥ र्ग्स्_२६।१ ॥ यावन्त सत्त्व कुशलार्थिक मोक्षकामा सर्वेष भोन्ति अनुमोदितु पुण्यराशि ।	ཀུན་གྱི་བསོད་ནམས་ཕུང་པོ་ལ་ཡང་ཡི་རང་འགྱུར་༎
 सत्त्वर्थि ते जिनगुण अनन्त प्रापुणित्वा दास्यन्ति धर्म जगती दुखसंक्षयाये ॥ र्ग्स्_२६।२ ॥	དེ་ཕྱིར་དེ་དག་རྒྱལ་བའི་ཡོན་ཏན་ཐོབ་གྱུར་ནས་༎ སྡུག་བསྔལ་ཟད་པར་བྱ་ཕྱིར་འཇིག་རྟེན་ཆོས་སྦྱིན་བྱེད་༎
 यो बोधिसत्त्व अविकल्पकु सर्वधर्मान् शून्यानिमित्त परिजानति निष्प्रपञ्चान् ।	བྱང་ཆུབ་སེམས་དཔའ་གང་ཞིག་མི་རྟོག་ཆོས་རྣམས་ཀུན་༎ སྟོང་དང་མཚན་མ་མེད་དང་སྤྲོས་མེད་ཡོངས་ཤེས་པ་༎
 न च प्रज्ञ बोधि परिएषति आशयेन सो युक्त प्रज्ञवरपारमिताय योगी ॥ र्ग्स्_२६।३ ॥	དེ་ནི་ཤེས་རབ་གཉིས་ཀྱིས་བྱང་ཆུབ་ཚོལ་མི་བྱེད་༎ རྣལ་འབྱོར་པ་དེ་ཤེས་རབ་ཕ་རོལ་ཕྱིན་མཆོག་བརྩོན་༎
 आकाशधातु गगनस्य सिया विरोधो न हि तेन तस्य कुतु केनचिदेष प्राप्ता ।	ནམ་མཁའི་ཁམས་དེ་དང་ནི་ནམ་མཁའ་དེར་འགལ་བ་༎ ཡོད་པ་མ་ཡིན་གང་གིས་ཀྱང་ནི་དེ་མ་ཐོབ་༎
 एमेव प्रज्ञचरितो विदु बोधिसत्त्वो अभ्योवकाशसदृशो उपशान्तचारी ॥ र्ग्स्_२६।४ ॥	དེ་བཞིན་ཤེས་རབ་སྤྱོད་མཁས་བྱང་ཆུབ་སེམས་དཔའ་ཡང་༎ ནམ་མཁའ་ལྟ་བུ་ཡིན་ཏེ་ཉེ་བར་ཞི་བར་སྤྱོད་༎ སྐྱེ་བོའི་དབུས་ན་སྒྱུ་མའི་སྐྱེས་བུ་འདི་སྙམ་དུ་༎
 यथ मायकारपुरुषस्य न एव भोति ते शिष्य मां जनत सो च करोति कार्यम् ।	སྐྱེ་བོ་འདི་མགུ་བྱ་སྙམ་མི་སེམས་དེ་ཡང་བྱེད་༎
 पश्यन्ति तं विविध कार्यु निदर्शयन्तं न च तस्य कायु न पि चित्त न नामधेयम् ॥ र्ग्स्_२६।५ ॥	རྫུ་འཕྲུལ་སྣ་ཚོགས་རབ་ཏུ་སྟོན་པར་བྱེད་མཐོང་ཡང་༎ དེ་ལ་ལུས་མེད་སེམས་མེད་མིང་ཡང་ཡོད་མ་ཡིན་༎
 एमेव प्रज्ञचरिते न कदाचि भोति बुद्धित्व बोधि जगती परिमोचयित्वा ।	དེ་བཞིན་ཤེས་རབ་སྤྱོད་པ་ནམ་ཡང་འདི་སྙམ་དུ་༎ བྱང་ཆུབ་རྟོགས་ནས་འགྲོ་བ་ཡོངས་སུ་དགྲོལ་མི་སེམས་༎ སྐྱེ་བ་སྣ་ཚོགས་དང་ནི་བྱ་བ་མང་ལྡན་པ་༎
 आत्मोपपत्ति विविधां क्रियसंप्रयोगां दर्शेति मायसदृशो न विकल्पचारी ॥ र्ग्स्_२६।६ ॥	སྒྱུ་མ་ལྟ་བུར་སྟོན་ཀྱང་རྣམ་པར་མི་རྟོག་སྤྱོད་༎
 यथ बुद्ध निर्मित करोति च बुद्धकार्यं न च तस्युपद्यति मदो करमाणु किंचित् ।	དཔེར་ན་སངས་རྒྱས་སྤྲུལ་པ་སངས་རྒྱས་མཛད་པ་བྱེད་༎ བྱེད་པ་དེ་ལ་དྲེགས་པ་ཅུང་ཟད་སྐྱེད་མི་འགྱུར་༎
 एमेव प्रज्ञचरितो विदु बोधिसत्त्वो दर्शेति सर्व क्रिय निर्मितमायतुल्यम् ॥ र्ग्स्_२६।७ ॥	དེ་བཞིན་ཤེས་༄༢༠༩ཨ་༌༎ རབ་སྤྱོད་མཁས་བྱང་ཆུབ་སེམས་དཔའ་ཡང་༎ སྤྲུལ་པ་སྒྱུ་མ་བཞིན་དུ་བྱ་བ་ཐམས་ཅད་སྟོན་༎
 पलगण्ड दक्ष विदुना कृतु दारुयन्त्रो पुरुषे स्त्रितुल्य स करोति ह सर्वकार्यम् ।	ཤིང་མཁན་བཟོ་བོ་མཁས་པས་སྐྱེས་པ་བུད་མེད་དང་༎ འདྲ་བའི་བཟོ་བྱས་དེ་ཡང་བྱ་བ་ཐམས་ཅད་བྱེད་༎
 एमेव प्रज्ञचरितो विदु बोधिसत्त्वो ज्ञानेन सर्व क्रिय कुर्वति निर्विकल्पो ॥ र्ग्स्_२६।८ ॥ भगवत्यां रत्नगुणसंचयगाथायां मायोपमपरिवर्तो नाम षड्विंशतिमः ॥	དེ་བཞིན་ཤེས་རབ་སྤྱོད་མཁས་བྱང་ཆུབ་སེམས་དཔའ་ཡང་༎ རྣམ་པར་མི་རྟོག་ཡེ་ཤེས་བྱ་བ་ཐམས་ཅད་བྱེད་༎
 एवं चरन्तु विदु ना पृथुदेवसंघाः कृतअञ्जलीपुट प्रणम्य नमस्ययन्ति ।	དེ་ལྟར་སྤྱོད་མཁས་རྣམས་ལ་ལྷ་ཚོགས་མང་པོ་དག་། ཐལ་མོ་སྦྱར་བ་བཏུད་ནས་ཕྱག་ཀྱང་འཚལ་བར་བྱེད་༎
