 राष्ट्रपालपरिपृच्छा नमः सर्वबुद्धबोधिसत्त्वार्यश्रावकप्रत्येकबुद्धेभ्यः ॥ निदानपरिवर्तः प्रथमः ।	༄༤༥༨བ་། །རྒྱ་གར་སྐད་དུ་། ཨའ་རྱ་རའཤཏ་པའ་ལ་པ་རི་པྲི་ཙཚ་ནའ་མ་མ་ཧའ་ཡའ་ན་སའུ་ཏྲ་། བོད་སྐད་དུ་། འཕགས་པ་ཡུལ་འཁོར་སྐྱོང་གིས་ཞུས་པ་ཞེས་བྱ་བ་ཐེག་པ་ཆེན་པོའི་མདོ་། བམ་པོ་དང་པོ་། སངས་རྒྱས་དང་བྱང་ཆུབ་སེམས་དཔའ་ཐམས་ཅད་ལ་ཕྱག་འཚལ་ལོ་༎
 एवं मया श्रुतम् ।	འདི་སྐད་བདག་གིས་ཐོས་པ་དུས་གཅིག་ན་།
 एकस्मिन् समये भगवान् राजगृहे विहरति स्म गृध्रकूटे पर्वते महताभिक्षुसंघेन सार्धमर्धत्रयोदशभिर्भिक्षुशतैः पञ्चभिश्च बोधिसत्त्वसहस्रैः,	བཅོམ་ལྡན་འདས་རྒྱལ་པོའི་ཁབ་ན་བྱ་རྒོད་ཀྱི་ཕུང་པོའི་རི་ལ་དགེ་སློང་སྟོང་ཉིས་བརྒྱ་ལྔ་བཅུའི་དགེ་སློང་གི་དགེ་འདུན་ཆེན་པོ་དང་། བྱང་ཆུབ་སེམས་དཔའ་ལྔ་སྟོང་ཐམས་ཅད་ཀྱང་སྤོབས་པ་ཐོགས་པ་མེད་པ་། བཟོད་པ་ཐོབ་པ་། བདུད་དང་ཕྱིར་རྒོལ་བ་བཅོམ་པ་།
 सर्वैरसङ्गप्रतिभानैः क्षान्तिप्रतिलब्धैर्निहतमारप्रत्यर्थिकैः सर्वबुद्धधर्मात्यासन्नीभूतैरेकहातिप्रतिबद्धैर्धरणीप्रतिलब्धैः	སངས་རྒྱས་ཀྱི་ཆོས་ཐམས་ཅད་ལ་ཤིན་ཏུ་ཉེ་བར་གྱུར་པ་། སྐྱེ་བ་གཅིག་གིས་ཐོགས་པ་། གཟུངས་ཐོབ་པ་། ཏིང་ངེ་འཛིན་ཐོབ་པ་། སྤོབས་པ་མཐའ་ཡས་པ་ཐོབ་པ་།
 समाधिप्रतिलब्धैरनन्तप्रतिभानप्रतिलब्धैरसङ्गवैशारद्यप्रतिरृद्धिवशितापरमपारमिप्राप्तैर्यावत्सर्वगुणवर्णपर्यादत्तैः । तद्यथा - समन्तभद्रेण च नाम बोधिसत्त्वेन महासत्त्वेन, समन्तनेत्रेण च बोधिसत्त्वेन महासत्त्वेन, समन्तावलोकितेन च समन्तरश्मिना च समन्तप्रभेण च उत्तरमतिना च वर्धमानमतिना च अनन्तमतिना च विपुलमतिना च अक्षयमतिना च धरणीधरेण च जगतींधरेण च जयमतिना च विशेषमतिना च धारणीश्वरराजेन च बोधिसत्त्वेन महासत्त्वेन । मञ्जुश्रीप्रमुखैश्च षष्टिभिरनुपमचित्तैः भद्रपालपूर्वंगमैश्च षोडशभिःसत्पुरुषैः ब्रम्हणा च सहांपतिना शक्रेण च देवानामिन्द्रेण चतुर्भिश्च लोकपालैः सुसीमेन च देवपुत्रेण सुस्थितमतिना च देवपुत्रेण सर्वैश्च देवेन्द्रैर्नागेन्दैः किन्नरेन्द्रैर्गन्धर्वेन्द्रैर्यक्षेन्द्रैरसुरेन्द्रैर्गरुडेन्द्रैः सर्वैरनेकजातिशतसहस्रपरिवारैस्तत्रैव पर्षदि संनिपतितैः संनिषण्णैः ॥	མི་འཇིགས་པ་ཐོགས་པ་མེད་པ་ཐོབ་པ་། རྫུ་༄༤༥༩ཨ་༌༎ འཕྲུལ་གྱི་སྟོབས་དང་། དབང་དམ་པའི་ཕ་རོལ་ཏུ་སོན་པ་ནས་ཡོན་ཏན་གྱི་ཚོགས་ཐམས་ཅད་ཟད་མི་ཤེས་པ་ཤ་སྟག་ལ་འདི་ལྟ་སྟེ་། བྱང་ཆུབ་སེམས་དཔའ་སེམས་དཔའ་ཆེན་པོ་ཀུན་ཏུ་བཟང་པོ་དང་། ཀུན་ཏུ་མིག་དང་། ཀུན་ཏུ་ལྟ་བ་དང་། ཀུན་ཏུ་འོད་ཟེར་དང་། ཀུན་ཏུ་འོད་དང་། བློ་གྲོས་མཆོག་དང་། བློ་གྲོས་འཕེལ་དང་། བློ་གྲོས་མཐའ་ཡས་དང་། བློ་གྲོས་རྒྱ་ཆེན་དང་། བློ་གྲོས་མི་ཟད་པ་དང་། ས་འཛིན་དང་། འགྲོ་བ་འཛིན་དང་། རྒྱལ་བའི་བློ་གྲོས་དང་། ཁྱད་པར་བློ་གྲོས་དང་། བྱང་ཆུབ་སེམས་དཔའ་སེམས་དཔའ་ཆེན་པོ་གཟུངས་ཀྱི་དབང་ཕྱུག་གི་རྒྱལ་པོ་དང་། འཇམ་དཔལ་ལ་སོགས་པ་སེམས་དཔའ་དཔེ་མེད་དྲུག་ཅུ་དང་། བཟང་སྐྱོང་ལ་སོགས་པ་སྐྱེས་བུ་དམ་པ་བཅུ་དྲུག་དང་། མི་མཇེད་ཀྱི་བདག་པོ་ཚངས་པ་དང་། ལྷའི་དབང་པོ་བརྒྱ་བྱིན་དང་། འཇིག་རྟེན་སྐྱོང་བ་བཞི་དང་། ལྷའི་བུ་མཚམས་བཟང་དང་། ལྷའི་བུ་བློ་གྲོས་ལེགས་གནས་དང་། ལྷའི་དབང་བོ་ཐམས་ཅད་དང་། ཀླུའི་དབང་པོ་དང་། མི་འམ་ཅིའི་དབང་པོ་དང་། དྲི་ཟེའི་དབང་པོ་དང་། གནོད་སྦྱིན་གྱི་དབང་པོ་དང་། ལྷ་མ་ཡིན་གྱི་དབང་པོ་དང་། ནམ་མཁའ་ལྡིང་གི་དབང་པོའི་འཁོར་བརྒྱ་སྟོང་དུ་མ་ཡོད་པ་༄༤༥༩བ་ཐམས་ཅད་དང་། འཁོར་དེ་ཉིད་དུ་འདུས་ཏེ་འཁོད་པ་རྣམས་དང་ཐབས་ཅིག་ཏུ་བཞུགས་སོ་༎
 अथ खलु भगवान् श्रीगर्भसिंहासने संनिषण्णो मेरुरिवाभ्युद्गतः सर्वपर्षन्मण्डलात्,	དེ་ནས་བཅོམ་ལྡན་འདས་དཔལ་གྱི་སྙིང་པོའི་སེངགེའི་ཁྲི་ལ་བཞུགས་ཏེ་། ལྷུན་པོ་ལྟར་འཁོར་གྱི་དཀྱིལ་འཁོར་ཐམས་ཅད་ལས་ནི་། མངོན་པར་འཕགས་།
 सूर्य इव सर्वलोकमवभासयन्,	ཉི་མ་ལྟར་འཇིག་རྟེན་ཐམས་ཅད་ལ་ནི་། སྣང་།
 चन्द्र इव सर्वजगदवभासयन्,	ཟླ་བ་ལྟར་འགྲོ་བ་ཐམས་ཅད་ལ་ནི་། སྣང་བར་མཛད་།
 ब्रम्हेव प्रशान्तविहारी,	ཚངས་པ་ལྟར་རབ་ཏུ་ཞི་བར་ནི་། བཞུགས་།
 शक्र इव दुरासदकायः,	བརྒྱ་བྱིན་ལྟར་སྐུ་ནི་། བསྙེན་པར་དཀའ།
 चक्रवर्तीव सप्तबोध्यङ्गरत्नसमन्वागतः,	འཁོར་ལོས་བསྒྱུར་བ་ལྟར་བྱང་ཆུབ་ཀྱི་ཡན་ལག་གི་རིན་པོ་ཆེ་བདུན་དང་ནི་། ལྡན་།
 सिंह इवानात्मशून्यसर्वधर्मवादी,	སེངགེ་ལྟར་ཆོས་ཐམས་ཅད་བདག་མེད་པ་དང་སྟོང་པར་ནི་། སྒྲོག་།
 अग्निस्कन्ध इव सर्वजगदवभासकरः,	མེའི་ཕུང་པོ་ཆེན་པོ་ལྟར་འགྲོ་བ་ཐམས་ཅད་ལ་སྣང་བའི་སྐུ་དང་ནི་།
 सर्वदेवप्रभासमणिरत्नसमुच्चयमणिराजवद्देदीप्यमानः, सर्वं त्रिसाहस्रमहासाहस्रं लोकधातुमाभया स्फुरित्वा ब्रम्हस्वररुतरवितेन	ལྡན་། ལྷ་ཐམས་ཅད་སྣང་བའི་ནོར་བུ་རིན་པོ་ཆེ་ཀུན་ནས་བསྡུས་པའི་ནོར་བུ་རིན་པོ་ཆེའི་རྒྱལ་པོ་ལྟར་གཟི་བརྗིད་ཀྱིས་ཤིན་ཏུ་འབར་ཞིང་སྟོང་གསུམ་གྱི་སྟོང་ཆེན་པོའི་འཇིག་རྟེན་གྱི་ཁམས་ཐམས་ཅད་སྣང་བས་ཁྱབ་པར་མཛད་ནས་དོན་ཤིན་ཏུ་རྣམ་པར་ངེས་པས་ཆོས་ཐམས་ཅད་ཀྱི་དམ་པའི་ཕ་རོལ་ཏུ་བྱོན་པ་འཁོར་གྱི་ནང་ན་བཞུགས་ཤིང་ཚངས་པའི་སྒྲ་དབྱངས་བསྒྲགས་པ་།
 सर्वसत्त्वविज्ञापनानुगतेन घोषेणाशुविनिश्चितार्थः सर्वधर्मपरमपारमिप्राप्तः	སེམས་ཅན་ཐམས་ཅད་ཀྱི་གོ་བར་བྱེད་པ་དང་ལྡན་པའི་དབྱངས་ཀྱིས་ཆོས་སྟོན་ཏེ་།
 पर्षद्गतो धर्मं देशयति स्म आदौ कल्याणं मध्ये कल्याणं पर्यवसाने कल्याणम्,	ཚངས་པར་སྤྱོད་པ་། ཐོག་མར་དགེ་བ་། ༄༤༦༠ཨ་༌༎ བར་དུ་དགེ་བ་། ཐ་མར་དགེ་བ་། དོན་བཟང་པོ་༎ ཚིག་འབྲུ་བཟང་པོ་༎ མ་འདྲེས་པ་། ཡོངས་སུ་རྫོགས་པ་། ཡོངས་སུ་དག་པ་།
 स्वर्थंसुव्यञ्जनं केवलं परिपूर्णं परिशुद्धं पर्यवदातं ब्रम्हचर्यं संप्रकाशयति स्म ॥	ཡོངས་སུ་བྱང་བ་ཡང་དག་པར་རབ་ཏུ་སྟོན་ཏོ་༎
 अथ खलु प्रामोद्यराजो नाम बोधिसत्त्वो महासत्त्वस्तस्यामेव पर्षदि संनिपतितो ऽभूत् संनिषण्णः ।	དེ་ནས་བྱང་ཆུབ་སེམས་དཔའ་སེམས་དཔའ་ཆེན་པོ་མཆོག་ཏུ་དགའ་བའི་རྒྱལ་པོ་ཞེས་བྱ་བ་འཁོར་དེ་ཉིད་དུ་འདུས་པར་གྱུར་ཏེ་འདུག་པ་དེས་བཅོམ་ལྡན་འདས་སེངགེའི་ཁྲི་ལ་བཞུགས་པ་།
 स भगवन्तं सिंहासनस्थं सूर्यसहस्रातिरेकया प्रभया सर्वपर्षन्मण्डलं जिह्मीकुर्वन्तमतीव	ཉི་མ་སྟོང་ལས་ལྷག་པའི་འོད་ཀྱིས་འཁོར་གྱི་དཀྱིལ་འཁོར་ཐམས་ཅད་ཟིལ་དུ་རླག་པར་མཛད་ནས་ཤིན་ཏུ་ལྷང་ངེར་བཞུགས་པ་མཐོང་སྟེ་།
 विरोचमानं दृष्ट्वा हृष्टतुष्टः प्रसादावर्जिरहृदय उत्थायासनात्कृतकरपुटो भगवन्तमाभिर्गाथाभिरभ्यष्टावीत् -	དགའ་བ་དང་། མགུ་བ་དང་། དད་པས་འདུན་པའི་སེམས་ཀྱིས་སྟན་ལས་ལངས་ནས་ཐལ་མོ་སྦྱར་ཏེ་བཅོམ་ལྡན་འདས་ལ་ཚུལ་དང་མཐུན་པའི་ཚིགས་སུ་བཅད་པ་འདི་དག་གིས་མངོན་པར་བསྟོད་དོ་༎ 
 अभिभूय जिनो जगदेतान् देवगणासुरकिन्नरनागान् ।	ལྷ་ཚོགས་ལྷ་མ་ཡིན་དང་མི་འམ་ཅི་༎ ཀླུ་དང་ཉན་ཐོས་དག་དང་སངས་རྒྱས་སྲས་༎
 श्रावकबुद्धसुतान् मेरुतेजा भासति हेमगिरिः स यथैव ॥ १ ॥ (वैद्य, र्प् १२१)	འགྲོ་བ་འདི་དག་རྒྱལ་བས་གཟི་ཡངས་ཀྱིས་༎ ཟིལ་མནན་ཁྱོད་ནི་གསེར་གྱི་རི་ལྟར་གསལ་༎
 मेरुरिवामरसंघनिवासः सागरमध्यगतो ऽपि विराजन् ।	རྒྱ་མཚོའི་དབུས་ན་གནས་ཀྱང་རྣམ་མཛེས་པ༏་༏ལྷུན་པོ་ལྷ་ཡི་ཚོགས་ཀྱི་གནས་ལྟ་བུར་༎ ཐུགས་རྗེའི་རྒྱ་མཚོའི་དབུས་སུ་དེ་བཞུགས་ཏེ་༎
 कृपसागरमध्यगतो ऽसौ मुञ्चति रश्मिसहस्रशतानि ॥ २ ॥	འོད་ཟེར་སྟོང་ཕྲག་བརྒྱ་དག་འགྱེད་པར་མཛད་༎ ཚངས་པའི་གནས་༄༤༦༠བ་ལ་གནས་པའི་ཚངས་པ་དེ་༎
 ब्रम्हविहारगतः स च ब्रम्ह ब्रम्हपुरस्थ इवाभिरराज ।	ཚངས་པའི་མདུན་ན་གནས་ཏེ་མངོན་མཛེས་ལྟར་༎
 ध्यानविमोक्षसमाधिविहारी भासति सर्वजगे वरसत्त्वः ॥ ३ ॥	བསམ་གཏན་རྣམ་ཐར་ཏིང་ངེ་འཛིན་བཞུགས་པ་༎ སེམས་ཅན་དམ་པ་འགྲོ་བ་ཀུན་ལ་གསལ༏་༏བརྒྱ་ཕྱིན་སུམ་ཅུ་རྩ་གསུམ་ལྷ་ནང་དུ་༎
 शक्र इव त्रिदशेषु विराजन् देवतमध्यगतः पृथुतेजाः ।	གནས་ནས་གཟི་བརྗིད་ཡངས་པས་མཛེས་པ་ལྟར་༎
 भासति सर्वजगे मुनिराजा लक्षणचित्रित ज्ञानगुणाढ्यः ॥ ४ ॥	མཚན་གྱིས་སྤྲས་པ་ཡེ་ཤེས་ཡོན་ཏན་ཕྱུག་། ཐུབ་པའི་རྒྱལ་པོ་འགྲོ་བ་ཀུན་ལ་གསལ་༎ གླིང་བཞི་མི་ཡི་བདག་པོ་སྣང་ལྡན་པ་༎
 द्वीपचतुर्नृपतिर्ह्यवभासी शोभति लोकमिमं त्वनुभासन् ।	འཇིག་རྟེན་འདི་ལ་སྟོན་པ་མཛེས་པ་ལྟར་༎ འཕགས་པའི་ལམ་དུ་འཇུག་པ་རབ་མཛད་ཅིང་༎
 आर्यपथे च नेयोजयमानः शोभति एष कृपाशयबुद्धिः ॥ ५ ॥	ཐུགས་རྗེས་དགོངས་པའི་ཐུགས་མངའ་འདི་ཡང་མཛེས་༎
 अग्निमणिप्रभध्यामकरो ऽसौ भासति खे प्रतियन्निव सूर्यः ।	མཁའ་ལ་ཉི་མ་ལྷམ་མེ་ཐལ་ལེ་བ་༎ ནོར་བུ་མེ་འོད་མོག་མོག་བྱེད་འདི་ལྟར་༎
 सूर्यसहस्रविशिष्टप्रभासो भासति बुद्धरविर्जगतीह ॥ ६ ॥	ཉི་མ་སྟོང་བས་ཁྱད་པར་འཕགས་པའི་འོད་༎ སངས་རྒྱས་ཉི་མ་འགྲོ་བ་འདི་ན་གསལ་༎
 चन्द्र इवामल भाति निशीथे भासति सर्वजगेषु विशुद्धः ।	དྲི་མེད་ཟླ་བ་ནམ་གྱི་གུང་གསལ་ལྟར་༎ ཤིན་ཏུ་རྣམ་དག་འགྲོ་བ་ཀུན་ལ་གསལ་༎
 पूर्णशशाङ्कनिभं जिनवक्त्रं सर्वप्रभामभिभूय विभाति ॥ ७ ॥	རྒྱལ་བའི་ཞལ་རས་ཟླ་བ་ཉ་བ་འདྲ་༎ ཀུན་འོད་ཟིལ་གྱིས་མནན་ནས་རྣམ་པར་མཛེས་༎ ཇི་ལྟར་རི་བོའི་ཟོམ་ལ་མེ་འབར་བ་༎
 पर्वतमूर्धनि अग्निर्यथैव रात्रिप्रशान्त प्रभासति सत्त्वान् ।	མཚན་མོ་མི་ཉལ་ཙམ་ན་ཀུན་སྣང་ལྟར་༎
 मोहतमो निखितं विनिहत्य भासति ज्ञानप्रभासु महर्षिः ॥ ८ ॥	གཏི་མུག་མུན་པ་མ་ལུས་བཅོམ་ནས་ནི་༎ དྲང་སྲོང་ཆེན་པོའི་ཡེ་ཤེས་འོད་ཀྱང་གསལ་༎ སེངགེ་རི་སུལ་བརྟེན་པའི་སྒྲ་སྒྲོག་ཅིང་༎
 पर्वतकन्दरधीरनिनादी त्रासयतीह मृगान् भुवि सिंहः ।	ས་ལ་རི་དབ༹གས་ཚོགས་རྣམས་སྐྲག་བགྱིད་ལྟར་༎
 शून्यनिरात्मनिनादि नरेन्द्रः भासयते हि तथापरतीर्थ्यान् ॥ ९ ॥	མི་དབང་སྟོང་པ་བདག་མེད་གསུང་༄༤༦༡ཨ་༌༎ སྒྲོག་ཅིང་༎ ཕ་རོལ་མུ་སྟེགས་ཅན་རྣམས་སྐྲག་པར་མཛད་༎
 सन्मणिराज इवोज्ज्वलतेजा भासति सर्वमणीनभिभूय ।	ནོར་བུའི་རྒྱལ་པོ་བཟང་བ་གཟི་བརྗིད་འབར་༎ ནོར་བུ་ཐམས་ཅད་ཟིལ་མནན་ལྷམ་མེ་ལྟར་༎
 काञ्चनवर्णनिभो जिनकायो भासति सर्वजगत्यभिभूय ॥ १० ॥	རྒྱལ་བའི་སྐུ་ནི་གསེར་གྱི་མདོག་འདྲ་བ་༎ འགྲོ་ཀུན་ཟིལ་གྱིས་མནན་ནས་ལྷམ་མེར་བཞུགས་༎
 न च ते ऽस्ति समः क्वचि लोके उत्तरि नापि च विद्यति सत्त्वः ।	འཇིག་རྟེན་གང་ནའང་ཁྱོད་དང་མཚུངས་མ་མཆིས་༎
 पुण्यतु ज्ञानतु वीर्यौपायैः सर्वगुणैश्च समो न तवास्ति ॥ ११ ॥	ལྷག་པའི་སེམས་ཅན་མཆིས་པར་ག་ལ་འགྱུར་༎ བསོད་ནམས་ཡེ་ཤེས་བརྩོན་འགྲུས་ཐབས་རྣམས་དང་༎ ཡོན་ཏན་ཀུན་གྱིས་ཁྱོད་དང་མཚུངས་མ་མཆིས་༎ མི་ཡི་དཔའ་བོ་འགྲོ་ལ་ལྷམ་མེ་བ་༎
 भासयते हि जगन्नरवीरो दृष्टु मया गुणसागर नाथः ।	མགོན་པོ་ཡོན་ཏན་རྒྱ་མཚོ་བདག་གིས་མཐོང་༎
 गौरवजातविवर्धितप्रीतिः पादतले पतितो ऽस्मि जिनाय ॥ १२ ॥	གུས་པ་སྐྱེས་ཤིང་དགའ་བ་རྣམ་པར་འཕེལ་༎ རྒྱལ་བའི་ཞབས་ཀྱི་མཐིལ་ལ་བདག་གིས་གཏུགས་༎
 स्तुत्य मया रूपसागरबुद्धिं सर्वगुणाकर लोकप्रदीपम् ।	ཡོན་ཏན་ཀུན་གྱི་འབྱུང་གནས་འཇིག་རྟེན་སྒྲོན་༎
 पुण्यमुपार्जितमत्र तेन सर्वजगत्स्पृशतां वरबोधिम् ॥ १३ ॥	གྲགས་པ་དམ་པ་རྒྱ་ཆེན་ཐུགས་མངའ་བ་༎ བདག་གིས་བསྟོད་དེ་བསོད་ནམས་འདིས་ཐོབ་དེས་༎ འགྲོ་བ་ཐམས་ཅད་བྱང་ཆུབ་མཆོག་རེག་ཤོག་།
 अथ खलु प्रामोद्यराजो बोधिसत्त्वो महासत्त्वो भगवन्तमाभिर्गाथाभिरभिष्टुत्य कृताञ्जलिपुटो ऽनिमिषाभ्यां नयनाभ्यां तथागतकायमवलोकयन् धर्मधातुमेव विचारयमाणो	དེ་ནས་བྱང་ཆུབ་སེམས་དཔའ་སེམས་དཔའ་ཆེན་པོ་མཆོག་ཏུ་དགའ་བའི་རྒྱལ་པོས་བཅོམ་ལྡན་འདས་ལ་ཚིགས་སུ་བཅད་པ་འདི་དག་གིས་མངོན་པར་བསྟོད་ནས་ཐལ་མོ་སྦྱར་ཏེ་མིག་གཉིས་མི་འཛུམ་པར་དེ་བཞིན་གཤེགས་པའི་སྐུ་ལ་ནི་། ༄༤༦༡བ་བལྟ༏་ཆོས་ཀྱི་དབྱིངས་ཉིད་ལ་ནི་། རྣམ་པར་དཔྱོད་།
