 राष्ट्रपालपरिपृच्छा नमः सर्वबुद्धबोधिसत्त्वार्यश्रावकप्रत्येकबुद्धेभ्यः ॥ निदानपरिवर्तः प्रथमः ।	༄༤༥༨བ་། །རྒྱ་གར་སྐད་དུ་། ཨའ་རྱ་རའཤཏ་པའ་ལ་པ་རི་པྲི་ཙཚ་ནའ་མ་མ་ཧའ་ཡའ་ན་སའུ་ཏྲ་། བོད་སྐད་དུ་། འཕགས་པ་ཡུལ་འཁོར་སྐྱོང་གིས་ཞུས་པ་ཞེས་བྱ་བ་ཐེག་པ་ཆེན་པོའི་མདོ་། བམ་པོ་དང་པོ་། སངས་རྒྱས་དང་བྱང་ཆུབ་སེམས་དཔའ་ཐམས་ཅད་ལ་ཕྱག་འཚལ་ལོ་༎
 कौसीद्यं राष्ट्रपाल बोधिसत्त्वानां बोधिपरिपन्थकारको धर्मः ।	མ་དད་པ་བྱང་ཆུབ་སེམས་དཔའ་རྣམས་ཀྱི་བྱང་ཆུབ་ལ་བགེགས་བྱེད་པའི་ཆོས་དང་། ཡུལ་འཁོར་སྐྱོང་།
 मानो राष्ट्रपाल बोधिसत्त्वानां बोधिपरिपन्थकारको धर्मः ।	ང་རྒྱལ་བྱང་ཆུབ་སེམས་དཔའ་རྣམས་༄༤༧༢བ་ཀྱི་བྱང་ཆུབ་ལ་བགེགས་བྱེད་པའི་ཆོས་དང་། ཡུལ་འཁོར་སྐྱོང་།
 परपूजेर्ष्यामात्सर्यचित्तं राष्ट्रपाल बोधिसत्त्वानां बोधिपरिपन्थकारको धर्मः ।	ཕ་རོལ་གྱི་མཆོད་པ་ལ་ཕྲག་དོག་དང་སེར་སྣའི་སེམས་དང་ལྡན་པ་བྱང་ཆུབ་སེམས་དཔའ་རྣམས་ཀྱི་བྱང་ཆུབ་ལ་བགེགས་བྱེད་པའི་ཆོས་ཏེ་།
 इमे राष्ट्रपाल बोधिसत्त्वानां चत्वारो बोधिपरिपन्थकारका धर्माः ॥	ཡུལ་འཁོར་སྐྱོང་། བཞི་པོ་དེ་དག་ནི་། བྱང་ཆུབ་སེམས་དཔའ་རྣམས་ཀྱི་བྱང་ཆུབ་ལ་བགེགས་བྱེད་པའི་ཆོས་སོ་༎
 अथ खलु भगवांस्तस्यां वेलायामिमा गाथा अभाषत -	དེ་ནས་བཅོམ་ལྡན་འདས་ཀྱིས་དེའི་ཚེ་ཚིགས་སུ་བཅད་པ་འདི་དག་བཀའ་སྩལ་ཏོ་༎ མ་དད་ལེ་ལོ་རྟག་ཏུ་རྨོངས་པའི་སེམས་༎
 अश्रद्धाः कुसीदाः सद मूढचित्ता अभिमानिनस्ते ऽपि सदा च क्रोधना ।	དེ་དག་མངོན་པའི་ང་ཅན་རྟག་ཏུ་ཁྲོ་༎
 क्षमिणश्च दृष्ट्वा सद भिक्षु युक्तं दास्यन्ति दण्डं व्रजतो विहारात् ॥ ८७ ॥	བཟོད་ལྡན་རྟག་བརྩོན་དགེ་སློང་མཐོང་ནས་ནི་༎ གཙུག་ལག་ཁང་ནས་འགྲོ་ཚེ་དབྱུག་པས་བརྡེག་།
 परस्य पूजार्थमिहेर्ष्य जाता अवस्थानु चित्तस्य च तेषु नास्ति । (वैद्य, र्प् १३१)	ཕ་རོལ་མཆོད་ཕྱིར་འདི་ནི་ཕྲག་དོག་སྐྱེ་༎ དེ་དག་སེམས་ནི་གནས་པ་ཡོད་མ་ཡིན་༎ གླགས་ལྟ་བྱེད་ཅིང་འཁྲུལ་པ་ཚོལ་བ་ཅན་༎
 अवतारप्रेक्षी स्खलितां गवेषी को ऽस्यापराधो ऽस्तिह चोदयिष्ये ॥ ८८ ॥	སུ་ལ་འཁྲུལ་ཡོད་གང་ལ་གླེང་བྱ་སྙམ་༎
 दूरे इतस्ते मम शासनस्य गुणद्वेषिणस्ते हि अपायनिम्नाः ।	དེ་དག་ང་ཡི་བསྟན་པ་འདི་ལས་རིང་༎ དེ་དག་ཡོན་ཏན་སྡང་ཞིང་ངན་སོང་གཞོལ་༎ དེ་དག་རྒྱལ་བའི་བསྟན་པ་བོར་ནས་ནི་༎
 त्यक्त्वा जिनस्यापि च शासनं ते यास्यन्त्यपायं ज्वलितं प्रचण्डम् ॥ ८९ ॥	ངན་སོང་ཤིན་ཏུ་མི་ཟད་འབར་བར་འགྲོ་༎
 श्रुत्वा च तेषामिह पापचर्याम् अधर्मयुक्तां च गतिं सुदारुणाम् ।	དེ་དག་རྣམས་ཀྱི་སྡིག་པའི་སྤྱོད་པ་དང་༎ ཆོས་མིན་ལྡན་འགྲོ་རབ་སྡིག་འདིར་ཐོས་ནས་༎
 युज्यध्व नित्यं सद बोधिमार्गे मा तप्स्यथा दुर्गतिषूपपन्नाः ॥ ९० ॥	རྟག་ཏུ་འཁོར་མོར་བྱང་ཆུབ་ལམ་ལ་སྦྱོར་༎ ངན་འགྲོར་སྐྱེས་ཤིང་གདུང་བར་གྱུར་ཏ་རེ་༎
 बहुकल्पकोटीभि कदाचि बुद्धो उत्पद्यते लोकहितो महर्षिः ।	སངས་རྒྱས་འཇིག་རྟེན་ཕན་པ་དྲང་སྲོང་ཆེ་༎ བསྐལ་པ་བྱེ་མང་བརྒྱ་ལམ་འབྱུང་བར་༄༤༧༣ཨ་༌༎ འགྱུར༏་༏དེ་ལྟར་དལ་བ་དམ་པ་རྙེད་པ་ལ་༎
 लब्धो ऽधुना स प्रवरः क्षणो ऽद्य त्यज प्रमादं यदि मोक्षकामः ॥ ९१ ॥	གལ་ཏེ་ཐར་འདོད་བག་མེད་སྤང་བར་གྱིས་༎
 चत्वार इमे राष्ट्रपाल पुद्गला बोधिसत्त्वेन न सेवितव्याः ।	ཡུལ་འཁོར་སྐྱོང་། གང་ཟག་བཞི་པོ་འདི་དག་ནི་། བྱང་ཆུབ་སེམས་དཔས་བསྟེན་པར་མི་བྱ་བ་སྟེ་༎
 कतमे चत्वारः ?	བཞི་གང་ཞེ་ན་།
 पापमित्रं राष्ट्रपाल पुद्गलो बोधिसत्त्वेन न सेवितव्यः ।	ཡུལ་འཁོར་སྐྱོང་། བྱང་ཆུབ་སེམས་དཔས་སྡིག་པའི་བཤེས་གཉེན་གྱི་གང་ཟག་བསྟེན་པར་མི་བྱ་བ་དང་། ཡུལ་འཁོར་སྐྱོང་།
 उपलम्भदृष्टिको राष्ट्रपाल पुद्गलो बोधिसत्त्वेन न सेवितव्यः ।	བྱང་ཆུབ་སེམས་དཔས་དམིགས་པར་ལྟ་བ་ཅན་གྱི་གང་ཟག་བསྟེན་པར་མི་བྱ་བ་དང་། ཡུལ་འཁོར་སྐྱོང་།
 सद्धर्मप्रतिक्षेपकः पुद्गलो राष्ट्रपाल बोधिसत्त्वेन न सेवितव्यः ।	བྱང་ཆུབ་སེམས་དཔས་དམ་པའི་ཆོས་སྤང་པའི་གང་ཟག་བསྟེན་པར་མི་བྱ་བ་དང་། ཡུལ་འཁོར་སྐྱོང་།
 आमिषलोलुपः पुद्गलो राष्ट्रपाल बोधिसत्त्वेन न सेवितव्यः ।	བྱང་ཆུབ་སེམས་དཔས་ཟང་ཟིང་ལ་བརྐམ་པའི་གང་ཟག་བསྟེན་པར་མི་བྱ་བ་སྟེ་།
 इमे राष्ट्रपाल चत्वारः पुद्गला बोधिसत्त्वेन न सेवितव्याः ॥	ཡུལ་འཁོར་སྐྱོང་། གང་ཟག་བཞི་པོ་འདི་དག་ནི་། བྱང་ཆུབ་སེམས་དཔས་བསྟན་པར་མི་བྱའོ་༎
 अथ खलु भगवांस्तस्यां वेलायामिमा गाथा अभाषत -	དེ་ནས་བཅོམ་ལྡན་འདས་ཀྱིས་དེའི་ཚེ་ཚིགས་སུ་བཅད་པ་འདི་དག་བཀའ་སྩལ་ཏོ་༎ གང་དག་སྡིག་པའི་བཤེས་གཉེན་རྣམ་སྤོང་ཞིང་༎
 ये पापमित्राणि विवर्जयन्ति कल्पाणमित्राणि सदा भजन्ति ।	གང་དག་དགེ་བའི་བཤེས་གཉེན་སྟེན་བྱེད་པ་༎
 वर्धन्ति ते बोधिपथेषु नित्यं यथ शुक्लपक्षे दिवि चन्द्रमण्डलम् ॥ ९२ ॥	དེ་དག་རྟག་ཏུ་བྱང་ཆུབ་ལམ་ལ་འཕེལ་༎
 उपलम्भदृष्ट्यां च सदा निविष्टा आत्मे निविष्टास्तथ जीवपोषे ।	དཔེར་ན་མཁའ་ལ་ཟླ་བ་ཡར་ངོ་བཞིན༏་༏དམིགས་པར་ལྟ་ལ་རྟག་ཏུ་ཞེན་པ་དང་༎ བདག་དང་སྲོག་དང་གསོ་བར་ཞེན་པ་དང་༎ དེ་དག་དུག་ཕྱིས་བཞིན་དུ་རྟག་ཏུ་སྤང་༎
 विषकुम्भवत्ते सद वर्जयन्ति ये बुद्धज्ञानेन भवन्ति अर्थिकाः ॥ ९३ ॥ क्षिपन्ति ये धर्म नरोत्तमानां शान्तं विरागममृतानुकूलम् ।	གང་དག་སངས་རྒྱས་ཡེ་ཤེས་དོན་མི་༄༤༧༣བ་གཉེར་རོ༏་༏གང་དག་མི་མཆོག་རྣམས་ཀྱི་ཞི་བའི་ཆོས་༎ འདོད་ཆགས་བྲལ་བའི་བདུད་རྩི་མཐུན་སྤོང་བ་༎ དེ་དག་དཔེར་ན་ངན་སྐྱུག་ཇི་བཞིན་སྤང་༎
 तान् वर्जयेन्मीढघटां यथैव य इच्छते बुध्यितुमग्रबोधिम् ॥ ९४ ॥	གང་ཞིག་བྱང་ཆུབ་དམ་པ་འཚང་རྒྱར་འདོད་༎
 अध्योषिता आमिष पात्रचीवरे कुलसंस्तवे चैव सदाभियुक्ताः ।	ཟང་ཟིང་དག་དང་ཆོས་གོས་ལྟུང་བཟེད་ཆགས་༎ རྟག་ཏུ་ཁྱིམ་ལ་འདྲིས་པར་བྱེད་བརྩོན་པ་༎ དེ་དག་རྣམས་དང་འདྲེས་པར་མི་བྱ་སྟེ་༎
 कुर्वीत सार्धं न हि तेषु संस्तवं तान् वर्जयेदग्निखधां (खदां) यथैव ॥ ९५ ॥	དེ་དག་མེ་ཡི་འོབས་བཞིན་སྤང་བར་བྱ་༎
 यस्येप्सितं धर्षयितुं हि मारं प्रवर्तितुं चक्रवरं ह्यनुत्तरम् ।	གང་ཞིག་བདུད་ནི་གདུལ་བར་བྱ་བ་དང་༎ འཁོར་ལོ་དམ་པ་བླ་མེད་བསྐོར་བ་དང་༎ དེ་ལྟར་སེམས་ཅན་དོན་ཡངས་བྱེད་འདོད་པ་༎
 सत्त्वार्थमेवं विपुलं च कर्तुं वर्ज्याश्च तेनापि च पापमित्राः ॥ ९६ ॥	དེས་ནི་སྡིག་པའི་བཤེས་གཉེན་སྤང་བར་བྱ་༎ གང་ཞིག་བྱང་ཆུབ་དམ་པ་འཚང་རྒྱར་འདོད་༎
 विवर्जयित्वा च प्रियाप्रियाणि लाभं यशो भण्डनमानमीर्ष्याम् ।	དེ་ཡིས་རྙེད་དང་སྡུག་དང་མི་སྡུག་དང་༎ གྲགས་དང་མཚང་འདྲུ་ཕྲག་དོག་ང་སྤངས་ཏེ་༎
 एषेत नित्यं सद बुद्धज्ञानं य इच्छते बुध्यितुमग्रबोधिम् ॥ ९७ ॥ (वैद्य, र्प् १३२)	སངས་རྒྱས་ཡེ་ཤེས་རྟག་ཏུ་བཙལ་བར་བྱ་༎
 चत्वार इमे राष्ट्रपाल बोधिसत्त्वानां दुःखविपाका धर्माः ।	ཡུལ་འཁོར་སྐྱོང་། བཞི་པོ་འདི་དག་ནི་། བྱང་ཆུབ་སེམས་དཔའ་རྣམས་ཀྱི་སྡུག་བསྔལ་རྣམ་པར་སྨིན་པའི་ཆོས་ཏེ་༎
 कतमे चत्वारः ?	བཞི་གང་ཞེ་ན་།
 ज्ञानेनाभिमन्यनता राष्ट्रपाल बोधिसत्त्वानां दुःखविपाको धर्मः ।	ཡུལ་འཁོར་སྐྱོང་། ཤེས་པས་མངོན་པར་རློམ་སེམས་སུ་བྱེད་པ་བྱང་ཆུབ་སེམས་དཔའ་རྣམས་ཀྱི་སྡུག་བསྔལ་རྣམ་པར་སྨིན་པའི་ཆོས་དང་། 
 ईर्ष्यामात्सर्यचित्तं राष्ट्रपाल बोधिसत्त्वानां दुःखविपाको धर्माः ।	ཡུལ་འཁོར་སྐྱོང་། ཕྲག་དོག་དང་སེར་སྣ་དང་ལྡན་པའི་སེམས་བྱང་ཆུབ་སེམས་དཔའ་རྣམས་ཀྱི་སྡུག་བསྔལ་རྣམ་པར་སྨིན་པའི་ཆོས་དང་། 
 अनधिमुक्ती राष्ट्रपाल बोधिसत्त्वानां दुःखविपाको धर्मः ।	ཡུལ་འཁོར་སྐྱོང་།
 अपरिशुद्धज्ञानक्षान्तिसंभोगपर्येष्टी राष्ट्रपाल बोधिसत्त्वानां दुःखविपाको धर्मः ।	མ་མོས་པ་བྱང་༄༤༧༤ཨ་༌༎ ཆུབ་སེམས་དཔའ་རྣམས་ཀྱི་སྡུག་བསྔལ་རྣམ་པར་སྨིན་པའི་ཆོས་དང་། ཡུལ་འཁོར་སྐྱོང་། ཡོངས་སུ་མ་དག་པའི་ཤེས་པ་དང་། བཟོད་པའི་ལོངས་སྤྱོད་ཡོངས་སུ་ཚོལ་བ་བྱང་ཆུབ་སེམས་དཔའ་རྣམས་ཀྱི་སྡུག་བསྔལ་རྣམ་པར་སྨིན་པའི་ཆོས་ཏེ་། 
 इमे राष्ट्रपाल बोधिसत्त्वानां दुःखविपाका धर्माः ॥	ཡུལ་འཁོར་སྐྱོང་། བཞི་པོ་དེ་དག་ནི་། བྱང་ཆུབ་སེམས་དཔའ་རྣམས་ཀྱི་སྡུག་བསྔལ་རྣམ་པར་སྨིན་པའི་ཆོས་སོ་༎
 अथ खलु भगवांस्तस्यां वेलायामिमा गाथा अभाषत -	དེ་ནས་བཅོམ་ལྡན་འདས་ཀྱིས་དེའི་ཚེ་ཚིགས་སུ་བཅད་པ་འདི་དག་བཀའ་སྩལ་ཏོ་༎ གང་དག་ས་ལ་ཆོས་ནི་འཛིན་གྱུར་ཅིང་༎
 धर्मधरा भुवि ये तु भवन्ति पूजित सर्वजगेषु भवन्ति । अवमन्यति तानि आज्ञः (?)	འགྲོ་བ་ཐམས་ཅད་ཀྱིས་ཀྱང་མཆོད་འགྱུར་བ་༎
 तेन स विन्दति दुःखमनन्तम् ॥ ९८ ॥	དེ་ལ་མི་ཤེས་པས་ནི་བརྙས་བྱེད་ན་༎ དེས་ན་དེ་ནི་སྡུག་བསྔལ་མཐའ་ཡས་རྙེད་༎ ཡང་བས་ནི་གང་ཞིག་ལོངས་སྤྱོད་ཚུལ་༎
 विषमेण स देशति भोगेन् छन्दरुचिः सद ज्ञानि अशुद्धे ।	ཤེས་པ་མ་དག་རྟག་ཏུ་འདུན་ཅིང་འདོད་༎
 मानोन्नत यश्च हि नित्यं नमते गुरुआर्यजनेषु ॥ ९९ ॥	གང་ཞིག་རྟག་ཏུ་ང་རྒྱལ་ཁེངས་གྱུར་ལ་༎ བླ་མ་འཕགས་པའི་སྐྱེ་བོ་མི་འདུད་ཅིང་༎
 अधिमुक्ति न विद्यति बुद्धे धर्मगणे च न तस्यधिमुक्तिः ।	སངས་རྒྱས་ལ་ཡང་མོས་པ་ཡོད་མིན་ལ༏་༏ཆོས་དང་ཚོགས་ལ་དེ་ནི་མོས་པ་མེད་༎ བསླབ་དང་སྦྱངས་པ་རྣམས་ལ་དེ་མི་མོས་༎
 शिक्ष धुतेषु न तस्यधिमुक्तिः पापमतेस्त्रिरपायमुखस्य ॥ १०० ॥	སྡིག་པའི་བློ་ཅན་ངན་སོང་གསུམ་ཕྱོགས་པ་༎
 स इतश्च्युतो हि मनुजेषु कर्मवशादबुधो हि विमूढः ।	དེ་ནི་མི་ནང་འདི་ནས་ཤི་འཕོས་ནས་༎ ལས་ཀྱི་དབང་གིས་མི་མཁས་རྣམ་པར་རྨོངས་༎
 नरकेष्वथ तिर्यग्गतिषु प्रेतगतिषु च वन्दति दुःखम् । १०१ ॥	དམྱལ་བའམ་འོན་ཏེ་དུད་འགྲོའི་སྐྱེ་གནས་སམ་༎ ཡི་དབ༹གས་འགྲོ་བ་རྣམས་སུ་སྡུག་བསྔལ་རྙེད་༎
 यस्य मतिर्भुवि लोकप्रदीपो दुःखक्षयान्तकरो नरवीरः ।	གང་ཞིག་འཇིག་རྟེན་༄༤༧༤བ་སྒྲོན་འགྱུར་བློ་ལྡན་ཞིང་། མི་ཡི་དཔའ་བོ་སྡུག་བསྔལ་མཐར་འབྱིན་པ་༎
 तेन अपायपथं प्रविहाय बोधिपथः सततं हि निषेव्यः ॥ १०२ ॥	དེ་ཡིས་ངན་སོང་ལམ་རྣམས་རབ་སྤངས་ཏེ་༎ བྱང་ཆུབ་ལམ་ནི་རྟག་ཏུ་བསྟེན་པར་བྱ་༎༎ བམ་པོ་གཉིས་པ༏་༏ཡུལ་འཁོར་སྐྱོང་།
 चत्वारीमानि राष्ट्रपाल बोधिसत्त्वानां बन्धनानि ।	བཞི་པོ་འདི་དག་ནི་། བྱང་ཆུབ་སེམས་དཔའ་རྣམས་ཀྱི་འཆིང་བ་སྟེ་།
 कतमानि चत्वारि ? परावमन्यनता बोधिसत्त्वानां बन्धनम् ।	བཞི་གང་ཞེ་ན་།
 लौकिकेनोपायेन भावनताप्रयोगनिमित्तसंज्ञा बोधिसत्त्वानां बन्धनम् । अनिगृहीतचित्तस्य ज्ञानविरहितस्य प्रमादसेवनता राष्ट्रपाल बोधिसत्त्वस्य बन्धनम् । प्रतिबद्धचित्तस्य कुलसंस्तवो राष्ट्रपाल बोधिसत्त्वस्य बन्धनम् ।	ཕ་རོལ་ལ་བརྙེས་པ་བྱང་ཆུབ་སེམས་དཔའ་རྣམས་ཀྱི་འཆིང་བ་དང་། འཇིག་རྟེན་པའི་ཐབས་ཀྱིས་བསྒོམ་པ་ལ་སྦྱོར་བ་དང་། མཚན་མའི་འདུ་ཤེས་བྱང་ཆུབ་སེམས་དཔའ་རྣམས་ཀྱི་འཆིང་བ་དང་། ཀུན་འཛིན་པའི་སེམས་དང་ལྡན་པ་དང་། ཡེ་ཤེས་དང་བྲལ་བ་དང་། བག་མེད་པ་ལ་བརྟེན་པར་བྱེད་པ་བྱང་ཆུབ་སེམས་དཔའ་རྣམས་ཀྱི་འཆིང་བ་དང་། ཕྱིར་འབྲང་བའི་སེམས་ཀྱིས་ཁྱིམ་ལ་འདྲིས་པར་བྱེད་པ་བྱང་ཆུབ་སེམས་དཔའ་རྣམས་ཀྱི་འཆིང་བ་སྟེ་། ཡུལ་འཁོར་སྐྱོང་།
 इमानि राष्ट्रपाल बोधिसत्त्वानां चत्वारि बन्धनानि ॥	བཞི་པོ་དེ་དག་ནི་།
 अथ खलु भगवंस्तस्यां वेलायामिमा गाथा अभाषत -	བྱང་ཆུབ་སེམས་དཔའ་རྣམས་ཀྱི་འཆིང་བའོ་༎ དེ་ནས་བཅོམ་ལྡན་འདས་ཀྱིས་དེའི་ཚེ་ཚིགས་སུ་བཅད་པ་འདི་དག་བཀའ་སྩལ་ཏོ་༎ རྟག་ཏུ་གཞན་དག་ལ་ནི་བརྙས་བྱེད་ཅིང་༎
 अवमन्यति नित्य परस्य भावयते सद लौकिकध्यानम् । बध्यति तेभि स दृष्टिशतेभिः पङ्कि गजो यथ दुर्बलकायः ॥ १०३ ॥	རྟག་ཏུ་འཇིག་རྟེན་པ་ཡིས་བསམ་གཏན་སྒོམ་༎ ལྟར་གྱུར་འདི་དག་གིས་ནི་དེ་བཅིངས་ཏེ་༎ གླང་པོ་ལུས་རིང་འདམ་དུ་སོང་བ་བཞིན་༎
 कुलसंस्तवबन्धनयुक्तो यस्तु प्रमत्त सदा ग्रहचित्तः ।	ཁྱིམ་ལ་འདྲིས་བྱེད་འཆིང་དང་ལྡན་པ་དང་༎ གང་ཞིག་བག་མེད་རྟག་ཏུ་ཀུན་འཛིན་སེམས་༎ ཡེ་ཤེས་སྤངས་༄༤༧༥ཨ་༌༎ ཤིང་བློ་གྲོས་རྨོངས་གྱུར་པ་༎
 ज्ञानविवर्जित मूढमतिश्च बध्यति एभि अयुक्तचरीभिः ॥ १०४ ॥	མི་རིགས་སྤྱོད་པ་འདི་དག་རྣམས་ཀྱིས་བཅིངས་༎
