 राष्ट्रपालपरिपृच्छा नमः सर्वबुद्धबोधिसत्त्वार्यश्रावकप्रत्येकबुद्धेभ्यः ॥ निदानपरिवर्तः प्रथमः ।	༄༤༥༨བ་། །རྒྱ་གར་སྐད་དུ་། ཨའ་རྱ་རའཤཏ་པའ་ལ་པ་རི་པྲི་ཙཚ་ནའ་མ་མ་ཧའ་ཡའ་ན་སའུ་ཏྲ་། བོད་སྐད་དུ་། འཕགས་པ་ཡུལ་འཁོར་སྐྱོང་གིས་ཞུས་པ་ཞེས་བྱ་བ་ཐེག་པ་ཆེན་པོའི་མདོ་། བམ་པོ་དང་པོ་། སངས་རྒྱས་དང་བྱང་ཆུབ་སེམས་དཔའ་ཐམས་ཅད་ལ་ཕྱག་འཚལ་ལོ་༎
 जात्यन्धदौर्बल्यमथाल्पस्थामतां गृह्णन्ति ते मानवशेन मूढाः ॥ २२१ ॥	རྨོངས་ནས་ང་རྒྱལ་དབང་གིས་ངན་སོང་ས་༎ མི་ཁོམ་འགྲོ་བ་རྣམས་དང་དབུལ་པོ་དང་༎ དམའ་བའི་རིགས་སུ་སྐྱེ་དང་ལོང་བ་དང་༎ མདོག་ངན་པ་དང་མཐུ་ཆུང་དེ་དག་འཛིན་༎
 ते वृत्तिचर्यापरिहीनभावाः प्रमादलाभेन स्मृतिप्रनष्टाः ।	དེ་དག་ཚུལ་དང་སྤྱོད་པ་ཡོངས་ཉམས་དངོས་༎ བག་མེད་རྙེད་ནས་དྲན་པ་རབ་ཏུ་ཉམས་༎ ག-ཡང་ས་ཆེན་པོ་མི་བཟད་ལྷུང་བར་འགྱུར་༎
 घोरं प्रयास्यन्ति महाप्रपातं यतो न मोक्षो ऽस्त्यपि कल्पकोटिभिः ॥ २२२ ॥	དེ་ནས་བསྐལ་པ་བྱེ་བར་ཐར་པ་མེད་༎
 यदीह लाभिन भवेत बोधिस्तद्देवदत्तो ऽपि लभेत बोधिम् । वैरम्भवातेन यथैव पक्षी क्षिप्यन्ति लाभेन तथा अयुक्ताः ॥ २२३ ॥	གལ་ཏེ་འདིར་ནི་འཐོབ་པས་བྱང་ཆུབ་ན་༎ དེ་ཕྱིར་ལྷས་སྦྱིན་གྱིས་ཀྱང་བྱང་ཆུབ་འཐོབ་༎ རྣམ་པར་འཐོར་རླུང་གིས་ནི་བྱ་ལྷུང་ལྟར་༎ ཆགས་པས་ཀྱང་ནི་དེ་ལྟར་མི་རིགས་སོ་༎
 पुण्यैर्विहीनाः परदारगृद्धा अशुद्धशीलाः कुशलेषु बोद्दरः ।	བསོད་ནམས་ཉམས་ཤིང་གཞན་གྱི་ཆུང་མར་༄༤༨༥བ་ཆགས༏་༏ཚུལ་ཁྲིམས་མ་དག་དགེ་བ་རྣམས་ལས་ཉམས་༎ བྱང་ཆུབ་སེམས་ཀྱིས་ཡེ་ཤེས་གང་མ་ཐོབ་༎
 ते शासने ऽनर्थश्मशानदारुवत् ये बोधिचित्तेन अलब्धज्ञानाः ॥ २२४ ॥	དེ་དག་བསྟན་ལ་མི་དགོས་དུར་ཤིང་བཞིན་༎
 बोध्यर्थिको ऽन्वेषति बुद्धधर्मान् न तिष्ठते चापि यथा समोक्षः ।	བྱང་ཆུབ་དོན་གཉེར་སངས་རྒྱས་ཆོས་ཚོལ་བ་༎ དཔེར་ན་ཐར་པ་དེ་བཞིན་མི་གནས་སོ་༎
 दृढाः स लेपेन कृतः कपिर्वा मानाभिभूतस्य तथैव बोधिः ॥ २२५ ॥ (वैद्य, र्प् १४२)	དེ་ནི་རྙོང་གིས་སྤྲེའུ་ལ་དམ་བྱས་ལྟར་༎ ང་རྒྱལ་ཟིལ་ནོན་བྱང་ཆུབ་དེ་འདྲའོ་༎ བྱང་ཆུབ་དོན་དུ་གཉེར་བས་ཆོས་ཚིག་ཕྱིར་༎
 बोध्यर्थिकेनापि मया स्वजीवं त्यक्तः प्रियः धर्मपदस्य हेतोः ।	ང་ཡི་རང་གི་སྲོག་ནི་ཕངས་པའང་བཏང་༎ ཆོས་དེ་བཏང་ནས་བརྩོན་དང་མི་ལྡན་པ་༎
 त्यक्त्वा च धर्मांस्त अयुक्तयोगाः निरर्थभूता निपतन्ति शासनम् ॥ २२६ ॥	དོན་མེད་གྱུར་ནས་བསྟན་ལས་ལྷུང་བར་འགྱུར་༎ ང་ནི་སྔོན་ཆད་ལེགས་པར་བཤད་དོན་ཕྱིར་༎
 महाप्रपातं ज्वलितं हुताशनं सुभाषितार्थे पतितो ऽस्मि पूर्वे ।	ག-ཡང་ས་ཆེན་པོ་མེ་ལྕེ་འབར་བར་མཆོངས་༎
 श्रुत्वा च तस्मिन् प्रतिपत्तिये स्थितो विहाय सर्वाणि प्रियाप्रियाणि ॥ २२७ ॥	དེ་ཐོས་ནས་ནི་སྡུག་དང་མི་སྡུག་པ་༎ ཐམས་ཅད་རྣམ་པར་སྤངས་ཏེ་ནན་ཏན་གནས་༎
 श्रुत्वा गुणाढ्यं च विचित्रशासनं तेषां स्पृहा नैकपदे ऽपि जायते ।	བསྟན་པ་སྣ་ཚོགས་ཡོན་ཏན་འབྱོར་ཐོས་ལ་༎ དེ་དག་ནམ་ཡང་འདོད་པ་མི་སྐྱེ་ན་༎
 अधर्मकामस्य कुतो ऽस्ति बोधिः यथैव चान्धस्य पथि प्रकाशनम् ॥ २२८ ॥ इति ॥	ཆོས་མིན་འདོད་ལ་བྱང་ཆུབ་ག་ལ་ཡོད་༎ དཔེར་ན་ལོང་བ་ལམ་སེལ་མེད་དང་མཚུངས་༎ ཡུལ་འཁོར་སྐྱོང་།
 भूतपूर्वं राष्ट्रपाल अतीते ऽध्वन्यसंख्यएयैः कल्पैरसंख्येयतरैरचिन्त्यैरतुल्यैरप्रमाणैर्विपुलैरप्रमेयैर्यदासीत् ।	སྔོན་བྱུང་བ་འདས་པའི་དུས་ན་བསྐལ་པ་གྲངས་མེད་པའི་ཡང་ཆེས་གྲངས་མེད་པ་། རྒྱ་ཆེ་བ་། བསམ་གྱིས་མི་ཁྱབ་པ་།
 तेन कालेन तेन समयेन सिद्धार्थबुद्धिर्नाम तथागतो ऽर्हन् सम्यक्संबुद्धो लोक	མཚུངས་པ་མེད་པ་། དཔག་ཏུ་མེད་པ༏་ཚད་མེད་པར་གྱུར་པ་དེའི་ཚེ་དེའི་དུས་ན་དེ་བཞིན་གཤེགས་པ་དགྲ་བཅོམ་པ་ཡང་དག་པར་རྫོགས་པའི་སངས་རྒྱས་རིག་པ་དང་ཞབས་སུ་ལྡན་པ་། བདེ་བར་གཤེགས་༄༤༨༦ཨ་༌༎
 उदपादि विद्याचरणसंपन्नः सुगतो लोकविदनुत्तरः पुरुषदम्यसारथिः शास्ता देवमनुष्याणां	པ༏་འཇིག་རྟེན་མཁྱེན་པ་། སྐྱེས་བུ་འདུལ་བའི་ཁ་ལོ་སྒྱུར་བ་བླ་ན་མེད་པ་། ལྷ་དང་མི་རྣམས་ཀྱི་སྟོན་པ་སངས་རྒྱས་བཅོམ་ལྡན་འདས་དོན་གྲུབ་བློ་ཞེས་བྱ་བ་འཇིག་རྟེན་དུ་བྱུང་ངོ་༎ ཡུལ་འཁོར་སྐྱོང་།
 च बुद्धो भगवान् । तेन च समयेन अर्चिष्मान्नाम राजाभूत् ।	དེའི་ཚེ་དེའི་དུས་ན་རྒྱལ་པོ་འོད་ཟེར་ལྡན་ཞེས་བྱ་བ་ཞིག་བྱུང་ངོ་༎
 अर्चिष्मतः पुना राष्ट्रपाल राज्ञो जम्बूद्वीपे राज्यमभूत्षोडशयोजनसहस्राणि ।	ཡུལ་འཁོར་སྐྱོང་། རྒྱལ་པོ་འོད་ཟེར་ལྡན་ནི་། འཛམ་བུའི་གླིང་དཔག་ཚད་ཁྲི་དྲུག་སྟོང་ལ་རྒྱལ་སྲིད་བྱེད་དོ་༎
 तेन च राष्ट्रपाल कालेन तस्मिन् जम्बूद्वीपे विंशतिनगरसहस्राण्यभूवन् सर्वाणि कुलकोटिसहस्रिकाणि ।	ཡུལ་འཁོར་སྐྱོང་། དེའི་ཚེ་དེའི་དུས་ན་འཛམ་བུའི་གླིང་དེ་ན་གྲོང་ཁྱེར་ཉི་ཁྲི་དང་ཁྱིམ་བྱེ་བ་ཕྲག་སྟོང་ཡོད་དོ་༎ ཡུལ་འཁོར་སྐྱོང་།
 तस्य खलु पुना राष्ट्रपाल राज्ञो ऽर्चिष्मतो रत्नप्रभासं नाम नगरमभूद्राजधानी यत्र स राजा अर्चिष्मान् प्रतिवसति द्वादशयोजनान्यायामेन पूर्वेण पश्चिमेन च, सप्त योजनानि विस्तरेण दक्षिणेनोत्तरेण च,	རྒྱལ་པོ་འོད་ཟེར་ལྡན་དེ་རྒྱལ་པོ་ཕོ་བྲང་གང་ན་གནས་པ་རྒྱལ་པོ་འོད་ཟེར་ལྡན་དེའི་གྲོང་ཁྱེར་རིན་པོ་ཆེ་སྣང་བ་ཞེས་བྱ་པ་ཤར་ནུབ་ཏུ་ཆུར་དཔག་ཚད་བཅུ་གཉིས་ཡོད་པ་། ལྷོ་བྱང་དུ་རྒྱར་དཔག་ཚད་བདུན་ཡོད་པ་།
 सप्तानां रत्नानां च सप्तप्राकारमष्टापदसुकृतम् ।	རིན་པོ་ཆེ་སྣ་བདུན་གྱི་ཕྱིར་ར་བ་རིམ་པ་བདུན་དང་། མིག་མང་རིས་སུ་བྲིས་པས་མཛེས་པར་བྱས་པ་ཡོད་དོ་༎
 तेन च समयेन दशवर्षकोटिनियुतानि सत्त्वानामायुःप्रमाणमभूत् ।	དེའི་ཚེ་སེམས་ཅན་རྣམས་ཀྱི་ཚེའི་ཚད་ནི་། ལོ་བྱེ་བ་ཕྲག་བཅུ་ཐུབ་པར་གྱུར་ཏོ་༎ ཡུལ་འཁོར་སྐྱོང་། རྒྱལ་པོ་འོད་ཟེར་ལྡན་གྱི་བུ་བསོད་ནམས་ཀྱི་འོད་ཟེར་ཞེས་བྱ་བ་གཟུགས་བཟང་བ་།
 राज्ञः पुना राष्ट्रपाल अर्चिष्मतः पुण्यरश्मिर्नाम पुत्रो ऽभूदभिरूपः प्रासादिको दर्शनीयः परमशुभवर्णपुष्कलतया समन्वागतः ।	མཛེས་པ་། བལྟ་ན་སྡུག་པ་། ཁ་དོག་བཟང་པོ་རྒྱས་པ་མཆོག་དང་ལྡན་པ་ཞིག་ཡོད་དེ་།
 तस्य जातमात्रस्यैव निधानसहस्रं प्रादुर्भूतम् ।	དེ་བཙས་མ་ཐག་ཏུ་རིན་༄༤༨༦བ་པོ་ཆེ་སྣ་བདུན་གྱི་གཏེར་སྟོང་བྱུང་བར་གྱུར་ཏོ་༎
 सप्तानां रत्नानामेकं चात्र निधानं राज्ञः प्रासादे प्रादुर्भूतं दशपौरुषप्रमाणं सप्तानां रत्नानाम् ।	རྒྱལ་པོའི་ཁང་བཟང་གི་ནང་དུ་ཡང་རིན་པོ་ཆེ་སྣ་བདུན་གཏེར་གྱི་མི་བཅུའི་ཚད་ཙམ་བྱུང་བར་གྱུར་ཏེ་ཡུལ་འཁོར་སྐྱོང་།
 तस्य खलु पुना राष्ट्रपाल पुण्यरश्मे राजकुमारस्य जातामात्रस्यैव सर्वे जाम्बूद्वीपकाः सत्त्वा आत्तमनसो ऽभूवन् ।	རྒྱལ་བུ་གཞོན་ནུ་བསོད་ནམས་ཀྱི་འོད་ཟེར་དེ་བཙས་མ་ཐག་ཏུ་འཛམ་བུའི་གླིང་པའི་སེམས་ཅན་ཐམས་ཅད་ཡིད་རངས་པར་གྱུར་ཏོ་༎
 ये च सत्त्वा बन्धनगतास्तेषां बन्धनमोक्षो ऽभूत् ।	སེམས་ཅན་གང་དག་བརྩོན་ར་ན་འཁོད་པ་དེ་དག་ཀྱང་བརྩོན་ར་ནས་ཐར་པར་གྱུར་ཏོ་༎
 तेन खलु पुना राष्ट्रपाल पुण्यरश्मिना राजकुमारेण सप्तभिर्दिवसैः सर्वशिल्पान्यधिगतानि यावन्ति लौकिकानि ॥	ཡུལ་འཁོར་སྐྱོང་། རྒྱལ་བུ་གཞོན་ནུ་བསོད་ནམས་ཀྱི་འོད་ཟེར་དེས་ཉི་མ་བདུན་གྱིས་འཇིག་རྟེན་པའི་སྒྱུ་རྩལ་ཇི་སྙེད་པ་དེ་དག་ཐམས་ཅད་རྟོགས་པར་གྱུར་ཏོ་༎ ཡུལ་འཁོར་སྐྱོང་།
 अथ खलु राष्ट्रपाल पुण्यरश्मे राजकुमारस्य शुद्धावासकायिका देवता अर्धरात्रकालसमये संचोदयन्ति स्म - अप्रमत्तेन ते कुमार सदा भवितव्यम्	དེ་ནས་གནས་གཙང་མའི་རིས་ཀྱི་ལྷ་རྣམས་ཀྱིས་ནམ་གྱི་གུང་གི་དུས་ལ་བབ་པ་དང་། རྒྱལ་བུ་གཞོན་ནུ་བསོད་ནམས་ཀྱི་འོད་ཟེར་ལ་གཞོན་ནུ་། ཁྱོད་བག་ཡོད་པར་གྱིས་ཤིག་།
 अनित्यताप्रत्यवेक्षणकुशलेन भवितव्यम् ।	མི་རྟག་པར་སོ་སོར་བརྟག་པ་ལ་མཁས་པར་གྱིས་ཤིག་། གཞོན་ནུ་།
 अल्पं हि कुमार जीवितं मनुष्याणाम् ।	མི་རྣམས་ཀྱི་སྲོག་ནི་། ཆེན་པོ་མེད་པ་སྟེ་།
 गमनीयः संपरायः ।	ཚེ་འཕོ་བར་འགྲོ་བ་ཡིན་གྱི་།
 परलोकभयदर्शिना च ते भवितव्यं न सर्मक्रियोद्धुरेण ।	འཇིག་རྟེན་ཕ་རོལ་ལ་འཇིགས་པར་བལྟ་བར་བྱ་ཞིང་ལས་དང་བྱ་བ་དང་མི་འགལ་བར་གྱིས་ཤིག་། 
 तस्यां वेलायामिमा गाथा अभाषत -	ཅེས་བསྐུལ་ཏེ་། དེའི་ཚེ་ལྷའི་བུ་དེ་དག་གིས་ཚིགས་སུ་བཅད་པ་འདི་དག་ཀྱང་སྨྲས་སོ༏་༏གཞོན་ནུ་བག་མེད་པར་ནི་གྱུར་ཏ་རེ་༎
 मा कुमार भव सुप्रमत्तको मा प्रमादवशमभ्युपेष्यसे ।	བག་མེད་དབང་དུ་སོང་བར་གྱུར་ཏ་རེ་༎
 अप्रमाद सुगतेन वर्णितो निन्दिता हि सुगतैः प्रमत्तकाः ॥ २२९ ॥	བདེ་བར་གཤེགས་པས་བག་ཡོད་རབ་བསྟོད་ཅིང་༎ བདེ་གཤེགས་རྣམས་ཀྱིས་བག་མེད་རྣམས་༄༤༨༧ཨ་༌༎ ཀྱང་སྨད་༎
 अप्रमत्त इह ये च सूरता दानसंयमरता अमत्सराः ।	ངེས་པ་གང་དག་འདི་ན་བག་ཡོད་ཅིང་༎
 सर्वसत्त्वकृपमैत्रमानसा ते भवन्ति नचिरान्नरोत्तमाः ॥ २३० ॥	ལེགས་སྡོམ་དགའ་ལ་སེར་སྣ་བྱེད་པ་དང་༎ སེམས་ཅན་ཀུན་ལ་སྙིང་རྗེ་བྱམས་ཡིད་ལྡན་༎ དེ་དག་རིང་པོར་མི་ཐོགས་མི་མཆོག་འགྱུར་༎
 ये ऽप्रमेय सुगता अतीताः सांप्रतं च हि ये ऽप्यनागताः ।	བདེ་བར་གཤེགས་པ་གང་དག་འདས་པ་དང་༎ འདི་ན་ད་ལྟར་དག་དང་གང་མ་བྱོན་༎
 सर्वएव कुशलैस्त उद्गता अप्रमादपथ एव सुस्थिताः ॥ २३१ ॥	དེ་དག་ཐམས་ཅད་དགེ་བ་རྣམས་ཀྱིས་འཕགས་བག་ཡོད་ལམ་ཉིད་ལ་ཡང་ཤིན་ཏུ་གནས་༎
 अन्नपानमथ वस्त्रभोजनं हेमरूप्यमणिभूषणम् । दत्तं तैरपि च कल्पकोटियः प्रार्थयद्भिरिह बोधिमुत्तमाम् ॥ २३२ ॥ (वैद्य, र्प् १४३)	བཟའ་དང་བཏུང་དང་གོས་དང་ཁ་ཟས་དང་༎ གསེར་དང་དངུལ་དང་ནོར་བུ་མུ་ཏིག་དང་༎ བསྐལ་པ་བྱེ་བར་དེ་དག་རྣམས་ཀྱིས་བཏང༏་༏བྱང་ཆུབ་དམ་པ་འདི་ནི་དོན་དུ་གཉེར་༎
 हस्तपादमथ कर्णनासिका याचिता ददति संप्रहर्षिताः ।	རྐང་པ་ལག་པ་དེ་བཞིན་རྣ་བ་སྣ་༎ སློང་བ་རྣམས་ལ་རབ་ཏུ་དགོས་བྱིན་ན་༎
 सर्वबोधिगुणपूरिताशयाः ते भवन्ति नचिरान्नरोत्तमाः ॥ २३३ ॥	བྱང་ཆུབ་ཡོན་ཏན་ཀུན་གྱིས་བསམ་རྫོགས་ནས་༎ དེ་དག་རིང་པོར་མི་ཐོགས་མི་མཆོག་འགྱུར་༎
 रज्यसौख्यविभवांश्च सर्वशो विप्रहाय दयिताः स्रियो ऽपि च ।	རྒྱལ་སྲིད་བདེ་དང་སྡུག་པའི་བུད་མེད་དང་༎ ནོར་རྣམས་ཐམས་ཅད་དུ་ཡང་རྣམ་སྤངས་ཏེ་༎
 रङ्गमायसदृशं हि संस्कृतं संश्रयस्व वनमेव निःस्पृहः ॥ २३४ ॥	འདུས་བྱས་གང་ལ་བལྟ་དང་སྒྱུ་མ་འདྲས༏་༏འདོད་པ་མེད་པར་དགོན་པར་གནས་པར་གྱིས་༎
 जीवितं चपलमध्रुवं सदा मृत्तिकाघटक एव भेदि च ।	སྲོག་ནི་བརྟན་པ་མེད་དེ་རྟག་ཏུ་ག-ཡོ་༎ འཛིམ་པའི་བུམ་པ་ལྟ་བུར་འཇིག་པ་ཅན་༎
 याचितोपममशाश्वतं सदा नात्र नित्यमशुभं कुमारक ॥ २३५ ॥	བརྙན་མ་འདྲ་ཞིང་རྟག་ཏུ་ཐེར་ཟུག་མིན་༎ གཞོན་ནུ་འདི་ལྟ་རྟག་མེད་དགེ་མ་ཡིན་༎ ངན་འགྲོར་ལྷུང་བའི་ཚེ་ན་འདི་ན་ནི་༎
 नेह मात्र न पिता न बान्धवा धारयन्ति यतमान दुर्गतिम् ।	ཕ་དང་མ་ཡང་འཛིན་པར་བྱེད་པ་མེད་༎
 यत्कृतं हि शुभाशुभं तत्प्रायन्तमनुयाति पृष्ठतः ॥ २३६ ॥	དེ་ཡིས་དགེ་དང་མི་དགེ་གང་བྱས་༄༤༨༧བ་བ༏་༏དེ་ནི་རྟག་ཏུ་ཕྱི་བཞིན་འབྲང་བར་འགྱུར་༎
 कामहेतु बहुकल्पसागरा अन्यमन्यवधिता निरर्थकाः ।	འདོད་པའི་རྒྱུ་ཡིས་བསྐལ་མང་རྒྱ་མཚོར་ནི་༎ དོན་མེད་པར་ཡང་གཅིག་གིས་གཅིག་བསད་དེ་༎
 कस्यचिन्न च कृतं त्वया हितं व्यर्थ एव च निवेशितः श्रमः ॥ २३७ ॥	ཁྱོད་ཀྱིས་མི་ཕན་མ་བྱས་ཅི་ཡང་མེད་༎ དོན་མེད་ཉིད་དུ་ངལ་བ་བསྟེན་པར་གྱུར་༎
 अद्य ते जगत एषतो हितं बोधिशान्तमतुलं पदोत्तमम् ।	ད་ལྟར་ཁྱོད་ཀྱིས་འགྲོ་ཕན་བྱང་ཆུབ་ཞི་༎ མཚུངས་མེད་གོ་འཕང་དམ་པ་བཙལ་བའི་ཕྱིར་༎ རྐང་དང་ཤ་དང་པགས་པ་དེ་བསྐམས་ཀྱང་༎
 मज्जमांसमपि चर्म शुष्यते यद्यपि त्वमपि मा कृथा श्रमम् ॥ २३८ ॥	ད་ལྟ་ན་ཡང་ཁྱོད་ནི་ངལ་མ་སེམས་༎
 दुर्लभो हि सुगतस्य संभवः शान्तधर्मश्रवणं सुदुर्लभम् ।	བདེ་བར་གཤེགས་པ་འབྱུང་བ་རྙེད་པར་དགའ༎ ཞི་བའི་ཆོས་ཐོས་པ་ཡང་ཤིན་ཏུ་དཀའ༎
 मारपक्षमवधूय यत्नतो बुद्धज्ञान नचिरेण लप्स्यसे ॥ २३९ ॥	བསྒྲིམ་པ་བྱས་ཏེ་བདུད་ཀྱི་ཕྱོགས་བསལ་ན་༎ སངས་རྒྱས་ཡེ་ཤེས་རིང་པོར་མི་ཐོགས་ཐོབ་༎ བཤེས་གཉེན་བཟང་ལ་རྟག་ཏུ་ཡོངས་བརྟེན་ཅིང་༎
