 सर्वव्याधिप्रशमनं सर्वसत्वसुखावहम् ॥ त्भ्_४४	ནད་ནི་ཐམས་ཅད་ཞི་བྱེད་མ་༎ སེམས་ཅན་ཀུན་ལ་བདེ་སྟེར་མ་༎
 त्रिकारं यः पठेद् धीमान् शुचिः स्नानसमाहितः ।	བློ་ལྡན་གང་ཞིག་ལན་གསུམ་ཀློག་། མཉམ་བཞག་གཙང་སྦྲ་བྱས་པ་ཡིས་༎ དེས་ནི་དུས་མི་རིང་བ་རུ་༎
 अचिरेणैव कालेन राज्यश्रियम् अवाप्नुयात् ॥ त्भ्_४५	རྒྱལ་སྲིད་དཔལ་ཡང་ཐོབ་པར་འགྱུར་༎
 दुःखितः स्यात् सुखी नित्यदरिद्रो धनवान् भवेत् ।	རྟག་ཏུ་སྡུག་པའང་བདེ་བར་འགྱུར་༎ བཀྲེན་པ་ཕྱུག་པོར་འགྱུར་བའོ་༎
 जडो भवेन् महाप्राज्ञो मेधावी च न संशयः ॥ त्भ्_४६	རྨོངས་པ་ཤེས་རབ་ཆེན་པོར་འགྱུར་༎
 बन्धनान् मुच्यते बद्धो व्यवहारे जयो भवेत् ।	ཡིད་གཞུངས་འགྱུར་བར་ཐེ་ཚོམ་མེད་༎ བཅིངས་པ་བཅིངས་ལས་གྲོལ་བར་འགྱུར་༎ ཐ་སྙད་ལས་ཀྱང་རྒྱལ་བར་འགྱུར་༎ དགྲ་བོ་བཤེས་པོར་འགྱུར་བ་སྟེ་༎
 शत्रवो मित्रतां यान्ति शृङ्गिणश् चाथ दंष्ट्रिणः ॥ त्भ्_४७	རབ༹་ཅན་དང་ནི་མཆེ་བ་ཅན་༎
 संग्रामे संकटे दुर्गे नानाभयसमाकुले ।	དོག་པའི་འཐབ་མོ་རྒྱལ་དཀའ་དང་༎ སྣ་ཚོགས་འཇིགས་པ་འཁྲུགས་པ་ལས་༎
 स्मरणाद् एव नामानि सर्वपापान्य् अपोहति ॥ त्भ्_४८	མཚན་ནི་འདི་རྣམས་དྲན་པ་ཡིས་༎ འཇིགས་པ་ཀུན་ལས་སྒྲོལ་བར་བྱེད་༎
 नाकालमृत्युर् भवति प्राप्नोति विपुलां श्रियम् । मानुश्यं सफलं जन्म यस्य कस्य महात्मनः ॥ त्भ्_४९	དུས་མིན་འཆི་ལ་སྒྲོལ་བར་བྱེད་༎ སྐྱེས་བུ་སྙན་པ་ཐོབ་པར་བྱེད་༎ མིར་ནི་སྐྱེ་བ་དོན་དང་བཅས་༎ དེ་གཅིག་པུ་ཡི་ཕན་ཡོན་གྱིས་༎
 यश् चेदं प्रातर् उत्थाय मानवः कीर्तयिष्यति ।	གང་ཞིག་འདིར་ནི་སྔར་ལངས་ནས༏་༏སྐྱེས་བུ་གང་ཞིག་སྒྲོག་བྱེད་པ་༎
 स दीर्घकालम् आयुष्मान् श्रियं च लभते नरः ॥ त्भ्_५०	དེ་ཡི་དུས་རིང་ཚེ་དང་ལྡན་༎ མི་ནི་དཔལ་གྱིས་དགའ་འགྱུར་ཏེ་༎
 देवा नागास् तथा यक्षा गन्धर्वाः कटपूतनाः ।	ལྷ་དང་ཀླུ་དང་གནོད་སྦྱིན་དང་༎ དྲི་ཟ་དང་ནི་ལུས་སྲུལ་པོ་༎
 पिशाचराक्षसा भूता मातरो रौद्रतेजसः ॥ त्भ्_५१ क्षयापस्मारकारकश् चैव क्षतकाखोर्डकादयः ।	འབྱུང་པོ་གཤེད་བྱེད་སྲིན་པོ་དང་༎ མ་མོ་རྩུབ་པའི་སེམས་ལྡན་པ་༎
 डाकिन्यास् तारका प्रेताः स्कन्दा मारा महाग्रहाः ॥ त्भ्_५२	གནོད་སྦྱིན་མོ་དང་ཡི་དབ༹གས་བྱེད་༎ སྨྱོ་བྱེད་དང་ནི་གདོན་ཆེན་རྣམས་༎ གྲིབ་གནོན་དང་ནི་བརྗེད་བྱེད་དང་༎ ཤ་ཟ་༄༧༩ཨ་༌༎ ལ་སོགས་པ་རྣམས་དང་༎ རོ་ལངས་ལ་སོགས་སྣ་ཚོགས་རྣམས་༎
 छायाम् अपि न लङ्घन्ते किं पुनस् तस्य विग्रहः ।	སྐུལ་བྱེད་གཞན་སེམས་སྡང་བ་རྣམས་༎ གྲིབ་མ་ཡང་ནི་འགོམ་མི་འགྱུར་༎ ཇི་ལྟར་སླར་ནི་མཆོད་པར་འགྱུར་༎ སྡང་བའི་སེམས་ཅན་འཆིང་བར་འགྱུར་༎
 दुष्टसत्वा न वाधन्ते व्याधयो नाक्रमन्ति च ॥ त्भ्_५३	ནད་ལ་སོགས་པས་ཐེབས་མི་འགྱུར་༎ ཕྱུག་ཅིང་ལོངས་སྤྱོད་ཡོན་ཏན་ལྡན་༎
 देवासुरम् अपि संग्रामम् अनुभवन्ति महर्द्धिकाः । सर्वैश्वर्यगुणैर् युक्तः पुत्रपौत्रैश् च वर्धते ॥ त्भ्_५४	བུ་དང་ཚ་བོ་འཕེལ་བར་འགྱུར་༎ བློ་ལྡན་སྐྱེ་བ་དྲན་པར་འགྱུར་༎
 जातिस्मरो भवेद् धीमान् कुलीनः प्रियदर्शनः ॥ त्भ्_५५	རིགས་དང་ལྡན་ཞིང་མཐོང་དགར་འགྱུར་༎ གཟི་བརྗིད་དང་ལྡན་ཞིང་ཚིག་གསལ་བ་༎
 प्रीतिमांश् च महावाग्मी सर्वशास्त्रविशारदः ॥ त्भ्_५६	བསྟན་བཅོས་ཐམས་ཅད་རིག་པར་འགྱུར་༎
 कल्याणमित्रसंसेवी बोधिचित्तविभूषितः ।	དགེ་བཤེས་བསྙེན་བཀུར་ཡང་དག་བསྟེན་༎
 सदाविरहितो बुद्धैर् यत्र यत्रोपपद्यते ॥ त्भ्_५७	བྱང་ཆུབ་སེམས་ཀྱིས་བརྒྱན་པ་དང་༎ གང་དང་གང་དུ་སྐྱེས་པ་དེར་༎ རྟག་ཏུ་སངས་རྒྱས་ཀྱིས་མི་སྤོང་༎
