 अनेन परमार्थतः बोधिसत्त्वो नाम स कश्चिद् धर्मो न भवति, तथापि संवृतौ पुण्यज्ञानसम्भारं परिपूर्य परिशुद्धंज्ञानदर्शनाभ्यां यस्तथागतो भवति, (तेन) अविचारमणीयस्कन्धमात्रस्य बोधिसत्त्वस्यास्तित्वं भवन्त्येव ।	འདིས་ནི་དོན་དམ་པར་བྱང་ཆུབ་སེམས་དཔའ་ཞེས་བྱ་བའི་ཆོས་དེ་གང་ཡང་མེད་དུ་ཟིན་ཀྱང་ཀུན་རྫོབ་ཏུ་གང་བསོད་ནམས་དང་ཡེ་ཤེས་ཀྱི་ཚོགས་ཡོངས་སུ་བསྐངས་ནས་མཁྱེན་པ་དང་གཟིགས་པ་ཡོངས་སུ་དག་པའི་དེ་བཞིན་གཤེགས་པར་འགྱུར་བ་མ་བརྟགས་གཅིག་པུ་ན་དགའ་བ་ཕུང་པོ་ཙམ་གྱི་རང་བཞིན་གྱི་བྱང་ཆུབ་སེམས་དཔའི་ཡོད་པ་ཉིད་དོ་༎ 
 अन्यथा संवृतावपि यदि स न भवेत् तदा कस्तथागतो भवेदित्येवं तावत् दर्शितम् ।	དེ་ལྟ་མ་ཡིན་ཏེ་། གལ་ཏེ་ཀུན་རྫོབ་ཏུ་ཡང་དེ་མེད་དུ་ཟིན་ན་དེའི་ཚེ་སུ་ཞིག་དེ་བཞིན་གཤེགས་པར་འགྱུར་ཞེས་དེ་སྐད་སྟོན་ཏོ་༎
 तत्र संविद्यते तथागतस्य प्रज्ञाचक्षुः इत्येव तावन्नोच्यते, (अपि तु) विशिष्टं विशुद्धदर्शनमभिधातुं चक्षुषो विद्यामानत्वं दर्शितम् ।	དེ་ལ་དེ་བཞིན་གཤེགས་པ་ལ་ཤེས་རབ་ཀྱི་སྤྱན་ཁོ་ན་མངའོ་ཞེས་མི་བྱ་བ་ནི་གཟིགས་པ་རྣམ་པར་དག་པ་ཁྱད་ཞུགས་པར་བསྟན་པའི་ཕྱིར་སྤྱན་མངའ་བར་སྟོན་ཏོ་༎
 समासतश्चतुर्विधं भवति चक्षुः- रूपग्राहकम्,	མདོར་བསྡུས་སྤྱན་རྣམ་པ་བཞི་སྟེ་།
 परमार्थसत्यग्राहकम्, संवृतिसत्यग्राहकम्, सर्वाकारज्ञेयग्राहकं च ।	གཟུགས་འཛིན་པ་དང་། དོན་དམ་པའི་བདེན་པ་འཛིན་པ་དང་། ཀུན་རྫོབ་ཀྱི་བདེན་པ་འཛིན་པ་དང་། རྣམ་པ་ཐམས་ཅད་དུ་ཤེས་བྱ་འཛིན་པའོ་༎
 रूपग्राहकमपि द्विविधम्- कर्मफलं भावनाफलञ्चेति ।	གཟུགས་འཛིན་པ་ཡང་རྣམ་པ་གཉིས་ཏེ་། ལས་ཀྱི་འབྲས་བུ་དང་། བསྒོམས་པའི་འབྲས་བུའོ་༎ སྤྱན་རྣམ་པ་ལྔ་དང་གོ་རིམས་བཞིན་ནོ་༎
 पञ्चविधं चक्षुः क्रमशः- तत्र स्थूलविषयत्वात् प्रथमं रूपग्राहकं कथितम्,	དེ་ལ་ཡུལ་རིགས་པའི་ཕྱིར་དང་པོར་གཟུགས་འཛིན་པ་བསྟན་ཏོ་༎
 परमार्थवशेन संवृतिज्ञानं परिशुद्धध्यतीत्यतः पूर्वं परमार्थसत्यग्राहकं पश्चाच्च संवृतिसत्यग्राहकमभिहितमिति सङ्गच्छते क्रमनिर्देशः	དོན་དམ་པའི་དབང་གིས་ཀུན་རྫོབ་ཤེས་པ་ཡོངས་སུ་དག་པར་འགྱུར་ཏེ་། དེས་ན་དོན་དམ་པའི་བདེན་པ་འཛིན་པ་ནི་སྔར་བསྟན་ལ་། ཀུན་རྫོབ་ཀྱི་བདེན་པ་འཛིན་པ་ནི་ཕྱིས་བཤད་དོ་ཞེས་གོ་རིམས་བསྟན་པའི་མཚམས་སྦྱར་བའོ་༎
 पुद्गलधर्मनैरात्म्ययोः संविद्यते प्रज्ञाचक्षुः,	གང་ཟག་དང་ཆོས་ལ་བདག་མེད་པའི་ཡུལ་ལ་ནི་ཤེས་རབ་ཀྱི་སྤྱན་མངའོ་༎
 संवृतौ धर्ममात्रमेव तावदवभासते, न तु पुद्गल इति पुद्गलशून्ये धर्ममात्रे धर्मचक्षुः,	ཀུན་རྫོབ་ཏུ་ཆོས་ཙམ་དུ་སྣང་བ་ཉིད་དེ་གང་ཟག་ནི་མ་ཡིན་ན་ཞེས་གང་ཟག་སྟོང་སྟེ་། ཆོས་ཙམ་གྱི་ཡུལ་ལ་ནི་ཆོས་ཀྱི་སྤྱན་ནོ་༎
 सर्वज्ञेयानां सर्वाकारज्ञानं तावद् बुद्धचक्षुरित्युच्यते,	ཤེས་བྱ་ཐམས་ཅད་རྣམ་པ་ཐམས་ཅད་དུ་མཁྱེན་པ་ནི་སངས་རྒྱས་ཀྱི་སྤྱན་ཞེས་བྱ་སྟེ་།
 अनेनेदानीं साक्षात्कृत्य विहरणात् । तथ्यसंवृतौ पञ्चचक्षुषां देशनयोक्तं विशुद्धदर्शनम् । ३। अनुत्तरज्ञानपरिशुद्धिसम्पद् :	འདིས་ནི་ད་ལྟར་མངོན་སུམ་དུ་མཛད་པར་བཞུགས་པའི་ཕྱིར་ཡང་དག་པའི་ཀུན་རྫོབ་ཏུ་སྤྱན་ལྔ་བསྟན་པས་ནི་གང་གཟིགས་པ་རྣམ་པར་དག་པ་བརྗོད་དོ་༎ 
 विशुद्धज्ञानाभिधानार्थम्- तत्किं मन्यसे सुभूते इत्याद्याह ।	མཁྱེན་པ་རྣམ་པར་དག་པ་བརྗོད་པའི་ཕྱིར་། རབ་འབྱོར་འདི་ཇི་སྙམ་དུ་ཞེས་བྱ་བ་ལ་སོགས་པ་གསུངས་སོ་༎
 त्रैकालिकाः चित्तचैतसास्तावच्चित्तसन्ततिः ।	དུས་གསུམ་གྱི་སེམས་དང་སེམས་ལས་བྱུང་བ་རྣམས་ནི་སེམས་ཀྱི་རྒྱུན་ནོ༎
 ततः त्रैकाल्यविषयत्वेन तद्विषयावबोधो ज्ञानमित्युच्यते, न तु दर्शनम् ।	༄༢༥༡བ་དེ་བས་ན་དུས་གསུམ་ཡུལ་ཡིན་པའི་ཕྱིར་ཡུལ་དེ་ཤེས་པ་ནི་མཁྱེན་པ་ཞེས་བྱའི་གཟིགས་པ་ཞེས་ནི་མི་བྱའོ་༎
 तदपि सरागचित्तवीतरागचित्तेत्यादिनानाविधसंक्लेशव्यवदानभावेन वेदितव्यम् ।	དེ་ཡང་འདོད་ཆགས་དང་བཅས་པའི་སེམས་དང་འདོད་ཆགས་དང་དབྲལ་བའི་སེམས་ཞེས་བྱ་བ་ལ་སོགས་པ་ཀུན་ནས་ཉོན་མོངས་པ་དང་། རྣམ་པར་བྱང་བའི་ངོ་བོ་སྣ་ཚོགས་སུ་རིག་པར་བྱའོ་༎
 तावन्तो लोकधातवः इत्युपलक्षणम्,	དེ་སྙེད་ཀྱི་འཇིག་རྟེན་གྱི་ཁམས་ཞེས་བྱ་བ་ནི་མཚོན་པ་སྟེ་།
 अनन्तलोकधात्वन्तर्निहितसत्त्वानां चित्तधारायाः परिज्ञानात् । तथाहि- संवृतौ तथागतस्य मांसचक्षुरादीनि भवन्ति,	འཇིག་རྟེན་གྱི་ཁམས་མཐའ་ཡས་པར་གཏོགས་པའི་སེམས་ཅན་རྣམས་ཀྱི་རྒྱུན་ཡོངས་སུ་མཁྱེན་པའི་ཕྱིར་རོ་༎ འདི་ལྟར་ཀུན་རྫོབ་ཏུ་དེ་བཞིན་གཤེགས་པ་ལ་ཤའི་སྤྱན་ལ་སོགས་པ་མངའ་སྟེ་།
 अतस्तन्निष्पादनार्थं बोधिसत्त्वेन छन्दप्रणिधानाभ्यां स्थातव्यम् । अनेन तावद् वचनेन सम्पद्द्वयं परिदीपितम् ।	དེས་ན་དེས་བསྒྲུབ་པའི་ཕྱིར་བྱང་ཆུབ་སེམས་དཔའ་འདུན་པ་དང་སྨོན་ལམ་གྱི་གནས་པར་བྱ་བའོ་༎ གཞུང་འདིས་ནི་ཕུན་སུམ་ཚོགས་པ་གཉི་ག་ཡང་བསྟན་པ་ཡིན་ནོ་༎
 मांसचक्षुरादीन्यपि एकानेकस्वभावाभ्यां विचारणायामनुपलब्धान्येव । न ह्यर्थान्तरज्ञानेन ग्रहणं युज्यते,	ཤའི་སྤྱན་ལ་སོགས་པ་ཡང་གཅིག་དང་དུ་མའི་རང་བཞིན་གྱིས་དཔྱད་ན་མི་དམིགས་པ་ཉིད་ལ་། དོན་གཞན་ཤེས་པས་འཛིན་པར་ཡང་མི་རིགས་ཏེ་།
 यथा पूर्वं विचारितम्, एवं सति कथं प्रज्ञास्येते तथागतस्य मांसचक्षुरादिविद्यमानता चित्तधारा चेति चित्ताशयं विदित्वा तत्कस्य हेतोः? इत्याह । बोधिसत्त्वेन कथमनयोर्द्वयोर्विशुद्धयोर्योगसमापत्त्या प्रतिपत्तव्यम्?	ཇི་ལྟར་སྔར་དཔྱད་པ་ལྟ་བུ་ཡིན་ན་དེ་བཞིན་གཤེགས་པ་ལ་ཤའི་སྤྱན་ལ་སོགས་པ་མངའ་བ་དང་སེམས་ཀྱི་རྒྱུན་རབ་ཏུ་མཁྱེན་པར་ཇི་ལྟར་འགྱུར་སྙམ་དུ་སེམས་པའི་བསམ་པ་ལ་བརྟགས་ནས་དེ་ཅིའི་སླད་དུ་ཞེས་ཞུས་པ་དང་། བྱང་ཆུབ་སེམས་དཔའ་རྣམ་པར་དག་པ་འདི་གཉིས་ལ་རྣལ་འབྱོར་དུ་སྙོམས་པར་འཇུག་པས་ཇི་ལྟར་བསྒྲུབ་པར་བྱ་བ་དེ་བསྟན་པའི་ཕྱིར་།
 इत्येतदभिधातुं चित्तधारा चित्तधारा इत्याद्याह ।	སེམས་ཀྱི་རྒྱུན་སེམས་ཀྱི་རྒྱུན་ཞེས་བྱ་བ་ལ་སོགས་པ་གསུངས་སོ་༎
 परमार्थतः अधारा इति ।	རྒྱུན་མེད་ཅེས་བྱ་བ་ནི་དོན་དམ་པར་རོ་༎
 स्वभावतो ऽसत्त्वे ऽपि संवृतिमधिकृत्याह- तेनोच्यते चित्तधारेति इति ।	རང་བཞིན་མེད་དུ་ཟིན་ཀྱང་ཀུན་རྫོབ་ལ་བརྟེན་ནས་གསུངས་ཏེ་། དེ་ཉིད་ཀྱི་ཕྱིར་སེམས་ཀྱི་རྒྱུན་ཞེས་བྱའོ་ཞེས་གསུངས་སོ་༎
 अन्यथा परमार्थतः सर्ववाग्गोचरातीतत्वान्न वक्तुं शक्ष्यत इत्यभिप्रायः ।	དེ་ལྟ་མ་ཡིན་པ་དོན་དམ་པར་ནི་བརྗོད་པའི་སྤྱོད་ཡུལ་ཐམས་ཅད་ལས་འདས་པའི་ཕྱིར་བརྗོད་པར་མི་འགྱུར་རོ་སྙམ་དུ་དགོངས་པའོ་༎
 चित्तधारेत्युपलक्षणम् ।	སེམས་ཀྱི་རྒྱུན་ཞེས་སྨོས་པ་ནི་མཚོན་པ་སྟེ་།
 मांसचक्षुरादीन्यपि चक्षुःस्वभावरहितान्येव उक्तानीति कथनं प्रकृतं साक्षान्नोक्तम् ।	ཤའི་སྤྱན་ལ་སོགས་པ་ཡང་སྤྱན་གྱི་རང་བཞིན་མེད་པ་ཉིད་དུ་གསུངས་སོ་ཞེས་བརྗོད་པར་བྱ་བའི་སྐབས་ཡིན་ཏེ་། མངོན་སུམ་གསུངས་སོ་༎
 अत्र कथं चित्तं प्रग्रहीतव्यमिति तदभिधातुमाह तत्कस्य हेतोः? इति ।	འདི་ལ་ཇི་ལྟར་སེམས་རབ་ཏུ་གཟུང་བར་བྱ་བ་དེ་བསྟན་པའི་ཕྱིར་དེ་ཅིའི་སླད་དུ་ཞེས་བྱ་བ་དེ་ཞུས་ཏེ་།
 अधारेत्यनेन सह योजनीयम् ।	རྒྱུན་མེད་ཅེས་བྱ་བ་དང་སྦྱར་རོ་༎
 अतीतादीनां चित्तानां परमार्थतो ऽनुत्पन्नत्वाद् अनुपलम्भः ।	འདས་པ་ལ་སོགས་པའི་༄༢༥༢ཨ་༌་༎ སེམས་ནི་དོན་དམ་པར་མ་སྐྱེས་པའི་ཕྱིར་མི་དམིགས་ཀྱི་།
 सत्त्वे ऽपि ग्रहणानुपपत्त्या नानुपलम्भः ।	ཡོད་ཀྱང་འཛིན་པར་མི་འཐད་པས་མི་དམིགས་པ་ནི་མ་ཡིན་ནོ་༎
 तथा सति अचित्तधारादेशनमपि न भवेत्,	དེ་ལྟ་ན་ནི་སེམས་ཀྱི་རྒྱུན་མེད་པར་བསྟན་པར་མི་འགྱུར་ཏེ་།
 न चानुपलम्भमात्रेण भावानां निःस्वभावत्वं स्यात् ।	མི་དམིགས་པ་ཙམ་གྱིས་ནི་དངོས་པོ་རྣམས་ཀྱི་རང་བཞིན་མེད་པར་མི་འགྱུར་རོ་༎
 यथा त्रैकालिकचित्तस्य परमार्थतो ऽभावस्तथा पूर्वमुक्तं वक्ष्यते च ।	ཇི་ལྟར་དུས་གསུམ་གྱི་སེམས་དོན་དམ་པར་མེད་པ་དེ་ལྟར་ནི་སྔར་ཡང་བཤད་དེ་། སྟོན་པར་ཡང་འགྱུར་རོ་༎
 चित्तोक्तिरूपलक्षणम्,	སེམས་སྨོས་པ་ནི་མཚོན་པ་སྟེ་།
 ततो ऽतीतादिमांसचक्षुरादीन्यप्यनुपलब्धान्येव ।	དེས་ན་ཤའི་མིག་ལ་སོགས་པ་འདས་པ་ལ་སོགས་པ་ཡང་མི་དམིགས་པ་ཉིད་དོ་༎
 अत्र अधारा इत्यादिभिः पदैर्गाम्भीर्यमुक्तम्,	འདི་ལ་རྒྱུན་མེད་ཅེས་བྱ་བ་ལ་སོགས་པའི་ཚིག་གིས་ནི་ཟབ་པ་བརྗོད་དོ་༎
 शेषैरौदार्यम् ।	ལྷག་མ་རྣམས་ཀྱིས་ནི་རྒྱ་ཆེ་བའོ་༎
 ४। प्राप्तपुण्यस्कन्धाधिपत्यसम्पद् : यदि नास्ति त्रैकालिकं चित्तं तदा पुण्यस्कन्धो ऽपि न स्यात्, चित्ताश्रितत्वात्तस्य ।	གལ་ཏེ་དུས་གསུམ་གྱི་སེམས་མེད་ན་དེའི་ཚེ་བསོད་ནམས་ཀྱི་ཕུང་པོ་ཡང་མེད་པར་འགྱུར་ཏེ་། དེ་ནི་སེམས་ལ་བརྟེན་པའི་ཕྱིར་རོ་༎
 ततः तथागतस्य पुण्यस्कन्धाधिपत्यसम्पदं सम्पादयितुं कथं बोधिसत्त्वो यत्नं कूर्यादिति विचिन्त्य पुण्यस्कन्धाधिपत्यसम्पदमधिकृत्य- तत्किं मन्यसे सुभूते इत्याद्याह ।	དེ་བས་ན་དེ་བཞིན་གཤེགས་པའི་བསོད་ནམས་ཀྱི་ཕུང་པོ་ལ་མངའ་བ་ཕུན་སུམ་ཚོགས་པ་བསྒྲུབ་པའི་ཕྱིར་བྱང་ཆུབ་སེམས་དཔའ་ཇི་ལྟར་འབད་པར་བྱ་སྙམ་པ་ལ་བརྟགས་ཏེ་། བསོད་ནམས་ཀྱི་ཕུང་པོ་ལ་མངའ་བ་ཕུན་སུམ་ཚོགས་པའི་དབང་དུ་མཛད་ནས་། རབ་འབྱོར་འདི་ཇི་སྙམ་དུ་སེམས་ཞེས་བྱ་བ་ལ་སོགས་པ་གསུངས་སོ་༎
 अनेन कुलपुत्रो वा कुलदुहिता वा यो ऽन्तशो रत्नादिकं बाह्यवस्तु त्यजति, सो ऽपि (यदि) महापुण्यस्कन्धेन युक्तो भवति (तदा)	འདིས་ནི་རིགས་ཀྱི་བུ་འམ་རིགས་ཀྱི་བུ་མོ་ཐ་ན་གང་ཕྱིའི་དངོས་པོ་ནི་རིན་པོ་ཆེ་ལ་སོགས་པ་གཏོང་བར་བྱེད་པ་དེ་ཡང་བསོད་ནམས་ཀྱི་ཕུང་པོ་ཆེན་པོ་དང་ལྡན་པར་འགྱུར་ན་། 
 कथं न तथागतस्य असंख्येयाप्रमेयकल्पेषु दुष्करानेकशतान्यभ्यस्यतः पुण्यस्कन्धाधिपत्यं स्यादित्येवं देशितम् ।	དེ་བཞིན་གཤེགས་པ་བསྐལ་པ་གྲངས་མེད་དཔག་ཏུ་མེད་པར་བྱ་དཀའ་བ་བརྒྱ་ཕྲག་དུ་མ་གོམས་པར་མཛད་པས་བསོད་ནམས་ཀྱི་ཕུང་པོ་ལ་མངའ་བར་ཅིའི་ཕྱིར་མི་འགྱུར་ཞེས་དེ་སྐད་ན་། སྟོན་ཏོ་༎ 
 अत एव परमार्थतो ऽसत्यपि पुण्यस्कन्धे संवृतौ सत्त्वाद् बोधिसत्त्वेन तत्र वशीभावं निष्पादयितुं छन्दप्रणिधानाभ्यां स्थातव्यमित्यादर्शितम्	དེས་ན་དོན་དམ་པར་བསོད་ནམས་ཀྱི་ཕུང་པོ་མེད་དུ་ཟིན་ཀྱང་ཀུན་རྫོབ་ཏུ་ཡོད་པས་ན་བྱང་ཆུབ་སེམས་དཔས་དེ་ལ་དབང་བ་བསྒྲུབ་པའི་ཕྱིར་འདུན་པ་དང་། སྨོན་ལམ་གྱིས་གནས་པར་བྱའོ་ཞེས་བསྟན་ཏེ་།
 अनेनौदार्यमप्युक्तम् ।	འདི་ནི་རྒྱ་ཆེ་བ་ཡང་བརྗོད་དོ་༎
 कथं न परमार्थतः पुण्यस्कन्धसत्त्वं व्यवस्थाप्यत इति विचिन्त्य ऽबोधिसत्त्वेनात्र कथं प्रतिपत्तव्यम्, कथञ्च चित्तं प्रग्रहीतव्यम्,	བསོད་ནམས་ཀྱི་ཕུང་པོ་དོན་དམ་པར་ཡོད་པར་ཅིའི་ཕྱིར་རྣམ་པར་མི་གཞག་སྙམ་པ་ལ་བརྟགས་ནས་བྱང་ཆུབ་སེམས་དཔས་འདི་ལ་ཇི་ལྟར་བསྒྲུབ་པར་བྱ་བ་དང་། སེམས་རབ་ཏུ་གཟུང་བར་བྱ་བ་དང་། གཉི་ག་བསྟན་པའི་ཕྱིར་།
 ऽ; इत्युभयं सन्दर्शियितुं सचेत् सुभूते इत्याद्याह ।	རབ་འབྱོར་གལ་ཏེ་ཞེས་བྱ་བ་ལ་སོགས་པ་གསུངས་སོ་༎
 सचेत् इति ऽयदिऽ; इत्यर्थः ।	གལ་ཏེ་ཞེས་བྱ་བ་ནི་ཇི་༄༢༥༢བ་སྟེ་ཞེས་བྱ་བའི་ཐ་ཚིག་གོ་༎
 न तथागतो ऽभाषिष्यत् इति परमार्थतो ऽभिधानं नाचरिष्यत् ।	དེ་བཞིན་གཤེགས་པ་མི་གསུང་ངོ་ཞེས་བྱ་བ་ནི་དོན་དམ་པར་བརྗོད་པ་མི་སྤྱོད་པའི་ཕྱིར་ཏེ་། 
 अनिर्देशे ऽपि तथा ख्यायत इत्यभिप्रायः ।	མ་བསྟན་པར་ཡང་དེ་ལྟར་གྲགས་པར་འགྱུར་རོ་སྙམ་དུ་དགོངས་པའོ་༎
 यथा परमार्थतः पुण्यस्कन्धस्याभावस्तथा प्राग्वर्णितः ।	ཇི་ལྟར་བསོད་ནམས་ཀྱི་ཕུང་པོ་དོན་དམ་པར་མེད་པ་དེ་ལྟར་སྔར་བསྟན་ཟིན་ཏོ་༎
