 बहु तत् पृथिवीरजो ऽपि यः परमाणुस्वभाव उक्तस्तदेकत्वग्रहणनिषेधात् तदरज एव ।	སའི་རྡུལ་༄༢༣༥བ་དེ་མང་པོ་གཅིག་པ་ཉིད་དུ་འཛིན་པ་གསལ་བའི་ཕྱིར་རྡུལ་ཕྲ་རབ་ཀྱི་ངོ་བོར་གསུངས་པ་གང་ཡིན་པ་དེ་ནི་རྡུལ་མེད་པ་ཁོ་ན་སྟེ་།
 मायानिर्मितस्वभावत्वान्नास्ति परमाणुः परमार्थतः, बुद्ध्योपचरितरूपत्वात् ।	དོན་དམ་པར་ན་སྒྱུ་མས་སྤྲུལ་པའི་ངོ་བོ་བཞིན་དུ་རྡུལ་ཕྲ་རབ་མེད་པ་ཁོ་ན་ལས་བློས་རབ་ཏུ་བརྟགས་པའི་བདག་ཉིད་ཡིན་པའི་ཕྱིར་རོ་༎ 
 इदं तावदेकत्वग्रहणोपायमात्रम्, न तु परमार्थम्,	འདིས་ནི་གཅིག་པུར་འཛིན་པའི་ཐབས་ཙམ་དུ་གསུངས་པར་ཟད་ཀྱི་དོན་དམ་པར་ནི་མ་རོ་༎ ཡིན་ནོ་༎ 
 तेनोच्यते पृथिवीरज इति । तद् युक्तं संवृतौ सत्त्वात्,	དེས་ན་སའི་རྡུལ་ཞེས་བགྱིའོ་ཞེས་བྱ་བ་ནི་དེ་རིགས་པའི་ཀུན་རྫོབ་ཏུ་ཡོད་པའི་ཕྱིར་རོ་༎
 अन्यथा परमार्थस्तस्यासत्त्वाद् अनभिलाप्यत्वाच्च स्वलक्षणं नाभिलप्यत इत्येवमभिप्रायः ।	དེ་ལྟ་མ་ཡིན་ན་དོན་དམ་པར་དེ་མེད་པའི་ཕྱིར་དང་། རང་གི་མཚན་ཉིད་ནི་བརྗོད་དུ་མི་རུང་བའི་ཕྱིར་བརྗོད་པར་མི་འགྱུར་རོ་སྙམ་པ་ཁོ་ནར་དགོངས་པའོ་༎ 
 उद्भावनासंवृत्यापि तस्य देशनं न युज्यते,	བརྗོད་པའི་ཀུན་རྫོབ་ཏུ་དེ་བསྟན་པར་ཡང་མི་རིགས་ཏེ་།
 तदीयान्यतरात्मस्वभावस्य अप्रतिभासमानत्वात् ।	དེའི་རང་གི་ངོ་བོ་ནི་གཞན་ཡང་མི་སྣང་བའི་ཕྱིར་རོ་༎
 अनेन तावद् अनेकस्वभाववियोगाधिगमोपायो निराभासकरणत्वेनोपदर्श्यते ।	འདིས་ནི་དུ་མའི་རང་བཞིན་དང་བྲལ་བར་ཁོང་དུ་ཆུད་པའི་ཐབས་ནི་སྣང་བ་མེད་པར་བྱ་བ་ཡིན་པར་སྟོན་ཏོ་༎
 एवञ्चान्तशः परमाणूनामपि युक्त्या प्रत्येकं परिक्ष्यमाणानां प्रतीतावेव सत्त्वात् प्रतीयते लोकधातूनां चानेकस्ववियुक्तत्वम्,	འདི་ལྟར་མཇུག་ཏུ་ཕྲ་རབ་རྣམས་ཀྱང་རིགས་པས་སོ་སོར་བཏགས་ནས་སྣང་བར་བྱེད་པས་ན་།
 ततश्च (तेषां) निःस्वभावत्वमवगम्यते ।	འཇིག་རྟེན་གྱི་ཁམས་རྣམས་དུ་མའི་རང་བཞིན་དང་བྲལ་བར་རྟོགས་པར་འགྱུར་ཞིང་དེའི་འོག་ཏུ་རང་བཞིན་མེད་པར་ཁོང་དུ་ཆུད་དོ་༎
 एवं खलु भाजनलोकस्य एकानेकस्वभाववियोगेन निःस्वभावत्वमॄ एवमभिधाय सत्त्वलोकस्याप्यभिधानार्थ यो ऽसौ लोकधातुः इत्याह ।	དེ་ལྟར་རེ་ཞིག་སྣོད་ཀྱི་འཇིག་རྟེན་གཅིག་དང་དུ་མའི་རང་བཞིན་དང་བྲལ་བས་རང་བཞིན་ནི་མེད་པ་ཁོ་ནར་བརྗོད་ནས་སེམས་ཅན་གྱི་འཇིག་རྟེན་ཡང་བརྗོད་པའི་ཕྱིར་། འཇིག་རྟེན་གྱི་ཁམས་གང་ལགས་པ་དེ་ཞེས་བྱ་བ་གསོལ་ཏོ་༎
 अत्र लोकधातुना सत्त्वलोको ऽभिप्रेतः,	འཇིག་རྟེན་གྱི་ཁམས་ནི་འདིར་སེམས་ཅན་གྱི་འཇིག་རྟེན་ལ་དགོངས་པ་སྟེ་།
 इतरस्य पूर्वमेवोक्तत्वात् ।	གཞན་ནི་སྔར་བཤད་ཟིན་པའི་ཕྱིར་རོ་༎
 अधातुः सः इति एकानेकस्वभावरहितः स इत्यभिप्रायः ।	དེ་ཁམས་མ་མཆིས་པར་ཞེས་བྱ་བ་དེ་གཅིག་དང་དུ་མའི་རང་བཞིན་དང་བྲལ་བའི་ཕྱིར་རོ་སྙམ་དུ་དགོངས་པ་སྟེ་།
 एवं यो हि रूपस्कन्धः स भाजनलोकत्वेनाभिहितः,	འདི་ལྟར་རེ་ཞིག་དེ་ལས་གཟུགས་ཀྱི་ཕུང་པོ་གང་ཡིན་པ་དེ་ནི་སྣོད་ཀྱི་འཇིག་རྟེན་ཉིད་ཀྱིས་བཤད་དོ་༎ 
 शेषाश्चत्वारः स्कन्धास्तु यथैकानेकस्वभावेन वियुक्तास्तथा पूर्वं विवेचिता एव ।	ཕུང་པོ་ལྷག་མ་བཞི་ནི་ཇི་ལྟར་གཅིག་དང་དུ་མའི་རང་བཞིན་དང་མི་ལྡན་པར་སྔར་དཔྱད་པ་ཉིད་དོ་༎
 एवं सति परमार्थतो निःस्वभावत्वात् सर्वे धर्मा मायोपमा दृश्यन्ते योगिभिः ।	དེ་ལྟ་མ་ཡིན་པས་ན་ཆོས་ཐམས་ཅད་སྒྱུ་མ་བཞིན་དུ་དོན་དམ་པར་རང་བཞིན་མེད་པར་རྣལ་འབྱོར་པ་རྣམས་ཀྱིས་མཐོང་ངོ་༎
 अनेन गाम्भीर्यमपि तावदुक्तम् ।	འདིས་ནི་ཟབ་པ་ཡང་བརྗོད་དོ་༎
 अर्थतः परमार्थे सत्त्वभाजनलोकीयभावाभिनिवेशो विपक्षत्वेन परिदीपितः ।	དོན་གྱིས་ན་དོན་དམ་པར་སྣོད་དང་སེམས་ཅན་གྱི་འཇིག་རྟེན་ལ་དངོས་པོར་མངོན་པར་ཞེན་པ་མི་མཐུན་པའི་ཕྱོགས་སུ་ཡོངས་སུ་བསྟན་ཏོ་༎
 तत्प्रहाणार्थं च छन्दः प्रणिधानं च निर्दिष्टे ।	དེ་སྤང་བར་༄༢༣༦ཨ་༌་༎ བྱ་བའི་ཕྱིར་འདུན་པ་དང་། སྨོན་ལམ་གདབ་པ་ཡང་བསྟན་ཏེ་།
 त्रिसाहस्रमहासाहस्रे लोकधातौ इति निमित्तमात्राभिधानेन सर्वभावानां निःस्वभावत्वभावना सन्दर्शिता ।	སྟོང་གསུམ་གྱི་སྟོང་ཆེན་པོའི་འཇིག་རྟེན་གྱི་ཁམས་ཞེས་མཚན་མ་ཙམ་ཞིག་ཡོངས་སུ་བརྗོད་པས་དངོས་པོ་མཐའ་དག་རང་བཞིན་མེད་པར་བསྒོམ་པར་ཡོངས་སུ་སྟོན་ཏོ་༎ 
 अरजस्तत् इति अधातुः इत्याभ्यां परमार्थव्यवस्थापनया योगसमापत्त्या कथं प्रतिपत्तव्यमिति तत् परिदीपितम् ।	དེ་རྡུལ་མ་མཆིས་པར་ཞེས་བྱ་བ་དང་། ཁམས་མ་མཆིས་པར་ཞེས་བྱ་བ་འདིས་ནི་དོན་དམ་པར་རྣམ་པར་འཇོག་པ་འདིས་ནི་རྣལ་འབྱོར་དུ་སྙོམས་པར་འཇུག་པས་ཇི་ལྟར་བསྒྲུབ་པར་བྱ་བ་དེ་ཡོངས་སུ་བསྟན་ཏོ་༎
 तेनोच्यते लोकधातुः इत्यनेनापवादान्तं परिहृत्य विक्षेपनिग्रहो निर्दिष्टः ।	དེས་ན་འཇིག་རྟེན་གྱི་ཁམས་ཞེས་བགྱིའོ་ཞེས་བྱ་བ་འདིས་ནི་སྐུར་པ་འདེབས་པའི་མཐའ་བཀག་ནས་ག-ཡེང་བ་ཚར་གཅོད་པ་བསྟན་ཏོ་༎
 ११। तथागतपूजासत्कार-स्थानम् : सम्प्रति ये बोधिसत्त्वाः पुण्यसम्भारप्रतिपत्तये ऽत्यन्तमुपकारित्वाद् भगवन्तं पूजयेयुस्तेषां तस्य (भगवतः) अविनाशिकायो न पूरयति पुण्यसम्भारम्,	ད་ནི་བྱང་ཆུབ་སེམས་དཔའ་གང་དག་བསོད་ནམས་ཀྱི་ཚོགས་བསྒྲུབས་པའི་ཤིན་ཏུ་ཕན་འདོགས་པས་བཅོམ་ལྡན་འདས་ལ་མཆོད་པ་ན་དེའི་སྐུ་རྣམ་པར་མི་འཇིག་པ་དེ་དག་བསོད་ནམས་ཀྱི་ཚོགས་ཡོངས་སུ་རྫོགས་པར་མི་འགྱུར་ཏེ་།
 सम्यङ्मनसिकाराप्रवृत्तत्वात् ।	ཡང་དག་པ་ཡིད་ལ་བྱེད་པ་ལ་མ་ཞུགས་པའི་ཕྱིར་རོ་༎
 तस्मात् तेषां सम्भारासञ्चयतो वियोगार्थं एकादशस्थानमधिकृत्याह- तत्किं मन्यसे सुभूते इत्यादि ।	དེ་བས་ན་དེ་དག་ཆོགས་མ་བསགས་པ་དང་བྲལ་བའི་ཕྱིར་གནས་བཅུ་གཅིག་པའི་དབང་དུ་མཛད་ནས་། རབ་འབྱོར་འདི་ཇི་སྙམ་དུ་སེམས་ཞེས་བྱ་བ་ལ་སོགས་པ་གསུངས་སོ་༎
 सामान्यतो ऽत्रायं सङ्ग्रहार्थः,	འདིར་སྤྱིར་བསྡུ་བའི་དོན་ནི་འདི་ཡིན་ཏེ་།
 तथागतपूजासत्कारेषु लक्षणसम्पदा तथागतो न द्रष्टव्यः,	དེ་བཞིན་གཤེགས་པ་ལ་མཆོད་པ་དང་། རིམ་གྲོ་བྱེད་པ་ན་མཚན་ཕུན་སུམ་ཚོགས་པས་དེ་བཞིན་གཤེགས་པར་མི་ལྟའི་།
 अथ कथमिति चेत्?	འོ་ན་ཇི་ལྟ་བུ་ཞེ་ན་།
 परमार्थधर्मतायामित्युच्यते ।	དོན་དམ་པ་ཆོས་ཉིད་དུ་ཞེས་བྱ་བའོ་༎
 इह अवशिष्टव्याख्यानं तु रूपकायाप्तिकामतास्थानानुरूपम् ।	ལྷག་མའི་བཤད་པ་ནི་གཟུགས་ཀྱི་སྐུ་ཐོབ་པར་འདུན་པའི་གནས་དང་འདིར་མཐུན་ནོ་༎
 न चात्र पुनरुक्तिरप्याशङ्कनीया ।	འདི་ལ་ཚིག་ཟློས་པ་སྙམ་དུ་དོགས་པར་ཡང་མི་བྱ་སྟེ་།
 पूर्वं रूपकायाप्तिकामताप्रसङ्गे तु तद्व्युदासो दर्शितः,	སྔར་ནི་གཟུགས་ཀྱི་སྐུ་ཐོབ་པར་འདུན་པའི་དུས་ན་དེ་རྣམ་པར་གཞིག་པར་བསྟན་།
 अधुना तथागतपूजासत्कारप्रसङ्गे दर्शितत्वाद् भिन्न एव (रूपकायः) ।	ད་ནི་དེ་བཞིན་གཤེགས་པ་ལ་མཆོད་པ་དང་རིམ་གྲོ་བ་པའི་དུས་ན་བསྟན་པས་ཐ་དད་དོ་༎ 
 अत्रार्थतः रूपकाये तथागताभिनिवेशं विपक्षत्वेन निर्दिश्य तत्प्रहानार्थं छन्दः प्रणिधानं चापि प्रदर्शिते ।	འདིར་དོན་གྱིས་ན་གཟུགས་ཀྱི་སྐུ་ལ་དེ་བཞིན་གཤེགས་པར་མངོན་པར་ཞེན་པ་མི་མཐུན་པའི་ཕྱོགས་སུ་ཡོངས་སུ་བསྟན་ཏེ་། དེ་སྤང་བར་བྱ་བའི་ཕྱིར་འདུན་པ་དང་སྨོན་ལམ་གདབ་པར་ཡང་བསྟན་ཏོ་༎
 लक्षणानि इत्युपलक्षणमात्रोक्त्या सकलो रूपकायः परिदीपितः ।	མཆན་ཕུན་སུམ་ཚོགས་པ་ཞེས་མཚན་མ་ཙམ་ཞིག་བརྗོད་པས་གཟུགས་ཀྱི་སྐུ་མཐའ་དག་ཡོངས་སུ་བསྟན་ཏོ་༎ 
 अलक्षणानि इति परमार्थव्यवस्थानम् ।	མཚན་མ་མཆིས་པར་ཞེས་བྱ་བ་ནི་དོན་དམ་པ་རྣམ་པར་འཇོག་པའོ་༎
 तेन इत्यादिना विक्षेपनिग्रहो निर्दिष्टः ।	དེས་ན་ཞེས་བྱ་བ་ལ་སོགས་པས་ནི་ག-ཡེང་བ་ཚར་གཅོད་པ་བསྟན་ཏོ་༎
 १२। कायचित्तपरिश्रान्तौ विर्यम्युख्यानारम्भलाभ-सत्कारविरहितता : एवं सर्वधर्माणां नैरात्म्यावगमोपाये निर्दिष्टे ऽपि कायजीवितेष्वासज्य ये लाभसत्काराध्यसिताः कौसीद्यलाभसत्कारपिण्डपातानुरक्ता तेषां तत्रानुरक्तिविसंयोगार्थं द्वादशस्थानमधिकृत्याह-	དེ་ལྟར་ཆོས་ཐམས་ཅད་ལ་བདག་མེད་པར་༄༢༣༦བ་རྟོགས་པར་བྱ་བའི་ཐབས་བསྟན་དུ་ཟིན་ཀྱང་ལུས་དང་སྲོག་ལ་ཆགས་ཤིང་རྙེད་པ་དང་བཀུར་སྟི་ལ་གདུ་བ་གང་དག་ལེ་ལོ་དང་རྙེད་པ་དང་བཀུར་སྟི་དང་བསོད་སྙོམས་ལ་ཆགས་པར་གྱུར་པ་དེ་དག་དེ་ལ་ཆགས་པ་དང་བྲལ་བའི་ཕྱིར་གནས་བཅུ་གཉིས་པའི་དབང་དུ་མཛད་ནས་།
 यश्च खलु पुनः सूभूते, स्त्री वा पुरुषो वा इत्यादि ।	རབ་འབྱོར་སྐྱེས་པའམ་བུད་མེད་གང་གིས་ཞེས་བྱ་བ་ལ་སོགས་པ་གསུངས་སོ་༎
 अनेन चासारे ऽनेकशतसहस्रदुःखैकस्थानतुच्छात्मभावे तस्मिन् स्निह्यन् एतावच्छरिरपरित्यागेनापि यत्पुण्यं न प्राप्तम्,	འདིས་ནི་སྙིང་པོ་མེད་པ་སྡུག་བསྔལ་བརྒྱ་སྟོང་དུ་མའི་གནས་ལུས་གཅིག་གི་ཕྱིར་ཁྱེད་ལ་ཆགས་ནས་ལུས་འདི་སྙེད་ཡོངས་སུ་བཏང་བས་ཀྱང་མི་རྙེད་པའི་བསོད་ནམས་གང་ཡིན་པ་དེའི་བར་ཆད་བྱེད་ཀྱིས་། 
 तदन्तरायकरत्वात्तस्मिन् कायजीविते निरपेक्षचित्ततया सर्वात्मनास्मिन् (धर्मपर्याये) योगः करणीय इति परिदिपितम् ।	ལུས་དང་སྲོག་ལ་མི་ལྟ་བའི་སེམས་ཀྱིས་བདག་ཉིད་ཐམས་ཅད་ཀྱིས་འདི་ལ་བརྩོན་པར་བྱ་བའི་རིགས་སོ་ཞེས་ཡོངས་སུ་བསྟན་ཏོ་བྱེད་ཀྱིས་། 
 अनेनार्थतः कौसीद्यादयो विपक्षत्वेन दर्शिताः ।	༎ འདིས་ནི་དོན་གྱིས་ན་ལེ་ལོ་ལ་སོགས་པ་མི་མཐུན་པའི་ཕྱོགས་སུ་ཡོངས་བྱེད་ཀྱིས་། ༎ སུ་བསྟན་ཏོ་༎ 
 तत्प्रहाणाय सद्धर्मसमादानाय च छन्दः प्रणिधानञ्चापि निर्दिष्टे ।	དེ་སྤང་པའི་ཕྱིར་དམ་པའི་ཆོས་ཡོངས་སུ་བཟུང་བ་ལ་སོགས་པའི་དོན་དུ་འདུན་པ་དང་སྨོན་ལམ་གདབ་པ་ཡང་སྟོན་ཏོ་༎
 इतो धर्मपर्यायात् इत्युपलक्षणमात्रोक्त्या समस्तमहायानश्रवणादीनि आबध्यन्ते ।	ཆོས་ཀྱི་རྣམ་གྲངས་འདི་ལས་ཞེས་མཚན་མ་ཙམ་ཞིག་བརྗོད་པས་ནི་ཐེག་པ་ཆེན་པོ་མཐའ་དག་ལ་ཉན་པ་ལ་སོགས་པར་མཛད་པའོ་༎
 बहुतरं पुण्यम् इत्यनेन आदार्यमुक्तम् ।	བསོད་ནམས་ཆེས་མང་དུ་ཞེས་བྱ་བ་འདིས་ནི་རྒྱ་ཆེ་བ་བརྗོད་དོ་༎
 धर्मवेगेन इति धर्मश्रद्धाबलेनेत्यर्थः । आर्यसुभूतिः अश्रूणि प्रामुञ्चत् तदपि भगवतो ऽधिष्ठानेनान्येषु कुसीदेषु जनेषु अद्भुतमहायानधर्मस्याभिधानेन परमश्रद्धोत्पादार्थे द्रष्टव्यम्	ཆོས་ཀྱི་ཤུགས་ཀྱིས་ཞེས་བྱ་བ་ནི་ཆོས་ལ་དད་པའི་ཤུགས་ཀྱིས་ཞེས་བྱ་བའི་ཐ་ཚིག་གོ་༎ འཕགས་པ་རབ་འབྱོར་མཆི་མ་བྱུང་བ་དེ་ཡང་བཅོམ་ལྡན་འདས་ཀྱི་བྱིན་གྱིས་རླབས་ཀྱིས་ལེ་ལོ་ཅན་གཞན་དག་ཐེག་པ་ཆེན་པོའི་ཆོས་རྨད་དུ་བྱུང་བ་བརྗོད་པས་ཤིན་ཏུ་དད་པ་བསྐྱེད་པའི་དོན་དུ་བལྟ་བར་བྱའོ་༎
 तस्माद् हस्तेन अश्रूणि प्रमृज्य भगवन्तमेतदवोचत् आश्चर्यं भगवन्,	དེའི་ཕྱིར་ལག་པས་མཆི་མ་ཕྱིས་ནས་བཅོམ་ལྡན་འདས་ལ་འདི་སྐད་ཅེས་གསོལ་ཏོ་༎
 यावदयं धर्मपर्यायस्तथागतेन भाषितः इत्याह ।	ཆོས་ཀྱི་རྣམ་གྲངས་འདི་དེ་བཞིན་གཤེགས་པ་ཇི་སྙེད་པས་གསུངས་པ་ནི་བཅོམ་ལྡན་འདས་ངོ་མཚར་ལགས་སོ་ཞེས་བྱ་བ་གསོལ་ཏོ་༎
 यावद् इति कारित्रविशेषः ।	ཇི་སྙེད་པས་ཞེས་བྱ་བ་ནི་མི་བྱེད་པའི་བྱེ་བྲག་སྟེ་།
 यावता प्रकारेण देशानार्हास्तान् बोधिसत्त्वानुपदिशन्त्विति वाक्यार्थः ।	བཤད་པར་བྱ་བར་འོས་པའི་རྣམ་པ་ཇི་སྙེད་ཀྱིས་བྱང་ཆུབ་སེམས་དཔའ་རྣམས་ལ་གསུངས་ཤིག་ཅེས་བྱ་བའི་ཐ་ཚིག་གོ་༏་། ཅིའི་ཕྱིར་སྙམ་པ་ལ་།
 कस्मादित्याकाङ्क्षायां यतो मे ज्ञानमुत्पन्नम् इत्यकथयत् ।	བདག་གི་ཡེ་ཤེས་སྐྱེས་ཚུན་ཆད་ཅེས་བྱ་བ་གསོལ་ཏོ་༎
 यतः इत्यार्यसत्यगोचरज्ञानोत्पादमारभ्य एतत्पर्यन्तं धर्मपर्यायस्य परमपुण्यफलस्य यथोक्ता देशना श्रावक-प्रत्येकबुद्धनामगोचरा नैवं श्रुतपूर्वेत्यर्थः ।	ཚུན་ཆད་ཅེས་བྱ་བ་ནི་འཕགས་པའི་བདེན་པའི་སྤྱོད་ཡུལ་གྱི་ཡེ་ཤེས་སྐྱེས་པ་ནས་བཟུང་སྟེ་། དེའི་བར་གྱི་ཆོས་ཀྱི་རྣམ་གྲངས་བསོད་ནམས་ཀྱི་འབྲས་བུ་མཆོག་ཏུ་ཇི་སྐད་བསྟན་པ་ཉན་ཐོས་དང་རང་སངས་༄༢༣༧ཨ་༌་༎ རྒྱས་ཀྱི་སྤྱོད་ཡུལ་མ་ཡིན་པ་འདི་ལྟ་བུ་སྔོན་ཆད་མ་ཐོས་སོ་ཞེས་བྱ་བའི་ཐ་ཚིག་གོ་༎ 
 एतेन (वज्रट्_१६४) दौर्लभ्यं प्रोक्तम् ।	འདིས་ནི་རྙེད་དཀའ་བར་བརྗོད་དོ་༎
