 नागार्जुन: भवसङ्क्रान्तिपरिकथा नमः कुमारभूताय मञ्जुश्रिये ।	༄༡༦༧བ་༅་༎ རྒྱ་གར་སྐད་དུ་༏་བྷའ་བ་སམ་ཀརའན་ཏ་པ་རི་ཀ་ཐའ་། བོད་སྐད་དུ་། སྲིད་པ་ལས་འདས་པའི་གཏམ་། འཇམ་དཔལ་གཞོན་ནུར་གྱུར་པ་ལ་ཕྱག་འཚལ་ལོ་༎
 भावान्न जायते ऽभावो नाभावादपि जायते ।	དངོས་མེད་དངོས་ལས་མི་སྐྱེ་སྟེ་༎ དངོས་མེད་ལས་ཀྱང་སྐྱེ་མ་ཡིན་༎
 भाव उत्पद्द्यते नित्यं भाबो भ्रान्तिः खपुष्पवत् ॥ १ ॥ सति धर्मे नभस्तुल्ये खतुल्यं जायते परम् ।	དངོས་པོ་རྟག་ཏུ་སྐྱེ་བ་སྟེ་༎ དངོས་འཁྲུལ་ནམ་མཁའི་མེ་ཏོག་བཞིན་༎ མཁའ་དང་འདྲ་བའི་ཆོས་ཡོད་ན་༎ གཞན་ནི་མཁའ་དང་འདྲ་བ་སྐྱེ་༎
 प्रतीत्य सर्व खसमं भावस्तस्मादभाववान् ॥ २ ॥	བརྟེན་ནས་ཐམས་ཅད་མཁའ་དང་འདྲ་༎ དེ་ནས་སྲིད་པ་མེད་པ་ཅན་༎
 स्बभावतः कर्म नास्ति हेतुर्नास्ति फलं न च ।	ངོ་བོ་ཉིད་ཀྱིས་ལས་མེད་ཅིང་༎ རྒྱུ་མེད་འབྲས་བུ་ཡོད་མ་ཡིན་༎
 न विद्द्यत इदं सर्बं लोको नास्ति न भञ्जनम् ॥ ३ ॥	འདི་དག་ཐམས་ཅད་མེད་པ་སྟེ་༎ འཇིག་རྟེན་པ་མེད་འཇིག་པ་མེད་༎
 अनुत्पन्नश्च यो भावः परं (स)	མ་སྐྱེས་པ་ཡི་དངོས་པོ་གང་༎
 जनयेत्कथम् ।	ཇི་ལྟར་གཞན་ཞིག་སྐྱེད་པར་འགྱུར་༎
 लोकः प्रथमतो ऽजातः केनापि न हि निर्मितः ।	འཇིག་རྟེན་དང་པོར་མ་བྱུང་སྟེ་༎ འགའ་ཞིག་གིས་ཀྱང་སྤྲུལ་པ་མིན་༎ ཟླ་བ་སེང་གེའི་གྲོང་ཁྱེར་བཞིན་༎
 सोमसिंहपुरीतुल्यो लोको भ्रम्यत्यनर्थके ॥ ४ ॥	འཇིག་རྟེན་དོན་མེད་གྱི་ན་འཁྱམས་༎
 लोको विकल्पदुत्पन्नो विकल्पश्चित्तसंभवः ।	འཇིག་རྟེན་རྣམ་པར་རྟོག་ལས་འབྱུང་༎ རྣམ་རྟོག་སེམས་ལས་ཡང་དག་འབྱུང་༏་། སེམས་ནི་ལུས་ལ་བརྟེན་པ་སྟེ་༎
 चित्तं हि कायाश्रयकं तस्मात्कायो विचार्यते ॥ ५ ॥	དེ་ཕྱིར་ལུས་ནི་རྣམ་དཔྱད་དོ་༎
 रूपं शून्यं वेदना निःस्वभावा संज्ञा नास्ते नास्ति संस्कारभावः ।	གཟུགས་ནི་སྟོང་པ་ཚོར་བ་རང་བཞིན་མེད་༎ འདུ་ཤེས་མེད་དེ་འདུ་བྱེད་ཡོད་མ་ཡིན་༎
 भूतं हित्वा चित्तचैत्ते च नस्तस्तस्मात्कायः कल्पहीनस्वभावः ॥ ६ ॥	འབྱུང་བ་སྤངས་ནས་སེམས་དད་སེམས་བྱུང་མེད་༎ དེ་ཕྱིར་ལུས་ནི་རྟོག་བྲལ་ངོ་བོ་ཡིན་༎
 चित्त नास्ति न धर्मास्ते न कायो नापि धातवः ।	སེམས་མེད་ཆོས་རྣམས་དེ་དག་མེད་༏་། ལུས་མེད་ཁམས་རྣམས་ཡོད་མ་ཡིན་༎ གཉིས་སུ་མེད་པའི་ལས་འདི་ནི་༎
 अद्वयीकरणं हीदं तत्त्वं विद्वद्भिरुच्यते ॥ ७ ॥	དེ་ཉིད་རིག་པ་རྣམས་གྱིས་བསྟན་༎
 अनालम्बमिदं सर्वमनालम्बं प्रभाषितम् ।	འདི་དག་ཐམས་ཅད་དམིགས་མེད་པར་༎ གཉིས་སུ་མེད་པར་བསྟན་པ་ཡིན་༎
 कृत्वा मतिमनालम्बामनालम्बं समुद्धितं ॥ ८ ॥	བློ་ནི་དམིགས་པ་མེད་བྱས་ནས་༎ དམིགས་པ་མེད་པར་འབྱུང་བར་འགྱུར་༎
 दानशीलक्षमावीर्यध्यानादौ सुनिषेविते ।	སྦྱིན་དང་ཚུལ་ཁྲིམས་བཟོད་བརྩོན་འགྲུས་༏་། བསམ་གཏན་ལ་སོགས་བརྟེན་བྱས་ནས་༎
 अचिरेणैव कालेन परमां बोधिमाप्स्यति ॥ ९ ॥	ཡུན་མི་རིང་བའི་དུས་ཀྱིས་ནི་༎ བྱང་ཆུབ་དམ་པ་ཐོབ་པར་འགྱུར་༎
 उपायप्रज्ञयोस्थित्वा सत्त्वांश्च करुणापयेत् ।	ཐབས་དང་ཤེས་རབ་ལ་གནས་ཏེ་༎ སེམས་ཅན་རྣམས་ལ་བརྩེ་པར་བྱ་༎ མྱུར་བ་ཁོ་ནར་ཐམས་ཅད་མཁྱེན་༎
 सर्वज्ञानं शिघ्रमेव लप्स्यते नहि संशयः ॥ १० ॥	ཐོབ་པར་འགྱུར་བར་ཐེ་ཚོམ་མེད་༎
 नाममात्रमिदं सर्वं संज्ञामात्रे प्रतिष्ठितम् ।	འདི་དག་ཐམས་༄༡༦༨ཨ་༌་༎ ཅད་མིང་ཙམ་སྟེ་༎ འདུ་ཤེས་ཙམ་ལ་རབ་ཏུ་གནས་༎ རྗོད་པར་བྱེད་ལས་ཐ་དད་པའི་༎
 नाभिधानात्पृथग्भूतमभिधेयं न विद्यते ॥ ११ ॥	བརྗོད་པར་བྱ་བ་ཡོད་མ་ཡིན་༎
 अनामकाः सर्वधर्मा निरात्मानः प्रकीर्तिताः ।	ཆོས་རྣམས་ཐམས་ཅད་མིང་མེད་དེ་༎ བདག་མེད་པར་ཡང་ཡོངས་སུ་གསལ་༎
 इमे धर्मा अभूताश्च कल्पनायाः समुद्धिताः ।	།
 कल्पना सापि शून्येयं यया शून्येति कल्पिताः ॥ १२ ॥	གང་གིས་སྟོང་པ་ཞེས་བརྟགས་པའི་༎ རྟོག་པ་དེ་ཡང་འདིས་སྟོང་ངོ་༎
 चक्षु पश्यति रूपाणि तत्त्ववक्त्रा यदुच्यते ।	མིག་གིས་གཟུགས་རྣམས་མཐོང་བར་ནི་༎ དེ་ཉིད་གསུངས་པས་གང་བཤད་པ་༎
 मिथ्याभिमानलोकस्य सांवृतं सत्यमीरितम् ॥ १३ ॥	ལོག་པར་ཞེན་པའི་འཇིག་རྟེན་ལ་༎ ཀུན་རྫོབ་བདེན་པར་བརྗོད་པ་ཡིན་༎ གང་དུ་ཚོགས་བར་མཐོང་བ་ནི་༎
 सामग्र्या दर्शनं यत्र प्रकाशयति नायकः ।	འདྲེན་པས་སྟོན་པར་བྱེད་པ་ཡིན་༎
 प्राहोपचारभूमिं तां परमार्थस्य बुद्धिमान् ॥ १४ ॥	བློ་དང་ལྡན་པས་དོན་དམ་གྱི་༎ ཉེ་བར་བརྟགས་པའི་ས་དེ་གསུངས་༎
 न चक्षुः प्रेक्षते रूपं मनो धर्मान्न्वेत्ति च ।	མིག་གིས་གཟུགས་ནི་མི་མཐོང་སྟེ་༎ ཡིད་ཀྱིས་ཆོས་རྣམས་མི་རིག་གོ་༎
 एतत्तु परं सत्यं लोकस्य विषयो न यत् ॥ १५ ॥	འཇིག་རྟེན་པ་ཡི་ཡུལ་མིན་གང་༎ འདི་ནི་མཆོག་ཏུ་བདེན་པའོ་༎
 चक्षुर्नास्ति न रूपञ्च दृश्यं नास्ति न मनस्क्रिया ।	མིག་མེད་གཟུགས་ཀྱང་ཡོད་མིན་ཞིང་༎ སྣང་བ་ཡིད་ལ་བྱེད་པ་མེད་༎
 चित्तं स्वप्नसमं भ्रान्तिः सर्वं न सदसन्न च ॥ १६ ॥	སེམས་ནི་རྨི་ལམ་བཞིན་དུ་འཁྲུལ་༎ ཐམས་ཅད་ཡོད་མིན་མེད་པ་འང་མིན་༎
