 अन्तर्व्याप्तिसमर्थनम् । ॐ नमो बुद्धाय ।	༄༣༠༩བ་༅་༎ རྒྱ་གར་སྐད་དུ་། ཨཨནཏར་བཡའ་བ་ཏི་། བོད་སྐད་དུ་། ནང་གི་ཁྱབ་པ་། འཕགས་པ་འཇམ་དཔལ་གཞོན་ནུར་གྱུར་པ་ལ་ཕྱག་འཚལ་ལོ་༎
 तन्माभूव्वैफल्यमिति नैव व्याप्तिर्ग्रहीतव्या ।	འབྲས་བུ་མེད་པར་མ་གྱུར་ཅིག་ཅེས་སྨོས་པས་ཁྱབ་པ་མི་འཛིན་ནོ་༎
 तस्यामगृहीतायां सन्दिग्धोभयतया स्यादनैकान्तिकत्वं ।	དེ་མ་བཟུང་ན་གཉི་ག་ལ་ཐེ་ཚོམ་ཟ་བས་མ་ངེས་པ་ཉིད་དུ་འགྱུར་རོ་༎
 सर्व्वोपसंहारेण तु व्याप्तिग्रहणे यथोक्तन्यायेन साधनवैफल्याभावात् । अदुष्टं सत्त्वादि साधनमेवेति वेदितव्यम् । तदेवमुभयथा मूढजनापेक्षयासाधारणमनैकान्तिकमुक्तम् ।	ཐམས་ཅད་ཉེ་བར་བསྡུས་པས་ཁྱབ་པ་བཟུང་ན་ཇི་སྐད་བསྟན་པའི་རིགས་པས་སྒྲུབ་པར་བྱེད་པ་འབྲས་བུ་ཡོད་པའི་ཕྱིར་ཡོད་པ་ལ་སོགས་པའི་སྒྲུབ་པར་བྱེད་པའི་སྐྱོན་མེད་པ་རིག་པར་བྱའོ་༎ དེ་ལྟར་ན་རྣམ་པ་གཉིས་ཀྱིས་ཐུན་མོང་མ་ཡིན་པའི་མ་ངེས་པ་བསྟན་ཏོ་༎ ཕྱི་རོལ་ཁྱབ་པར་སྨྲ་བ་ལ་ཡང་སྒྲུབ་པར་བྱེད་པ་དེ་ཉིད་ཡིན་ནོ་༎
 समानञ्चैतद्वहिर्व्याप्तिवादिनामपि यदि हि मूढमतापेक्षा न स्यात् स्यादेव श्रावणत्वमदुष्टो हेतुः ।	གལ་ཏེ་མི་རྨོངས་པའི་བསམ་པ་ལ་ལྟོས་ནས་མཉན་པར་བྱ་བ་ཉིད་ཀྱི་གཏན་ཚིགས་སྐྱོན་མེད་པ་ཡིན་ཏེ་། 
 सत्वादिवन्नियतशब्देषु हि विवादे शब्दान्तरं स्यात् ।	ཡོད་པ་ལ་སོགས་པ་བཞིན་ནོ་༎ ངེས་པ་དང་ལྡན་པའི་སྒྲ་རྣམས་ལ་བརྩོན་ན་སྒྲ་གཞན་དཔེ་ཡིན་ནོ་༎ སྒྲ་ཐམས་ཅད་ལ་ཡང་ལོག་པར་རྟོགས་པ་ཡོད་ན་།
 दृष्टान्तः सर्व्वशब्देषु विगतौ बाधकं प्रमाणं प्रवर्त्तम्मनं अदृष्टान्तमपि तत्रैकं दृष्टान्तयतीति कथम साधारणमनैकान्तिकं वेति अन्तर्व्याप्तिसमर्थनं समाप्तमिति ॥ ० ॥	དཔེ་མེད་པའི་ཕྱིར་དེ་ལ་དཔེ་གང་ཞིག་གཞག་པར་བྱ་༎ གནོད་པ་ཅན་གྱི་ཚད་མ་ཞུགས་པས་ཇི་ལྟར་ཐུན་མོང་མ་ཡིན་པའི་མ་ངེས་པ་ཡིན་།
