amita ABasya ABA amitA ca tejAH amitam ca AyUramitaH ca saMGaH	'od ni dpag med gzi brjid dpag med pa // sku tshe dpag med dge 'dun dpag med pa // byang chub sems dpas bskor zhing mdzes gyur pa // sangs rgyas bsod nams phung po mchog la ltos //	74.80722278754027
smitam karotI amita AyunATam zawtriMSa kowIna yutAna arcizAm	de nas tshe dpag med kyis 'dzum mdzad nas // 'od 'phro bye ba khrag khrig sum cu drug /	85.84648404100443
ye niScaritvA muKa maNxalAtaH sPUranti kzetrANi sahasra kowIH	de dag zhal gyi dkyil 'khor nas byung ste // zhing stong bye ba dag ni khyab par mdzad // 'od 'phro de dag thams cad slar log ste //	87.58508958353522
tAH sarva sUrIH punar etya tatra mUrDe ca astam gami nAyakasya	'dren pa'i spyi gtsug der ni nub par gyur // de tshe 'od 'phro nub par gyur nas ni //	82.94753234992699
devAH manuzyAH janayanti prItim arciH tadA asyam idAm viditvA	lha dang mi rnams dga' ba rab tu skyed // de nas sangs rgyas sras po grags chen po //	78.65232794763226
uttizWate budDa sutaH mahA yaSAH nATa saH hi avalokita ISvaraH	spyan ras gzigs kyi dbang phyug de langs te // gang slad 'jig rten mgon po 'dzum mdzad pa //	85.23023803701238
kaH hetuH atra Bagavam kaH pratyayaH yena smitam kurvasi lokanATa	bcom ldan de yi rgyu dang rkyen gang lags //	53.71736587692908
tam vyAkarohI yatra saH rTa kovidaH hita anukampI bahu sattva mocakaH	sems can mang 'grol phan pa thugs brtse can // don dam mkhas pa de ni lung bstan gsol // gsung mchog yid du mchi ba de thos nas //	88.08469012185938
SrutvA iti vAcam paramAm manoramAm udagra cittAH Bavizyanti sattvAH	sems can dag ni dga' ba'i sems su 'gyur //	64.02466246609241
ye boDisattvAH bahu loka DAtutaH suKAvatIm prasTita budDa paSyatAm	'jig rten khams mang byang chub sems dpa' dag / sangs rgyas blta slad bde can 'dir mchi ba //	87.67827520887982
te SrutvA prItim vipulAm janetvA kzipram imam kzetra vilokayeyuH	de dag thos nas dga' ba cher bskyed de //	75.55509879087363
Agatya ca kzetram idam udAram RdDI balam prApuNi kzipram eva	myur du zhing 'di rnam par blta bar 'gyur //	78.69056015420762
divyam ca cakzuH taTa Srotra divyam jAti smarAH pArami kovidAH ca	rgya chen zhing 'dir lhags par gyur nas kyang; ;lha yi mig dang lha yi rna ba dang // tshe rabs dran dang blo gros mkhas mchog dang // rdzu 'phrul stobs kyang myur du thob par 'gyur //	81.79158468626777
amita Ayu budDaH tada vyAkaroti mama hi ayam praNiDi baBUva pUrvam	sangs rgyas tshe dpag med kyis lung bstan pa // ngas ni sngon @403a *// tshe smon lam 'di skad btab //	91.12304772927111
kaTam pi sattvA SruNiyAni nAma vrajeyu kzetram mama nityam eva suKu vEdya	sems can gang gis nga yi ming thos na // nga yi zhing du rtag tu 'ong bar shog /	88.72173580938222
sa me ayam praNiDi prapUrNa SoBanA sattvAH ca eBi bahu loka DAtutaH	nga yi smon lam bzang po de rdzogs pas // 'jig rten khams mang dag nas sems can 'ong //	90.50950195595817
Agatya kzipram mama antikasmim avEvartikA Bonti he eka jAtiyA	de dag nga yi zhing du lhags nas ni // de dag skye ba gcig las phyir mi ldog / de phyir byang chub sems dpa' gang zhig 'dir //	80.64193038451492
tasmAt ya icCati ha boDisattvaH mama api kzetram siyaH eva rUpam aham pi sattvAn bahu mocayeyam nAmena GozeNa Ta darSanena	bdag gi zhing yang 'di 'drar gyur pa dang // bdag gi ming dang sgra dang lta bas kyang // sems can mang po grol bar bya 'dod pa //	73.66162976331032
sa SIGra SIGram tvaramANa rUpaH suKAvatIm gacCatu lokaDAtum	de ni myur du rings par la gor du // bde ba can gyi 'jig rten khams song la //	71.16379351712706
gattvA ca pUrvam amita praBasya pUjetu budDAna sahasra kowIH	'od dpag med kyi gan du song nas ni // sangs rgyas bye ba stong la mchod pa gyis //	91.06637283121239
budDAna kowI bahu pUjayitvA RdDI balena bahu kzetra gattvA	rdzu 'phrul stobs kyi zhing mang song nas ni // sangs rgyas bye ba mang la mchod bya ste //	93.84314711917635
kRtvAnaH pUjAm sugatAna santike BaktyA gamizyanti suKO= atItaH	bde bar gshegs la mchod pa byas nas kyang // dro khar bde ba can du slar yang 'ong ////	85.71463126113527
iti	bam po gsum pa ste tha ma'o // kun dga' bo /	71.73294513875787
start suKv tasya Kalu punar Ananda amita AyuzaH taTAgatasya arhataH samyaksaMbudDasya boDivRkzaH sa daSa yojana SatAni uccEstvena	de bzhin gshegs pa dgra bcom pa yang dag par rdzogs pa'i sangs rgyas 'od dpag med de'i byang chub kyi shing ni 'phang du dpag tshad stong drug brgya yod pa /	84.27837540690062
azwO yojana SatAni aBipralambita SAKA patra palASaH paQca yojana Sata mUla Aroha pariNAhaH	yal ga dang / lo ma dang / 'dab ma dpag tshad brgyad brgya tshun chad du 'phyang ba / rtsa ba'i sboms dang khrun dpag tshad lnga brgya yod pa / rtag tu lo ma chags pa / rtag tu me tog chags pa / rtag tu 'bras bu chags pa / kha dog tha dad pa /	79.74307834360465
sadApatraH sadApuzpaH sadAPalaH nAnA varNaH neka Sata sahasra varNaH nAnA patraH nAnA puzpaH	kha dog brgya @403b stong du ma yod pa / lo ma tha dad pa / me tog tha dad pa / 'bras bu tha dad pa /	72.24972525551749
nAnA PalaH nAnA vicitra BUzaNa samalaMkRtaH candra BAsa maNi ratna parisPuwaH Sakra aBilagna maNi ratna vicitritaH cintAmaNi ratna AkIrNaH	rgyan sna tshogs kyis brgyan pa / zla ba lta bur snang ba'i nor bu rin po ches yongs su gsal ba / brgya byin thogs pa'i nor bu rin po ches rnam par spras pa /	84.75082968563979
sAgara vara maNi ratna su vicitritaH divya samatikrAntaH svarNa sUtra aBipralambitaH	yid bzhin gyi nor bu rin po ches gang ba / rgya mtsho'i nor bu rin po che mchog gis shin tu rnam par spras pa / kha dog lha'i las 'das pa /	92.11647930803
rucaka hAra ratna hAra vat sahAra kawaka hAra lohita mukta AhAra nIla muktA hAra siMha latA meKalA kalApa ratna sUtra sarva ratna vastu Sata aBivicitrita	gser gyi skud pa 'chang ba / se mo do mdzes pa dang / rin po che'i chun po dang / rgyan phreng dang / do shal chig rkyang dang / mu tig dmar po'i rgyan phreng dang / mu tig sngon po'i rgyan phreng dang / seng ge'i kha nas 'phyang ba'i ska rags kyi tshogs yod pa / rin po che'i skud pa dang / rin po che thams cad dang / dung gis mngon par spras pa /	78.57655969442409
svarNa jAla muktA jAla sarva ratna jAla kiFkiNI jAlatataH makarasvastika nandi Avarta candra samalaMkRtaH	gser gyi dra ba dang / mu tig gi dra ba dang / rin po che thams cad kyi dra ba dang / dril bu g-yer kha'i dra bas bla rer bres pa / chu srin dang / bkra shis pa dang / g-yung drung 'khyil ba dang / zla gam lta bus legs par brgyan pa /	85.55051303030692
kiFkiNI maNi jAla sOvarNa sarva ratna alaMkAra viBUzitaH yaTASaya sattva vijQapti samalaMkRtaH ca	nor bu 'khrol ba dang; gser dang rin po che'i rgyan thams cad kyis brgyan pa / sems can gyi bsam pa'i rnam par rig pa ji lta ba bzhin du legs par brgyan pa'o // kun dga' bo /	92.53678869279004
tasya Kalu punar Ananda boDivRkzasya vAta samIritasya yaH SabdaH GozaH niScarati saH parimANAn= loka DAtUn vijQApayati	byang chub kyi shing de rlung gis bskyod na sgra dbyangs 'byung ba gang yin pa des 'jig rten gyi khams tshad med pa go bar byed do //	79.46228641074799
tatra Ananda yezAm sattvAnAm sa boDivRkzaH Srotra avaBAsam AgacCati	kun dga' bo / de la byang chub kyi shing gi sgra de sems can gang dag gi rna lam du grag @404a *//	85.13846066391271
tezAm Srotra rogaH na pratikAFkzitavyaH yAvat boDi paryantam	pa de dag byang chub kyi mtha'i bar du rna nad kyis mi btab par shes par bya'o // sems can dpag tu med / grangs med / bsam gyis mi khyab /	61.313161157593335
yezAm aprameya asaMKyeya acintya atulyAm Apya aparimANa anaBilApyAnAm sattvAnAm sa boDivRkzaH cakzuzaH ABAsam AgacCati tezAm cakzUrogaH na pratikAFkzitavyaH yAvat boDi paryantam	mtshungs pa med; gzhal du med / tshad med / brjod du med pa gang dag gi mig lam du byang chub kyi shing de snang ba de dag byang chub kyi mtha'i bar du nam yang mig nad kyis mi btab par shes par bya'o // kun dga' bo /	79.26221079712104
ye Kalu punar Ananda sattvAH tatas boDi vRkzAt ganDam jiGranti tezAm yAvat boDi paryantam na jAtu GrANa roa gaH pratikAFkzitavyaH	sems can gang dag byang chub kyi shing de'i dri tshor ba de dag kyang byang chub kyi mtha'i bar du nam yang sna nad kyis mi btab par shes par bya'o //	80.5370278526798
ye sattvAH tatas boDivRkzat PalAni AsvAdayanti tezAm yAvat boDi paryantam na jAtu jihvA rogaH pratikAFkzitavyaH	sems can gang dag byang chub kyi shing de'i 'bras bu'i ro myong ba de dag thams cad kyang byang chub kyi mtha'i bar du nam yang lce nad kyis mi btab par shes par bya'o //	86.50171942726315
ye sattvAH tasya boDivRkzasya aBayA sPuwA suKu vEdya Bavanti tezAm yAvat boDi paryantam na jAtu kAya rogaH pratikAFkzitavyaH	byang chub kyi shing de'i 'od kyis sems can gang dag la khyab par gyur ba de dag kyang byang chub kyi mtha'i bar du nam yang lus la nad kyis mi btab par shes par bya'o // kun dga' bo /	86.59941787608328
ye ca Kalu punar Ananda sattvAH tam boDi vRkzam DarmataH niDyAyanti tezAm tatas upAdAya yAvat boDi paryantam na jAtu citta vikzepaH pratikAFkzitavyaH	sems can gang dag byang chub kyi shing de chos nyid du nges par sems pa de dag kyang de nas bzung ste byang chub kyi mtha'i bar du nam yang sems mi g-yeng par shes par bya'o //	80.73130280953512
sarve ca te sattvAH saha darSanAt tasya boDi vRkzasya avEvartikAH saMtizWante yat uta anuttarAyAH samyaksaMboDeH tisraH ca kzAntIH pratilaBante yat idam Goza anugAmanulomikIm anutpattika Darma kzAntim	sems can de dag thams cad ni byang chub kyi shing de mthong ma thag tu bla na med pa yang dag par rdzogs pa'i byang chub las phyir mi ldog par 'gyur ro //	56.48086434059677
ca tasya eva amita AyuzaH taTAgatasya pUrva praNiDAna aDizWAnena pUrva jina kRta aDikAratayA pUrva praNiDAna paricaryayA ca su samApyayA su BAvita yAnUna avikala tayA start suKv	de bzhin gshegs pa tshe dpag med de nyid kyi sngon gyi smon lam gyi byin gyi rlabs @404b dang / sngon gyi rgyal ba la lhag par bya ba byas pa dang / sngon gyi smon lam dang spyod pa shin tu rdzogs pa dang / shin tu bsgoms pa dang / mi nyung ba dang / ma tshang ba med pas 'di lta ste / sgra'i rjes su 'gro ba dang / rjes su mthun pa dang / mi skye ba'i chos la bzod pa dang / bzod pa rnam pa gsum 'thob bo // kun dga' bo /	66.76753060146619
tatra eva Kalu punar Ananda ye boDisattvAH pratyAjAtAH pratyAjAyante pratyAjanizyante vA sarve te eka jAti pratibadDAH tatas eva anuttarAm samyaksaMboDim aBisaMBotsyante sTApayitvA	byang chub sems dpa' gang dag sangs rgyas kyi zhing der skyes pa dang / skye ba dang / skye bar 'gyur ba de dag thams cad skye ba gcig gis thogs pa gyur nas bla na med pa yang dag par rdzogs pa'i byang chub mngon par rdzogs par 'tshang rgya bar 'gyur te / smon lam gyi dbang ni ma gtogs so //	89.29217400761857
praNiDAna vaSam ye te boDisattvAH mahA siMhanAda nAdinaH udAra saMnAha saMnadDAH sarva sattva parinirvANa aBiyuktAH ca start suKv	byang chub sems dpa' de dag ni seng ge'i sgra chen po sgrogs pa / go cha chen po bgos pa / sems can thams cad yongs su mya ngan las bzla ba la mngon par brtson pa sha stag go /	85.87585105640885
tasmina Kalu punar Ananda budDa kzetre ye SrAvaka ante vyAma praBAH	kun dga' bo / sangs rgyas kyi zhing de na nyan thos gang dag 'khod pa de dag ni 'od 'dom gang ba sha stag go /	90.93669756626657
te boDisattvAH te yojana kowI Sata sahasra praBAH	byang chub sems dpa' gang dag 'khod pa de dag ni 'od dpag tshad bye ba brgya stong pa sha stag ste //	92.76621118375344
sTApayitvA dvO boDisattvO yayoH praBayA sA lokaDAtuH satata samitam nitya avaBAsa sPuwA	byang chub sems dpa' gang 'od kyis 'jig rten gyi khams de rtag tu rgyun mi 'chad par khor yug tu snang bas khyab par byed pa gnyis ni ma gtogs so; ;de nas bcom ldan 'das la tshe dang ldan pa kun dga' bos 'di skad ces gsol to // bcom ldan 'das /	73.31468557765119
aTa Kalu AyuzmAn AnandaH Bagavantam etat avocat  kiMnAmaDeyO Bagavan= tO boDisattvO mahAsattvO	byang chub sems dpa' sems dpa' chen po de gnyis kyis ming ci zhes @405a *// bgyi; bcom ldan 'das kyis bka' stsal pa /	76.81733341012085
BagavAn Aha  ekaH tayoH Ananda avalokita ISvaraH boDisattvaH mahAsattvaH dvitIyaH mahA sTAma prAptaH nAma	kun dga' bo / de gnyis la gcig gi ming ni byang chub sems dpa' sems dpa' chen po spyan ras gzigs dbang phyug ces bya'o // gcig gi ming ni mthu chen thob ces bya ste /	86.40800096212713
itas eva ca Ananda budDa kzetrAt cyutA tO tatra upapannO	kun dga' bo / de gnyis ni sangs rgyas kyi zhing 'di nas shi 'phos nas sangs rgyas kyi zhing der skyes so; ;kun dga' bo /	90.07540504722179
start suKv tatra ca Ananda budDa kzetre ye boDisattvAH pratyAjAtAH sarve te dvAtriMSat mahApuruza lakzaNa samanvAgatAH paripUrNa gAtrAH DyAna aBijQA kovidAH	byang chub sems dpa' gang dag sangs rgyas kyi zhing der skyes pa de dag thams cad ni skyes bu chen po'i mtshan sum cu rtsa gnyis dga' bo / dang ldan pa / lus yongs su rdzogs pa; bsam gtan dang mngon par shes pa la dga' bo / dang ldan pa / mkhas pa / shes rab kyis rab tu dbye ba la mkhas pa dga' bo / dang ldan pa / mkhas pa /	84.53539754038817
prajQA praBeda kuSalAH tIkzNa indriyAH su saMvRta indriyAH AjQAta avIndriyAH adIna abala indriyAH	/ dbang po rno ba / dbang po bsdams pa / kun shes pa'i dbang po dang ldan pa / ma zhum pa / dbang po mi g-yo ba /	80.40614582142291
pratilamBa kzAntikAH ananta aparyanta guNAH start suKv	bzod pa thob pa / yon tan mtha' yas pa mu med pa sha stag go /	80.09313246964187
tasmin Kalu punar Ananda budDa kzetre ye boDisattvAH pratyAjAtAH	kun dga' bo / byang chub sems dpa' gang dag sangs rgyas kyi zhing der skyes pa de dag thams cad ni sangs rgyas mthong ba dang mi 'dra la ba /	86.51920780996105
sarve te virahitAH budDa darSanena avinipAta DarmANaH yAvat boDi paryantam	byang chub kyi mtha'i bar du log par mi ltung ba'i chos can sha stag ste /	78.74329232709833
sarve te tatas upAdAya na jAtu jAti smarAH Bavizyanti sTApayitvA taTArUpezu kalpa saMkzoBezu	de dag thams cad 'di nas nye bar bzung nas nam yang tshe rabs mi dran par mi 'gyur gyi tshe rabs dran par 'gyur te / gang dag dper na /	80.20344927201315
ye pUrva sTAna praNihitAH paQcasu kazAyezu vartamAnezu yadA budDAnAm BagavatAm loke prAdurBAvaH Bavati tat yaTA api nAma mama etarhi start suKv	da ltar gyi nga bzhin du snyigs ma lnga'i dus na gang gi tshe sangs rgyas bcom ldan 'das dag @405b 'jig rten du 'byung bar 'gyur ba de lta bu'i bskal pas bkrugs pa dag tu gnas par sngon smon lam btab pa rnams ni ma gtogs so //	89.72509329435233
tasmin Kalu punar Ananda budDa kzetre ye boDisattvAH pratyAjAtAH sarve te eka puroBaktena anyAn= lokaDAtUn gatvA anekAni budDa kowI niyuta Sata sahasrANi upatizWanti yAvat AkAFkzanti budDa anuBAvena	kun dga' bo / byang chub sems dpa' gang dag sangs rgyas kyi zhing der skyes pa de dag thams cad snga dro gcig bzhin 'jig rten gyi khams gzhan dag tu dong nas sangs rgyas bye ba khrag khrig phrag du ma la bsnyen bkur byed de /	76.8614598156046
te yaTA yaTA cittam utpAdayanti evam evaMrUpEH puzpa DUpa dIpa ganDa mAlya vilepana cUrNa cIvara= Catra Dvaja patAkA vEjayantI tUrya saMgIti vApUjAm kuryAmaH iti	de dag rnam pa 'di lta bu'i me tog dang / bdug pa dang / mar me dang / spos dang / phreng ba dang / byug pa dang / phye ma dang / gos dang / gdugs dang / rgyal mtshan dang / ba dan dang / sil snyan dang / glu dbyangs dang; rol mo'i dbyangs sgra dag gis mchod par bya'o snyam du ji lta ji ltar sems bskyed cing /	89.08666645178587
tezAm saha citta utpAdAt taTArUpANi ca sarva pUjA viDAnAni pANO prAdurBavanti	ji ltar 'dod pa rnams de dag gis sems bskyed ma thag tu sangs rgyas kyi mthus rnam pa de lta bu'i mchod pa'i yo byad thams cad lag pa nas 'byung bar 'gyur te /	86.1072348411342
te tEH puzpEH yAvat vAdyEH tezu budDezu Bagavatsu pUjAm kurvantaH bahu aparimANa asaMKyeyam kuSalam upacinvanti	de dag gis me tog nas rol mo'i dbyangs sgra'i bar de dag gis sangs rgyas bcom ldan 'das de dag la mchod pa byed la / dge ba'i rtsa ba mang po tshad med / grangs med pa dag kyang bskyed cing gsog go /	90.7209785422796
saced punar AkAFkzanti evaMrUpAH puzpa puwAH pANO prAdurBavantu iti	gal te me tog gi skon bu rnam pa 'di lta bu lag pa nas 'byung bar gyur cig ces 'dod na yang de dag gis sems bskyed ma thag tu lha'i me tog kha dog tha dad pa /	84.70947594532502
tezAm saha citta utpAdAt nAnA varNAH aneka varNAH nAnA ganDAH divyAH puzpa puwAH pANO prAdurBavanti	dri tha dad pa / dri du ma yod pa'i skon bu dag lag pa nas 'byung ste / de dag gis skon bu'i me tog rnam pa de lta bu de dag @406a *//	87.3469391741232
te tEH taTArUpEH puzpa puwEH tAn budDAn BagavataH vakiranti aByavakiranti aBiprakiranti	sangs rgyas bcom ldan 'das de dag la 'thor / mngon par 'thor / mngon par rab tu 'thor ro //	79.48227994500022
tezAm ca yaH sarva parItaH puzpa puwa suKu vEdya utsRzwaH sa daSa yojana vistaram puzpa= Catram prAdurBavati upari antarIkze	skon bu'i me tog gtor ba de dag thams cad las nang gi chung du gang yin pa de yang steng gi bar snang la dpag tshad bcu'i tshad tsam gyi me tog gi gdugs su 'gyur te /	82.70551853324001
dvitIye ca anutsRzwe na praTamaH DaraNyAm prapatati	phyi ma shos ma gtor gyi bar snga mas la mi ltung ngo //	71.48585573534153
santi tatra puzpa puwAH ye utsRzwAH santaH viMSati yojana vistArANi puzpa= CatrANi upari antarIkze prAdurBavanti	de na skon bu'i me tog gtor ba gang steng gi bar snang la dpag tshad nyi shu'i tshad tsam gyi gdugs su 'gyur ba yang yod /	83.29902368787135
santi triMSat catvAriMSat paQcASat yojana vistArANi	dpag tshad sum cu dang / bzhi bcu'i tshad tsam yang yod /	91.58738255162197
santi yAvat yojana Sata sahasra vistArANi puzpa= CatrANi upari antarIkze prAdurBavanti	steng gi bar snang la me tog gi gdugs dpag tshad brgya stong gi tshad kyi bar tsam du 'gyur ba dag kyang yod do //	90.36897396410676
tatra ye udAram prIti prAmodyam saMjanayanti	de na gang dag dga' ba dang mchog tu dga' ba rgya chen po bskyed cing /	91.8992427866383
udAram ca citta Odvilyam pratilaBante te bahu aparimitam asaMKyeyam kuSala mUlam avaropya bahUni ca budDa kowI niyuta Sata sahasrANi upasTAya	sems dga' ba chen po thob pa de dag dge ba'i rtsa ba grangs med dpag tu med pa bskyed nas sangs rgyas bye ba khrag khrig brgya stong phrag mang po la bsnyen bkur byas te / snga dro gcig la slar log nas 'jig rten gyi khams bde ba can du gnas so //	92.24420821730624
eka pUrvAhNena punar api suKAvatyAm lokaDAtO pratizWante tasya eva amita AyuzaH taTAgatasya pUrva praNiDAna aDizWAna parigraheNa pUrva datta Darma SravaNena pUrva jina avaropita kuSala mUla tayA pUrva praNiDAna samRdDi paripUrya Atma BUtayA suviBakta BAvitayA	bcom ldan 'das de bzhin gshegs pa tshe dpag med de'i sngon gyi smon lam gyi byin gyi rlabs kyis yongs su zin pa dang / sngon chos mnyan pa byin pa dang / sngon gyi rgyal ba la dge ba'i rtsa ba bskyed pa dang / sngon gyi smon lam 'byor zhing yongs su rdzogs pa dang / mi nyung ba dang / shin tu rnam par phye ba dang / @406b shin tu bsgoms pas smon lam btab pa 'grub pa / kun dga' bo /	82.63055937738298
start suKv tasmin Kalu punar Ananda budDa kzetre ye sattvAH pratyAjAtAH sarve te sarvajQa tA sahagatAm eva Darma kaTAm kaTayanti	byang chub sems dpa' gang dag sangs rgyas kyi zhing der skyes par gyur pa de dag thams cad ni thams cad mkhyen pa nyid dang ldan pa'i chos kyi gtam smra ba dag go /	87.81285089068209
na ca tatra budDa kzetre sattvAnAm kAcid parigraha saMjQA asti	sangs rgyas kyi zhing de na sems can gang dag yongs su 'dzin pa'i 'du shes 'ga' yang mi bskyed do //	91.5431779619453
te sarve ca tat budDa kzetram anucaMkramamANAH anuvicarantaH na ratim na aratim utpAdayanti	de dag thams cad sangs rgyas kyi zhing de kun du 'chag cing rnam par rgyu ba na do // dga' ba dang / mi dga' ba mi bskyed do //	88.169738745407
prakrAmantaH ca anapekzAH	'gro ba na yang ltos pa med pa nyid du 'gro'i /	67.90198174943315
na ca prakrAmanti sa apekzAH	ltos pa dang bcas par ni ma yin no // 'di lta ste /	72.52659258187985
sarva sattva izAm eva cittam na asti	dngos po yongs su 'dzin pa dang / gnas kyi sems dang / sems de lta bu dag de dag la yod med do // kun dga' bo /	81.00442698953556
tatra Kalu punar Ananda suKAvatyAm lokaDAtO ye sattvAH pratyAjAtAH na asti tezAm anyatamaka saMjQA	byang chub sems dpa' gang dag 'jig rten gyi khams bde ba can der skyes pa de dag la gzhan gyi 'du shes med /	85.03693398360271
na asti svaka saMjQA	rang gi 'du shes med /	87.72698346051303
na asti asama saMjQA	bdag gi 'du shes med /	83.91456309231845
na asti vigrahaH	'thab pa med /	75.68157223292759
na asti vivAdaH	rtsod pa med /	74.54036535535539
na asti viroDaH	mi mthun pa med / mi mnyam pa'i sems med de /	42.932507832845054
sama cittAH mEtra cittAH mRdu cittAH snigDa cittAH karmaNi acittAH prasanna cittAH sTira cittA	de dag ni sems can thams cad la sems mnyam pa dang / phan pa'i sems dang / byams pa'i sems dang / mnyen pa'i sems dang / 'jam pa'i sems dang / dge ba'i sems dang / rab tu dang ba'i sems dang; brtan pa'i sems dang / sgrib pa med pa'i sems dang / 'khrug pa med pa'i sems dang / rnyog pa med pa'i sems dang / shes rab kyi pha rol tu phyin pa la spyad pa spyod pa'i sems @407a *//	55.72630980496125
vinIvaraNa cittAH akzuBita cittAH alulita cittAH prajQApAramitA caryA caraNa cittAH citta ADAra budDi pravizwAH	dang; sems kyi rgyud sgyu ma'i rang bzhin la blo rab tu zhugs pa /	52.26016462537789
sAgara samAH prajQayA	shes rab rgya mtsho chen po dang mnyam pa /	66.83588891805604
meru samA budDyA	blo ri rab dang mtshungs pa /	71.24331917433904
aneka guNa saMnicayAH boDi aFga saMgItyAH vikrIxitAH	yon tan du ma bsags pa; byang chub kyi yan lag yang dag par 'gro bas rnam par brtsen pa / sangs rgyas yang dag par 'gro ba la mngon par brtson pa /	72.30682005561759
budDa saMgIti aBiyuktAH mAMsacakzuH pravicinvanti	sha'i mig rab tu rnam par 'byed pa /	58.49859982066684
divyam cakzuH aBinirharanti	lha'i mig mngon par bsgrub pa /	72.31613735229739
prajQA cakzuH gatiMgatAH Darma cakzuH pAra gatAH budDacakzuH nizpAdayantaH darSayantaH dyotayantaH vistareNa prakASayantaH saFga jQAnam aBini	shes rab kyi mig rtogs par khong du chud pa / chos kyi mig gi pha rol tu son pa / sangs rgyas kyi spyan sgrub cing 'chad de ston pa / rgya cher yang dag par rab tu ston cing chags pa med pa'i ye shes mngon par sgrub pa /	83.2214374650265
trEDAtuka samatAyAm aBiyuktAH dAnta cittAH SAnta cittAH sarva Darma DAtu upalabDi samanvAgatAH	khams gsum mnyam pa nyid du mngon par brtson pa / sems dul ba / sems zhi ba / chos thams cad mi dmigs pa dang ldan pa / kun 'byung ba'i nges pa'i tshig la mkhas pa / chos kyi nges pa'i tshig dang ldan pa / gsal ba dang mi gsal ba la mkhas pa /	74.19725065030029
samudaya nirukti kuSalAH Darma nirukti samanvAgatAH hAra AhAra kuSalAH naya Anaya kuSalAH sTAna kuSalA	tshul dang tshul ma yin pa'i gnas la mkhas pa /	53.15983366514174
lOkikIzu kaTAsu anapekzAH viharanti	'jig rten pa'i gtam la mi lta bar gnas pa /	83.4501124093699
loka uttarABiH kaTABiH sAram pratyayanti	'jig rten las 'das pa'i gtam rnams kyi snying po rtogs pa /	72.46084563206819
sarva Darma paryezwi kuSalAH sarva Darma prakRti vyupaSama jQAna vihAriNaH nupalamBa gocarA	chos thams cad yongs su tshol ba la mkhas pa / chos thams cad rang bzhin gyis nye bar zhi bar shes pas gnas pa / dmigs pa med pa'i spyod yul ba / ci yang med pa / len pa med pa / sems pa med pa / phung po med pa /	81.91351596140633
nizkiMcanA nirupAdAnA niScintA nirupaDayaH nupAdAya su vimuktAH anaFgaNAH aparyasTAyinaH	len pa med pas shin tu rnam @407b par grol bar nyon mongs pa med pa / mngon par shes pa rnams la thug pa med par gnas pa /	76.30482104316553
BijQAsu amUla sTAyinaH saFga AcArikAH anavalInAH gamBIrezu Darmezu aBiyuktAH na saMsIdanti	rtsa ba med pa la gnas pa / sems chags pa med pa / zhum pa med pa / chos zab mo rnams la mngon par brtson pa /	76.79365710675587
dUranuboDa budDa jQAna praveSa udgatA ekAyana mArga anuprAptA nirvicikitsA AstIrNa kaTaMkaTA	sgyid lug pa med pa / sangs rgyas kyi ye shes rtogs par dka' ba la 'jug pas / 'phags pa bgrod pa gcig pu'i lam rjes su thob pa / the tshom med pa / dogs pa las brgal pa; shes pa gzhan gyi dring la mi 'jog pa /	81.40525591693437
apara pratyaya jQAnAH anaDimAninaH	lhag pa'i nga rgyal med pa /	56.035122803279336
sumeru samAH jQAna aByudgatAH	ye shes kyis mngon par 'phags te ri rab dang mtshungs pa /	85.39563918113708
sAgara samAH budDi akzoByAH	'khrugs pa med pa'i blos rgya mtsho dang 'dra ba /	73.56516542434693
candra sUrya praBA atikrAntAH prajQA aBayA pANxa rasu Sukla SudDa SuBa citta tayA ca uttapta hema varNa sadRSAH avaBAsa nirBAsa tayA ca	shes rab kyi 'od dang dkar zhing shin tu dkar la dag cing dge ba'i sems dang / gser btso ma'i kha dog 'dra bar snang zhing 'od 'byung ba'i yon tan gyi mchog gis nyi zla'i 'od las shin tu 'das pa /	88.46105946633736
vasuMDarA sadRSAH sarva sattva SuBa aSuBa kzamaNa tayA	sems can thams cad kyi dge ba dang / mi dge ba bzod pas sa dang mtshungs pa /	85.79479473048015
apsadRSAH sarva kleSa mUla nirDAvana pravAhaNa tayA ca	nyon mongs pa'i dri ma 'khru bar 'bab pas chu dang 'dra ba /	84.28915835938201
agni rAja sadRSAH sarva Darma manyanA kleSa nirdahana tayA	chos thams cad la rlom sems su byed pa dang / nyon mongs pa sreg pa'i phyir me'i phung po dang mtshungs pa /	85.9915051859612
vAyu sadRSAH sarva lokA saQjana tayA	'jig rten thams cad la mi chags pa'i phyir rlung dang 'dra ba /	79.84818278040204
AkASa sadRSAH sarva Darma nErveDika tayA sarvaSas nizkiMcana tayA ca	chos thams cad nges par phigs pa dang thams cad du ci yang med pa'i phyir nam mkha' dang mtshungs pa dang /	83.9487556095193
suKu vEdya  padma sadRSAH sarva lokAnupalipta tayA	'jig rten thams cad kyis mi gos pa'i phyir padma dang 'dra ba /	81.03332176041667
kAlAnusAri mahA meGa sadRSA Darma aBigarjana tayA	chos dang chos ma yin pa mngon par sgrogs pas dus kyi rjes su 'brang ba'i @408a *// 'brug chen po dang mtshungs pa /	77.63623135845171
mahA vRzwi sadRSA Darma salila aBipravarzaNa tayA	chos kyi chu'i char mngon par 'bebs pas char ba chen po dang 'dra ba /	87.05005629868381
RzaBa sadRSA mahA gaNa aBiBavana tayA	tshogs chen po zil gyis gnon pas khyu mchog dang mtshungs pa /	86.19002100729173
mahA nAga sadRSAH parama sudAnta citta tayA	sems shin tu mchog tu dul bas glang po che chen po dang 'dra ba /	89.08916993384877
BadrASva ajAneya sadRSAH su vinIta tayA	shin tu dul bas rta cang shes bzang po dang mtshungs pa /	85.38268912465948
