na ca tAni ratnAni loke pracaranti yAni suKAvatyAm lokaDAtO vidyante start suKv	'jig rten gyi khams bde ba can na snang ba'i rin po che gang yin pa de dag ni 'jig rten na mi spyod do //	85.65057071208666
sA KalvAnanda suKAvatI lokaDAtuH suraBi nAnA ganDa samIritA nAnA puzpa Pala samRdDA ratna vRkza samalaMkRtA taTAgata aBinirmita manojQasva	kun dga' bo / 'jig rten gyi khams bde ba can de ni spos sna tshogs dri rab tu zhim pa ngad ldang ba'i me tog dang 'bras bu sna tshogs 'byor @391b pa'o; ;rin po che'i shing ljon pas legs par brgyan pa'o // de bzhin gshegs pa'i sprul pa'i bya rnam pa sna tshogs sgra yid du 'ong ba can gyi tshogs // kyis brgyan pa'o // kun dga' bo /	78.44332741501407
te ca Ananda ratna vRkzAH nAnA varNAH aneka varNAH aneka Sata sahasra varNAH	rin po che'i shing ljon pa de dag ni kha dog tha dad pa / kha dog du ma / kha dog brgya stong phrag du ma yod pa'o //	93.53917992036557
santi tatra ratna vRkzAH suvarNa varNAH suvarNa mayAH	kun dga' bo / de na rin po che'i shing ljon pa gser gyi kha dog lta bu dang / gser gyi rang bzhin dag yod do //	90.68021733823232
santi rUpya varNAH rUpya mayAH	dngul gyi kha dog lta bu dang / dngul gyi rang bzhin dag yod do //	79.70631579919295
santi vExUrya varNAH vExUrya mayAH	bee d'ur+ya'i kha dog lta bu dang / bee d'ur+ya'i rang bzhin dag yod do //	91.92134801093775
santi sPawika varNAH sPawika mayAH	shel gyi kha dog lta bu dang / shel gyi rang bzhin dag yod do //	92.83566856384277
santi musAra galva varNAH musAra galva mayAH	spug gi kha dog lta bu dang / spug gi rang bzhin dag yod do //	65.76381315580228
santi lohita muktA varNAH lohita mukta AmayAH	mu tig dmar po'i kha dog lta bu dang / mu tig dmar po'i rang bzhin dag yod do //	82.39444827757868
santi aSma garBa varNAH aSmagarBa mayAH	rdo'i snying po'i kha dog lta bu dang / rdo'i snying po'i rang bzhin dag yod do //	82.70002351347094
santi kecid dvayaH ratnayoH suvarNasya rUpyasya ca	kha cig ni gser dang / dngul dang / rin po che sna gnyis pa dag yod do //	79.01788825142907
santi trayANAm ratnAnAm suvarNasya rUpyasya vExUryasya ca	gser dang / dngul dang / bee d'ur+ya dang / rin po che sna gsum pa dag kyang yod do //	87.61345220950817
santi caturNAm ratnAnAm suvarNasya rUpyasya vExUryasya sPawikasya ca	gser dang / dngul dang / bee d'ur+ya dang / shel dang / rin po che sna bzhi pa dag kyang yod do //	91.41593625451974
santi paQcAnAm ratnAnAm suvarNasya rUpyasya vExUryasya sPawikasya musAra galvasya ca	gser dang / dngul dang / bee d'ur+ya dang / shel dang / spug dang / rin po che sna lnga pa dag kyang yod do //	89.31391536384454
santi zaNNAm ratnAnAm suvarNasya rUpyasya vExUryasya sPawikasya musAra galvasya lohita muktAyAH ca	gser dang / dngul dang / bee d'ur+ya dang / shel dang / spug dang / mu tig dmar po dang / rin po che sna drug pa dag kyang yod do // gser dang / dngul @392a *//	94.05370134890177
santi saptAnAm ratnAnAm suvarNasya rUpyasya vExUryasya sPawikasya musAra galvasya lohita muktAyAH aSmagarBasya ca saptamasya	dang; bee d'ur+ya dang / shel dang / spug dang / mu tig dmar po dang / rdo'i snying po dang / rin po che sna bdun pa dag kyang yod do //	83.4197383931734
tatra Ananda suvarNa mayAnAm vRkzANAm suvarNa mayAni mUla skanDa viwapa SAKA patra puzpANi	kun dga' bo / de na gser gyi shing ljon pa rnams kyi rtsa ba dang / sdong po dang / yal ga dang / lo ma dang / 'dab ma dang / me tog rnams gser gyi rang bzhin la / rtsa ba rnams dngul gyi rang bzhin no //	90.05966166379606
PalAni rUpya mayANi rUpya mayANAm vRkzANAm rUpya mayAni eva mUla skanDa viwapa SAKA patra puzpANi	dngul gyi shing ljon pa rnams kyi rtsa ba dang / sdong po dang / yal ga dang / lo ma dang / 'dab ma dang / me tog rnams dngul gyi rang bzhin la /	90.66677430508943
PalAni vExUrya mayANi	'bras bu rnams bee d'ur+ya'i rang bzhin no //	87.28487960497539
vExUrya mayANAm vRkzANAm vExUrya mayANi mUla skanDa viwapa SAKA patra puzpANi	bee d'ur+ya'i shing ljon pa rnams kyi rtsa ba dang / sdong po dang / yal ga dang / lo ma dang / 'dab ma dang / me tog rnams bee d'ur+ya'i rang bzhin la /	91.26870725898543
PalAni sPawika mayAni	'bras bu rnams shel gyi rang bzhin no //	94.61067843437195
sPawika mayAnAm vRkzANAm sPawika mayAni eva mUla skanDa viwapa SAKA patra puzpANi suKu vEdya PalAni ca musAra galva mayAni	shel gyi shing ljon pa rnams kyi rtsa ba dang / sdong po dang / yal ga dang / lo ma dang / 'dab ma dang / me tog rnams shel gyi rang bzhin la /	87.46661311613147
musAra galva mayAnAm vRkzANAm musAra galva mayAni eva mUla skanDa viwapa SAKA patra puzpANi	'bras bu rnams spug gi rang bzhin no; ;spug gi shing ljon pa rnams kyi rtsa ba dang / sdong po dang / yal ga dang / lo ma dang / 'dab ma dang / me tog rnams spug gi rang bzhin la /	90.6739969725359
PalAni ca lohita muktA AmayAni	'bras bu rnams mu tig dmar po'i rang bzhin no //	92.78228855133057
lohita muktA mayAnAm vRkzANAm lohita mukta AmayAni eva mUla skanDa viwapa SAKA patra puzpANi PalAni ca aSmagarBa mayANi	mu tig dmar po'i shing ljon pa rnams kyi rtsa ba dang / sdong po dang / yal ga dang / lo ma dang / 'dab ma dang / me tog rnams mu tig dmar po'i rang bzhin la / @392b 'bras bu rnams rdo'i snying po'i rang bzhin no //	94.72406368756626
aSmagarBa mayANAm vRkzANAm aSma garBa mayANi eva mUla skanDa viwapa SAKA patra puzpANi PalAni ca suvarNa mayAni	rdo'i snying po'i shing ljon pa rnams kyi rtsa ba dang / sdong po dang / yal ga dang / lo ma dang / 'dab ma dang / me tog rnams rdo'i snying po'i rang bzhin la; 'bras bu rnams gser gyi rang bzhin no // kun dga' bo /	92.62540501891866
kezAMcid Ananda vRkzANAm suvarNa mayAni mUlAni	shing ljon pa kha cig ni rtsa ba rnams gser gyi rang bzhin la /	91.16142127927405
rUpya mayAH skanDAH	sdong po rnams dngul gyi rang bzhin /	82.70607443757959
vExUrya mayAH viwapAH	yal ga rnams bee d'ur+ya'i rang bzhin /	91.59660097268912
sPawika mayAH SAKAH musAra galva mayAni patrANi	lo ma rnams shel gyi rang bzhin / 'dab ma rnams spug gi rang bzhin /	92.94876080297972
lohita mukta AmayAni puzpANi	me tog rnams mu tig dmar po'i rang bzhin /	91.92435677846272
aSmagarBa mayANi PalAni	'bras bu rnams rdo'i snying po'i rang bzhin no // kun dga' bo /	87.350222924399
kezAMcid Ananda vRkzANAm rUpya mayANi mUlAni	shing ljon pa kha cig ni rtsa ba rnams dngul gyi rang bzhin la /	87.98738168451997
vExUrya mayAH skanDAH	sdong po rnams bee d'ur+ya'i rang bzhin /	91.76680361933825
sPawika mayAH viwapAH	yal ga rnams shel gyi rang bzhin /	89.11873786589679
musAra galva mayAH SAKAH	lo ma rnams spug gi rang bzhin /	80.61719989776611
lohita mukta AmayAni patrANi	'dab ma rnams mu tig dmar po'i rang bzhin /	91.22524905759235
aSmagarBa mayANi puzpANi	me tog rnams rdo'i snying po'i rang bzhin /	90.95882054262383
suvarNa mayAni PalAni	'bras bu rnams gser gyi rang bzhin no // kun dga' bo /	91.63317280345493
kezAMcid Ananda vRkzANAm vExUrya mayANi mUlAni sPawika mayAH skanDAH	shing ljon pa kha cig ni rtsa ba rnams bee d'ur+ya'i rang bzhin la /	87.55846404499806
musAra galva mayAH viwapAH	sdong po rnams shel gyi rang bzhin /	83.00802193747626
lohita mukta AmayAH SAKAH	yal ga rnams spug gi rang bzhin / lo ma rnams mu tig dmar po'i rang bzhin /	83.59946354230246
aSmagarBa mayANi patrANi	'dab ma rnams rdo'i snying po'i rang bzhin /	83.27280230955644
suvarNa mayAni puzpANi	me tog rnams gser gyi rang bzhin /	94.21614644106697
rUpya mayANi PalAni	'bras bu rnams dngul gyi rang bzhin no //	89.72563017286905
kezAMcid Ananda vRkzANAm sPawika mayAni mUlAni	kun dga' bo / shing ljon pa kha cig ni rtsa ba rnams shel gyi rang bzhin la /	93.00109403901587
musAra galva mayAH skanDAH	sdong po rnams spug gi rang bzhin /	74.80408838817053
lohita muktA mayAH viwapAH	@393a *// yal ga rnams mu tig dmar po'i rang bzhin //	85.7706026895991
aSmagarBa mayAH SAKAH	lo ma rnams rdo'i snying po'i rang bzhin /	86.98770904541016
suvarNa mayAni patrANi	'dab ma rnams gser gyi rang bzhin /	92.72633848871503
rUpya mayANi puzpANi	me tog rnams dngul gyi rang bzhin /	90.77732024874005
vExUrya mayANi PalAni	'bras bu rnams bee d'ur+ya'i rang bzhin no // kun dga' bo /	89.96660820104309
kezAMcid Ananda vRkzANAm musAra galva mayAni mUlAni	shing ljon pa kha cig ni rtsa ba rnams spug gi rang bzhin la /	86.14753680609842
lohita mukta AmayAH skanDAH	sdong po rnams mu tig dmar po'i rang bzhin /	81.06538640369068
aSmagarBa mayAH viwapAH	yal ga rnams rdo'i snying po'i rang bzhin /	89.56637985761775
suvarNa mayAH SAKAH	lo ma rnams gser gyi rang bzhin /	78.39717245824409
rUpya mayANi patrANi	'dab ma rnams dngul gyi rang bzhin /	85.34514066908095
vExUrya mayANi puzpANi	me tog rnams bee d'ur+ya'i rang bzhin /	93.07792840248499
sPawika mayAni PalAni	'bras bu rnams shel gyi rang bzhin no //	90.0984697341919
kezAMcid Ananda vRkzANAm lohita mukta AmayAni mUlAni	kun dga' bo; shing ljon pa kha cig ni rtsa ba rnams mu tig dmar po'i rang bzhin la /	90.76531178585452
aSmagarBa mayAH skanDAH	sdong po rnams rdo'i snying po'i rang bzhin /	88.6805486149258
suvarNa mayAH viwapAH	yal ga rnams gser gyi rang bzhin /	88.74176829001483
rUpya mayAH SAKAH vExUrya mayANi patrANi	lo ma rnams dngul gyi rang bzhin / 'dab ma rnams bee d'ur+ya'i rang bzhin /	93.13483578596504
sPawika mayAni puzpANi	me tog rnams shel gyi rang bzhin /	91.49517056521248
musAra galva mayANi PalAnikezAMcid Ananda vRkzANAm aSmagarBa mayANi mUlAni	'bras bu rnams spug gi rang bzhin no // kun dga' bo / shing ljon pa kha cig ni rtsa ba rnams rdo'i snying po'i rang bzhin la /	91.38749443658753
suvarNa mayAH skanDAH	sdong po rnams gser gyi rang bzhin /	86.03359444936116
rUpya mayAH viwapAH	yal ga rnams dngul gyi rang bzhin /	88.45915910175869
vExUrya mayAH SAKAH	lo ma rnams bee d'ur+ya'i rang bzhin /	84.72766780853271
sPawika mayAni patrANi	'dab ma rnams shel gyi rang bzhin /	89.11857066835675
musAra galva mayAni puzpANi	me tog rnams spug gi rang bzhin /	88.3130469972437
lohita muktA mayAni PalAni	'bras bu rnams mu tig dmar po'i rang bzhin no // kun dga' bo /	92.64873093943442
kezAMcid Ananda vRkzANAm sapta ratna mayAni mUlAni	shing ljon pa kha cig ni rtsa ba rnams rin po che sna bdun gyi rang bzhin la /	92.83207756937716
sapta ratna mayAH skanDAH	sdong po @393b rnams kyang rin po che sna bdun gyi rang bzhin /	82.94451582242573
sapta ratna mayAH viwapAH	yal ga rnams kyang rin po che sna bdun gyi rang bzhin /	89.70554928346114
sapta ratna mayAH SAKAH	lo ma rnams kyang rin po che sna bdun gyi rang bzhin /	74.11711314872458
sapta ratna mayAni patrANi	'dab ma rnams kyang rin po che sna bdun gyi rang bzhin /	92.36465222494942
sapta ratna mayAni puzpANi	me tog rnams kyang rin po che sna bdun gyi rang bzhin /	94.43652508475564
sapta ratna mayAni PalAni	'bras bu rnams kyang rin po che sna bdun gyi rang bzhin no // kun dga' bo /	92.96890838940939
sarvezAm ca Ananda tezAm vRkzANAm mUla skanDa viwapa SAKA patra puzpa PalAni suKa saMsparSAni suganDIni	shing ljon pa de dag thams cad kyi rtsa ba dang; sdong po dang / yal ga dang / lo ma dang / 'dab ma dang / me tog dang / 'bras bu rnams ni 'jam pa / reg na bde ba / dri zhim pa dag go /	93.64691376443476
vAtena preritena ca tezAm valgu manojQa GozaH niScarati asecanakaH pratikUlaH SravaNAya	rlung gis bskyod na de dag las snyan cing yid du 'ong ba'i sgra 'byung ste / mnyan pa dang mthun zhing mnyan pas chog mi shes pa'o //	87.87685706565351
evaMrUpEH Ananda sapta ratna mayEH vRkzEH saMtatam tat budDa kzetram samantAt ca kadalI skanDEH	kun dga' bo / sangs rgyas kyi zhing de ni rin po che sna bdun gyi shing ljon pa rnam pa de lta bu dag gis gang ste /	86.5643051481956
sapta ratna mayEH ratna tAla paFktiBiH ca anuparikziptam sarvatas ca hema jAla praticCannam	mtha' na rin po che sna bdun gyi chu shing gi sdong po dang / rin po che'i shing ta la'i phreng gis yongs su bskor to // thams cad kyang gser gyi dra bas khebs pa'o //	89.26747347198278
samantaH ca sarva ratna mayEH padmEH saMCannam	kun du rin po che sna bdun gyi padma rnams kyis khebs pa'o //	87.15711663315001
santi tatra padmAni arDa yojana pramANAni	de na padma'i tshad dpag tshad phyed pa tsam yang yod /	90.98248343034224
santi yojana pramANAni	dpag tshad kyi tshad tsam yang yod /	90.2285376124912
santi dvi tri catur paQca yojana pramANAni	dpag tshad gcig dang / gnyis dang / gsum dang / bzhi dang / lnga'i tshad tsam yang yod /	89.94452685209554
santi yAvat daSa yojana pramANAni	dpag tshad bcu'i bar gyi tshad tsam dag kyang yod do //	92.52272844314575
sarvatas ca ratna padmAt zawtriMSat raSmi kowI Sata sahasrANi niScaranti	rin po che'i padma thams cad las kyang 'od zer bye ba stong phrag sum cu rtsa drug drug 'byung ngo // 'od zer gyi rtse mo @394a *//	90.81622122542207
sarvatas ca raSmi muKAt zawtriMSat budDa kowI Sata sahasrANi niScaranti suvarNa maya varNEH kAyEH dvAtriMSat mahApuruza lakzaNa DarEH yAni pUrvasyAm diSi aprameya asaMKyeyAsu lokaDAtuzu gatvA sattveByaH Darmam deSayanti	thams cad las kyang sangs rgyas kyi sku gser gyi kha dog can skyes bu chen po'i mtshan sum cu rtsa gnyis mnga' ba bye ba stong phrag sum cu rtsa drug drug 'byung ste; de dag shar phyogs su 'jig rten gyi khams grangs med dpag tu med pa dag tu gshegs nas sems can rnams la chos ston to //	80.68112289331377
evam dakziNa paScima uttarAsu dikzu aDas UrDvam anuvidikzu gata AvaraNe loke prameya asaMKyeyAn= loka DAtUn gatim gattvA sattveByaH Darmam start suKv suKu vEdya	de bzhin du lho dang / nub dang / byang phyogs dang; 'og dang / steng dang / phyogs mtshams rnams su 'jig rten gyi khams tha dad pa grangs med dpag tu med pa dag tu gshegs nas sems can rnams la chos ston to // kun dga' bo /	84.57297469495492
tasmin Kalu punar Ananda budDa kzetre sarvaSas kAla parvatAH na santi sarvatas ratna parvatAH sarvaSas sumeravaH parvata rAjAH sarvaSamahA cakravAlAH parvata rAjAH	sangs rgyas kyi zhing de na ri nag po rnams ye med de / ri thams cad kyang rin po che'i ri sha stag go / ri'i rgyal po ri rab thams cad dang / khor yug dang / ri'i rgyal po khor yug chen po thams cad dang / mtsho chen po rnams med do //	90.08012263691279
samantAt ca tat budDa kzetram samam ramaNIyam pANitala jAtam nAnAviDa ratna maNi cita BUmi BAgam	sangs rgyas kyi zhing de ni kun du mnyam pa / nyams dga' ba / lag mthil ltar mnyam pa / sa phyogs rin po che rnam pa sna tshogs kyis spras pa'o //	89.1404131204052
evam ukte AyuzmAn AnandaH Bagavantam etat avocat  ye ca punar te Bagavan= cAturmahA rAja kAyikAH devAH sumeru pArSva nivAsinaH trAyastriMSAH	de skad ces bka' stsal pa dang / bcom ldan 'das la tshe dang ldan pa kun dga' bos 'di skad ces gsol to // bcom ldan 'das / rgyal chen bzhi'i ris kyi lha ri rab kyi ngos la gnas pa dang / sum cu rtsa gsum pa'i lha ri rab kyi rtse mo la gnas pa de dag gang na gnas / bcom ldan 'das kyis bka' stsal pa / kun dga' bo / 'di ji @394b snyam du sems /	78.68330304724476
te kutra pratizWitAH BagavAn Aha  tat kim manyase Ananda ye te iha sumeroH parvata rAjasya upari yAmA devAH tuzitA vA nirmANa ratayaH vA paranirmitavaSavartinaH vA brahmakAyikAH vA brahma purohitAH vA mahA brahmANaH va yAvat akanizWA vA	'di na ri'i rgyal po ri rab kyi gong ma 'thab bral gyi lha rnams dang / dga' ldan dang / 'phrul dga' dang / gzhan 'phrul dbang byed dang / tshangs ris dang / tshangs pa'i mdun na 'don dang / tshangs chen nas 'og min gyi bar gyi lha rnams gang na gnas /	69.48549214189177
kutra te pratizWitAH iti	gsol pa /	37.27237399419149
AnandaH Aha  acintyaH Bagavan karmaNAm vipAkaH karma aBisaMskAraH	bcom ldan 'das / las kyi rnam par smin pa dang / las mngon par 'du bgyid pa bsam gyis mi khyab bo // bcom ldan 'das kyis bka' stsal pa /	88.62557561338656
BagavAn Aha  labDaH tvayA AnandaH iha acintyaH karmaNAm vipAkaH karma aBisaMskAraH na budDAnAm BagavatAm acintyam budDa aDizWAnam kRta puNyAnca sattvAnAm avaropita kuSala mUlAnAm tava acintyA puNyA viBUtiH	kun dga' bo / las kyi rnam par smin pa dang / las mngon par 'du byed pa bsam gyis mi khyab pa ni rnyed par rung gi / sangs rgyas bcom ldan 'das rnams kyi dge ba dang / rdzu 'phrul dang / byin gyi rlabs bsam gyis mi khyab pa ni sus kyang mtha' ma / tshad rtogs pa'am / bsam par mi nus te / gzhan du na sangs rgyas kyi yul bsam gyis mi khyab po zhes rab tu 'byed do // de ltar sems can bsod nams byas pa dang / dge ba'i rtsa ba bskyed pa'i bsod nams dang ye shes dang / rdzu 'phrul dang / 'byor pa bsam gyis mi khyab pa dag sangs rgyas kyi zhing der 'byung ngo // gsol pa / bcom ldan 'das /	57.33011527388552
AnandaH Aha  na me tra Bagavan kAcid kAFkzA vA vimatiH vA vicikitsA vA	bdag ni de la dogs pa'am / yid gnyis sam / the tshom ma mchis te /	84.99959513748111
api tu Kalu aham anAgatAnAm sattvAnAm kAFkzA vimati vicikitsA nirGAtAya taTAgatam etad arTam paripRcCAmi	bdag ni ma 'ongs pa'i sems can rnams kyi dogs pa dang / yid gnyis dang / the tshom bsal ba'i slad du de bzhin gshegs pa la don 'di yongs su zhu'o // bcom ldan 'das kyis bka' stsal pa /	89.15888019034904
BagavAn Aha  sADu sADu Ananda	kun dga' bo / legs @395a *// so; ;legs so //	89.1207927790555
evam te karaNIyam	de lta bu ni khyod kyi bya ba yin no // kun dga' bo /	77.14046333420951
start suKv tasyAm Kalu Ananda suKAvatyAm lokaDAtO nAnA prakArAH nadyaH pracaranti	'jig rten gyi khams bde ba can de na chu klung rnam pa sna tshogs dag 'bab ste /	83.36814100167285
santi tatra mahA nadyaH yojana vistArAH	de na chu klung chen po kha tshon dpag tshad tsam dag kyang yod de /	90.56721698317757
santi yAvat viMSati triMSat catvAMriSat paQcASat yojana vistArAH yAvat dvAdaSa yojana AveDAH	dpag tshad bcu dang / nyi shu dang / sum cu dang / bzhi bcu dang / lnga bcu'i bar dang / kha tshon dpag tshad brgya stong gi tshad tsam dag kyang yod de / zabs su ni dpag tshad bcu gnyis pa dag go /	91.42641923971232
sarvAH ca tAH nadyaH suKa vAhinyaH nAnA suraBi ganDa vAri vAhinyaH nAnA ratna lulita puzpa saMGAta vAhinyaH nAnA maDura svara nirGozAH	chu klung de dag thams cad kyang spos dri rab tu zhim pa sna tshogs kyi chur 'bab cing rin po che'i me tog sil ma'i tshogs dag 'bab pa dag go / sgra dbyangs snyan pa tha dad pa sna tshogs dang yang ldan pa dag go / kun dga' bo /	88.64750718282961
tAsAm ca Ananda kowi Sata sahasra aFga saMprayuktasya divya saMgIti samUrcCitasya tUryasya kuSalEH saMpravAditasya tAvat manojQa GozaH niScarati yaTArUpaH tAsAm mahA nadInAm	chu klung chen po de dag las lha'i glu dbyangs yan lag bye ba brgya stong dang ldan pa'i sil snyan dag mkhas pa rnams kyis byas pa bas lhag pa'i sgra yid du 'ong ba 'byung ste /	74.27500922506462
nirGozaH niScarati gamBIraH jQeyaH vijQeyaH nelaH karNa suKaH hRdayaMgamaH premaNIyaH valguH manojQaH secanakaH pratikUlaH SravaNAya anityam SAntam anAtmA iti suKa SravanIyaH yaH tezAm sattvAnAm Srotra indriya ABAsam AgacCati	chu klung chen po de dag las rnam pa 'di lta bu'i sgra 'byung ba ni zab pa dang / kun du shes par bya ba dang / rnam par shes par bya ba dang / brdzun pa ma yin pa dang / rna bar bde ba dang / snying du 'ong ba dang / dga' bar bya ba dang / snyan pa dang / yid du 'ong ba dang / mnyan pas chog mi shes pa dang / mnyan pa dang mthun pa dang / mi rtag pa dang / zhi ba dang / bdag med ces bya ba dang / mnyan na bde ba ste / de dag sems can de dag gi rna ba'i @395b dbang po la grag go /	68.960718553687
tAsAm Kalu punar Ananda mahA nadInAm uBayatas tIrANi nAnA ganDa ratna vRkzEH saMtatAni	kun dga' bo / chu klung chen po de dag gi 'gram gnyis ni rin po che'i spos kyi shing ljon pa dag gis gang ste /	88.65448796117967
yeByaH nAnA SAKA patra puzpa maQjaryaH valambante	de dag la yal ga dang / lo ma dang / me tog dang / dog pa sna tshogs 'phyang ngo //	86.28517252513235
tatra ye sattvAH tezu nadI tIrezu AkAFkzanti divya aBirAma ramaNIyAm rati krIxAm ca anuBavitum	de na sems can gang dag chu klung gi 'gram de dag tu zang zing med pa'i lha'i dga' ba dang / rtse ba myong bar 'dod pa de dag chu klung de dag tu 'jug pa'i tshe /	88.3332459420626
tezAm tatra nadIzu avatIrNAnAm AkAFkzatAm gulPa mAtram vAri saMtizWate	'dod na chu long bu nub tsam du gnas so //	68.06942716483724
AkAFkzatAm jAnu mAtram kawi mAtram kakza mAtram AkAFkzatAm karNa mAtram vAri saMtizWate	'dod na chu pus mo nub tsam dang / 'dod na rked pa nub tsam dang / 'dod na mchan khung nub tsam dang / 'dod na mid pa nub tsam du chu gnas par 'gyur te /	80.69484002266579
divyAH ca ratayaH prAdurBavanti	lha'i dga' ba dag kyang 'byung ngo //	82.0379991660247
tatra ye sattvAH AkAFkzanti SItam vAri Bavatu iti tezAm SItam vAri Bavati	der sems can gang dag chu grang bar gyur cig snyam du 'dod na yang de dag la bsil bar 'gyur ro //	83.16275980098584
yaH AkAFkzani uzNam Bavatu iti tezAm uzNam Bavati	gang dag dro bar gyur cig snyam du 'dod na yang de dag la dro bar 'gyur 'gyur ro // ro //	85.16189445292933
yaH AkAFkzanti SIta uzNam Bavatu iti tezAm SIta uzNam eva tad vAri Bavati anusuKam	gang dag bsil ba dang / dro bar gyur cig snyam du 'dod na yang de dag la chu de bsil ba dang dro bar 'gyur te /	87.72131679211772
tAH ca mahA nadyaH divya tamAla patra agaru kAla anusAri ta gara uraga sAra candana vara ganDa vAsita vAri paripUrNAH	bde bar 'gyur ro // chu klung chen po de dag ni lha'i shing ta ma la'i lo ma dang / aa ka ru dang / dus kyi rjes su 'brang ba dang / rgya spos dang / tsan dan sprul gyi snying po dang / spos mchog gis bsgos pa'i chus yongs su gang ste 'bab pa /	83.72327895297684
pravahanti divya utpala padma kumuda puNxarIka sOganDika Adi puzpa saMCannA haMsa sArasa krOQca cakravAka kAraNxavaSuka SArika kokila kuNAla kala	lha'i me tog autpa la dang; padma dang / ku mu ta dang / padma dkar po dang / dri rab tu zhim pa dag gi me tog gis khebs pa / khol khol dag na bya ngang pa dang / gzhad dang / khrung khrung dang / ngur pa dang / ka @396a *// ran da ba dang / ne tso dang / ri skegs dang / khu byug dang / ku na la dang / ka la ping ka dang / rma bya la sogs pa sgra yid du 'ong ba dang ldan pa /	71.24113424199253
svarAH taTAgata aBinirmita pakzi saMGa nizevita pulinAH DArtarAzwra upaSoBitAH su upatIrTA	de bzhin gshegs pas sprul pa'i bya'i tshogs kyis bsten pa / ngang pa dang / ngang pa'i rgyal po rnams kyis mdzes par byas pa dang / 'bab stegs bde ba / 'dam rdzab med pa /	82.04963480282406
vikardamAH suvarNa vAlukA saMkirNAH	gser gyi bye ma bdal ba dag go /	70.05487656593323
tatra yadA te sattvAH AkAFkzanti kIdRSA suKu vEdya asmAkam aBiprAyAH paripUryantAm iti tadA tezAm tAdRSAH eva aBiprAyA paripUryante yaH ca asO= Ananda tasya vAriNaH nirGozaH sa manojQaH niScarati	de na gang gi tshe sems can de dag bdag cag gi bsam pa 'di 'dra ba yongs su rdzogs par gyur cig snyam du 'dod pa de'i tshe de dag gi bsam pa de lta bu dag chos dang ldan par yongs su rdzogs par 'gyur ro // kun dga' bo /	73.65515340539291
yena sarvAvat tat budDa kzetram aBijQApyate ye ca sattvAH nadI tIrezu sTitAH AkAFkzanti mA asmAka mayam SabdaH Srotra indriya avaBAsam AgacCatu iti tezAm na divyasya api Srotra indriyasya avaBAsam AgacCati	chu de las yid du 'ong ba'i sgra 'byung ba gang yin pa des sangs rgyas kyi zhing der thams cad dang ldan pa'i 'khor la go bar byed do // de na sems can gang dag chu ngogs na 'khod pa dag sgra 'di bdag cag gi rna ba'i dbang po la grags par ma gyur cig ces 'dod na de de dag gi lha'i rna ba'i dbang po la grags par mi 'gyur ro //	87.02534761034985
yaH ca yaTArUpam Sabdam AkAFkzati Srotum sa taTArUpam eva manojQam Sabdam SRNoti	gang sgra rnam pa ji lta bu thos par 'dod pa de rnam pa de lta bu'i sgra yid du 'ong ba thos so // 'di lta ste /	85.5865040189763
tat yaTA  budDa Sabdam Darma Sabdam saMGa Sabdam pAramitA Sabdam BUmi Sabdam bala Sabdam vESAradya Sabdam AveNika budDa Darma Sabdam pratisaMvid Sabdam SUnyatA nimitta apraNihita anaBisaMskAra ajAta anutpAda aBAva niroDa Sabdam SAnta praSAnta upaSAntam mahA mEtrI mahAkarUNA mahAmuditAmahA upekzA Sabdam anutpattika Darma kzAnti aBizeka BUmi pratilamBa Sabdam	sangs rgyas kyi sgra dang / chos kyi sgra dang / dge 'dun gyi sgra dang / pha rol tu phyin pa'i sgra dang / sa'i sgra dang / stobs kyi sgra dang / mi 'jigs pa'i sgra dang / sangs rgyas kyi chos ma 'dres pa'i sgra dang / mngon par shes pa'i sgra dang / @396b so so yang dag par rig pa'i sgra dang / stong pa nyid dang / mtshan ma med pa dang / smon pa med pa dang / mngon par 'du bya ba med pa dang / ma skyes pa dang / ma byung ba dang / dngos po med pa dang / 'gag pa med pa'i sgra dang / zhi ba dang / rab tu zhi ba dang / nye bar zhi ba'i sgra dang / byams pa chen po dang / snying rje chen po dang / dga' ba chen po dang / btang snyoms chen po'i sgra dang / mi skye ba'i chos la bzod pa dang / dbang bskur ba'i sa rab tu thob pa'i sgra dag thos so // des sgra rnam pa de lta bu thos nas dga' ba dang / mchog tu dga' ba rgya chen po thob bo //	49.55343458251995
SrutvA udAra prIti prAmodyam pratilaBate viveka saha gatam virAga saha gatam SAnta sahagatam niroDa saha gatam Darma saha gatam boDi parinica	dben pa dang ldan pa dang / 'dod chags dang bral ba dang ldan pa dang / zhi ba dang ldan pa dang / 'gog pa dang ldan pa dang / chos dang ldan pa dang / byang chub yongs su 'grub pa'i dge ba'i rtsa ba dang ldan pa'i sgra 'byung ngo // kun dga' bo /	81.44981211045274
sarvaSas ca Ananda suKAvatyAm loka DAtO= akuSala SabdaH na asti	'jig rten gyi khams bde ba can na mi dge ba'i ming med do //	84.36581268481848
sarvaSas nIvaraNa SabdaH na asti	sgrib pa'i sgra yang yong med do //	85.7628468785967
sarvaSas pAya durgati vinipAta SabdaH na asti	ngan song ngan 'gro rnam par ltung ba'i sgra yang yong med do //	90.16127017432586
sarvaSas duHKa SabdaH na asti	sdug bsngal gyi sgra yang yong med do // kun dga' bo /	90.14144943378591
aduHKa asuKa vedanA SabdaH pi tAvat Ananda tatra na asti	de na sdug bsngal yang ma yin / bde ba yang ma yin pa'i tshor ba'i sgra yang med na /	86.8645986189628
kutas punar duHKa SabdaH Bavizyati	sdug bsngal dang / sdug bsngal gyi sgra lta ga la yod /	92.76040775125676
tat anena Ananda paryAyeNa sA lokaDAtuH suKAvatI iti ucyate saMkziptena	kun dga' bo / mdor bsdu na rnam grangs 'dis 'jig rten gyi khams de bde ba can zhes bya ste / rgyas par ni ma yin no // kun dga' bo / rgyas par byed @397a *//	88.46007660274246
