saH utpAda vinASa kAmaH	de ni skye ba dang / 'jig pa 'dod pa'o //	80.41025362945184
Badanta SAriputra	btsun pa sh'a ri'i bu /	90.31106152741806
punar aparam DarmaH  rajaH virajaH	gzhan yang / chos ni rdul med cing rdul dang bral pa ste /	83.47869522818203
tatas kaScid DarmaH ced yasmin anunaya ssya At antamaSas nirvANe pi	de la gang dag chos gang la chags na tha na mya ngan las 'das pa la'ang rung ste /	65.54789713286247
sa hi Darma kAmaH na asti	de dag ni chos 'dod pa ma yin gyi /	59.47617524010794
sa rAgarajaH kAmaH	de dag ni 'dod chags kyi rdul 'dod pa'o //	59.23953403745379
DarmaH vizayaH na asti yA vizaya gaNanA sA Darma kAmaH na asti	chos ni yul ma yin te / gang dag yul bgrang ba de dag ni chos 'dod pa ma yin gyi /	81.07213643291496
sa vizaya kAmaH	de dag ni yul 'dod pa'o //	57.405050681187554
DarmaH hi anAvyUhaH nirvyuhaH	chos ni blang ba med pa /	73.89131727218627
kaScid DarmaH yasmin aBigrahaNam ca utsargaH sa Darma kAmaH na asti	dor ba med pa ste / gang dag chos gang la 'dzin pa dang / gtong ba de dag ni chos 'dod pa ma yin te /	76.09775827024924
sa hi aBigrahaNa utsarga kAmaH	de dag ni 'dzin pa dang / gtong ba 'dod pa'o //	73.68515033924832
DarmaH na AlayaH	chos ni kun gzhi med pa ste /	94.52059592871831
yaH Alaya ArAmAH te na Darma kAmAH	gang kun gzhi la dga' ba de dag ni chos 'dod pa ma yin gyi /	88.48221270243327
te hi Alaya kAmAH	de dag ni kun gzhi 'dod pa'o //	91.2713880385122
DarmaH nimittaH SUnyaH	chos ni mtshan ma med pa stong pa ste /	85.91240701919946
yezAm vijQAna nimitta anugamanam te na Darma kAmAH	gang dag gi rnam par shes pa mtshan ma'i rjes su 'jug pa de dag ni chos 'dod pa ma yin te /	82.45798173964725
te nimitta kAmAH	de dag ni mtshan ma 'dod pa'o //	88.27282094955444
DarmaH sahavAsaH	chos ni lhan cig gnas pas ma yin te /	88.62946791906614
ye kecid DarmeNa saha viharanti te na Darma kAmAH	gang su dag chos dang lhan cig gnas pa de dag ni chos 'dod pa ma yin gyi /	85.7411728735303
te vihAra kAmAH	de dag ni gnas pa 'dod pa'o //	86.11663484573364
DarmaH dRzwa Sruta mata vijQAtat na asti	chos ni mthong ba dang / thos pa dang / bye brag phyed pa dang / rnam par rig pa ma yin te /	83.55460569267375
ye dRzwa Sruta mata vijQAte caranti te dRzwa Sruta mata vijQAta kAmAH	gang dag mthong ba dang / thos pa dang / bye brag phyed pa dang / rnam par rig pa la spyod pa @318a *//	82.61322716433637
na tu Darma kAmAH	de dag ni mthong ba dang / thos pa dang / bye brag phyed pa dang / rnam par rig pa 'dod pa yin gyi de dag ni chos 'dod pa ma yin no //	63.11246478954473
Badanta SAriputra	btsun pa sh'a ri'i bu /	90.31106152741806
Darma ssaMskRta AsaMskRtat na asti	chos ni 'dus byas dang / 'dus ma byas med pa ste /	74.99543590545655
ye saMskRta avacarAH te na Darma kAmAH te saMskRra grahaNa kAmAH	gang dag 'dus byas spyod yul ba de dag ni chos 'dod pa ma yin gyi de dag ni 'dus byas su 'dzin pa 'dod pa'o //	86.32885957674218
Badanta SAriputra	btsun pa sh'a ri'i bu /	90.31106152741806
atas icCeH ced Darma tvayA sarva DarmAH apratikAMkzitavyAH	de lta bas na khyod chos 'dod par bya na khyod kyis chos thams cad mi 'dod par bya'o //	87.14037607426047
asmin Darma upadeSe nirdiSyamAne deva putrANAm paQca Satasya Darmezu viSudDam Darma cakzuH udapAdi	chos bstan pa 'di bshad pa na lha'i bu lnga brgya chos rnams la chos kyi mig rnam par dag go /	82.63370719265998
aTa licCaviH vimala kIrtiH maju SrI kumAra BUtam abravIt maMju SrIH	de nas li tsa b'i dri ma med par grags pas 'jam dpal gzhon nur gyur pa la go / smras pa / 'jam dpal /	92.5168649921273
daSa dikzu Sata sahasrANi asaMKyeyAni budDa kzetrANi budDa kzetra cArikAm caritvA kasmin budDa kzetre sarva uttamAni sarva guNa sampannAni siMhAsanAni tvayA dRzwAni	khyod kyis phyogs bcu'i sangs rgyas kyi zhing brgya stong grangs med pa dag tu sangs rgyas kyi zhing rgyu zhing 'gro ba na sangs rgyas kyi zhing gang na seng ge'i khri thams cad kyi mchog yon tan thams cad dang ldan pa dag mthong /	89.24084713508907
evam avocat maMju SrI kumAra BUtaH licCavi bimala kIrtim etat avocat kula putra	de skad ces smras pa dang / 'jam dpal gzhon nur gyur pas li tsa b'i dri ma med par grags pa la 'di skad ces smras so // rigs kyi bu /	95.45306299087551
itas pUrvA asmin dvAtri Sat gaFgA nadI vAlukA samAni budDa kzetrANi atikramya asti meruDvajaH nAma lokaDAtuH	'di nas shar phyogs su sangs rgyas kyi zhing gangg'a'i klung sum cu rtsa gnyis kyi bye ma snyed 'das pa na 'jig rten gyi khams lhun po'i rgyal mtshan zhes bya ba yod de //	94.64565649893427
tatrameru pradIpa rAjaH nAma taTAgataH tizWiti Driyate yApayati	de na de bzhin gshegs pa lhun po'i sgron me'i @318b rgyal po zhes bya ba bzhugs te 'tsho zhing gzhes so //	92.65197520672375
tasya taTAgatasya kAya pramANam caturaSItiH yojana Sata sahasrANI	de bzhin gshegs pa de'i sku ni dpag tshad 'bum phrag brgyad cu rtsa bzhi'o //	91.63852377240838
tasya Bagavata ssiMhAna pramANam azwa zazwiH yojana Sata sahasrANi	bcom ldan 'das de'i seng ge'i khri'i tshad ni dpag tshad 'bum phrag drug cu rtsa brgyad do //	87.82335291426313
tezAm boDisattvAnAm kAya pramANam api dvicatvAriMSat yojana Sata sahasrANi	byang chub sems dpa' de dag gi lus kyang dpag tshad 'bum phrag bzhi bcu rtsa gnyis so //	88.70803889472091
tezAm boDisattvAnAm siMhAsana pramANam api catur tri Sat yojana Sata sahasrANi	byang chub sems dpa' de dag gi seng ge'i khri'ang dpag tshad 'bum phrag sum cu rtsa bzhi yod de / rigs kyi bu /	90.41658750998444
kula putra tasmin= tasya meru pradIpa rAjasya taTAgatasya budDa kzetre meru Dvaje lokaDAtO siMhAsanAni santi sarva uttamAni sarva guNa sa	de bzhin gshegs pa lhun po'i sgron me'i rgyal po de'i sangs rgyas kyi zhing 'jig rten gyi khams lhun po'i rgyal mtshan de na seng ge'i khri thams cad kyi mchog yon tan thams cad dang ldan pa dag yod do //	92.1760886257079
tatas tena Kalu samayena tAdRSam aBiprAyam saQcintya licCavinA vimala kIrtinAsyAH evaMrupardvi viDyAH aBisaMskAraH BisaMskRtaH yaTA	de nas li tsa b'i dri ma med par grags pas de'i tshe de lta bu'i bsam pa kun bsams shing / 'di lta bu'i rdzu 'phrul 'di mngon par 'du byed pa mngon par byas te /	80.28666908940451
meru DvajAt lokaDAtoH BagavatA meru pradIpa rAjena taTAgateta dvAtri Sat siMhAsana sahasrANi anuprezita anietAvat unnata ArohANi etAvat viSAlAn	gang 'jig rten gyi khams lhun po'i rgyal mtshan de na bcom ldan 'das de bzhin gshegs pa lhun po'i sgron ma'i rgyal po des seng ge'i khri sum khri nyis stong bskur te / de tsam du 'phang mtho ba / de tsam du yangs pa / de tsam du blta na sdug pa /	87.97824692655418
yAni tEH boDisattvEH ca tEH mahA SrAvakEH ca tEH Sakra brahma lokapAla deva putrEH adRzwa pUrvANi	gang byang chub sems dpa' de dag dang / nyan thos chen po de dag dang / brgya byin dang / tshangs pa dang / 'jig rten skyong ba dang / lha'i bu de dag gis sngon ma mthong ba de dag steng gi @319a *//	88.85592679929496
tAni upari vihAyasaH Agatya	nam mkha' las 'ongs te /	71.13583183288574
licCaveH vimala kIrteH gRhe pratizWAnAni	li tsa b'i dri ma med par grags pa'i khyim du so sor gnas so //	90.08254100872402
dvAtriMSat nAnA asi hAsana sahasrezu anAyAtena vahamAnezu	seng ge'i khri sna tshogs sum khri nyis stong ma zlos par shong ste /	82.66607843698979
taDgRham api etAvat viSAlam dRzyate sma	khyim de'ang de tsam du yangs par snang ngo //	80.0589908413265
vESAlI api mahA nagarya nivRtA aBUta	yangs pa'i grong khyer chen po'ang bsgribs par gyur pa med /	84.94845628738403
jambudvIpaH catur dvIpakaH lokaDAtu Sca anivRtAH	dzambu'i gling dang / gling bzhi pa'ang bsgribs pa med de /	77.77330535804217
sarve te pi yaTApUrva dRSyante sma	de dag thams cad kyang sngon ji lta ba bzhin du snang ngo //	87.83867327372234
aTa licCaviH vimala kIrtiH maQjuSrI kumAra BUtam etat avocat maMju SrIH	de nas li tsa b'i dri ma med par grags pas 'jam dpal gzhon nur gyur pa la 'di skad ces smras so // 'jam dpal /	96.3506362061538
siMhAsana anurupakAya aDizWitAH tavam ime ca boDisattvAH sihA Asane zu nizIdata	seng ge'i khri dang 'tsham pa'i lus su byin gyis brlabs nas byang chub sems dpa' 'di dag dang seng ge'i khri la 'dug cig /	83.78806358919479
tatas ye BijQAla aBiboDisattvAH te dvicatvAriMSat yojana Sata sahasra kAya aDizWitAH sihA Asanezu nizIdanti sma	de nas byang chub sems dpa' gang mngon par shes pa thob pa de dag ni bdag gi lus dpag tshad 'bum phrag bzhi bcu rtsa gnyis par byin gyis brlabs te seng ge'i khri la 'khod do //	93.08690750065425
ye boDisattvAa Adi karmikAH te tezu sihA Asanezu nIzIt itunna aSakan	byang chub sems dpa' gang dag las dang po pa de dag ni seng ge'i khri de dag la 'dug ma nus so //	80.12794354715467
tatas licCaviH vimala kIrtiH yaTA te boDisattvAH paQca aBijQAyAm siDyeyuH taTA hi evam teByaH boDisattveByaH Darma deSayi	de nas li tsa b'i dri ma med par grags pas ji ltar byang chub sems dpa' de dag mngon par shes pa lnga 'grub par 'gyur pa de lta de lta bur byang chub sems dpa' de dag la chos bstan te /	90.00682565263526
te BijQAm prApya  RdDyA dvicatvAri Sat yojana Sata sahasra SarIrANi aBinirmAya tezu sihA Asanezu nizidanti sma	de dag gis mngon par shes pa thob nas lus dpag tshad 'bum @319b phrag bzhi bcu rtsa gnyis par mngon par sgrub te seng ge'i khrid dag la 'khod do //	87.73841178743544
tezvA api mahA SrAvakezu tezu sihA Asanezu nizIditum asamarTezu	nyan thos chen po de dag kyang seng ge'i khri de dag la 'khod ma nus te /	86.2267339619349
licCaviH vimala kIrtiH tatas Ayuzmantam SAriputram abravIt Badanta SAriputra	de nas li tsa b'i dri ma med par grags pas tshe dang ldan pa sh'a ri'i bu la smras pa / btsun pa sh'a ri'i bu /	94.36983704331433
sihasane nizIda	seng ge'i khri la 'dug cig / smras pa /	69.01707397974455
avocat sat puruza	skyes bu dam pa /	64.76108646392822
ezu sihA Asanezu utkRzwezu ca atimAtrezu	seng ge'i khri 'di dag mtho zhing che bas 'dug mi nus so //	61.385027093402414
nizIditut na Sakromi	smras pa /	35.430158734321594
abravIt Badanta SAriputra	btsun pa sh'a ri'i bu /	80.57068899403448
tasmE Bagavate taTAgatAya meru pradIpa rAjAya kuru praNAmaQca nizIditum Sakzyasi	bcom ldan 'das de bzhin gshegs pa lhun po'i sgron ma'i rgyal po de la phyag gyis shig dang / 'dug nus par 'gyur ro //	86.42653208307736
aTa te mahA SrAvakAH tasmE Bagavate taTAgatAya meru pradIpa rAjAya aBivandanam kRtvA puratas te sihA Asanezu nyazIdan	de nas nyan thos chen po de dag gis bcom ldan 'das de bzhin gshegs pa lhun po'i sgron ma'i rgyal po de la phyag btsal nas gdod de dag seng ge'i khri la 'khod do //	87.55320464427136
aTa Ayuzma aMSAri putraH licCavi vimala kIrtim etat avocat kula putra	de nas tshe dang ldan pa sh'a ri'i bus li tsa b'i dri ma med par grags pa la 'di skad ces smras so // rigs kyi bu /	94.03907060623169
AScarya yaTE vam utkRzwa atimAtrANi IdRSa nAnA sahasrANi siMhAsanAni etAvat alpa gRham praviSanti ca eBiH api vESAlI mahA nagarI nivRtA na ati	khyim chung du'i nang du seng ge'i khri 'di lta bu'i mtho zhing che ba sna tshogs 'di lta bu stong phrag 'di snyed chud pa dang / 'di dag gis yangs pa'i grong khyer chen po'ang bsgribs par ma gyur /	83.71222135802938
jambUdvIpasya grAma nagara nigama rAzwra rAjaDAnI ca catur mahAdvIpakaH pi lokaDAtu Sca na kicid nivRtAH	dzambu'i gling gi grong dang / grong khyer dang / grong rdal dang / yul 'khor dang; rgyal po'i 'khor dang / gling chen po bzhi la'ang cung zad kyang ma bsgribs /	91.5500986765705
api ca deva nAga yakza ganDarvAsuH garuxa kinnara mahoraga sTAna ani anivRtAni pUrva yAdRSAnyAyati api dRSyante taTA	lha dang / klu dang / gnod sbyin dang / dri za dang / lha ma yin dang / nam mkha' lding @320a *// dang mi'am ci dang / lto 'phye chen po'i gnas rnams kyang bsgribs par ma gyur te / sngon ci 'dra ba phyis kyang de bzhin du snang ba ni ngo mtshar to //	83.2133385928828
licCaviH vimala kIrtiH abrabIt Badanta SAriputra	li tsa b'i dri ma med par grags pas smras pa / btsun pa sh'a ri'i bu /	91.27870930505388
taTAgateByaH ca boDisattveByaH cintyaH nAma vimokzaH sti	de bzhin gshegs pa dang / byang chub sems dpa' rnams la ni rnam par thar pa bsam gyis mi khyab pa zhes bya ba yod de /	81.23704592064027
tasmin acintya vimokze viharan boDisattvaH etAvat unnata atireka vipulam sumerum parvata rAjam sarzapa aByantaram prakzipan tasmin sarzapca sumerO= avyaye tAdRSAm	rnam par thar pa bsam gyis mi khyab pa de la gnas pa'i byang chub sems dpa' ni ri'i rgyal po ri rab de tsam du mtho ba de / / de tsam du che ba / de tsam du 'phags pa; de tsam du yangs pa'ang yungs 'bru'i nang du 'jug ste / yungs 'bru de'ang skyes pa'ang med / ri rab kyang gang pa'ang med la bya ba de'ang ston to //	82.23305741989853
krIyAm deSayati cAturmahA rAja kAyika devAH ca trayasriMSa devAH api kutra vayam prakziptAH na jAnanti	rgyal chen bzhi'i ris kyi lha rnams dang / sum cu rtsa gsum pa'i lha nams kyang bdag cag gang du bcug mi shes so //	84.81409356906073
anyEH tvRd viviDi neyika sattvEH sa parvata rAjassumeruH sarzapa aByantaram prakziptam prajQAyate ca dRSyate	rdzu 'phrul gyis 'dul ba'i sems can gzhan dag gis ni ri'i rgyal po ri rab de yungs 'bru'i nang du bcug par shes shing mthong ngo //	70.4103468402131
sa hi Badanta SAriputra	da ni btsun pa sh'a ri'i bu /	89.00067909832659
boDisattvAnAm acintya vimokza vizaya pravezaH	byang chub sems dpa' rnams kyi rnam par thar pa bsam gyis mi khyab pa'i yul la 'jug pa'o //	92.70725645460138
Badanta SAriputra	btsun pa sh'a ri'i bu / gzhan yang /	89.27766360176935
BUyas pyacintya vimokza vihAri boDisattvasya catur mahA samudrasya skanDAn ekoromakUpam pravartayaH	rnam par thar pa bsam gyis mi khyab pa la gnas pa'i byang chub sems dpa' rgya mtsho chen po bzhi'i chu'i phung @320b po rnams spu'i khung bu gcig tu blugs te /	86.9955883391416
matsya kUrma SiSumAra maNxUka ani ajala ja prANiByaH upaGAtaH na asti	nya dang / rus sbal dang / chu srin byis pa gsod dang / sbal pa dang / chu las skyes pa'i srog chags gzhan dag la'ang gnod par gyur pa med /	85.63196561811715
nAgakzaganDarva asurANAm api evam vayam kutra viveSayitA iti na Bavati tasyAm kriyAyAm dRSyamAnAyAm	klu dang / gnod sbyin dang / dri za dang / lha ma yin rnams kyang 'di snyam du bdag cag gar btsud snyam yang mi sems la /	71.80025188865474
teByaH sattveByaH upaGAtaH ca saMkzoBaH na asti ayam api acintya vimokza vihAri boDisattva s	bya ba de'ang snang zhing sems can de dag la gnod cing 'khrug par gyur pa'ang med do //	64.33899668179359
tri sAhasra mahA sAhasra lokaDAtum kumBakArasya cakram iva dakziNa hastena AdAya ca pravartayya gaFgA nadI vAlukA upama loka DAtUnAm dUram kzipati kziptaH ca sattvAH vayam kutra udDRtAH	stong gsum gyi stong chen po'i 'jig rten gyi khams 'di'ang rdza mkhan gyi 'khor lo bzhin lag pa g-yas pas blangs te bskor nas 'jig rten gyi khams gang'a'i klung gi bye ma snyed du 'phangs kyang sems can rnams bdag cag gang du phyung /	82.19214425894388
kutas AgatAH na jAnanti	gang nas 'ongs mi shes so //	88.10130657468524
punar eva gRhItAH sva sTAnam eva pratizWApitAH Agamana gamanan na jAnanti yadi api sA kriyA saMdRSayate	slar yang blangs nas gnas bzhin du bzhag kyang 'ong ba dang / 'gro bar mi shes mod kyi bya ba de'ang kun tu snang ngo //	81.84257069320941
Badanta SAriputra	btsun pa sh'a ri'i bu / gzhan yang /	89.27766360176935
BUyas pyaprameya kAla vEneyika sattvAH vidyante	'khor ba tshad med pas 'dul ba'i sems can dag kyang yod /	70.36744255836264
vidyante ca saMkzepya kAla vEneyikAH	'khor ba bstung pas 'dul ba dag kyang yod de /	70.10665802333665
tatra acintya vimokza vihAri boDisattvaH prameya kAla vEneyeka sattva vEneya arTAya sapta aham kalpa atyayena	de la rnam par thar pa bsam gyis mi khyab pa la gnas pa'i byang chub sems dpa' ni 'khor ba tshad med pas 'dul pa'i sems can rnams 'dul ba'i dbang gi phyir zhag bdun yang bskal pa 'das par ston te /	87.71780026665563
saMkzepya kAla vEneyika sattveByaH kalpam sapta aha atyayena darSayate	'khor ba bstung bas 'dul ba'i sems can rnams la ni bskal pa'ang zhag @321a *// bdun gyis 'das par ston to //	88.6645148731439
tatra aprameya kAla vEneyika sattvAH sapta ahe kalpAtyayam jAnanti	de la 'khor ba tshad med pas 'dul pa'i sems can rnams ni zhag bdun la'ang bskal pa 'das pa snyam du shes so //	89.1356348991394
ye saMkzepya kAla vEneyika sattvAH te kalpam sapta ahena atItam jAnanti	gang 'khor ba bstung bas 'dul ba'i sems can de dag ni bskal pa'ang zhag bdun gyis 'das par shes so //	87.46239277253008
taTA hi acintya vimokza vihAri boDisattvaH sarva budDa kzetra guNa vyUha aneka bidDa kzetre darSayate	de ltar rnam par thar pa bsam gyis mi khyab pa la gnas pa'i byang chub sems dpa' ni sangs rgyas kyi zhing thams cad kyi yon tan bkod pa rnams sangs rgyas kyi zhing gcig tu ston so // to //	90.26897579352226
ca api sarva sattvAn dakziNa kara tale ADAya	sems can thams cad kyang lag pa g-yas pa'i mthil du bzhag ste /	86.0512995604912
citta javana RdDi viDyA gacCanti asarva budDa kzetrANi AdarSayati ki ca api ekabudDa kzetrAt a calitaH	sems kyi mgyogs pa'i rdzu 'phrul gyis 'gro zhing sangs rgyas kyi zhing kun tu ston kyang sangs rgyas kyi zhing gcig nas kyang ma g-yos so //	85.69679794859498
daSa dikzu Bagavate budDAya yAvat pUjanAni sarvANi tAni eka romakUpe deSayati	phyogs bcu'i sangs rgyas bcom ldan 'das la mchod pa ji snyed yod pa de thams cad spu'i khung bu gcig tu ston to //	88.15482929007975
daSa dikzu yAvat candraH ca AdityaH ca tArakA rUpANi sarvANi tAni api eka romakUpe darSayate	phyogs bcu na zla ba dang / nyi ma dang / skar ma'i gzugs ji snyed yod pa de thams cad kyang spu'i khung bu gcig tu ston to //	89.79107795274767
daSa dikzu vAyu maNxalAni yAvat uttizWanti sarvANi tAni muKena pItvA tasya kAyaH vinazwaH ca tezAm budDa kzetrANAm tRNa vanaspatayaH prapatitAH	phyogs bcu na rlung gi dkyil 'khor ldang ba ji snyed pa de thams cad kha'i nang du brdubs kyang de'i lus zhig pa'ang med cing sangs rgyas kyi zhing de dag gi rtsva dang / nags tshal rnams nyal ba'ang med do //	88.22193897787601
daSa dikzu sarva tam budDa kzetra dahana kalpa uddAha agnirASi sva udaram prakzipya yat karma tena karaNIyam tat karoti	phyogs bcu'i sangs rgyas kyi zhing rnams sreg pa'i bskal @321b pas tshig pa'i me'i phung po de kun rang gi ltor bcug kyang gang des las bya ba de'ang byed do //	86.81243437771582
aDastAt gaFgA nadI vAlukA samaani budDa kzetrANi a atikramya saH ekam	'og tu sangs rgyas kyi zhing gangg'a'i klung gi bye ma snyed 'das pa nas sangs rgyas kyi zhing de steng du byung ste bteg nas /	91.62807547668045
bidDa kzetram UrDvam utkzipya ca Aruhya UrDva gaFgA nadI vAlukA samAni budDa kzetrANi a	gyen du sangs rgyas kyi zhing gangg'a'i klung gi bye ma snyed 'das par steng du 'jog ste /	83.17310621157054
atikramya uparizwAt tat yaTA api nAma mahA sTAmnA puruzeNa sUcI agreNa badara patram ucCritam evam eva utkziptam bidDa kzetran nikzipati	'di lta ste / dper na / skyes bu mthu chen po zhig gis khab kyi rtse mos rgya shug gi lo ma la btsugs te bteg pa bzhin no //	66.99500175479149
taTA hi acintya vimokza vihAri boDisattvaH sarva sattva rupam aDitizWati	de ltar rnam par thar pa bsam gyis mi khyab pa la gnas pa'i byang chub sems dpa' sems can thams cad 'khor los bsgyur ba'i gzugs su byin gyis rlob bo //	84.14185956183552
cakravarti rAjasya rUpam aDitizWati	de bzhin du 'jig rten skyong ba'i gzugs su byin gyis rlob bo // brgya byin gyi gzugs su byin gyis rlob bo // tshangs pa'i gzugs su byin gyis rlob bo // nyan thos kyi gzugs su byin gyis rlob bo //	68.81405594449113
evam eva aDitizWati lokapAla Sakra brahma SrAvaka pratyekabudDa boDisattva sarva sattva budDa rUpam	rang sangs rgyas kyi gzugs su byin gyis rlob bo //	51.81359339971906
sa boDisattvaH	byang chub sems dpa'i gzugs su byin gyis rlob bo // sems can thams cad sangs rgyas kyi gzugs su byin gyis rlob bo //	48.840405782453125
daSa dikzu sattvAnAm sarva agra maDya hIna Sabda prasidDaH yAH kAScana Sabda prajQaptayaH tAH sarvAH budDa Goza rutaMca budDa Darma saMGa Sabdam aDitizWiti	phyogs bcu na sems can rab 'bring tha ma thams cad kyi sgrar grags pa dang / sgrar btags pa gang ji snyed pa de dag thams cad sangs rgyas kyi gsung dbyangs dang / sangs rgyas kyi sgra dang / chos kyi sgra dang / dge 'dun gyi sgrar byin gyis rlob ste /	89.23885487433908
tasmAt Sabda svarAt anitya tA duHKa SUnya nErAtmya Sabda svaram niScArayati	sgra dbyangs de las @322a *// kyang mi rtag pa dang / sdug bsngal ba dang / stong pa dang / bdag med pa'i sgra dbyangs 'byung bar byed de /	78.21332415317937
daSa dikzu BagavAn buddaH yAvat AkAram upadeSena darSayati	phyogs bcu'i sangs rgyas bcom ldan 'das rnam pa ji snyed du bstan pas chos ston pa de dag thams cad sgra dang /	67.84312776344524
teByaH sarveByaH Sabda svareByaH niScArayati	dbyangs de dag las 'byung bar byed do //	83.08846473693848
Badanta SAriputra	btsun pa sh'a ri'i bu /	90.31106152741806
ayam hi acintya vimokza vihAri boDisattva vizaya praveSaH kiMcid mAtram kevalam darSitaH	'di ni rnam par thar pa bsam gyis mi khyab pa la gnas pa'i byang chub sems dpa' rnams kyi yul la 'jug pa cung zad tsam zhig bstan par zad de /	92.35754022637775
Badanta SAriputra tattvataH	btsun pa sh'a ri'i bu /	81.40886837503184
kalpa aByaDikam vA tat atikrAntam vA acintya vimokza vihAri boDisattva vizaya praveSa upadeSam daeSanIyam aBavizyat	rnam par thar pa bsam gyis mi khyab pa la gnas pa'i byang chub sems dpa' rnams kyi yul la 'jug pa bstan pa ni bskal pa las lhag pa'am / de las 'das pa'ang kho bos bshad do //	82.27124528909634
aTa mahAkASyapaH sTaviraH imam boDisattva acintya vimokza upadeSam SrutvA	de nas gnas brtan 'od srung chen pos byang chub sems dpa'i rnam bar thar pa bsam gyis mi khyab pa bstan pa 'di thos nas ngo mtshar du gyur te /	91.57496780699906
AScarya adButa prAptaH SAriputram sTaviram etat avocat AyuzmaMSAriputra	gnas brtan sh'a ri'i bu la 'di skad ces smras so // tshe dang ldan pa sh'a ri'i bu /	86.72153428860722
tat yaTA api nAma jAti anDa puruzasya aBimuKam sarva rUpa upapannAnAm kriyANAm darSitAnAm api tena jAti anDena eka rupam api tu na dRSyate	'di lta ste / dper na / mi dmus long gi mdun du la las gzugs su gyur pa thams cad bstan kyang dmus long nges gzugs gcig kyang mi mthong ba de bzhin du /	74.00145177304695
evam eva AyuzmaMSAriputra	tshe dang ldan pa sh'a ri'i bu /	64.94179344177246
asya acintya vimokza muKasya deSanA kAle sarva SrAvaka pratyekabudDeByaH jAti anDa sameByaH cakzuH na asti ca eka mAtra acintya dvAram api anaBimuKIB	rnam par thar pa bsam gyis mi khyab pa'i sgo 'di bstan pa'i tshe nyan thos dang / rang sangs rgyas @322b thams cad dmus long dang 'dra bar mig med de / bsam gyis mi khyab pa'i rgyu gcig tsam yang mngon du ma gyur na /	79.86732172278892
imam acintya vimokzam SrutvA kaH vicakzaNaH nuttara samyaksaMboDi cittat na janayet	rnam par thar pa bsam gyis mi khyab pa 'di thos nas mkhas pa su zhig bla na med pa yang dag par rdzogs pa'i byang chub tu sems mi skyed /	84.48097344481656
asmABiH praNazwa indriyEH dagDa pUtika bIja sadRSEH asmE mahAyAnAya BAjana aBUtEH idAnIm kaTam karaNIyam asmABiH imam Darma upadeSam SrutvA Arta svaram kranditvA	dbang po shin tu nyams pa / sa bon tshig pa dang / rul pa ltar theg pa chen po 'di la snod du ma gyur na da ji ltar bya /	59.79748737131907
sarva SrAvaka pratyekabudDEH tri sAhasra mahA sAhasra lokaDAtO Sabdam AdAtavyam	nyan thos dang / rang sangs rgyas thams cad kyis chos bstan pa 'di thos nas cho nges btab ste / stong gsum gyi stong chen po'i 'jig rten gyi khams su go bar byas so //	87.83346437472596
sarva boDisattvEH imam acintya vimokzam SrutvA yuvakaH rAja putraH yaTA mukuwam gRhaNIyAt ca prAmodyena mUrDni pratigrahIzyati ca asmin svADi mukti balam utpAdayitavyam	byang chub sems dpa' thams cad kyis ni rnam par thar pa bsam gyis mi khyab pa 'di thos na rgyal bu gzhon nus cod pa na blang ba bzhin du rab tu dga' bas spyi bor blang zhing 'di la mos pa'i stobs shin tu bskyed par bya'o //	84.30863234371664
yA asmin acintya vimokza DimuktiH tasyAm sarva mArAH api ki kuryuH	gang rnam par thar pa bsam gyis mi khyab pa 'di la mos pa de la bdud thams cad kyang ci zhig byed par 'gyur /	87.70562708692322
mahAkASyapena sTavirena asmanupadeSe deSite dvAtriMSat deva putra sahasrANi anuttara samyaksaMboDi cittam utpAdayanti sma	gnas brtan 'od srung chen pos bstan pa 'di bshad pa na lha'i bu sum khri nyis stong gis bla na med pa yang dag par rdzogs pa'i byang chub tu sems bskyed do //	87.24452401931171
tatas licCaviH vimala kIrtiH mahAkASyapam sTaviram etat avocat Badanta mahAkASyapa	de nas li tsa b'i dri ma med par grags pas gnas brtan 'od srung chen po la 'di skad ces smras so // btsun pa 'od srung chen po /	96.2335460072899
daSa dikzu a parimANa lokaDAtuzu ye kecid mArAH mAra kAriNaH	phyogs bcu'i 'jig rten gyi rkhams dpag tu med pa dag na bdud ji snyed @323a *//	88.51655282368785
sarve te cintya vimokza vihAri boDisattvAH ca upAya kOSalyena sattva paripAcana arTam mAra kAriNaH	bdud byed pa de dag thams cad kyang rnam par thar pa bsam gyis mi khyab pa la gnas pa'i byang chub sems dpa' rnams thabs la mkhas pas sems can yongs su smin par bya ba'i phyir bdud byed do //	88.90125062946343
Badanta mahAkASyapa	btsun pa 'od srung chen po /	91.41178737367902
daSa dikzu a parimANa lokaDAtuzu boDisattveByaH	phyogs bcu'i 'jig rten gyi khams dpag tu med pa dag na byang chub sems dpa' la slong ba gang dag gis lag pa'am / rkang pa'am / rna ba'am / sna'am / khrag gam / rgyus pa'am / rus pa'am / rkang pa'am / mig gam / ro stod dam /	49.96263021473947
ye hasta pada Srotra GrANa lohita snAyu asTi majjA cakzuH	mgo 'am; yan lag dang / nying lag gam / rgyal po'i srid dam /	55.81696286209248
pUrva kAya SIrza aFga pratyaMga rAjya rAzwra pradeSa BAryA putra duhitR dAsa dAsi aSvahasti raTa vAhana suvarNa jAtarUpa maNi muktA SaFKa sfawika SilAsaMbADam kurvanti	yul 'khor ram / ljongs sam / chung ma dang / bu pho dang / bu mo dang / bran pho dang / bran mo dang / rta dang / glang po che dang / shing rta dang / bzhon pa dang / gser dang / dngul dang / nor bu dang / mu tig dang / dung dang / man shel dang / byu ru dang / bee d'urya dang / nor bu rin po che rnams kyang rung / bza' ba dang / btung ba dang / bro ba rnams sam / gos rnams kyang rung /	69.2037985507422
sarve te pi yAcakAH yat BUyasA acintya vimokza vihAri boDisattvAH upAya kOSalyena imAm boDisattva	nyam nga bar byas te slong ba de dag thams cad kyang phal cher rnam par thar pa bsam gyis mi khyab pa la gnas pa'i byang chub sems dpa' rnams te /	86.49867127284925
