aTa te BagavataH suganDakUwasya taTAgatasya budDa kzetrasya boDisattvAH AScarya adButa prAptAH	de nas bcom ldan 'das de bzhin gshegs pa spos mchog brtsegs pa'i sangs rgyas kyi zhing gi byang chub sems dpa' de dag ngo mtshar du gyur nas bcom ldan 'das de bzhin gshegs pa spos mchog brtsegs pa de la 'di skad ces gsol to //	84.04453057604033
tam Bagavantam suganDakUwam taTAgatam etat avocan Bagavan evaMrUpaH mahAsattvaH kutas AgataH	bcom ldan 'das / sems can chen po 'di lta bu ga la mchis /	55.73165445923425
sa saha AlokaDAtuH kva asti	'jig rten gyi khams mi mjed de gang na mchis /	75.69159671534663
hIna aDimuktikAH nAma tat asti kim iti te boDisattvAH tam Bagavantam evam pRcCanti sma tatas BagavAn= tAn boDisattvAn etat avocat kula putrAH	dman pa la mos pa zhes bgyi ba de ci lags zhes bcom ldan 'das de la byang chub sems dpa' de dag gis de skad ces zhus pa dang / de nas bcom ldan 'das kyis byang chub sems dpa' de dag la 'di skad ces bka' stsal to / // rigs kyi bu /	89.73979583560676
itas DodiSi dvi vacatva ari Sat gaFgA nadI vAlukA samAni budDa kzetrANi atikramya asti sahA nAma lokaDAtuH	'og gi phyogs na sangs rgyas kyi zhing 'di nas sangs rgyas kyi zhing gangg'a'i klung bzhi bcu rtsa gnyis kyi bye ma snyed 'das pa na 'jig rten gyi khams mi med ces bya ba yod de /	91.41097399549867
tatra SAkyamuniH nAma taTAgataH paQca kazAya budDa kzetre hIna aDimuktikeByaH sattveByaH Darma deSayati	de na de bzhin gshegs pa @347b sh'akya thub pa zhes bya ba snyigs ma lnga'i sangs rgyas kyi zhing na dman pa la mos pa'i sems can rnams la chos ston to //	91.27251585338534
tatra saH cintya vimokza vihArI vimala kIrtiH nAma boDisattvaH boDisattveByaH Darma deSayati	de nas byang chub sems dpa' dri ma med par grags pa zhes bya ba rnam par thar pa bsam gyis mi khyab pa la gnas pa de byang chub sems dpa' rnams la chos ston chos ston to // te /	90.30842874321823
sa mad nAma parikIrtan ArTAya ca asya lokaDAtoH praSaMsA samprakASanA rTAya ca tezAm boDisattvAnAm kuSala mUla su tapta karaNa arTAya nirmita boDisattvam prezayati	des nga'i ming yongs su bsgrags pa dang / 'jig rten gyi khams 'di'i bsngags pa rab tu bstan pa dang / byang chub sems dpa' de dag gi dge ba'i rtsa ba shin tu 'bar bar bya ba'i phyir sprul pa'i byang chub sems dpa' btang ngo //	81.3466307692198
tatas te boDisattvAH etat avocan Bagavan	de nas byang chub sems dpa' de dag gis 'di skad ces gsol to // bcom ldan 'das /	84.69616967123011
tasya boDisattvasya mAhAtmyam yAvat idam nirmANaQca tasya evaMrUparDi bala vESAradyAni BUtAni	byang chub sems dpa' de'i che ba ji tsam na de'i sprul pa 'di'ang rdzu 'phrul dang / stobs dang / mi 'jigs pa 'di lta bur gyur /	82.36784261075648
sa BavAn avocat tasya boDisattvasya IdRSAm mAhAtmyam yaTA	bcom ldan 'das des bka' stsal pa / byang chub sems dpa' de'i che ba ni 'di 'dra ste /	84.38409512235032
daSa dikzu sarva budDa kzetrezu nirmANAH ni prezayati tAni nirmANAni ca tezAm budDa kzetrANAm sarva sattva kAryaa arTa budDa kAryeNa pratyupasTitAni Bavanti	des phyogs bcu'i sangs rgyas kyi zhing thams cad du sprul pa 'gyed de sprul ba de dag sangs rgyas kyi zhing de dag gi sems can thams cad las sangs rgyas kyi bya bas nye bar gnas par 'gyur ro //	84.59036023825955
aTa BagavAn suganDakUwaH taTAgataH sarva ganDa samanvAgate BAjane sarva ganDa vAsitam Bojanam Corayati sma	de nas bcom ldan 'das de bzhin gshegs pa spos mchog brtsegs pas dri thams cad dang ldan pa'i snod du dri thams cad bsgos pa'i zas blugs ro // te /	89.56778619252839
tat tasmE nirmita boDisattva Aya adAt	de sprul pa'i byang chub sems dpa' de la byin no //	80.9160374847113
tatas tadA boDisattvAnAm navati Sata sahasrANi tena gamikAni Bagavan	@348a *// de nas de'i tshe byang chub sems dpa' brgya stong phrag dgu bcu'ang der 'gro bar chas te / bcom ldan 'das /	86.77045783252531
vayam api tAm sahAm lokaDAtum tam Bagavantam SAkI amuni darSanAya vandanAya	bdag cag kyang 'jig rten gyi khams mi mjed der bcom ldan 'das sh'akya thub pa de la blta ba dang /	84.24188802109089
paryupAsanAya tam ca vimala kIrti ca tAn boDisattvAn darSanAya gacCAmaH	phyag 'tshal ba dang / bsnyen bkur bgyi ba dang / dri ma med par grags pa de dang / byang chub sems dpa' de dag kyang / blta ba'i slad du mchi'o //	87.60050969236197
sa BagavAn avocat kula putrAH	bcom ldan 'das des bka' stsal pa / rigs kyi bu dag /	88.18684500914354
gacCata yasya idAnIm kAlam manyaDve	da de'i dus la bab par shes na de ngas shig /	82.75453080071344
kula putrAH	rigs kyi bu dag /	70.87069985445808
te sattvAH unmAdAH ca pramattAH Kalu aBavizyan	sems can de dag myos shing bag med par gyur ta te /	82.21707266452266
tena gacCata ganDa apagata BUtAH	dri rnams med par gyis la dengs shig /	69.67528325632999
tasya saha AlokaDAtoH te sattvAH avasAdam AsAdayanti tasma Ahu svarUpAt nivartaDvam	'jig rten gyi khams mi mjed de'i sems can de dag spa gong bar 'gyur du 'ong gi rang gi gzugs kyang sgyur cig /	79.05714116573117
tasmin lokaDAtO hIna saMjQAm utpAdya pratiGa saMjQAm mA utpAdayata	'jig rten gyi khams de la'ang ngan par 'du shes bskyed nas khong khro ba'i 'du shes ma skyed cig / de ci'i phyir zhe na /	89.5930923399706
tat kasya hetoH kula putrAH	rigs kyi bu /	58.444251133845405
budDa kzetrem hi AkASa kzetram	sangs rgyas kyi zhing ni nam mkha'i zhing ste /	91.26146335804715
sattva paripAcana arTAya BagavantaH budDAH sarvAn budDa gocarAn na darSanti	sems can rnams yongs su smin par bya ba'i phyir sangs rgyas bcom ldan 'das rnams ni sangs rgyas kyi yul thams cad mi ston to //	93.40776847559343
aTa sa nirmita boDisattvaH tat sarva ganDa vAsitam Bojyam samAdAya boDisattvAnAm navati Sata sahasrEH sa arDa budDa anuBAvena ca vimala kIrteH aDizWAnena	de nas sprul pa'i byang chub sems dpa' des zhal zas de thogs nas byang chub sems dpa' brgya stong phrag dgu bcu dang lhan cig tu sangs rgyas kyi mthu dang /	72.57683915154011
eeka kzaNa lava muhUrtena tatraIva tasyAH sarva ganDa suganDa AlokaDAtvAH antarhitaH ca licCa vivimala kIrteH gRhe nizIdati sma	dri ma med par grags pa'i byin gyi @348b rlabs kyis skad cig yud tsam thang cig de nyid la 'jig rten gyi khams spos thams cad kyi dri mchog de nas mi snang bar gyur te mthu dang /	84.4720724660136
aTa licCaviH vimala kIrtiH yAdRSAni pUrva siMhAsanAni	/ li tsa b'i dri ma med par grags pa'i khyim na 'dug go / de nas li tsa b'i dri ma med par grags pas seng ge'i khri snga ma ci 'dra ba de lta bu'i seng ge'i khri brgya stong phrag dgu bcu byin gyis brlabs te /	79.2949100996305
tAdRSAnAm navati Sata sahasrANi aDitizWati sma tezu te boDisattvAH nyazIdan tatassa nirmita boDisattvaH tad Bojya pUrNa BAjanam vimala kIrtaye dAt	de la byang chub sems dpa' de dag 'khod do; ;de nas sprul pa'i byang chub sems dpa' des zhal zas kyis bkang ba'i snod de dri ma med par grags pa la byin no //	77.61487215046515
tatas tasya Bojyasya ganDaH vESAlIm mahA nagarIm saMnyavikzat	de nas zhal zas de'i dris yangs pa'i grong khyer chen por 'dug par gyur te /	80.70256439682865
sAhasra lokaDAtum yAvat ca GrAyate sma Asu Adya ganDaH	'jig rten gyi khams stong gi bar du dri zhim po mnam par gyur to //	80.27075050819305
ye vESAlyAH brAhmANa gRhapatayaH ca licCavi aDipaH licCavicandra= CattraH ca tam ganDam AGrAya	gang yangs pa'i grong khyer gyi bram ze dang / khyim bdag rnams dang / li tsa b'i rnams kyi dbang po li tsa b'i zla gdugs kyis dri de mnams nas ngo mtshar du gyur rmad du gyur te /	86.76771340334093
AScarya prAptAH adButa prAptAH prasanna kAya cittAH licCavInAm caturaSIti sahasrEH paripUrNEH saha vimala kIrteH gRham praviSanti sma	lus dang / sems dang bar gyur nas li tsa b'i brgyad khri bzhi stong tshang ba dang lhan cig tu dri ma med par grags pa'i khyim du zhugs so //	78.56134278622248
te tasmin gRhe boDisattvAn sampUrNa sihA Asanezu tanmAtra unnata atimAtra viSAlezu nizaNNAn paSyanti sma	de dag gi khyim de na byang chub sems dpas gang pa'i seng ge'i khri de tsam du mtho ba de tsam du che zhing yangs pa la 'khod pa mthong ste /	83.86395582624912
dRzwvA tEH aDimuktiH ca pramudita utpAditAH	mthong nas de dag shin tu mos shing rab tu dga' ba chen po skyes te /	84.57461593272988
sarve te tAn mahA SrAvakAm ca tAn mahA boDisattvAn aBivandya ekAnte sTuH	de dag thams cad kyis nyan thos chen po de dag dang / byang chub sems dpa' chen po de dag la phyag btsal @349a *//	88.76406364226638
BUmi avacara deva putrAH ca kAma avacara rUpa avacara deva putrAH ca tena ganDena coditAH vimala kIrteH gRham samAgacCanti sma	nas phyogs gcig tu 'khod do // sa la spyod pa'i lha'i bu rnams dang / 'dod pa na spyod pa dang / gzugs yod pa na spyod pa'i lha'i bu rnams kyang dri des bskul nas li tsa b'i dri ma med par grags pa'i khyim du lhags so //	86.96404113644446
aTa licCaviH vimala kIrtiH SAriputram sTaviram ca tAn mahA SrAvakAn etat avocat BadantAH	de nas li tsa b'i dri ma med par grags pas gnas brtan sh'a ri'i bu dang / nyan thos chen po de dag la 'di skad ces smras so // btsun pa rnams /	95.59814825223063
taTAgata Bojyam mahA karuNA parivAsita amRtam Bakzayata prAdeSika citta tAm tu mA upaprajQApayata dAna Boge samarTAH aBavizyata	de bzhin gshegs pa'i zhal zas bdud rtsi thugs rje chen pos yongs su bsgos pa zo la nyi tshe ba'i spyod pa la sems nye bar ma 'dogs shig / sbyin pa spyod ma nus sa re / de na nyan thos kha cig 'di snyam du sems so //	87.4595922078349
tatas kecid SrAvakAH etat manyante sma su alpa Bojanam iha AnayA etAdRSa parizadA kaTam BojanIyam iti	zhal zas nyung du 'di la 'di lta bu'i 'khor 'dis ji ltar bza'o snyam mo //	71.87469724533288
tatas sa nirmita boDisattvaH tAm SrAvakAn etat avocat AyuzmantaH	de nas sprul pa'i byang chub sems dpa' des nyan thos de dag la 'di skad ces smras so // tshe dang ldan pa dag /	90.72929105686414
yuzmad prajQA puNye taTAgatasya prajQA puNyAByAm mA tolayata	khyed rang gi shes rab dang / bsod nams dang / de bzhin gshegs pa'i shes rab dang / bsod nams su ma snyoms shig /	74.41122174985703
tat kasya hetoH	de ci'i phyir zhe na / 'di lta ste /	96.8504232565562
tat yaTA api nAma catur mahA samudrAH kzINAH samBaveyuH	dper na / rgya mtsho chen po bzhi ni zad kyang srid kyi /	75.31858772514627
ki tu asmin Bojane na kiQcid kzayaH Bavizyat	zhal zas 'di la zad pa cung zad kyang med do //	75.71703179339146
evam eva sarve sattvA tasya Bojanasya kalpam sumeru mAtrA lopAn BakzayeyuH ki tu idam kzayan= AyAsyat	sems can thams cad kyis zhal zas 'di kham ri rab tsam du bskal bar zos kyang 'di zad par mi 'gyur ro //	81.6298231419255
tat kasya hetoH	de ci'i phyir zhe na /	88.51330798322505
saH kzaya SIla prajQA samADi mayasya taTAgata Bojanasya BAjana avaSezaH kzayam yAtun na Saknoti	tshul khrims dang / shes @349b rab dang / ting nge 'dzin mi zad pa las byung ba de bzhin gshegs pa'i zhal zas kyi snod du lus pa 'di zad par mi nus so //	89.90146082878871
aTa tatas BojanAt sarvAvatI sA parzad tRptA BUtA na ca tad Bojanam kzIyate	de nas zhal zas des 'khor thams cad la tshim par byas kyang zhal zas de zad par ma gyur to //	90.52826451722763
yEH ca boDisattvEH SrAvakEH ca Sakra brahma lokapAlEH tad anyEH ca sattvEH tad Bojanam Buktam tezAm tAdRSam suKam kAye vakra antam yAdRSam sarva suKa maNxitAyAm lokaDAtO boDisattvAnAm suKam	byang chub sems dpa' dang / nyan thos dang / brgya byin dang / tshangs pa dang / 'jig rten skyong ba rnams dang / sems can gzhan dag gis zhal zas zos pa de dag kyang ji ltar 'jig rten gyi khams bde ba thams cad kyis rab tu brgyan pa na byang chub sems dpa' rnams kyi bde ba ci 'dra ba de lta bu'i bde pa lus las skyes so //	91.70561410493795
sarva romakUpeByaH ca tezAm tAdRSaH ganDaH pravAti	de dag gi spu'i khung bu nas kyang 'di lta bu'i dri 'byung ba ni / 'di lta ste / dper na /	91.97847662943911
tat yaTA api nAma tasyAm eva sarva ganDa suganDAyAm lokaDAtO vRkzANAm ganDaH tatassaMprajA nalliM= CaviH vimala kIrtiH BagavataH suganDakUwasya taTAgatasya budDa kzetrAt AgatAn boDisattvAn etat avocat kula putrAH	'jig rten gyi khams spos thams cad kyi dri mchog de na shing rnams las dri 'byung ba bzhin no // de nas li tsa b'i dri ma med par grags pa shes bzhin du bcom ldan 'das de bzhin gshegs pa spos mchog brtsegs pa'i sangs rgyas kyi zhing nas lhags pa'i byang chub sems dpa' rnams la 'di skad ces smras so // rigs kyi bu dag /	90.43655030056537
tasya taTAgatasya suganDakUwasya Darma deSanA kIdRSA	de bzhin gshegs pa spos mchog brtsegs pa de'i chos ston ba ci 'dra /	86.11710462670065
te vadan sa taTAgataH kzara niruktiByAm Darman na darSayati	de dag gis smras pa de bzhin gshegs pa de ni yi ge dang / nges pa'i tshig gis chos mi ston te /	76.3660519340109
tena ganDena eva boDisattvAH vinitAH Bavanti	dri de nyid kyis byang chub sems dpa' rnams 'dul bar gyur te /	89.3098710953317
ye ganDa vRkzAH	spos kyi shing gang dang / gang gi drung du @350a *//	73.1286401028903
yezAm mUlezu te boDisattvAH nizaNNAH teByaH yAdRSaH ganDaH teByaH boDisattveByaH	byang chub sems dpa' de dag 'dug pa de dang / de dag las 'di 'dra ba'i dri byung ste /	72.93925578655738
tAdRSaH niScarati GrAta mAtraH eva tasmin ganDe sarva boDisattva guNa AkaraH nAma samADi stEH pratilaByate prApta mAtre eva tasmin samADO sarvezu tezu boDisattva guNAH utpadyante	gang dri de mnams ma thag tu byang chub sems dpa'i yon tan thams cad kyi 'byung gnas zhes bya ba'i ting nge 'dzin rab tu thob par 'gyur ro // ting nge 'dzin de thob ma thag tu de dag thams cad la byang chub sems dpa'i yon tan rnams skye'o; ;de nas byang chub sems dpa' de dag gis li tsa b'i dri ma med par grags pa la 'di skad ces smras so //	81.62986433019273
aTa te boDisattvAH licCavi vimala kIrtim etat avadan iha BagavAm SAkya muniH kIdRSAm Darma deSanAm prakASayati	'di na bcom ldan 'das sh'akya thub pa chos bstan pa ji lta bu rab tu ston par mdzad /	68.1757359181122
Aha sat puruzAH	smras pa / skyes bu dam pa rnams /	93.13814839194802
ime sattvAH hi durvineyAH	sems can 'di dag ni gdul dka' ste /	80.66270583016532
eByaH KawuMka durvineya sattveByaH KawuMka durvineya vineya kaTAH prakASayati	sems can dmu rgod gdul dka' ba 'di rnams la dmu rgod dang / gdul dka' ba gdul ba'i gtam rnams rab tu ston to //	76.69423648314711
ke KawuMka durvineyAH vineyAH	dmu rgod gdul dka' ba rnams gdul ba gang /	75.93399370284307
KawuMka durvineya kaTA katamA tat yaTA	dmu rgod gdul dka' ba'i gtam de gang zhe na / 'di lta ste /	79.00694910146422
ime hi nErayikAH	'di ni sems can dmyal ba'o //	76.92523326544926
iyam hi tiryagyoniH	'di ni dud 'gro'i skye gnas so //	93.20043302304816
ayam yama lokaH	'di ni gshin rje'i 'jig rten no //	86.39054497550515
imAni hi akzaNAni	'di ni mi khom pa'o //	60.082088253714815
ime vihIna indriyAH	'di ni dbang po nyams par skye ba'o //	65.56787395477295
idam hi kAya duScaritam	'di ni lus kyi nyes par spod pa'o //	76.13727611965604
ayam hi kAya duScaritasya vipAkaH	'di ni lus kyis nyes par spyad pa'i rnam par smin pa'o //	92.36039248265719
idam vAc duScaritam	'di ni ngag gi nyes par spyod pa'o //	90.05817624040552
ayam vAc duScaritasya vipAkaH	'di ni ngag gis nyes par spyad pa'i rnam par @350b smin pa'o // 'di ni yid kyi nyes par spyod pa'o //	87.55221411836311
idam manaH duScaritam ayam manaH duSciritasya vipAkaH	'di ni yid kyis nyes par spyad pa'i rnam par smin pa'o //	92.04403568588152
ayam hi prANa atipAtaH	'di ni srog gcod pa'o //	92.0647471745809
iyam adatta AdAnam	'di ni ma byin par len pa'o //	94.0717101097107
ayam kAma miTyA AcAraH	'di ni 'dod pas log par g-yem pa'o //	95.3530921613848
ayam mRzAvAdaH	'di ni brdzun du smra ba'o //	95.08912328193928
ayam pESunya vAdaH	'di ni phra ma'o //	51.39962730909649
ayam pAruzya vAdaH	'di ni ngag rtsub pa'o //	54.530772018432614
ayam saMBinna pralApaH	'di ni tshig kyal pa'o //	91.91309185028076
iyam hi aBiDyA	'di ni brnab sems so //	91.58070752931677
ayam vyApAdaH	'di ni gnod sems so //	95.90642443570225
iyam miTyAdRzwiH	'di ni log par lta ba'o //	93.57766448534453
ayam hi tezAm vipAkaH	'di ni de dag gi rnam par smin pa'o //	93.90399442220989
idam mAtsarya	'di ni ser sna'o //	89.9255286517896
idam mAtsaryasya falam	'di ni ser sna'i 'bras bu'o //	86.46850458780925
idam dOHSIlyam idam dOHSIlyasya falam	'di ni 'chal pa'i tshul khrims so //	92.27625717057121
ayam kroDaH	'di ni khro ba'o //	94.09485784329867
idam kroDasya falam idam kOsIdyam	'di ni le lo'o //	76.26241007973165
idam kOsIdyasya falam	'di ni le lo'i 'bras bu'o //	90.21737432479858
iyam hi dOzprajQA	'di ni 'chal pa'i shes rab bo //	84.65565824508667
idam dOzprajQAfalam	'di ni 'chal pa'i shes rab kyi 'bras bu'o //	82.58508283441716
ayam SikzA pada samatikramaH	'di ni bslab pa'i gzhi las 'das pa'o //	86.160975028307
ayam hi prAtimokzaH	'di ni so sor thar pa'o //	91.17978594853328
idam kAryam	'di ni bya pa'o //	70.802692466312
idam akAryam	'di ni mi bya ba'o //	87.45976148332868
ayam yoga AcAraH	'di ni rnam par 'byor pa'o //	89.85036935477422
idam prahANam	'di ni spong ba'o //	95.78654718399048
idam AvaraNam	'di ni sgrib pa'o //	96.03894305229187
idam anAvaraNam	'di ni sgrib pa med pa'o //	92.70444271299574
iyam ApattiH	'di ni ltung ba'o //	94.65942978858948
idam Apatti vyutTAnam	'di ni ltung ba las byung ba'o //	88.83109058033337
ayam mArgaH	'di ni lam mo //	96.27536749839783
ayam ku mArgaH	'di ni lam ngan pa'o //	94.00478670908056
idam kuSalam	'di ni dge ba'o //	92.17733081181844
idam akuSalam	'di ni mi dge ba'o //	95.90705274400257
idam sAvadyam	'di ni kha na ma tho ba dang bcas pa'o //	89.63938085625811
idam anavadyam idam sa Asravam idam anAsravam	'di ni kha na ma tho ba med pa'o; ;'di ni zag pa dang bcas pa'o // 'di ni zag pa med pa'o //	94.5123021325871
idam lOkikam  idam lokottaram	'di ni 'jig rten pa'o // 'di ni 'jig rten las 'das pa'o //	94.0360894203186
idam saMskRtam	'di ni 'dus byas so //	95.91644371639599
idam asaMskRtam ayam hi saMkleSaH	'di ni 'dus ma @351a *// byas so // 'di ni kun nas nyon mongs pa'o //	94.80264195529901
idam vyavadAnam	'di ni rnam par byang ba'o //	95.31765028526044
ayam saMsAraH idam nirvANam iti	'di ni 'khor ba'o //	77.14694428443909
evam aneka vidyam Darma deSayan SAkya muniH taTAgataH sattvAnAm aSva KawuMka cittam pratizWApayati	'di ni mya ngan las 'das pa'o zhes de lta bur chos rnam pa du mar bshad nas rta dmu rgod lta bu'i sems rab tu gnas par byed do // 'di lta ste /	82.52212319839737
tat yaTA api nAma KawuMkASvaH vA hastI vA rvAk marma hatAH vinItAH Bavanti	dper na / rta'am / bal glang dmu rgod gnad du brdab pa tshun chad kyis dul bar 'gyur ro //	83.39022862206295
evam eva KawuMka durvineyAH sattvAH api sarva duHKa prakASana kaTAyAH vinItAH Bavanti	de bzhin du sems can dmu rgod gdul dka' ba rnams kyang sdug bsngal thams cad smos pa'i gtam gyis dul bar 'gyur ro // byang chub sems dpa' de dag gis smras pa /	90.83974078893728
te boDisattvAH avadan taTA BagavataH budDasya SAkyamuneH mAhAtmyam pratizWApitam	'di ltar bcom ldan 'das sh'akya thub pa sangs rgyas kyi che ba bzhag ste /	77.10183809232427
AScarya hi hIna daridra KawuMka sattva damanam ye ca boDisattvAH evaMviDaH OdArike budDa kzetre vasTitAH tezAm acintya mahA karuNA	ngan cing dbul ba sems can dmu rgod rnams 'dul ba ni ngo mtshar to; ;byang chub sems dpa' gang 'di lta bur sangs rgyas kyi zhing yang pa na 'khod pa de dag gi snying rje chen po'ang bsam gyis mi khyab bo //	89.11662078174375
tatas licCaviH vimala kIrtiH abravIt tat taTA iti sat puruzAH	de nas li tsa b'i dri ma med par grags pas smras pa / skyes bu dam pa dag /	84.40701369956864
yaTA vat aTa tat taTA	de de bzhin te ji skad smras pa de bzhin no //	57.63795627718387
ye boDisattvAH iha utpannAH ezAm mahAkaruNA su dRXA	gang 'dir skyes pa'i byang chub sems dpa' 'di dag gis snying rje chen po shin tu brtan no //	87.89027920374019
te tasmin loka DAtO= ekasyAm jAtyAm sattveByaH bahu arTa kurvanti tasyAm sarva ganDa suganDAyAm likaDAtO kalpAnAm api sata sahasrANi sattveByaH IdRSam arTa kartun na Saknuvanti	de dag 'jig rten gyi khams 'dir tshe gcig la sems can gyi don shin tu mang du byed de / 'jig rten gyi khams spos thams cad kyi dri mchog der bskal pa brgya @351b stong gis kyang sems can gyi don de ltar byed mi nus so //	79.8723537609126
tat kasya hetoH	de ci'i phyir zhe na / skyes bu dam pa dag /	94.66194859418002
sat puruzAH asyAm sahAyAm lokaDAtO daSa parigraha AvahAH kuSala saMnicaya DarmAH saMvidyante	'jig rten gyi khams mi mjed 'dir gang de dag yongs su 'dzin par 'gyur ba'i dge ba bsags pa chos bcu yod de /	84.79908833414169
te nyasmin budDa kzetre na Bavanti	de dag ni sangs rgyas kyi zhing gzhan na med do //	87.73594064712525
katame daSa tat yaTA	bcu gang zhe na / 'di lta ste /	92.55807356680593
dAnena daridra saMgrahaH	dbul po rnams la ni sbyin pas sdud do //	91.4808988571167
SIlena duHSIla saMgrahaH	tshul khrims 'chal pa rnams la ni tshul khrims kyis sdud do //	93.48929917427802
kzAntyA kawuka saMgrahaH	khong khro ba rnams la ni bzod pas sdud do //	78.02383240063985
vIryeNa kusIda saMhgrahaH	le lo can rnams la ni brtson 'grus kyis sdud do //	81.39736557006836
DyAnena vikzipta citta saMgrahaH	sems g-yeng ba rnams la ni bsam gtan gyis sdud do //	89.40614997423613
prajQayA duzprajQa saMgrahaH	shes rab 'chal ba rnams la ni shes rab kyis sdud do //	91.97437619279933
akzaNa prApteByaH zwAByaH kzaNeByaH tikramaNa deSanA	mi khom par gyur pa rnams la ni mi khom pa brgyad las 'da' ba ston to //	69.60704359965253
pradeSa kAriByaH mahAyAna deSanA kuSala mUlena anavaropita kuSala mUla saMgrahaH	nyi tshe bar spyod pa rnams la ni theg pa chen po ston to // dge ba'i rtsa ba ma bskyed pa rnams la ni dge ba'i rtsa bas sdud do //	92.24456914921798
caturBiH saMgraha vastuBiH satata samitam sattva paripAcanam te daSa pragraha AvahAH kuSala saMnicaya DarmAH anyasmin budDa kzetre na saMvidyante	bsdu ba'i dngos po bzhis rtag tu rgyun mi 'chad par sems can yongs su smin par byed pa ste / dge ba bsags pa'i chos bcu po 'di dag rab tu 'dzin par 'gyur ba de dag ni sangs rgyas kyi zhing gzhan na med do //	88.5392355930832
boDisattvAH avadan anvitAH katiBiH DarmEH boDisattvAH	byang chub sems dpa' de dag gis smras pa /	61.495316528138666
asyAH sahAyAH lokaDAtvAH cyutvA akzata anupadrutAH pariSudDa budDa kzetram gamizyanti	chos du dang ldan na byang chub sems dpa' 'jig rten gyi khams mi mjed 'di nas shi 'phos nas ma rmas ma snang par sangs rgyas kyi zhing yongs su dag @352a *// par 'gro bar 'gyur / smras pa /	77.75298542095715
Aha anvitAH azwABiH DarmEH boDisattvAH asyAH sahAyAH lokaDAtvAH cyutvA akzata anupadrutAH pariSudDa budDa kzetram gamizyanti	chos brgyad dang ldan na byang chub sems dpa' 'jig rten gyi khams mi mjed 'di nas shi 'phos nas ma rmas ma snad par sangs rgyas kyi zhing yongs su dag par 'gro bar 'gyur ro //	84.9685403441303
katame zwO boDisattvEH pratyavekzitavyam	brgyad gang zhe na /	64.81780862808228
sarva sattvAH mayA anugrahyAH	sems can thams cad la bdag gis phan par bya ste /	88.27029653471344
icCan= tveByaH na kicid hitam	'di dag las ni phan pa chung zad kyang mi 'chol la /	77.05209535818834
sarva sattvAnAm sarva duHKam kzAmyam tad prAptAni	sems can thams cad kyi sdug bsngal thams cad bzod par bya ste /	82.85732251942895
sarva kuSala mUlAni sarva sattveByaH utsrazwavyAni iti sarva sattvezu apratihataH BavAni SAstarI iva sarva boDisattva nandI BavAni Sruta aSruta DarmA SrutvA BavAni	des dge ba'i rtsa ba thams cad sems can thams cad la gtang bar bya'o snyam pa dang / sems can thams cad la khong khro ba med pa dang / byang chub sems dpa' thams cad la ston pa lta bur dga' ba dang / thos pa dang / mthos pa'i chos rnams thos na mi spong ba dang / gzhan gyi rnyed pa la phrag dog med cing bdag gi rnyed pas mi snyems shing sems nges par sems pa dang /	68.19910877977003
apratikzepaH para lABaH IrzyA apagataH sva lABena agarvaH ca citta niDyaptaH BavAni Atma sKalitAni pratyavekzamANaH para dizAn na codayAmi	bdag gi 'khrul pa la so sor rtog cing gzhan gyi nyes pa mi gleng ba dang pa dang /	51.50683817316849
apramAda rataH ca sarva guNAn saMpratIcCami iti	/ bag yod pa la dga' zhing yon tan thams cad yang dag par len pa ste pa dang /	72.46357958929667
tEH azwABiH DarmEH anvitAH boDisattvAH sahAyAH lokaDAtvAH cyutvA akzata anupadrutAH parisudDa budDa kzetram gamizyanti	/ / chos brgyad po de dag dang ldan na byang chub sems dpa' 'jig rten gyi khams mi mjed nas shi 'phos nas ma rmas ma snad par sangs rgyas kyi zhing yongs su dag par 'gro bar 'gyur ro //	85.86436618038998
aTa licCa vivimala kIrtinA ca maMju SrI kumAra BUtena ca evam tasyAm parzadi saMnipatiteByaH taTA hi Darme deSite Sata mAtrANAm praNisahasrANAm anuttara samyaksaMboDi cittAni utpAditAni boDisattvAnAm daSaBiH sahasrEH anutpattika Darma kzAntiH pratilabDA	@352b de nas li tsa b'i dri ma med par grags pa dang / 'jam dpal gzhon nur gyur pas de ltar 'khor der 'dus pa la de ltar chos bstan pas 'di ltar srog chags 'bum tshang ba bla na med pa yang dag par rdzogs pa'i byang chub tu sems skyes so // byang chub sems dpa' khri ni mi skye ba'i chos la bzod pa thob par gyur to //	76.46377832585436
nirmANa Bojya AdAnasya parivartaH navamaH kzaya akzayat nAma DarmayOtakam	sprul pas zhal zas blangs pa'i le'u ste dgu pa'o ////	70.33078719609777
tena Kalu punar samayaH Amra pAlI vane BagavatA Darme nirdiSyamAne sa maNxalamAxaH vistIrNaH viSAlaH BUt	yang de'i tshe bcom ldan 'das aa mra srung ba'i tshal na chos ston pa'i 'khor gyi khyams de'ang rgya che zhing yangs par gyur to //	83.90480826371369
sA parzad ca suvarNa varNaH iva saMnivizwA aBUt	'khor de'ang gser gyi kha dog lta bur 'dug go /	86.71917533874512
tatas AyuzmAn AnandaH Bagavantam etat avocat Bagavan	de nas bcom ldan 'das la tshe dang ldan pa kun dga' bos 'di skad ces gsol to // bcom ldan 'das /	95.22065317563725
atra idam Amra pAlI vanam vistIrNaMca viSAla BUtam sarvAvatI parzad api suvarNa varNe dRSyate kasya Kalu idam pUrva nimittam	'di ltar aa rma srung ba'i tshal 'di rgya che zhing yangs par gyur pa dang / 'khor thams cad kyang gser gyi kha dog du gda' ba 'di su'i snga ltas lags /	84.79063464834518
BagavAn avocat Ananda	bcom ldan 'das kyis bka' stsal pa /	93.62200498580933
idam licCa vi vimala kIrtimaMju SrI kumAra BUtayoH praBUta parivAreNa parivRtayoH puraskRtayoH taTAgata samIpa Agamana pUrva nimittam	kun dga' po; 'di ni li tsa b'i dri ma med par grags pa dang / 'jam dpal gzhon nur gyur pa gnyis 'khor mang pos yongs su bskor cing mdun du bdar te / de bzhin gshegs pa'i drung du 'ong ba'i snga ltas so //	86.26953397833533
