ekasmin samaye dvO BikzU Apattim ApannO Bagavati lajjamAnO Bagavat samIpam anupasaMkramya	bcom ldan 'das / bdag gis mngon par 'tshal ba dus gcig na / dge slong gnyis shig ltung ba byung nas bcom ldan 'das la ngo tsha ste bcom ldan 'das kyi drung du ma mchis kyi /	90.1647994943384
tO= uBO yena aham tena upasaMkramya	de gnyis bdag ga la ba der mchis te bdag la 'di skad ces mchi'o // btsun pa nye bar 'khor /	87.91776185327082
mO= evam vadataH Badanta upAle Avam Apattim Apannou ca lajjamAnO Bagavat samIpam tu anupasaMkramya	bdag cag gnyis la ltung ba byung ste ngo tsha nas bcom ldan 'das kyi drung du'ang ma mchis na / tshe dang ldan pa nye bar 'khor /	88.16653374609307
Ayuzma anupAliH AvayoaH saMSayam prativinodayatu AvAmApattyAH praNayatu	khyod kyis bdag cag gnyis kyi the tshom sol te bdag cag gnyis ltung ba las phyungs shig ces mchi nas /	83.84777045974181
iti ukte Bagavan	bcom ldan 'das /	57.085307598114014
yena tAByAm BikzuByAm Darma kaTAm adeSayam tena sa licCaviH vimala kIrtiH api upasaMkramya mAm etat vadati sma	bdag dge slong de gnyis la chos kyi gtam ston pa'i phyogs der li tsa b'i dri ma med par grags pa'ang mchis nas de bdag la 'di skad ces mchi'o //	87.47917108977225
Badanta upAle	btsun pa nye bar 'khor /	88.39490358034769
tvayA anayoH BikzvoH ApattiH BUyas dRXA na kartavyA	khyod kyis dge slong 'di gnyis kyi ltung ba de phyir dam du mi bya /	87.59885108487417
na AvilatarA kartavyAH anayoH Apatti vipratisAram prativinodaya	rnyog pa can du mi bya bar 'di gnyis kyi ltung ba'i 'gyod pa sol cig /	81.38059901496875
Badanta upAle	btsun pa nye bar 'khor /	88.39490954081217
ApattiH hi aDyAtmam apratizWitA	ltung ba ni nang na'ang mi gnas /	77.29642663579999
bahirDAvyati vRttA uBayezu asatsu ca sA	phyi rol du'ang mi 'phos /	53.30819225311279
na upalaByate	gnyis ka med par yang mi dmigs so //	85.71346969074673
tat kasya hetoaH	de ci'i phyir zhe na /	75.93542216040872
BagavAn avocat citta saMkleSena sattva saMkleSaH	bcom ldan 'das kyis bka' stsal pa / sems kun nas nyon mongs pas sems can kun nas nyon mongs so //	82.76379495123139
citta vyavadAnena viSudDiH iti su BAzita arTe	sems rnam par byang bas rnam par dag par 'gyur ro zhes gsungs pa'i phyir te /	85.43296651875248
Badanta upAle	btsun pa nye bar 'khor @294a *//	87.17732691764832
cittam aDyAtmam vA bahirDA vA na asti	sems ni nang na'ang ma yin /	75.04027904782976
uBayezu asatsu api tat	phyi rol na'ang ma yin /	72.41626079877219
na upalaByate	gnyis ka med par yang mi dmigs so //	85.71346969074673
cittam yaTA taTA api ApattiaH	sems ji lta bar ltung ba'ang de bzhin no //	88.8991492958956
yaTApattiH taTA api sarva DarmAHtaTatAyAH na atikrAmaNti	ltung ba ji lta bar chos thams cad kyang de bzhin te / de bzhin nyid las mi 'da'o //	79.7255787041532
Badanta upAle	btsun pa nye bar 'khor /	88.39490954081217
yaH citta svaBAvaH sa Badantasya vimukta cittasya citta svaBAvaH yena kena citta svaBAvena ki kadAcana saMklizwaH BUt	sems kyi rang bzhin gang yin pa dang / sems kyi rang bzhin gang gis btsun pa'i sems rnam par grol ba'i sems kyi rang bzhin de nam yang kun nas nyon mongs par gyur tam / smras pa /	85.48511603238197
abravamH no hi idam	de ni ma yin no //	66.5973818567064
Aha Badanta upAle	smras pa / btsun pa nye bar 'khor /	91.28200047356742
sarva sattva cittam hi tad svaBAvaH	sems can thams cad kyi sems ni de'i rang bzhin te /	92.24957460983127
Badanta upAle	btsun pa nye bar 'khor /	88.39492146174112
saMkalpaH hi kleSaH	kun tu rtog pa ni nyon mongs pa ste /	89.48885055490442
nirvikalpaH vikalpanA svaBAvaH	mi rtog / rnam par mi rtog pa ni rang bzhin no //	86.39626783254195
viparyAsaH saMkleSa	phyin ci log ni kun nas nyon mongs pa ste /	89.4458763987519
aviparyAsaH svaBAvaH	phyin ci ma log pa ni rang bzhin no //	90.76085334075124
Atma samAropaH saMkleSaH	bdag tu sgro 'dogs pa ni kun nas nyon mongs pa ste /	93.4378569492927
nErAtmyam svaBAvaH Badanta upAle	bdag med pa ni rang bzhin no; ;btsun pa nye bar 'khor /	67.41088611429387
sarva DarmAH hi upapadya	chos thams cad ni skyes nas 'jig cing mi gnas pa ste /	75.91636231210497
vinaSyantaH pratizWitAH mAyA aBra viDudupamAH	sgyu ma dang / sprin dang / glog lta bu'o //	68.81704523346642
sarva DarmAH anavasTitAH kzaNa mAtram api na tizWanti	chos thams cad ni mi sdod pa ste / skad cig tsam du'ang mi 'dug go /	87.4496996053549
sarva DarmAH hi svapna marIci niBAH aBUta darSanam	chos thams cad ni rmi lam dang / smig rgyu ba dang 'dra ste / yang dag pa ma yin pa mthong ba'o //	86.90728054138054
sarva DarmAH udaka candra pratibimba kalpAH citta saMkalpAt sa muCritAH yEH kEScana taTA hi prajQAyate	chos thams cad ni chu zla dang / gzugs brnyan dang 'dra ste / @294b sems kun tu rtog pa las byung ba'o //	75.24282110931063
te vinaya DarAH na ama ucyante	gang dag gis de ltar shes pa de dag ni 'dul ba 'dzin pa zhes bya ste /	83.23819984708514
ye kecana evam dAMtAH te su dAMtAH	gang dag de ltar btul ba de dag ni legs par btul ba'o //	66.6555301802499
aTa tO BikzU etat avadatAm ayam gRhapatiaH su prajQAvAn	de nas dge slong de gnyis 'di skad ces mchi'o // khyim bdag 'di ni shin tu shes rab dang ldan te /	88.41288378221546
vinaya DarANAm BagavatA eza hi agre AKyAtaH Badanta upAliH tAdRSaH su prajQAvAn na asti	bcom ldan 'das kyis 'dul ba 'dzin pa rnams kyi mchog tu gsungs pa btsun pa nye bar 'khor 'di ni de tsam ma yin no //	86.6509960918975
tAByAm evam avacam BikzU	de gnyis la bdag gis 'di skad ces bgyis so //	61.51914532979329
imam yuvAm gRhapatim mA pratijAnItam	dge slong khyed kyis 'di la khyim bdag snyam pa'i 'du shes ma skyed cig /	80.00867918187822
tat kasya hetoH	de ci'i phyir zhe na /	88.51331394368952
sTApayitvA taTAgatam ye kecana asya pratiBAna pratiprasrabDyAH samarTAH SrAvakAH vA boDisattvAH vA	de bzhin gshegs pa ma gtogs par gang dag 'di'i spobs pa'i rgyun gcod nus pa'i nyan thos sam /	82.15958843470547
te kecid na vidyante	byang chub sems dpa' de gang yang med de /	56.4666276432219
asya prajQA lokaH tad jAtIyaH	'di'i shes rab kyi snang ba ni de dang 'dra'o //	85.71304376920065
tatas tO BikzU vicikitsAm pratinisRjya tatra eva aDyASayena anuttara samyaksamboDi cittam saMjanayamAnO tam sat puruzam aBivandya	de nas dge slong de gnyis the tshom bsal nas de nyid du lhag pa'i bsam pas bla na med pa yang dag par rdzogs pa'i byang chub tu sems bskyed de / de gnyis kyis skyes bu dam pa de la phyag btsal nas /	88.45641048366623
etat avadatAm sarva sattvAH api ca evaMrUpam pratiBAnam laBeran iti	'di skad ces / sems can thams cad kyis kyang 'di lta bu'i spobs pa thob par gyur cig ces mchi'o //	86.88054945862096
etasmAt na utsahe	de'i slad du bdag skyes bu dam pa de'i bro 'dri zhing mchi bar mi spro'o //	69.86111761728922
aTa BagavAn Ayuzmantam rAhulam Amantrayate sma rAhula gacCa	de nas bcom ldan 'das kyis tshe dang ldan pa sgra gcan zin la bka' stsal pa / sgra gcan zin / khyod li tsa b'i dri ma med par grags pa'i nad 'drir song zhig /	81.58502605170703
rAhulaH tu avocat BagavAn na utsahe	@295a *// sgra gcan zin gyis kyang gsol pa / bcom ldan 'das / bdag skyes bu de'i bro 'dri zhing mchi bar mi spro'o // de ci'i slad du zhe na / bcom ldan 'das bdag gis mngon par 'tshal ba dus gcig na /	68.38580702989891
ekasmin samaye neka licCa vikumArAH yena aham tena upasaMkramya mAm evam vadanti sma Badanta rAhula tvam BagavataH si putraH	li tsa b'i gzhon nu mang zhig bdag ga la ba der mchis nas bdag la 'di skad ces mchi'o // btsun pa sgra gcan zin; khyod bcom ldan 'das kyi sras yin te /	86.91093312033281
cakravarti rAjyam hitvA pravrajya ki tvayA upalabDam	'khor los bsgyur ba'i rgyal srid por nas rab tu byung na /	80.61577811086963
pravrajyAyAH guNa anuSaMsam kim	khyod kyis gang la dmigs nas rab tu byung ba'i yon tan dang phan yon gang lags zhes mchi nas / bdag de dag la ci rigs par rab tu byung ba'i yon tan dang / phan yon ston cing mchis na /	68.59561322238409
iti ukte mAm teByaH yaTAyogam pravrajyA guNa anuSaMsam deSayantam licCaviH vimala kIrtiH api yena aham tena upasaMkrAntaH mahyat namaskRtvA etat avocat	li tsa b'i dri ma med par grags pa yang bdag ga la ba der mchis pa der bdag la phyag bgyis nas 'di skad ces mchi'o //	65.77199218118353
Badanta rAhula	btsun pa sgra gcan zin /	76.49038418134053
yaTA pravrajyA guNa anuSaMsam deSayasi taTA na deSayeH	rab tu byung ba'i yon tan dang / phan yon ji ltar khyod ston pa de ltar mi bstan to //	83.12958462793108
tat kasya hetoH pravajyA hi guNa rahitA	de ci'i phyir zhe na /	63.173181555487886
anuSaMsA apagatA	rab tu 'byung ba ni yon tan med cing phan yon med pa yin no //	75.13997228683964
Badanta rAhula	btsun pa sgra gcan zin /	76.49038418134053
yasmE saMskRtam pravartate tasmE guNa anuSaMsam pravrajyA tu asaMskRta yogaH ca asaMskRte guNa anuSaMsan na asti	gang la 'dus byas 'jug pa de la yon tan dang / phan yon yod mod kyi rab tu byung ba ni 'dus ma byas par sbyor ba yin te / 'dus ma byas la ni yon tan dang / phan yon med do //	89.51950074167621
Badanta rAhula	btsun pa sgra gcan zin /	76.49038418134053
arUpiNI hi pravrajyA rUpa apagatA	@295b rab tu 'byung ba ni gzugs can ma yin te /	84.65765845521967
avara agrAnta dRzwi vigatAH nirvANa paTaH	gzugs dang bral ba'o // thog ma dang / tha ma'i mthar lta ba dang bral ba'o // mya ngan las 'das pa'i lam mo //	77.42042111548103
paNxitEH varNitA	mkhas pa rnams kyis bsngags pa'o //	68.90887907573156
AryEH parigRhItA sarva mAra parAjaya karA	'phags pa rnams kyis yongs su bzung ba'o // bdud thams cad pham par byed pa'o //	86.41506165517264
paQcagati niaHsaraNam	'gro ba lnga las grol ba'o //	67.38511986568056
paQcacakzuH SoDanA	mig lnga rnam par spyod pa'o //	70.3321335854069
paQca bala prAptiH	sto bas lnga 'thob pa'o //	72.62829179030199
paQca indriya ASrayaH sA	dbang po lnga'i rten to //	88.54843299205486
nyeByaH pIxA pApa Darma asaMsRzwA para tIrTika su damanam	gzhan dag la mi gnod pa'o // sdig pa'i chos dang ma 'dres pa'o // pha rol mu stegs can rab tu 'dul ba'o //	84.60764074339873
prajQapti samatikrAntA kAma paMke gamBIraH	gdags pa las yang dag par 'das pa'o // 'dod pa'i 'dam la zab pa'o // yongs su 'dzin pa med pa'o //	81.1477540527276
ADAraNa rahitA mama aBAvA vIta ahaFkArA	nga yi ba med cing ngar 'dzin pa dang bral ba'o //	75.93262858390808
anupAdAnam anupAyAsaH	len pa med pa'o //	81.08205254872641
saMkzoBa pratiniHsargaH	'khrug pa med pa'o //	74.46887702033634
sva citta vinayaH ca para citta rakzaNam	'khrug pa spangs pa'o // rang gi sems 'dul zhing gzhan gyi sems srung ba'o //	85.36486494848484
SamaTa sAmagrI	zhi gnas dang mthun pa'o //	70.45885776590418
sarvatra niravadya tvam	thams cad du kha na ma tho ba med pa ste /	72.65618648983182
sA hi pravrajyA nAma	de ni rab tu byung ba zhes bya /	87.98654651641846
ye kecana taTA hi pravrajitAH te su pravrajitAH	gang dag de ltar rab tu byung ba de dag ni legs par rab tu byung ba'o // gzhon nu /	84.37406967787088
kumArAH etAdRSe su AKyAte Darme pravrajata	khyod kyang legs par gsungs pa'i chos 'di lta bu la rab tu phyungs shig /	88.30654436746114
budDa utpAdaH durlaBaH	sangs rgyas 'byung ba'ang rnyed par dka'o //	88.8634672164917
kzaNa sampad api ca durlaBA	dal ba 'byor ba'ang rnyed par dka'o //	84.2596627034639
durlaBA punar manuzya gatiaH	mir 'gyur ba'ang rnyed par dka'o //	78.08594512939453
te kumArAH etat avadan gRhapate asmABiH yaTA Srutam taTAgatenaa uktam	gzhon nu de dag gis 'di skad smras so // khyim bdag / bdag cag gis thos @296a *//	76.31049366034576
mAtA pitRByAm anutsRzwaH pravrAjakaH na Bavati iti	na de bzhin gshegs pa ni pha mas ma btang bar rab tu mi 'byin ce'o //	89.29979021205882
sa tAn abravIt kumArAH	des de dag la smras pa / gzhon nu /	88.5982459613255
anuttara samyaksamboDi cittam saMjanayamAnAH prayatnena pratipatsyaTa	khyod kyis bla na med pa yang dag par rdzogs pa'i byang chub tu sems bskyed la nan tan gyis sgrubs shig dang /	77.39768115023007
taTA hi yUyam tattvataH pravrajitAH ca upasampannAH	de nyid khyod kyis rab tu byung zhing bsnyen par rdzogs pa yin no //	72.33591949956228
aTa tri sahasram dvi Satam licCa vikumArAH anuttara samyaksamboDi cittam utpAdayanti sma	de nas li tsa b'i gzhon nu sum stong nyis brgya bla na med pa yang dag par rdzogs pa'i byang chub tu sems bskyed do // bcom ldan 'das /	86.53736350460584
Bagavan etasmAt na utsahe	de'i slad du bdag skyes bu dam pa de'i bro 'dri zhing mchi bar mi spro'o //	77.39832146962485
tatas BagavAn Ayuzmantam Anandam Amantrayate smaH Ananda gacCa	de nas bcom ldan 'das kyis tshe dang ldan pa kun dga' bo la bka' stsal pa / kun dga' bo / khyod li tsa b'i dri ma med par grags pa'i nad 'drir song zhig /	85.37986546089296
Ananda punar avocat Bagavat na utsahe	kun dga' bos kyang gsol pa / bcom ldan 'das bdag skyes bu dam pa de'i bro 'dri zhing mchi bar mi spro'o // de ci'i slad du zhe na / bcom ldan 'das / bdag gis mngon par 'tshal ba dus gcig na /	71.9545837621089
ekasmin samaye BagavataH kAyaH ekaH rogaH niScArya	bcom ldan 'das kyi sku la snyun cig byung nas /	84.15762631436611
tasmE kzIram AkAFkzamANaH ham ekasya brAhmANa mahASAla kulasya dvAra samIpe pAtra DArI sTitaH BUvam licCaviH vimala kIrtiH api tad deSam upasaMkramya mahyat nama skRtvA evam vadati sma	de la 'o ma zhig 'tshal te bdag bram ze shing s'a la chen po lta bu zhig gi sgo drung na lhung bzed thogs shing mchis pa dang / li tsa b'i dri ma med par grags pa phyogs der mchis nas bdag la phyag bgyis te 'di skad ces mchi'o //	82.796927085525
Badanta Ananda	btsun pa kun dga' bo /	93.57832635532726
kimarTam kalyam eva pAtram AdAya asya kulasya dvAra samIpe sTitaH si tam evam avacam BagavataH kAyaH ekaH rogaH niScArya tasmE kzIreNa prayojanAt tad BEzajyam paryezaH iti avAdizam	ci'i phyir nang par sngar lhung bzed thogs nas @296b khyim gyi sgo drung 'di na 'dug /	36.85476924589929
sa mAm etat avocat	de la bdag gis 'di skad ces bgyis so // bcom ldan 'das kyi sku la snyun cig byung ste de la 'o ma zhig dgos nas de tshol lo zhes bgyis pa dang / de bdag la 'di skad ces mchi'o //	70.48172180437714
Badanta Ananda	btsun pa kun dga' bo /	93.57833827625622
evam mA vagDi	de skad ma zer cig /	86.71622824668884
Badanta Ananda	btsun pa kun dga' bo /	93.57833827625622
taTAgatasya hi kAyaH vajra kaWinaH	de bzhin gshegs pa'i sku ni rdo rje lta bu mkhregs pa ste /	87.67126594155522
sarva akuSala vAsanA prahINaH	mi dge ba thams cad kyi bag chags ni spangs /	84.3682443830702
tasmE sarva kuSala Darma upetAya rogaH kutas Bavet	dge ba'i chos thams cad dang ni ldan pa yin na de la snyun ga la 'byung /	75.27932399857568
AtaMkaH tasmE kutas	de la nyam nga ba ga la yod /	55.81896334681018
Badanta Ananda	btsun pa kun dga' bo //	94.42207882715307
Bagavate nu DvaMsanA karaNAya tUzNIm pratigacCa	bcom ldan 'das la skur pa ma 'debs par cang ma zer bar slar song zhig /	78.59469899008063
kaQcid anyam etat mA vagDi	gzhan su la'ang de skad ma smra zhig /	84.58794463308233
mahA mahA ojaskAH deva putrAH ca budDa kzetra samAgatAH boDisattvAH hi Srozyanti	gzi brjid che ba gzi brjid che ba'i lha'i bu rnams dang / sangs rgyas kyi zhing kun nas lhags pa'i byang chub sems dpa' rnams kyis thos sa re /	92.62133442538884
Badanta Ananda	btsun pa kun dga' bo /	93.57833827625622
yadi parItta kuSala mUla upetaH cakravarti rAjaH pyarogaH tasmE apramANa kuSala mUla saha gatAya Bagavate rogaH kutas tat sTAnan na bidyate	'khor los bsgyur ba'i rgyal po dge ba'i rtsa ba chung ngu dang ldan pa la'ang nad med na; bcom ldan 'das dge ba'i rtsa ba tshad med pa dang ldan ldan pa de la snyun ga la mnga' ste / de ni gnas med do //	85.2806451445051
Badanta Ananda	btsun pa kun dga' bo /	93.57832635532726
mAm lajjita karaNAya pratigacCa	kho bo ngo tsha bar mi bya bar slar song zhig /	66.94699900201027
anya tIrTikAH mImAMsakAH paribrAjakAH nirgranTAH AjIvikAH ca hi Srozyanti	gzhan mu stegs can spyod pa ba dang / kun tu rgyu dang / gcer bu pa dang / 'tsho ba pa dag gis thos sa re /	83.53404910537756
te evam aho yadi ezAm SAstA sva Atura trANasya api asamarTaH	de dag 'di snyam du kye ma'o 'di dag gi ston pa ni bdag nyid kyang @297a *//	78.71504198626623
sattva AturANAm trANam iva dAtum	na ba las skyob mi nus na /	68.38712796458492
kutas Sakroti iti cintayizyanti	sems can na bdag gi skyabs lta ga la nus snyam du sems sa re /	58.183961153030396
Badanta Ananda	btsun pa kun dga' bo /	93.57833827625622
praticCAdayamAnaH ntarDAnam gacCeH	gab cing mi snang bar bzhud cig /	65.9256655664155
kaScid SRNuyAt	sus kyang thos sa re /	53.90201772343028
Badanta Ananda	btsun pa kun dga' bo /	93.57833827625622
taTAgatAH hi Darma kAyaH na sa	de bzhin gshegs pa rnams ni chos kyi sku ste /	72.71744429546854
AhAra pozitam deham	kha zas kyis gsos pa'i lus ma yin no //	53.619662456023384
taTAgatAH sarva loka Darma samatikrAntaH loka uttara kAyaH	de bzhin gshegs pa rnams ni 'jig rten las 'das pa'i sku yin te / 'jig rten gyi chos thams cad las yang dag par 'das pa'o //	83.55950057697422
taTAgatasya kAyaH nupadravaH vinivRtta AsravaH	de bzhin gshegs pa'i sku la gnod pa med de / zag pa thams cad las rnam par log pa'o //	67.62649574035115
taTAgatasya kAyaH hi asaMskRtaH sarva saMskAra apagataH	de bzhin gshegs pa'i sku ni 'dus ma byas te / 'du byed thams cad dang bral ba'o //	88.45694947198808
Badanta Ananda IdRSAya vyADimezwum ayuktiH ca asadRSam	btsun pa kun dga' bo / de lta bu la nad yod par 'dod pa ni mi rigs shing 'dra ba ma yin no zhes mchi nas /	75.58764491232753
iti ukte tatra kim mayA BagavataH miTyA Srutam miTyA udgRhItam iti	de la bcom ldan 'das las bdag gis log par thos shing log par bzung bar ma gyur nas /	80.83874298461774
cintayamAnaH tilajjitaH BUtvA	grang snyam ste / bdag rab tu ngo tsha bar gyur te /	65.17376584273119
aTa antarIkzAt svaram aSrOzam Ananda	de nas bdag gis bar snang las sgra thos pa / kun dga' bo /	86.33612107408459
gRhapatiH yaTA deSayati	khyim bdag ji ltar ston pa de de bzhin te /	76.22364170606745
tat taTA api tu Bagavati paQcakazAya kAlaH utpanne atas sattvAH hInena pradAna caritena damyAH	'on kyang bcom ldan 'das snyigs ma lnga'i dus la byung bas de'i phyir sems can rnams dman zhing dbul ba'i spyod pas rnam par 'dul te /	79.52260353658593
tatas Ananda	de bas na / kun dga' bo /	80.02095465660095
alajjitaH kzIram AhRtya pratigacCe tyavAdIt	ngo tsha bar ma byed par 'o ma khyer la @297b slar song zhig ces mchi'o //	67.14944116556319
Bagavan licCaveH vimala kIrteH praSna samADAna upadeSaH tAdRSaH But	bcom ldan 'das / li tsa b'i dri ma med par grags pa dris pa lan 'debs pa'i stan pa 'di 'dri ste / bcom ldan 'das /	89.32639890037939
etasmAt Bagavat na utsahe	de'i slad du bdag skyes bu dam pa de'i bro 'dri zhing mchi bar mi spro'o //	76.17616399129233
evam eva paQca Sata mAtrAH SrAvakAH anutsahamAnAH sva pratiBAnam Bagavantam avocan	de bzhin du nyan thos lnga brgya tsam mi spro bar gyur pa de dag gis rang gi spobs pa bcom ldan 'das la gsol te /	81.64611405119675
yallicCavinA vimala kIrtinA saha kaTitam tat sarvam Bagavantam avocan	gang dag li tsa b'i dri ma med par grags pa dang gtam byas pa de thams cad kyang bcom ldan 'das la gsol to //	84.38201047665032
aTa BagavAn boDisattcam mEtreyam Amantrayate sma  mEtreya gacCa	de nas bcom ldan 'das kyis byang chub sems dpa' byams pa la bka' stsal pa / byams pa; khyod li tsa b'i dri ma med par grags pa'i nad 'drir song zhig / byams pas kyang gsol pa / bcom ldan 'das /	82.11135331055999
mEtreyaH tu avocat Bagavat na utsahe ekasmin samaye santuzita deva putra gaNena ca tuzita vaMSa deva putrEH sa arDa yena aham	bdag skyes bu dam pa de'i bro 'dri zhing mchi bar mi spro'o // de ci'i slad du zhe na / bcom ldan 'das // bdag gis mngon par 'tshal ba dus gcig na /	67.1361824508415
boDisattva mahA sattvAnAm avEvartika BUmim AraBya taTA hi Darma kaTAm kaTayamAnaH tena licCaviH vimala kIrti rUpa saMkramya	lha'i bu yongs su dga' ldan la sogs pa dga' ldan rigs kyi lha'i bu rnams la lhan cig tu 'di ltar byang chub sems dpa' sems dpa' chen po rnams kyi phyir mi ldog pa'i sa la brtsams te chos kyi bka' mchid mchi ba'i phyogs der li tsa b'i dri ma med par grags pa mchis te; de bdag la 'di skad ces mchi'o // byams pa /	75.97825242961169
mAm etat avocat mEtreya yadi tvam BagavatA anuttarAyAm samyaksamboDyAm eka jAti pratibadDaH vyAkRtaH	khyod bcom ldan 'das kyis bla na med pa yang dag par rdzogs pa'i byang chub tu skye ba gcig gis thogs par lung bstan na /	82.95426367488746
sa mEtreyaH kayA jAtyA vyAkRtaH	@298a *// byams pa de skye ba gang gis lung bstan /	78.6382341338139
atItena kim	byams pa ci 'das pas sam /	57.93744523708637
aho svid ana Agatena	'on te ma 'ongs pas sam /	60.43411302566528
aho svid pratyupannena tatra yA atIta jAtiH sA hi kzINA	'on te da ltar gyis de la gang 'das pa'i skye ba de ni zad pa'o //	79.00065263782324
yat anAgatam tad ananuprAptam	gang ma 'ongs pa de ni ma phyin pa'o //	80.72002759957925
pratyutpanna jAtyAm tu sTAnan na asti	da ltar gyi skye ba la ni gnas pa'ang med de /	76.42305635369343
tat yaTA BagavatA taTA hi Bikzo	'di lta ste / bcom ldan 'das kyis bka' stsal pa /	74.35246261285275
eka kzaNe tvam jAyase	'di ltar dge slong dag ;khyod ni skad cig gcig tu skye'o //	86.17978206731506
jIryase	rga'o //	73.83884525299072
mriyase	'chi'o //	56.962110890282524
cyavase	'pho'o //	64.1904317273034
upapadyasaH iti suBAzitam	'byung ngo zhes gsungs so //	53.02656439372472
anutpAde niyAma avakrAntiH	skye ba med pa la ni nges par gyur pa la 'jug pa ste /	84.3076880066483
ajAti Kya akRtA	mi skye ba ni lung bstan pa'ang med /	55.47518399599436
anutpadyamAnaH ced na aBisambuDyase mEtreya	mi skye ba ni mngon par rdzogs par 'tshang rgya ba'ang ma yin na / byams pa /	80.18346784109075
kaTam vyAkRtaH si	khyod de bzhin nyid skye bas sam /	66.93214678764343
taTatA jAtyA vA taTatA niroDena vA taTatA utpAda niroDa apagatA	de bzhin nyid 'gag pas sam /	65.28524971008301
anupatsyamAnA ca anirotsyamAnA	ji ltar lung bstan pa de bzhin nyid ni mi skye mi 'gag cing skye bar mi 'gyur la 'gag par mi 'gyur te /	58.5137909567778
yA sarva sattvAnAm sarva DarmANAQca sarva AryANAMca taTatA sA hi	gang sems can thams cad kyi de bzhin nyid dang / gang chos thams cad kyi de bzhin nyid dang / gang 'phags pa thams cad kyi de bzhin nyid de ni /	73.61145332807536
mEtreya	byams pa /	71.24168181419373
tava api taTA tA	khyod kyi'ang de bzhin nyid do //	71.73834929321752
tu aQcet evaMvyAkRtaH sarva sattvAH api evam vyAkRtAH tat kasya hetoH	gal te khyod de lta bur lung bstan na ni sems can thams cad kyang lung bstan pa yin no // de ci'i phyir zhe na /	87.03844157743416
taTatA hi dvaya apraBAvitA	de bzhin nyid ni gnyis kyis rab tu phye ba ma yin /	88.11011368620629
nAnAtva apraBAvitA	tha dad pas rab tu phye ba ma yin pa'i phyir te /	80.65060337708921
tena hi mEtreya	byams pa /	61.36447525024414
yadA tvam boDim aBisamBotsyase tadA sarva sattvAH api tAdRSAm boDim aBisamBotsyante	khyod @298b gang gi [?] tshe [?] byang chub mngon par rdzogs par 'tshang rgya ba de'i tshe sems can thams cad kyang de lta bu'i byang chub mngon par rdzogs par 'tshang rgya bar 'gyur ro //	87.57609777766191
tat kasya hetoH	de ci'i phyir zhe na /	88.51331394368952
boDiH hi sarva sattva anvayA	sems can thams cad rjes su rtogs pa ni byang chub yin pa'i phyir ro //	87.5395576953888
mEtreya yadA tvam parinirvRtaH tadA sarva sattvAH api parinirvAyizyanti	byams pa / khyod gang gi tshe yongs su mya ngan las 'das pa de'i tshe sems can thams cad kyang yongs su mya ngan las 'das par 'gyur ro //	89.52399239237762
tat kasya hetoH yadi	de ci'i phyir zhe na /	86.80357638272372
sarva sattvAH syuH aparinirvRtAH taTAgataH syAt aparinirvRtaH	sems can thams cad yongs su mya ngan las ma 'das par de bzhin gshegs pa yongs su mya ngan las mi 'da' ste /	82.24302039781229
sarve te sattvAH su parinirvRtAH tena hi nirvANa jAtIyAH dRSyante	de dag gi sems can thams cad shin tu yongs su mya ngan las 'das shing mya ngan las 'das pa'i rang bzhin can du mthong ba'i phyir ro // byams pa /	83.64821834286239
mEtreya tasmAt imAn deva putrAt mA vipralamBa sva mA vaQcayasva	de lta bas na lha'i bu 'di rnams ma brid ma slu zhig /	82.65500327255486
boDyAt na kaScid pratizWitA ivA vivartatA iva a	byang chub la ni su'ang mi gnas mi ldog gi /	68.9819648916071
tasmAt mEtreya	byams pa /	67.4633367061615
imAn deva putrAn= tAm boDi saFkalpa dRzwim utsarjaya	lha'i bu 'di dag byang chub la kun tu rtog par lta ba de 'dor du chug cig /	72.2454948285667
boDit na kAyena na api cittena aBisambuDyati	byang chub ni lus kyis mngon par rdzogs par 'chang rgya ba ma yin / sems kyis kyang ma yin no //	87.6070211005049
boDiH hi sarva nimitta vyUpa SamaH	byang chub ni mtshan ma thams cad rnam par zhi ba'o //	84.36899024468882
boDiH sarva AlambanAropa rahitA	byang chub ni dmigs pa thams cad kyis sgro btags pa med pa'o //	82.4992930245778
sarva manasikAra pracAra apagatA	byang chub ni yid la byed pa thams cad rgyu ba med pa'o //	71.55114736228154
sarva dRzwi gata paricCinnA	byang chub ni lta par gyur pa thams cad yongs su chad pa'o //	83.85894969252288
sarva paritarka vigatA	byang chub ni yongs su rtog pa thams cad dang @299a *//	58.94701290130615
boDiH sarva in jita cetaH calana visaMyuktA	bral ba'o // byang chub ni g-yo ba dang / sems pa dang / bskyod pa thams cad dang bral ba'o //	78.13136190747808
sarva praNiDAna apravRtA sarva udgrahaNa virahitA aSleza pratipannA	byang chub ni smon lam thams cad la mi 'jug pa'o; ;byang chub ni 'dzin pa thams cad dang bral zhing ma chags par 'jug pa'o //	78.67668701304738
DarmaDAtu niSraya niSritA	byang chub ni chos kyi dbyings kyi gnas kyis gnas pa'o // byang chub ni de bzhin nyid rjes su rtogs pa'o //	68.12958955101243
taTatA anvayA BUtakowI avasTitA manaH Darma aBAvena advayA	byang chub ni yang dag pa nyid kyi mtha' la gnas pa'o // byang chub ni yid dang / chos med pas gnyis su med pa'o //	78.08629331319713
AkASa sama samA	byang chub ni nam mkha' dang mnyam pas mnyam pa'o //	74.52897545007559
utpAda vyaya sTiti anyaTAtva aBAvena asaMskRtA	byang chub ni skye ba dang / 'jig pa dang / gnas pa dang / gzhan du 'gyur ba med pas 'dus ma byas pa'o //	86.21684500994262
boDiH sarva sattva anAQcitta caryA aDyASaya parijQA	byang chub ni sems can thams cad kyi sems dang / spyod pa dang / bsam pa yongs su shes pa'o // byang chub ni skye mched rnams kyi sgo ma yin pa'o //	85.38002410742706
