samprati budDekzetra pariSudDi parinizpattaye ye boDisattvAH evaMviDena aBiniveSena pravartante yezAm ca evaMviDaH vikalpaH tad nirAkaraNa arTam uktam	da ni sangs rgyas kyi zhing yongs su dag pa bsgrub pa'i phyir byang chub sems dpa' dag @250b 'jug pa na de ltar mngon par zhen pas 'jug go snyam du gang dag de ltar rnam par rtog pa de dag gi rnam par rtog pa de bsal bar gsungs pa'i phyir ro //	90.82869644322582
na ca anavasTA prasaFga tadA evaMviDasya kasyacid itara vikalpasya asamBavAt	de'i tshe kha cig gi rnam par rtog pa de lta bu gzhan mi 'byung bas thug pa med par yang mi 'gyur ro //	87.68131290001251
anena iha boDisattvena kaTam pratipattavyam tat vyapadizwam	'dis ni byang chub sems dpa' 'di la ji ltar bsgrub par bya ba de bstan to //	85.35761424837534
kIdRSaH boDisattvaH nAma iti atra yaH suBUte boDisattvaH iti Adi Aha	ci 'dra ba la byang chub sems dpa' zhes bya snyam pa la / rab 'byor byang chub sems dpa' gang zhig ces bya ba la sogs pa gsungs so //	91.31177391252108
nirAtmAnaH DarmAH iti dvis uktayA dviviDena nErAtmyena sarva DarmANAm nErAtmyam darSyate	chos rnams ni bdag med pa zhes lan gnyis brjod pa ni bdag med pa rnam pa gnyis kyis chos rnams bdag med par ston to //	87.9348421083989
boDisattvaH boDisattvaH iti dviruktyA tat eva dviviDam nErAtmya jQAnam darSyate	byang chub sems dpa' sems dpa' zhes lan gnyis brjod pas ni bdag med pa rnam pa gnyis po de nyid rtogs par ston to //	87.82988731759256
aTavA ekaH tAvat boDisattvaH AvRttaH	yang na de ni byang chub sems dpa' zhes bya ba gcig ni bzlas pa'o //	82.3874925232482
boDisattvaH iti AKyAtaH iti uttaraH tu kaTanasya prakAraH	byang chub sems dpa' zhes brjod do zhes bya ba 'og ma ni tshul lo //	88.29581822720228
tena kim darSayizyate iti ced	des na ji skad bstan par 'gyur zhe na /	86.12766495729105
kena nizpAdyante yadi pudgala Adi grAhaka aBAvaH kzetra vyUhAH iti Darma grAhakasya api aBAvaH uBaya BAva aDigamena boDisattvaH iti AKyAtaH iti nirdizwam	su dag gis bsgrub po snyam du gang zag la sogs par 'dzin pa med pa dang / zhing bkod pa rnams zhes chos su 'dzin pa yang med pa de dag med pa gnyi ga khong du chud pa'i phyir byang chub sems dpa' zhes brjod do zhes bstan par 'gyur te /	88.05533857265723
anena citta pragrahaH deSitaH	'dis ni sems rab tu gzung ba bstan to //	93.59593868255615
eBiH sarvEH sTAnEH gAmBIryam darSitam	gnas 'di mtha' dag gis ni zab pa bstan to //	86.95198067751798
tatra mAyA vat budDa kzetra parinizpAdana aDimuktayA boDisattvAnAm pravRtti pradarSanena OdAryam uktam anuttara dRzwi pariSudDi sampad	sangs rgyas kyi zhing sgyu ma lta bu de bsgrub pa'i phyir byang chub sems dpa' dag de la mos pas 'jug par bstan pas ni rgya che ba brjod do //	81.24614097650893
yadi na asti boDisattvaH nAmaH kaScid DarmaH tadA taTAgataH pariSudDa darSanena pariSudDa jQAnena ca yuktaH eva na Bavet	gal te byang chub sems dpa' zhes bya ba'i chos de gang yang med na de'i tshe de bzhin gshegs pa gzigs pa rnam par dag pa dang do // / mkhyen pa rnam par dag pa dang ldan pa med pa kho nar 'gyur te /	93.00609255152254
tasya boDisattvAt utpannAtvAt tasya aBAve sa kaTam Bavatum arhati	de ni byang chub sems dpa' las skyes pa'i de med na de ji ltar rung bar 'gyur /	82.50170227035203
ahetuka tve nitya sattva Adi dozAH	rgyu med pa ni rtag tu yod pa la sogs pa'i don du 'gyur ro //	78.64680024834931
tasmAt yasyAm saMnipatita tAyAm parizaDA ivam vikalpaH Bavet tasyAH kRte pariSudDam darSanam jQAnaQca iti anuttara dvayam aDikRtya tat kim manyase suBUte iti Adi Aha	de bas na 'khor 'dus pa gang de snyam du rnam par rtog par 'gyur ba de'i ched du gzigs pa dang mkhyen pa yongs su dag pa bla na med pa gnyis kyi dbang du mdzad nas rab 'byor 'di ji snyam du sems zhes bya ba la sogs pa gsungs so //	85.20758817497696
pUrvatas BagavataH BiprAyam gRhItvA Arya suBUtiH api Aha saMvidyate iti	'phags pa rab 'byor gyis kyang @251a * // bcom ldan 'das kyi dgongs pa sngar bzung nas mnga'o zhes gsol to //	87.13605866775447
anena paramArTataH boDisattvaH nAma sa kaScid DarmaH na Bavati taTA api saMvRtO puNya jQAna samBAram paripUrya pariSudDaMjQAna darSanAByAm yaH taTAgataH Bavati tena avicAra maNIya skanDa mAtrasya boDisattvasya astitvam Bavanti eva	'dis ni don dam par byang chub sems dpa' zhes bya ba'i chos de gang yang med du zin kyang kun rdzob tu gang bsod nams dang ye shes kyi tshogs yongs su bskangs nas mkhyen pa dang gzigs pa yongs su dag pa'i de bzhin gshegs par 'gyur ba ma brtags gcig pu na dga' ba phung po tsam gyi rang bzhin gyi byang chub sems dpa'i yod pa nyid do //	80.60633762501787
anyaTA saMvRtO= api yadi sa na Bavet tadA kaH taTAgataH Bavet iti evam tAvat darSitam	de lta ma yin te / gal te kun rdzob tu yang de med du zin na de'i tshe su zhig de bzhin gshegs par 'gyur zhes de skad ston to //	92.16289526768699
tatra saMvidyate taTAgatasya prajQAcakzuH iti eva tAvat na ucyate api tu viSizwam viSudDa darSanam aBiDAtum cakzuzaH vidyA mAna tvam darSitam	de la de bzhin gshegs pa la shes rab kyi spyan kho na mnga'o zhes mi bya ba ni gzigs pa rnam par dag pa khyad zhugs par bstan pa'i phyir spyan mnga' bar ston to //	81.60876502198619
samAsatas caturviDam Bavati cakzuH rUpa grAhakam	mdor bsdus spyan rnam pa bzhi ste /	82.64824523244584
parama arTa satya grAhakam saMvRti satya grAhakam sarva AkAra jQeya grAhakam ca	gzugs 'dzin pa dang / don dam pa'i bden pa 'dzin pa dang / kun rdzob kyi bden pa 'dzin pa dang / rnam pa thams cad du shes bya 'dzin pa'o //	89.98981594334768
rUpa grAhakam api dviviDam karma Palam BAvanA PalaQca iti	gzugs 'dzin pa yang rnam pa gnyis te / las kyi 'bras bu dang / bsgoms pa'i 'bras bu'o // spyan rnam pa lnga dang go rims bzhin no //	89.47373767755393
paQcaviDam cakzuH kramaSas tatra sTUla vizaya tvAt praTamam rUpa grAhakam kaTitam	de la yul rigs pa'i phyir dang por gzugs 'dzin pa bstan to //	70.94432040654715
parama arTa vaSena saMvRti jQAnam pariSudDaDyati iti atas pUrvam parama arTa satya grAhakam paScAt ca saMvRti satya grAhakam aBihitam iti saFga	don dam pa'i dbang gis kun rdzob shes pa yongs su dag par 'gyur te / des na don dam pa'i bden pa 'dzin pa ni sngar bstan la / kun rdzob kyi bden pa 'dzin pa ni phyis bshad do zhes go rims bstan pa'i mtshams sbyar ba'o //	91.65346585608837
pudgala Darma nErAtmyayoH saMvidyate prajQAcakzuH	gang zag dang chos la bdag med pa'i yul la ni shes rab kyi spyan mnga'o //	87.52083047584048
saMvRtO Darma mAtram eva tAvat avaBAsate na tu pudgalaH iti pudgala SUnye Darma mAtre Darma cakzuH	kun rdzob tu chos tsam du snang ba nyid de gang zag ni ma yin na zhes gang zag stong ste / chos tsam gyi yul la ni chos kyi spyan no //	85.97257490333267
sarvajQeyAnAm sarva AkAra jQAnam tAvat budDacakzuH iti ucyate	shes bya thams cad rnam pa thams cad du mkhyen pa ni sangs rgyas kyi spyan zhes bya ste /	94.17811581576363
anena idAnIm sAkzAtkRtya viharaNAt taTya saMvRtO paQca cakzuzAm deSanayA uktam viSudDa darSanam anuttara jQAna pariSudDi sampad	'dis ni da ltar mngon sum du mdzad par bzhugs pa'i phyir yang dag pa'i kun rdzob tu spyan lnga bstan pas ni gang gzigs pa rnam par dag pa brjod do //	83.97965859143135
viSudDa jQAna aBiDAna arTam tat kim manyase suBUte iti Adi Aha	mkhyen pa rnam par dag pa brjod pa'i phyir / rab 'byor 'di ji snyam du zhes bya ba la sogs pa gsungs so //	91.37851002491752
trEkAlikAH citta cEtasAH tAvat citta santatiH	dus gsum gyi sems dang sems las byung ba rnams ni sems kyi rgyun no//	91.62938870817223
tatas trEkAlya vizaya tvena tad vizaya avaboDaH jQAnam iti ucyate na tu darSanam	@251b de bas na dus gsum yul yin pa'i phyir yul de shes pa ni mkhyen pa zhes bya'i gzigs pa zhes ni mi bya'o //	89.93932023651398
tat api sa rAga citta vIta rAga citta ityAdi nAnAviDa saMkleSa vyavadAna BAvena veditavyam	de yang 'dod chags dang bcas pa'i sems dang 'dod chags dang dbral ba'i sems zhes bya ba la sogs pa kun nas nyon mongs pa dang / rnam par byang ba'i ngo bo sna tshogs su rig par bya'o //	87.22275253864113
tAvantaH lokaDAtavaH iti upalakzaNam	de snyed kyi 'jig rten gyi khams zhes bya ba ni mtshon pa ste /	85.29963551248822
ananta loka DAtu antar nihita sattvAnAm citta DArAyAH parijQAnAt taTA hi saMvRtO taTAgatasya mAMsa cakzuH AdIni Bavanti	'jig rten gyi khams mtha' yas par gtogs pa'i sems can rnams kyi rgyun yongs su mkhyen pa'i phyir ro // 'di ltar kun rdzob tu de bzhin gshegs pa la sha'i spyan la sogs pa mnga' ste /	87.78357852224306
atas tad nizpAdana arTam boDisattvena Canda praNiDAnAByAm sTAtavyam anena tAvat vacanena sampad dvayam paridIpitam	des na des bsgrub pa'i phyir byang chub sems dpa' 'dun pa dang smon lam gyi gnas par bya ba'o // gzhung 'dis ni phun sum tshogs pa gnyi ga yang bstan pa yin no //	90.08484830533808
mAMsa cakzuH AdIni api eka aneka svaBAvAByAm vicAraNAyAm anupalabDAni eva na hi arTa antara jQAnena grahaNam yujyate	sha'i spyan la sogs pa yang gcig dang du ma'i rang bzhin gyis dpyad na mi dmigs pa nyid la / don gzhan shes pas 'dzin par yang mi rigs te /	84.8498361187971
yaTA pUrvam vicAritam evam sati kaTam prajQAsi ete taTAgatasya mAMsa cakzuH Adi vidyamAna tA citta DArA ca iti citta ASayam viditvA tat kasya hetoH iti Aha boDisattvena kaTam anayoH dvayoH viSudDayoH yoga samApattyA pratipattavyam	ji ltar sngar dpyad pa lta bu yin na de bzhin gshegs pa la sha'i spyan la sogs pa mnga' ba dang sems kyi rgyun rab tu mkhyen par ji ltar 'gyur snyam du sems pa'i bsam pa la brtags nas de ci'i slad du zhes zhus pa dang / byang chub sems dpa' rnam par dag pa 'di gnyis la rnal 'byor du snyoms par 'jug pas ji ltar bsgrub par bya ba de bstan pa'i phyir /	83.31883023590851
iti etat aBiDAtum citta DArA citta DArA iti Adi Aha	sems kyi rgyun sems kyi rgyun zhes bya ba la sogs pa gsungs so //	74.96403107322658
paramArTataH aDArAH iti	rgyun med ces bya ba ni don dam par ro //	80.45374117827997
svaBAvataH sattve pi saMvRtim aDikRtya Aha tena ucyate citta DArA iti iti	rang bzhin med du zin kyang kun rdzob la brten nas gsungs te / de nyid kyi phyir sems kyi rgyun zhes bya'o zhes gsungs so //	85.01215459262035
anyaTA paramArTataH sarva vAc gocara atIta tvAt na vaktum Sakzyate iti aBiprAyaH	de lta ma yin pa don dam par ni brjod pa'i spyod yul thams cad las 'das pa'i phyir brjod par mi 'gyur ro snyam du dgongs pa'o //	89.60577023139102
citta DArA iti upalakzaNam	sems kyi rgyun zhes smos pa ni mtshon pa ste /	71.82691971115443
mAMsa cakzuH AdIni api cakzuH svaBAva rahitAni eva uktAni iti kaTanam prakRtam sAkzAt na uktam	sha'i spyan la sogs pa yang spyan gyi rang bzhin med pa nyid du gsungs so zhes brjod par bya ba'i skabs yin te / mngon sum gsungs so //	88.23294290043393
atra kaTam cittam pragrahItavyam iti tat aBiDAtum Aha tat kasya hetoH iti	'di la ji ltar sems rab tu gzung bar bya ba de bstan pa'i phyir de ci'i slad du zhes bya ba de zhus te /	90.44260605232816
aDAra iti anena saha yojanIyam	rgyun med ces bya ba dang sbyar ro //	80.25462716334575
atIta AdInAm cittAnAm paramArTataH nutpanna tvAt anupalamBaH	'das pa la sogs pa'i @252a * // sems ni don dam par ma skyes pa'i phyir mi dmigs kyi /	86.43190229663377
sattve pi grahaNa anupapattyA na anupalamBaH	yod kyang 'dzin par mi 'thad pas mi dmigs pa ni ma yin no //	80.69083612452374
taTA sati acitta DArAdeSanam api na Bavet	de lta na ni sems kyi rgyun med par bstan par mi 'gyur te /	83.11781661389239
na ca anupalamBa mAtreNa BAvAnAm niHsvaBAva tvam syAt	mi dmigs pa tsam gyis ni dngos po rnams kyi rang bzhin med par mi 'gyur ro //	90.51475000825992
yaTA trEkAlika cittasya paramArTataH BAvaH taTA pUrvam uktam vakzyate ca	ji ltar dus gsum gyi sems don dam par med pa de ltar ni sngar yang bshad de / ston par yang 'gyur ro //	85.92622578014881
citta ukti rUpa lakzaNam	sems smos pa ni mtshon pa ste /	85.09628606611682
tatas tIta Adi mAMsa cakzuH AdIni api anupalabDAni eva	des na sha'i mig la sogs pa 'das pa la sogs pa yang mi dmigs pa nyid do //	87.89808541035798
atra aDArAH ityAdiBiH padEH gAmBIryam uktam	'di la rgyun med ces bya ba la sogs pa'i tshig gis ni zab pa brjod do //	87.53164226091322
SezEH OdAryam	lhag ma rnams kyis ni rgya che ba'o //	84.79573982640318
prApta puNya skanDa ADipatya sampad yadi na asti trEkAlikam cittam tadA puNya skanDaH pi na syAt citta ASrita tvAt tasya	gal te dus gsum gyi sems med na de'i tshe bsod nams kyi phung po yang med par 'gyur te / de ni sems la brten pa'i phyir ro //	82.17152716179697
tatas taTAgatasya puNya skanDa ADipatya sampadam sampAdayitum kaTam boDisattvaH yatnam kUryAt iti vicintya puNya skanDa ADipatya sampadamtat kim manyase suBUte iti Adi Aha	de bas na de bzhin gshegs pa'i bsod nams kyi phung po la mnga' ba phun sum tshogs pa bsgrub pa'i phyir byang chub sems dpa' ji ltar 'bad par bya snyam pa la brtags te / bsod nams kyi phung po la mnga' ba phun sum tshogs pa'i dbang du mdzad nas / rab 'byor 'di ji snyam du sems zhes bya ba la sogs pa gsungs so //	87.05659322368682
anena kula putraH vA kula duhitA vA yaH ntaSaH ratna Adikam bAhya vaH tu tyajati saH pi yadi mahA puNya skanDena yuktaH Bavati tadA	'dis ni rigs kyi bu 'am rigs kyi bu mo tha na gang phyi'i dngos po ni rin po che la sogs pa gtong bar byed pa de yang bsod nams kyi phung po chen po dang ldan par 'gyur na /	86.86975034341026
kaTam na taTAgatasya asaMKyeya aprameya kalpezu duzkara aneka SatAni aByasyataH puNya skanDa ADipatyam syAt iti evam deSitam	de bzhin gshegs pa bskal pa grangs med dpag tu med par bya dka' ba brgya phrag du ma goms par mdzad pas bsod nams kyi phung po la mnga' bar ci'i phyir mi 'gyur zhes de skad na / ston to //	90.68418452250462
atas eva paramArTataH sati api puNya skanDe saMvRtO sattvAt boDisattvena tatra vaSIBAvam nizpAdayitum Canda praNiDAnAByAm sTAtavyam i	des na don dam par bsod nams kyi phung po med du zin kyang kun rdzob tu yod pas na byang chub sems dpas de la dbang ba bsgrub pa'i phyir 'dun pa dang / smon lam gyis gnas par bya'o zhes bstan te /	87.81048964019534
anena OdAryam api uktam	'di ni rgya che ba yang brjod do //	86.78802367619106
kaTam na paramArTataH puNya skanDa sattvam vyavasTApyate iti vicintya boDisattvena atra kaTam pratipattavyam kaTaQca cittam pragrahItavyam	bsod nams kyi phung po don dam par yod par ci'i phyir rnam par mi gzhag snyam pa la brtags nas byang chub sems dpas 'di la ji ltar bsgrub par bya ba dang / sems rab tu gzung bar bya ba dang / gnyi ga bstan pa'i phyir /	91.14762620332193
iti uBayam sandarSiyitum saced suBUte iti Adi Aha	rab 'byor gal te zhes bya ba la sogs pa gsungs so //	84.3727860056735
saced iti yadi iti arTaH	gal te zhes bya ba ni ji @252b ste zhes bya ba'i tha tshig go //	92.12621831893921
na taTAgataH BAzizyat iti paramArTataH BiDAnam na Acarizyat	de bzhin gshegs pa mi gsung ngo zhes bya ba ni don dam par brjod pa mi spyod pa'i phyir te /	73.80710428619939
anirdeSe pi taTA KyAyate iti aBiprAyaH	ma bstan par yang de ltar grags par 'gyur ro snyam du dgongs pa'o //	87.4143243795842
yaTA paramArTataH puNya skanDasya aBAvaH taTA prAk varNitaH	ji ltar bsod nams kyi phung po don dam par med pa de ltar sngar bstan zin to //	88.09176953462237
anena taTAgatasya puNya skanDa ADipatya sampadam parinizpAdayitum prasTitena boDisattvena paramArTataH tad anupalamBena yoga samApatti paramArTataH tad Alambana aBiniveSa parihAreNa cittam pragrahItatavyam iti uBayam deSitam	'dis ni de bzhin gshegs pa'i bsod nams kyi phung po mnga' ba phun sum tshogs pa bsgrub pa'i phyir zhugs pa'i byang chub sems dpas don dam par de mi dmigs par rnal 'byor du snyoms par 'jug pas bsgrub par bya ba dang / don dam par de dmigs pa la mngon par zhen pa spong pas sems rab tu gzung bar bya ba gnyi ga bstan te /	82.96427108793873
gAmBIryam api uktam kAya sampad  a rUpa kAya sampad	zab pa yang brjod do //	57.03663035061049
yadi puNya skanDaH na eva syAt tadA taTAgatAnAm dviviDA kAya lakzaNa sampad anu vyaQjana kAya sampad	gal te bsod nams kyi phung po med pa nyid yin na / de'i tshe de bzhin gshegs pa rnams kyi sku phun sum tshogs pa rnam pa gnyis po dpe byad bzang po'i sku phun sum tshogs pa dang / mtshan gyi sku phun sum tshogs pa bsod nams bla na med pa las skyes par 'dod pa gang yin pa de yang rgyu med pa'i phyir med par 'gyur ro //	70.61886364551849
lakzaNa kAya sampad ca yA an uttara puNyena aBinirvartayitum izyate sA na eva syAt	de bas na de bzhin gshegs pa'i sku phun sum tshogs pa rnam pa gnyis yongs su bsgrub ro //	71.0318505805429
kAraNa aBAvAt	pa'i phyir /	67.70536438624065
tasmAt taTAgatasya dviviDAm kAya sampadam parinizpAdayitum kaTam boDisattvEH yatnaH	byang chub sems dpas ji ltar 'bad par bya snyam du sems pa de'i ched du de bzhin gshegs pa rnams kyi gzugs kyi sku phun sum tshogs pa'i dbang du mdzad nas /	80.42624194234277
nuzWeyaH iti vicintayadByaH taTAgatasya rUpa kAya sampadam aDikRtya tat kim manyase suBUte iti Adi Aha	rab 'byor 'di ji snyam du sems zhes bya ba la sogs pa gsungs so //	71.58146179500655
rUpa kAyaH iti anuvyaQjana kAya rUpeNa drazwavyaH	gzugs kyi lus zhes bya ba ni dpe byad bzang po'i sku yin par blta bar bya'o //	92.59042469587826
lakzaNa kAyaH paScAt vakzyate go bali varda nyAyena	mtshan gyi sku ni 'og nas 'chad de ba lang dang glang zhes bya ba'i tshul du /	84.97600610288112
tatas yam atra Arya su BUteH ASayaH yaTA paramArTataH skanDaH eva puNya skanDaH taTA rUpa kAyaH pyunutpannaH eva	'di las 'phags pa rab 'byor gyi bsam pa ni 'di yin te / ji ltar bsod nams kyi phung po don dam par phung po med pa kho na yin pa de bzhin du gzugs kyi sku yang ma skyes pa kho na ste /	92.94031086965747
atas paramArTataH na rUpa kAya parinizpattyA taTAgataH drazwavyaH iti ucyate	de bas na don dam par gzugs kyi sku yongs su grub pas de bzhin gshegs par blta bar mi bgyi lags so zhes bya'o //	94.27235587528678
saMvRtO mAyA nirmita budDa vat vidyate eva rUpa kAyaH tatas upapannaH eva tasya	kun rdzob tu ni sgyu mas sprul pa'i sangs rgyas bzhin du gzugs kyi sku yod pa nyid de /	86.27707485350086
puNya skanDAt udBavaH	de bas na bsod nams kyi phung po las byung bar rung ba nyid do //	84.59876282398517
tasmAt boDisattvena mAyA nirmita budDasya taTAviDa rUpa aDimuktayA tad pratipattaye Canda praNiDAnAByAm sTAtavyam iti deSitam	de bas na byang chub sems dpas sgyu mas sprul pa'i sangs rgyas @253a * // kyi gzugs la mos pa de lta bus de bsgrub pa'i phyir 'dun pa dang smon lam gyis gnas par bya ba bstan pa yin no //	90.54180226510618
na api atra punarukti tA	'dir tshig zlos par yang mi 'gyur te /	81.42197321590623
pUrvam aDimukti caryA BUmO rUpa kAya Apti kAmatA kAle taTAgata pUjA satkAra kAle ca taTAviDaH BiniveSaH parivarjitaH	sngar mos pas spyod pa'i sa na gzugs kyi sku thob par 'dun pa'i dus dang / de bzhin gshegs pa mchod pa dang rim gro bya ba'i dus na de ltar mngon par zhen pa yongs su spang ba yin la /	90.59329541328663
samprati SudDa aDyASaya BUmO taTAgata rUpa kAya sampadam parinizpAdayitum samprasTitasya boDisattvasya rUpe BiniveSaH Bavati iti yAsAm prasidDiH tAsAm parizadAm durvikalpaH nirAkRtaH iti ukta	da ni lhag pa'i bsam pa dag pa'i sa na de bzhin gshegs pa'i gzugs kyi sku phun sum tshogs pa bsgrub pa'i phyir zhugs pa'i byang chub sems dpa' gzugs la mngon par zhen pa yod do zhes grag ces 'khor gang dag gi rnam par rtog pa ngan pa de bsal bar gsungs pa'i phyir ro //	83.52942828743583
evam tarhi taTAgatAnAm rUpa kAyaH kasmAt deSitaH iti vicintya tat kasya hetoH iti apRcCat	'o na de bzhin gshegs pa rnams kyi gzugs kyi sku ji ltar bstan snyam du sems shing / de ci'i slad du zhes dris te /	85.09744428860314
na rUpa kAya parinizpattyA taTAgataH drazwavyaH iti anena yojanIyam	gzugs kyi sku yongs su grub pas de bzhin gshegs par blta bar mi bya zhes bya ba dang sbyar ro //	90.15072597058963
na asO tAvat siDyati	'di ni grub pa med de gzugs kyi sku yan lag can gyi rang bzhin nam /	73.935762461494
avapavirUpeNa paramANu saQcaya rUpeNa vA rUpasya asidDa tvAt yaTA vicAritam prAk	rdul phra rab bsags pa'i rang bzhin du ma grub par ji ltar sngar dpyad pa bzhin no //	79.61111661114326
anena boDisattvena kaTam pratipattavyam tat nirdizwam	'dis ni byang chub sems dpas ji ltar bsgrub par bya ba de bstan to //	91.20745096100893
tena iti ityam saMvRtO BAvaH	des na zhes bya ba ni 'di ltar kun rdzob tu yod do /	85.03576275018546
na tu SaSa vizANa vat sarvaTABAvaH	ri bong gi rva bzhin du rnam pa thams cad du med pa ni ma yin pa'i phyir ro //	84.94853636430541
anena ca apavAda antam parihRtya kaTam cittam pragrahItavyam iti etat nirdizwam	'dis ni skur pa 'debs pa'i mtha' bkag nas ji ltar sems rab tu gzung bar bya ba de bstan to //	86.26136092186154
anena sarva sTAnena gAmBIryam pradarSitam	gnas 'di thams cad kyis ni zab pa bstan to //	85.64216595225864
saMvRtO taTAgatasya rUpa kAya sampadam nizpAdayitum boDisattvEH karaNIyAnAm yatnAnAm nidarSanena AdAryam api dIpitam	kun rdzob tu de bzhin gshegs pa'i gzugs kyi sku phun sum tshogs pa bsgrub pa'i phyir byang chub sems dpa' rnams kyis 'bad par bya ba bstan pas ni rgya che ba yang bstan to //	85.2889879975834
ba lakzaNa kAya sampad	mtshan gyi sku phun sum tshogs pa'i dbang du mdzad nas /	82.12509724072048
lakzaNa kAya sampadam aDikRtya tat kim manyase suBUte iti adya Aha	rab 'byor 'di ji snyam du sems zhes bya ba la sogs pa gsungs te /	82.49023002568316
atra pUrvavat sarvam aBihiatam vAka sampad	'dir bshad pa thams cad ni snga ma dang 'dra'o //	73.33159371784755
yadi rUpa kAya parinizpattyAa na taTAgataH drazwavyaH iti ced	gal te gzugs kyi sku yongs su grub pas de bzhin gshegs par blta bar mi bya na /	91.34512396363814
tadA deSanA api BagavatA na eva Bavet	de'i tshe bcom ldan 'das kyis bstan pa yang med par 'gyur te /	93.47358342909044
rUpa kAyena saMgRhItvAt tasyAH atas	de ni gzugs kyi @253b skus bsdus pa'i phyir ro //	87.56094806534904
boDisattavEH taTAgatasya vAc sampadam nizpAdayitum kaTam yatnaH karttavyaH iti vicintayadByaH vAc sampadam aDikRtya tat kim manyase su	de bas na byang chub sems dpas de bzhin gshegs pa'i gsung phun sum tshogs pa bsgrub pa'i phyir ji ltar 'bad par bya snyam du sems pa de'i ched du gsung phun sum tshogs pa'i dbang du mdzad nas / rab 'byor 'di ji snyam du sems zhes bya ba la sogs gsungs so //	81.77201790001041
paramArTataH vAcya vAcaka vacanAnAm aBAvAt na taTAgatasya evam Bavati mayA DarmaH deSitaH iti	don dam par 'chad pa po dang / bshad par bya ba dang / bshad pa med pa'i phyir de bzhin gshegs pa 'di snyam du ngas chos bstan to snyam du mi dgongs so //	91.35440705195741
anyaTA viparyayAt na Bavet sarvajQaH	de ltar ma yin na phyin ci log tu 'gyur ba'i phyir thams cad mkhyen par mi 'gyur so //	87.33308158550454
yaTA vAcakAH Atma AdayaH	ro //	15.770109176635739
vAcyAH bAhya ADyAtmikAH BAvAH	ji ltar 'chad pa po ste bdag la sogs pa dang / bshad par bya ba ste phyi nang gi dngos po dang / bshad pa ste /	69.509265830679
vacanAni karaNa rUpANi Sabda svaBAva aBAva AtmakAni vA taTA vistareNa prAk eva uktAni	byed pa gzugs sam sgra'i bdag nyid med pa de ltar ni sngar rgyas par bstan zin te /	70.38802572083303
sarve BAvAH SUnya tva vyAptAH prAk eva pratipAditAH	dngos po mtha' dag la stong pa nyid kyis khyab par sngar bsgrubs pa'i phyir ro //	80.3094618745802
saMvRtO vAcya vAcaka vacanAnAm avicAra ramaNIya tvena vyavahAra mAtraH eva te	kun rdzob tu 'chad pa po dang / bshad par bya ba dang / bshad pa ma brtags na dga' bas tha snyad 'dogs pa 'ba' zhig tu zad kyi don dam par ni ma yin no //	78.89845882535114
Bavanti na tu parama arTe yadi vastu tattvasya evam aBiDAne pi vyAmohena kicid paramArTataH trayANAm tezAm parAma arTa sattvam kalpayeyaH tadA kim nu syAt	gal te dngos po'i de kho na nyid de lta bu bstan du zin kyang kha cig mgo rmongs te don dam par gsum po yod par sems na de'i tshe cir 'gyur snyam pa la ma yin no //	78.77499547715827
iti vicintya yaH suBUte iti Adi Aha aByAcakzIta iti aByAlapet	/ rab 'byor su zhig ces bya ba la sogs pa gsungs so // skur pa ni don med par gleng ba'i phyir ro //	80.27501960104671
kaTam tat aBUtam Alapitum Sakyate iti vicAraNAyAm Aha asatA udgRhItena iti	ji ltar med pa des gleng bar nus snyam pa la /	69.1128971036627
viparIta aBiniveSataH vitaTa grahaNAt tat aBUtam iti arTaH	log par 'dzin pas zhes bya ba gsungs te / phyin ci log tu mngon par zhen pas log par zin pa'i phyir de med ces bya ba'i tha tshig go //	84.60574545398798
anena taTAgatasya vAc sampadi pravRttena boDisattvena pratiSrutka Adi vat jQAtvA pravartitavyam iti boDisattvena kaTam sTAtavyam iti deSitam	'dis ni de bzhin gshegs pa'i gsung phun sum tshogs pa la 'jug pa'i byang chub sems dpas brag ca la sogs pa lta bur shes pas 'jug par bya'o zhes byang chub sems dpa' ji ltar gnas par bya ba de bstan to//	88.87741608493519
yadi vacana Adi trayam asat tadA pudgala Darma nErAtmya deSakena BagavatA nAnA pada vAkya AtmikA iyam Darma deSanA kaTam prasiDyati tasyAm satyAm tad aBiDeyaH vAcyaH pi syAt eva	gal te bshad pa la sogs pa gsum po de med na gang zag dang chos la bdag med pa la sogs pa ston par byed pa bcom ldan 'das kyis chos bstan pa tshig dang ngag gi ngo bo sna tshogs 'di ji ltar grags /	76.50196182358269
yaH ca tad deSakaH vAcakaH	de yod na ni gang des bstan par bya ba ste /	66.72082534703343
saH pi Bavet eva tad balena trINi api vAcya vAcaka vacanAni	bshad par bya ba yang yod @254a * // pa nyid la / gang de ston par byed pa 'chad pa po de yang yod pa nyid de shugs kyis na gsum char yod do snyam du sems pa la de ci'i slad du zhes zhus pa dang / 'dir lan du chos bstan pa zhes bya ba gsungs so //	60.33578653598226
BaveyuH iti cintAyAm tat kasya hetoH iti pRzwam atra Darma deSanA iti udatarat	'di snyam du dgongs te /	36.58671014361746
ayam aBiprAyaH paramArTataH Darma deSanAyAm satyAm sA	chos bstan pa don dam par yod na rang gi mtshan nyid kyi ngo bo'am /	72.28075858438932
sva lakzaNa svaBAvA vA syAt sAmAnya lakzana svaBAvAH vA	spyi'i mtshan nyid kyi ngo bo zhig tu 'gyur grang na /	80.61851070045391
tatra na tAvat praTamaH pakzaH	re zhig phyogs dang po ni ma yin te /	94.12751286738627
sarvam pAramArTikam sva lakzaNam tAvat pUrvam eva vistareNa nirAkRtam	rang gi mtshan nyid don dam pa thams cad ni sngar rgya che bar gsal ba'i phyir ro //	79.30361644559201
na ca dbitIyaH pi	gnyis pa yang ma yin te /	68.11676783561707
asati sva lakzaNe ADArasya aBAvena kasyacid api asattvAt	rang gi mtshan nyid med na gnas med pas ci yang med pa'i phyir ro //	84.90651855900119
