evam tAvat rUpa Adi AyatanAnAm bAhya vastUnAm na ekatvam	'di ltar re zhig gang gzugs la sogs pa'i skye mched phyi rol gyi dngos po de ni gcig pu ma yin te /	80.26809480203273
AvRti anAvRtya urvirudDarmayoH tatra upalabDe	bsgribs pa dang ma bsgribs pa la sogs pa chos 'gal ba dmigs pa'i phyir ro ma yin te /	71.88357217691919
api ca virudDa Darma saMsarge pyekatve viSvam api eka dravyam syAt	// chos 'gal ba dang ldan bzhin du yang gcig pa nyid ni thams cad kyang rdzas gcig tu 'gyur te /	90.08425883792238
tatas yugapad utpatti vinASO syAtAm	de'i phyir lhan cig 'byung ba dang 'jig par 'gyur ro //	80.46839202534069
na aneka tvam api	du ma yang ma yin te /	86.9338972785256
taTA hi anekasmin viBajyamAne sati viBaktAH paramANavaH eva syuH tatas ca pOrvAparya avasTAnam na syAt niravayava tvAt paramANUnAm	'di ltar du mar bshig na rdul phra rab tu tha dad par 'gyur la /	54.598863466286865
citta cEtasika vat tatas diSam vyApya avasTitAH na pratiBAseran	rdul phra rab rnams kyang cha shas med pa'i phyir pha rol dang tshul rol na gnas pa ni med de sems dang sems las byung ba bzhin no // de'i phyir phyogs la khyab par gnas par snang bar yang mi 'gyur ba zhig na 'gyur te /	75.86537232627977
atas eva diS BAga BedaH ByupagantavyaH eva sati ca aByupagame kaTam nAma Bavet ekatvam	de bas na phyogs cha tha dad par khas blang bar bya'o ; / de khas len na ni gcig par ji ltar 'gyur /	86.48770667060272
atas sidDaH eva tAvat eka aneka svaBAva viraha tvam bAhya arTAnAm	de lta bas na de ltar re zhig phyi rol gyi don gcig dang du ma'i rang bzhin dang bral ba nyid du grub bo //	94.02802608398716
nIla Adi pratiBAsinaH jQAnasya api na eka svaBAva tvam citra AkAra grahitayA avaBAsyamAna tvAt	sngon po la sogs par snang ba'i shes pa yang ri mo'i rnam pa 'dzin par snang ba'i phyir gcig pu'i ngo bo nyid ma yin te /	89.6801958404909
Binna santAna vartti aneka vijQAna kzaNa vat	tha dad pa'i rgyud la yod pa'i rnam par shes pa'i skad cig ma du ma bzhin no //	91.54750493048567
yaTA saMKyam aneka vijQAnAni yugapad pravartante iti api vaktum na yujyate niravayavAnAm amUrtAnAm Kalu pOrvAparya avasTiteH ayukta tvA	du ma rnam grangs bzhin du rnam par shes pa cig car 'byung ngo zhes brjod du yang mi rung ste / cha shas med pa dang lus med pa rnams la ni / tshu rol dang pha rol na gnas pa mi rigs pa'i phyir ro //	82.86744939829005
taTA avasTAna aBAve na taTA avaBAsaH	de ltar gnas pa med na ni / de ltar snang bar @218b mi 'gyur ro //	86.28392966551256
aTa syAt vijQAnam tu ekam eva	'on te rnam par shes pa ni gcig pu kho na yin la /	90.50628881454467
miTyA AkArANAm tatra avaBAsyamAna tvAt na nAnAtva dozaH iti ced	rnam pa brdzun pa rnams de la snang bas sna tshogs kyi skyon du mi 'gyur ro zhe na /	91.20333101530962
sati ca evam kaTam te tatra BAseran mRzAH	gal te de lta na go brdzun pa de dag ji ltar de la snang bar 'gyur /	86.18184277853909
avaBAsaH iti prakASa AtmakaH ucyate	snang zhes bya ba ni gsal ba'i bdag nyid la bya ste /	93.10629130309482
tasya jQAna gata Darma tve sati miTyA AkArANAm SaSa vizANa Adi vat atyanta aByAvaH syAt iti kaTam avaBAseH an= iti	de ni shes pa'i bdag nyid du gtogs pa'i chos yin na brdzun ba ri bong gi rva la sogs pa dang 'dra bar shin du med na go snang bar ji ltar 'gyur /	87.71902255716348
tatas prakASa Atmaka AkAreByaH mRzA tvena aByupeteByaH kaH tAvat anyaH jQAna svaBAvaH sat BUtaH te vaSizyate prakASa Atma lakzaNa tvAt vijQAnasya nIla AdayaH pi prakASa AtmakAH svaBAvena avaBAsyamAna tvAt	de lta bas na gsal ba'i bdag nyid kyi rnam pa rnams brdzun pa nyid du khas len na khyod kyi bden par 'gyur ba gang yin pa shes pa'i ngo bo gzhan ci zhig lus te /	57.74781471374681
nIla AdInAm sva svaBAvAt Binnam yat anyat prakASa rUpam iti sadBUtam kim api na ati	rnam par shes pa yang gsal ba'i bdag nyid zhes bya ba ci yang yod pa ma yin te /	80.17850055939635
anya vyavacCeda apekzayA viSeze prAyaSas vyavahArAt	gzhan rnam par bcad pa la ltos nas bye brag rnams kho na la spyir tha snyad 'dogs pa'i phyir ro //	87.21000868093746
viSezANAm miTyAtve sarvezAm miTyAtvam ati vispazwam syAt	bye brag rnams brdzun na ni thams cad kyang brdzun par shin du gsal bar 'gyur te /	81.0929318413815
nirAkArasya miTyA AkAra rasya sati a AkAra Atmani sa AkAra Atmani jQAne kaTam niyamena Aa BAsaH syAt	rnam par yod pa ma yin pa rnams ni bden pa'i ngo bo'i shes pa'i bdag nyid de la gang gis na de la nges par snang bar 'gyur ba de'i bdag nyid kyi mtshan nyid dam /	83.82734209388278
tayoH tAvat tAdAtmya lakzaNaH vA tad utpatti lakzaNaH vA sambanDaH eva na asti	de las 'byung ba'i mtshan nyid kyis 'brel pa yang med do //	76.91114090393602
sambanDa aBAve na Kalu yujyate vaBAsanam	'brel pa med na ni snang bar mi rigs te /	88.6721694411301
atiprasaFgAt	ha cang thal bar 'gyur ba'i phyir ro //	91.33784217100877
atas eva na asti tAvat asidDaH hetuH	de bas na gtan tshigs ma grub pa yang ma yin no //	92.67879371643066
BAvAnAm anya AkAra aBAvAt na api EkAntikaH	dngos po'i rnam pa gzhan med pa'i phyir ma nges pa yang ma yin no //	91.18944826622462
na ca api virudDa sa pakze sattvAt	mthun pa'i phyogs la yod pa'i phyir 'gal ba yang ma yin no //	89.54085442277253
atas eva yaTA yaTArTAH cityante viSIryante taTA taTA	de lta bas na dngos po rnams ji lta ji ltar rnam par brtags pa de lta de ltar 'brel lo//	89.76090432279148
taTA ca uktam	de nyid kyi phyir / dngos rnams ji ltar rnam brtags na //	52.76298105507566
vastu svaBAva cintAyAm yaTA na sat svaBAva tA	bden bar de yi ngo bo med //	70.15103503635952
eka aneka svaBAvaH pi na tezAm vidyate taTA	'di ltar de dag gcig pu dang // du ma'i ngo bor yod ma yin //	89.14632911596475
api cAri alaFkA avatAre BagavatA uktam	zhes bshad do // bcom ldan 'das kyis kyang 'phags pa lang kar gshegs pa las /	83.38460490610446
yaTA hi darpaNe rUpam ekatva anyatva varjitam	ji ltar gzugs rnams me long la ; / gcig dang gzhan yang rnam spangs par //	79.86634469033179
dRSyate na ca tat na asti taTA ca utpAda lakzaNam	snang yang de na yod ma yin // de ltar dngos po'i ngo bo nyid //	90.04013640928439
budDyA vivecyamAnAnAm svaBAvaH na avaDAryate	blo yis rnam par gzhigs na go // ngo bo nyid ni gzung du med //	86.98508976740038
tasmAt anaBilApyAH te niHsvaBAvAH ca deSitAH	de phyir de dag brjod med cing // ngo bo nyid kyang med par bshad // ces gsungs so // de bzhin @219a * //	88.11414053222158
taTA cAryam ADirAja sUtre pi	du 'phags pa ting nge 'dzin gyi rgyal po'i mdo las kyang /	79.2648530335262
yaTA eva Ardram kadalIya skanDam sAra arTikaH puruzu vipAwayet	dper na chu shing rlon pa'i sdong po la // snying po 'dod mis rim par bshig byas kyang //	73.73804467006494
bahis vA aDyAtma na sAram asti taTA upamAn jAnaTa sarva DarmAn	phyi dang nang na snying po yod min pa // de ltar chos rnams thams cad shes par gyis //	84.90761417319887
tasmAt sarva BAvAnAm mAyA vat avicAra ramaNIya tvAt anaBiniveSena dAnam dAtavyam	zhes gsungs so // de lta bas na dngos po thams cad sgyu ma bzhin du ma brtags na dga' ba yin pas de ltar mngon par ma zhen par sbyin pa sbyin bar bya'o //	85.23636628356009
na tu vastu pratizWitena iti ayam arTaH tra yukti saFgataH	dngos po la gnas pas ni ma yin no zhes bya ba'i don 'di 'dir rigs pa dang ldan pa yin no //	88.17114528049227
evam dAna Adizu yaTA yogaH taTA AdarSitaH na anyatra yadi paramArTata kasyacid api vastunaH BAva aBAvAt vastu pratizWitena dAnam na dAtavyam tadA avastu aBiniveSena tu dAnasya kaTA eva kA	de ltar na sbyin pa la sogs pa la sbyor ba ji lta ba bzhin du yong pa yongs su bstan pa yin gyi gzhan du ni ma yin no // gal te don dam par dngos po ci yang med pas dngos po la gnas pas sbyin pa sbyin par me bya na dngos po med pa la mngon par zhen pas sbyin par bya ba lta zhig snyam // pa las /	89.5845869042658
atas eva na kvacipratizWitena iti uktam	ci la yang mi gnas par zhes bya ba gsungs so //	84.33894511486622
boDisattvena aBAva vikalpaH pi prahAtavyaH	byang chub sems dpas dngos po med par rnam par rtog pa yang spang bar bya ste /	89.97669954823847
BAva grAha aBAve sati tasya api aBAvAt	de ni dngos por 'dzin pa med na med pa'i phyir ro //	92.81992099835323
saMvRtO tAvat deya dAyaka AdayaH Bavanti eva	kun rdzob tu ni sbyin par bya ba dang / sbyin pa po la sogs pa yod de /	88.14773240493969
tatas vastunaH BAve pi tAvat aBiniveSaH na yujyate eva iti aBiprAyaH	de'i phyir dngos po med pa la mngon par zhen pa yang mi rigs par dgongs pa'o //	89.66251806812942
na rUpa pratizWitena ityAdinA boDisattvena na kvacid pratizWitena dAnam dAtavyam iti eva vistareNa aBihitam	gzugs la mi gnas par zhes bya ba la sogs pas ni byang chub sems dpas gang la mi gnas par sbyin pa sbyin par bya ba de nyid rgyas par ston to //	83.69182545903445
DarmaH iti anena Sabdena Darma Ayatanam parigRhyate	chos zhes bya ba'i sgras ni chos kyi skye mched yongs su gzung ngo //	90.8218564912691
Ayatanena prapaQcaH aBivyajyate atas cakzuH a AdIni ADyAtmika AyatanAni na ucyante	skye mched 'dis ni spros te mtshon pa yin pas des na mig la sogs pa nang gi skye mched rnams ma smos so //	85.77901454414956
anutpAda AdayaH vikalpAH api na karaNIyAH iti nidarSana arTa suBUte yaTA iti Adi uktam	mi skye ba la sogs par rnam par rtog pa yang mi bya'o zhes bstan pa'i phyir rab 'byor ci nas zhes bya ba la sogs pa gsungs te /	82.984185355546
nimittam tu vastu sva lakzaNam liFgam vA anutpAda Adi	mtshan ma ni dngos po'i rang gi mtshon pa ste rtags so // de yang ma skyes pa la sogs pa'o //	90.44778340487728
tasya udgrahaNam saMjQA	de la rtogs pa ni 'du shes so //	81.89922904968262
tatra nirvikalpantu apratizWitam	de la rnam par mi rtog pa ni de la mi gnas pa'o //	85.7763596534729
atas eva na kvacid pratizWitena iti nirdizwam	des ni ci la yang mi gnas par zhes bya ba de bstan to //	86.24844131108897
aTavA samagreNa etena gAmBIryam asya vyapadizwam	yang na 'di mtha' dag gis ni 'dis zab pa yang bstan la /	82.59857912492292
aDyAra upAvAda antO pratizidDO ca iti	sgro btags pa dang skur ba 'debs pa'i mtha' dgag pa yang bstan to //	70.47312204765375
asmin darSane upalamBakAnAm jQAna puNya samBAra pAripUraH yogya tvam pratiziDyate	dmigs pa can rnams @219b lta ba 'di la ni bsod nams dang ye shes kyi tshogs yongs su rdzogs par bya bar rung ba bkag ste /	87.9619200007563
evam pUjA anugraha kAmyayA yat dIyate tena atitarAm samprasAdaH janyate na tu deya dAyaka pratigrAhaka an upalamBe pratizWita tvena	'di ltar mchod pa dang phan gdags par 'dod pas gang byin pa de shin tu dang ba bskyed kyi / sbyin par bya ba dang / sbyin pa po dang / len pa po mi dmigs pa la gnas pas ni ma yin no //	84.68145363098596
evam hi aBAvaH deya Adi anupalabDa tvAt vizayasya aBAvAt ca praTama pakze kena api kasyacid api deyasya aBAvAt puNya aBAvaH prasajyate dvitIya pakze tAvat boDisattvEH yaH hi sattva arTam SramaH AsTitaH saH pi vyarTaH syAt sattva aBAvAt	'di ltar med pa'i phyir sbyin par bya ba la sogs pa mi dmigs sam 'on te yul med pa'i phyir phyogs dang po ni sus ci yang byin pa med pas bsod nams med par thal bar 'gyur ro // sems can dag med pa'i phyir byang chub sems dpa' rnams sems can gyi don gyi phyir yongs su ngal bar byas pa de yang don med par 'gyur // te /	78.93159478791365
atas eva na aBAva mAtram	de lta bas na med pa kho na ni ma yin no //	83.28218336992485
BagavatA deyA Adi vastUnAm dRzwa tvAt na ca vizayasya api aBAvaH	bcom ldan 'das kyis sbyin par bya ba la sogs pa'i dngos po gzigs pas yul ma yin no //	81.7733981962208
anyaTA kaTam BagavatA arTi janeByaH putra AdayaH pradattA iti sarvANi etAni codyAni manasi niDAya tat kasya hetoH	de lta ma yin na 'dod pa rnams la bcom ldan 'das kyis sras la sogs pa ji ltar yongs su btang bar 'gyur zhes rgol bar byed pa de mtha' dag sems la bzhag nas / de ci'i slad du zhes zhus pa dang lan du /	86.39948873843176
iti pRcCAyAm yaH suBUte	rab 'byor byang chub sems dpa' gang zhes bya ba la sogs pa gsungs so //	77.87022780700468
boDisattvaH ityAdinA visarjitam	dgongs pa ni 'di yin te /	56.7088376045227
ayam aBiprAyaH samyak dRwi vihitAni dAna AdIni su viSudDa tayA viSizwa izwa PalAni aBinirvartayanti	yang dag pa'i lta ba las byung ba'i sbyin pa la sogs pa ni yongs su dag pa'i phyir 'bras bu yid du 'ong ba khyad par du 'phags pa mngon par 'grub par byed pa yin gyi /	87.2336266820112
na viparIta tayA samudBUtAni	phyin ci log nas 'byung bas ni ma yin no //	75.62410879689594
miTyA dRzwi pravartita SIla aFga Adi vat	log par lta ba las byung ba'i tshul khrims kyi yan lag la sogs pa bzhin no //	90.82156288931125
deyA Adi vastUni yaTA ukta nyAyena kaTaQcid api asattvAt miTyA upalabDAni eva	sbyin par bya ba la sogs pa'i dngos po ni ji skad smos pa'i tshul gyis na gang yang med pas der dmigs pa ni phyin ci log kho na ste /	81.27199513702517
marIcikAsu udaka upalamBa vat	smig rgyu la chur dmigs pa bzhin no //	83.92357513779089
tasmAt tad udBUtaH sarva pAramitA aiDiH tAvat Atma AtmIya viparyasa udgata sa udgata dAna Adi vat aviSudDa hetoH samBUta tvAt kzINa balaH	de bas na de las byung ba'i pha rol tu phyin pa'i tshul thams cad ni bdag dang bdag gir phyin ci log las byung ba'i sbyin pa la sogs pa bzhin du rgyu rnam par dag pa ma yin pa las byung bas stobs chung ba'o //	87.50967265844936
deyA Adi upalakzaNa prApta anupalamBaH tu BUrta arTa gocara tvAt aviparyastaH	sbyin par bya ba la sogs pa dmigs pa'i rig byar gyur pa mi dmigs pa ni yang dag pa'i don gyis yul yin pas phyin ci ma log pa ste /	87.05431369906378
maricikAyAm udaka anupalabDi vat	smig rgyu la chur dmigs pa bzhin no //	83.11054569796512
tasmAt upacita hetu samBUta dAna AdIni bRhat PalAni	de bas na rgyas pa'i rgyu las byung ba'i phyir de las sbyin pa @220a * //	83.00504723225603
puzwa bIja aBinirvRtta aFkura Adi vat	la sogs pa 'bras bu che ba yin te / sa bon grung po las mngon par grub pa'i myu gu la sogs pa bzhin no //	87.6714113912129
atas eva anupalamBa pratizWitAni dAna AdIni samyak dRzwi samBUtAni iti vipaScitsu prasAda atiSayam janayanti na anyezu	de bas na mi dmigs pa la gnas pa'i sbyin pa la sogs pa de ni yang dag pa'i lta ba las byung bas mkhas pa rnams la shin du dang ba bskyed pa yin gyi gzhan ni ma yin no //	85.66132708289362
tatas ca dAna Adizu apravRtta tayA puNya aBAvaH deyA AdInAm ca ekAnta aBAvaH na izyate	gang gis na sbyin pa la sogs pa la mi 'jug pa'i phyir bsod nams med par 'gyur ba sbyin par bya ba la sogs pa gcig tu med par 'dod pa yang ma yin te /	88.82027366297336
saMvRti sattva aByupagamAt	kun rdzob tu yod par khas blangs pa'i phyir ro //	88.58108320528147
asamAhita avasTAyAm mAyA vat upalamBAt na sarvatra anupalamBaH	mnyam par ma bzhag pa'i gnas skabs na sgyu ma lta bur dmigs pa'i phyir thams cad du dmigs pa med pa yang ma yin no //	88.71416130806264
tadA ca aDimuktitaH prAdurBAvAt eva anupalamBaH vyavasTApyate	de'i tshe na yang mos pa las byung ba'i dmigs par ni rnam par gzhag go //	81.92497957236722
samAhita avasTAyAm upalamBasya atyanta aBAva mAtram	mnyam par bzhag pa'i gnas skabs na ni shin tu dmigs pa med pa kho na ste /	85.03716076375883
tadA dAna Adizu pravRttiH na aByupeyate prayoga avasTAyAm	de'i tshe na ni sbyin pa la sogs par 'jug par khas mi len gyi / dang po sbyor ba'i gnas skabs sam //	87.29764219452166
vyutTita avasTAyAm vA kriyayA upAlamBaH na yujyate	langs pa rnams la bya bas klan kar mi rung ngo //	61.298699043235
atas mahA Pala tvAya pAramitA yogasya edAryam aBiDIyate saMvRtO kArya kAraNa BAvasya upadarSanAt apavAda antaH pi niziDyate rUpa kAya Apti kAma tA sTAnam	'dis ni 'bras bu che ba'i phyir pha rol tu phyin pa la sbyor ba'i rgya che ba brjod do // kun rdzob tu rgyu dang 'bras bu'i dngos po nye bar ston pas skur pa 'debs pa'i mtha' bkag par yang gyur to //	83.61047648367791
triDA puNyam AkASa samam Bavati sarvatragodAra akzaya tvEH	rnam pa gsum gyis na bsod nams nam mkha' dang mtshungs pa yin te / thams cad du song ba dang / rgya che ba dang / mi zad pas so //	84.61511746052909
lOkika loka uttara puNya prasavanAt sarvatraga tvam	'jig rten pa dang 'jig rten las 'das pa'i bsod nams bskyed pas thams cad du song ba ste /	86.07994476543706
lOkikam tAvat puNyam asamAhita avasTAyAm prasUyate	'jig rten pa'i bsod nams ni mnyam par ma gzhag pa'i gnas skabs bskyed do //	92.3440038843966
loka uttaram tu samAhita avasTAyAm eva	'jig rten las 'das pa ni mnyam par bzhag pa'i gnas skabs so //	91.84858786675237
viSizwa viSizwatara gamanAt udAra tvam	khyad zhugs par khyad par du 'gro bas rgya che ba'o //	83.09671316323457
yAvat saMsAram aparyAdAnAt akzaya tvam	'khor ba ji srid kyi bar du yongs su gtugs par mi 'gyur bas mi zad pa'o //	80.81081033980882
tad aBAvAt na rUpa pratizWitena dAnam dAtavyam iti boDisattvaH taTAgata rUpa kAyAptikAmanayA dAna Adizu kaTam pravarteta iti ced iti ca udyam ASaFkaya tat kim manyase suBUte ityAdinA rUpa kAya Apti kAma tA sTAnam nirdizwam	gal te de med pa'i phyir gzugs la mi gnas pa sbyin pa sbyin par bya na de'i tshe byang chub sems dpa' de bzhin gshegs pa'i gzugs kyi sku thob par 'dod pas sbyin pa la sogs pa la ji ltar 'jug par bya zhes brgal du dogs nas / rab 'byor 'di ji snyam du sems zhes bya ba la sogs pas gzugs @220b kyi sku thob par 'dun pa'i gnas ston te /	84.99057781759947
arTataH tra rUpa kAye taTAgatatva aBimAna lakzaNaH vipakzaH pAkriyate	'dir don gyis na gzugs kyi sku la de bzhin gshegs par mngon pa'i nga rgyal gyi mtshan nyid mi mthun pa'i phyogs sel to //	86.12858395220249
lakzaNa sampadA iti nimitta mAtra aBiDAnena taTAgatasya niKilaH rUpa kAyaH lakzaNa anuvyaQjanEH alaFkRtaH paridIpitaH	mtshan phun sum tshogs pa zhes mtshan ma tsam zhig yongs su brjod pas de bzhin gshegs pa'i gzugs kyi sku mtshan dang dpe byad bzang pos brgyan pa mtha' dag yongs su ston to //	88.75411994432541
tatra lakzaNAni tAvat cakra aFka hasta pAda tA AdIni dvAtriMSat pada bAhulya BiyAH na ulliKyante	de la mtshan rnams ni phyag dang zhabs la 'khor lo mnga' ba la sogs pa sum cu rtsa gnyis te /	78.69297340925979
sUtrezu yaTA uktAnI taTA eva avaDeyAni	tshig mangs kyis dogs bas ma bris kyi mdo las ji skad 'byung ba bzhin du khong du chud par gyis shig / de dag kyang yul na te /	77.08538548161536
sTAna sTa uttapta pUrNa tvena nizpattiH	gnas pa dang / gsal ba dang / rdzogs pas phun sum tshogs pa'o //	69.6402337770223
aSItiH anu vyaQcanAni tAmra varNa naKa AdIni	dpe byad bzang po brgyad cu dag ni sen mo zangs kyi mdog 'dra ba la sogs pa ste /	86.34845567607724
yaTAsUtram jQAtavyAni tAni lakzanAdIni api mAyA nirmita budDa lakzaNa vat miTyA eva	mdo las 'byung ba bzhin du shes par gyis shig / mtshan la sogs pa de dag kyang sgyu mas sprul pa'i sangs rgyas kyi mtshan bzhin du brdzun pa'i phyir ro //	85.51738988296928
atas eva taTAviDe rUpa kAye Canda praNiDAnAByAm sTAtavyam iti nirdeSaH	de bas na gzugs kyi sku rnam pa de lta bu la 'dun pa dang smon lam gyis gnas par bya'o zhes ston to //	89.68947472136175
aTa imAni lakzaNAni paramANu saQcaya svaBAvAni vA tad ArabDa a= ayavi rUpANi vA BaveyuH iti	'di ltar mtshan de dag kyang rdul phra rab bsags pa'i ngo bo nyid dam / des brtsams pa yan lag can gyi gzugs zhig tu gyur grang na /	87.19168104538099
na tAvat praTamaH pakza	re zhig phyogs dang po ni ma yin te /	94.04754005896079
paramANUnAm pUrvam eva nirasta tvAt	rdul phra rab rnams sngar bshig zin pa'i phyir ro //	90.4715852003831
na api dvitIyaH	gnyis pa yang ma yin no //	93.2320079069871
asati ca AramBake tadA ArabDO= ayavinaH pyaBAvAt pUrva ukta AvaraNa Adi virudDarma upalamBAt ca	rtsom par byed pa med na des na brtsams pa yan lag can yang med pa'i phyir dang / sgrib pa la sogs pa 'gal ba'i chos sngar bshad pa dag dmigs pa'i phyir ro //	88.90476820376773
tad uddizwena aBihitaH BiprAyaH	de'i phyir smras pa las dgongs pa gsungs te /	53.45376247829861
etat vicintya suBUtiH Aha no hi idam iti vyaktIkRtam	de la brtags nas rab 'byor gyis / de ni ma lags te zhes gsal to //	81.73700373583698
yadi lakzaNAni mRzA BaveyuH tarhi kaTam BagavatA tad tad sUtrezu lakzaNAni samupadizwAni iti cintayan tat kasya hetoH iti pRzwvA evam siti Aha	gal te mtshan rnams brdzun pa nyid yin na 'o na bcom ldan 'das kyis mdo sde de dang de dag slas mtshan rnams gsungs snyam du bsams shing / de ci'i slad du zhes dris pa dang / de nyid mtshan phun sum tshogs pa med pa'i phyir ro zhes bya ba smras te /	89.85093029318023
sA lakzaNa sampad tAvat na uktA paramArTataH	mtshan phun sum tshogs pa de don dam par gsungs pa ni ma yin gyi /	89.70880108695152
mAyA nirmita budDa vat iti anena mRzA svaBAva tva mAtram uktam iti arTaH	sgyu mas sprul pa'i sangs rgyas bzhin du des brdzun pa'i ngo bo kho nar gsungs so zhes bya ba'i tha tshig go // 'phags @221a * //	91.85632342904623
Arya suBUtinA uktam eva arTa paripUrayitum BagavatA yAvat iti Adi Aha	pa rab 'byor gyis smras pa'i don de nyid bcom ldan 'das kyis bskang ba'i phyir ji tsam du zhes bya ba la sogs pa gsungs so //	85.78075424593978
yAvat lakzaNa sampad iti paramArTataH yAvat lakzana sampatsu aBiniveSaH tAvat miTyA aBiniveSaH eva iti arTaH	ji tsam du mtshan phun sum tshogs pa zhes bya ba ni don dam par ni ji tsam du mtshan phun sum tshogs par mngon par zhen pa de tsam du log par mngon par zhen pa yin no zhes bya ba'i tha tshig go //	89.45389589738538
yaToktam eva pUrvam	sngar ji skad bstan pa bzhin no //	70.38938609291525
yAvat lakzaNa sampad iti tad vIparIta tayA aBihitA iti avagantavyam	ji tsam du mtshan phun sum tshogs pa med pa zhes bya ba ni bzlog ste bshad par khong du chud par bya'o //	84.56605074553681
etena yoga samApattyA kaTam pratipattavyam iti tad deSitam kaTam anta dvayam parivarjya cittam pragrahItavyam iti tat nirdizwam	'dis ni 'di la rnal 'byor la snyoms par 'jug pas ji ltar bsgrub par bya ba de bstan to ; /'di la ji ltar mtha' gnyis spangs nas sems rab tu gzung bar bya ba de ston te /	87.32077195460984
evam iti mAyA nirmita budDa vat lakzaNataH taTAgataH drazwavyaH	de ltar zhes bya ba ni sgyu mas sprul pa'i sangs rgyas bzhin du mtshan gyis de bzhin gshegs pa blta bar bya'o //	93.71432459261652
anena apavAda antaH nirAkriyate	'dis ni skur ba 'debs pa'i mtha' sel te /	84.64500755217017
saMvRtO BagavataH rUpa kAya spa apratyAKyAnAt	kun rdzob tu bcom ldan 'das kyi gzugs kyi sku la skur pa mi 'debs pa'i phyir ro //	86.73759453867892
alakzaNam tAvat parama arTe drazwavyam	mtshan med pa ni don dam par blta bar bya ste /	81.19102238594218
kasya api lakzaNasya asidDa tvAt	mtshan gang yang grub pa med pa'i phyir ro //	91.73296981387668
anena tAvat samAropa antaH nirAkriyate	'dis ni sgro btags pa'i mtha' bsal to //	83.51950311660767
taTAgatasya rUpakAya avAptaye praNiDAnEH tu a OdAryam uktam	de bzhin gshegs pa'i gzugs kyi sku thob par bya ba'i phyir smon lam 'debs pas ni rgya che ba brjod do //	85.45949217552639
tad anupalamBa tayA ca gAmBIryam	de mi dmigs pas ni zab pa'o //	86.62333043416342
rUpa kAya Apti kAma tA sTAnam tAvat uktam Darma kAya Apti kAma tA sTAnam  a	gzugs kyi sku thob par 'dun pa'i gnas bshad zin to //	76.35213993297003
pravacana Darma kAyaH	chos kyi sku ni rnam pa gnyis te /	77.57890908858356
dviviDaH Kalu Darma kAyaH pravacana Darma kAyaH aDigama Darma kAyaH ca	bshad pa'i chos kyi sku dang / rtogs pa'i chos kyi sku'o //	83.77136104702743
aDigama Darma kAyaH pi dviviDaH jQAna hetukaH puNya hetukaH ca	rtogs pa'i chos kyi sku yang rnam pa gnyis te / ye shes kyi rgyu can dang / bsod nams kyi rgyu can no //	95.32513434127577
tatra anAgate puruzezu paQca kazAyANAm ADikyAt evaMviDa Darma ratnasya atyanta gamBIra udAra Pala tvAt pravacana Darma kAye na Aptatva ASaFkayA apRzwavAn	de la ma 'ongs pa'i skye bo snyigs ma lnga shas che ba'i phyir dang / chos dkon mchog 'di 'dra ba yang 'bras bu shin tu zab cing rgya che ba'i phyir bshad pa'i chos kyi sku la yid mi ches su dogs nas mchis lags sam zhes zhus te /	89.40009222383742
asti iti padam tu kecid sattvAH ye imezu evaMrUpezu sUtrAnta padezu BAzyamANezu BUta saMjQAm utpAdayizyanti iti arTa padena yojyam	mchis lags sam zhes bya ba'i tshig ni ci sems can gang la la dag 'di lta bu'i mdo sde'i chos bshad pa la yang dag par 'du shes bskyed par 'gyur ba 'byung ba dag ces bya ba'i tshig gi don de dang sbyar ro //	89.15403461726926
paScimAyAm paQcaSatyAm iti atra SatAnAm paQcakam paQcaSatI	lnga brgya tha ma zhes bya ba la brgya phrag lnga'i tshogs ni lnga brgya ste /	86.34407809874389
BagavatAm SAsanam paQca Sata varzANi sTAsyati iti prasidDeH atas eva paScimA iti viSezaNam vihitam	bcom ldan 'das kyi bstan @221b pa lnga brgya phrag lnga'i bar du gnas zhes grags pas de'i phyir tham zhes bye brag tu mdzad de /	81.12816956966358
tasmin kAle paQca kazAyANAm aDimAtra tA Bavati	de'i tshe snyigs ma lnga po dag ni shas che ba'i phyir ro //	84.06658864271009
sat Darma vipralopaH tAvat aDimukti vAcana svADyAya OpadeSaa AKyAna SravaNa cintA AdInAm hAniH	dam pa'i chos rab tu rnam par 'jig pa ni mos pa dang / klog pa dang / kha ton byed pa dang / lung nod pa dang / 'chad pa dang / nyan pa dang / sems pa la sogs pa nyams pa'o //	88.49973079332993
evam iti gamBIra udAra arTaH	'di lta bu zhes bya ba ni don zab cing rgya che ba'o //	86.69444235888395
sUtrAnta padezu iti sUtrAnta deSanA vAcaH	mdo sde'i tshig ces bya ba ni mdo sde bstan pa'i ngag rnams te / 'di dag gis don rtogs par byed /	80.50117368295643
tABiH arTasya pratipAdyamAna tvAt jQApyamAna tvAt ca	shes par byed pa'i phyir ro //	64.18470255533855
anena nimitta mAtra aBiDAnena samasta pravacana Darma kAyaH tAvat paridIpyate	mtshan ma tsam yongs su brjod pa 'di bshad pa'i chos kyi sku mtha' dag yongs su ston to //	82.3314887547562
aTavA sUtrAnta padezu iti aBiDiyamAna arTakezu	yang na mdo sde'i tshig dag ni brjod par bya ba'i tha tshig go //	84.63600768935147
asmin kaTane evam iti anena tAvat gamBIra OdArye yojanIye	bshad pa 'dir ni 'di lta bu zhes bya ba ni zab cing rgya che ba zhes bya bar sbyar ro //	87.61282687722506
BAzyamANezu iti praTama tayA aBiDiyamAnezu	bshad pa dag la zhes bya ba ni dang po ltar ni brjod pa rnams la zhes bya'o ro //	86.81837444120585
dvItIyatayA arTa pratipAdakezu iti arTaH	// gnyis pa la ni don ston pa rnams la zhes bya ba'i tha tshig go //	85.95586069728655
arTataH viparyayaH ta saMjQA eva atra BUta saMjQA iti aBiDIyate na tu Sabda aBiniveSa mAtram ayam BUtaH iti saMjQA	don la phyin ci ma log par 'du shes pa ni 'dir yang dag par 'du shes pa yin gyi / sgra ji bzhin du mngon par zhen nas 'di yang dag pa'o snyam du 'du shes pa la mi / bya'o //	88.66192884145849
