nivaraNa dOzWulyam vitarkka dOzWulyam AhAra dOzWulyam mETuna dOzWulyam svapna dOzWulyam vyADi dOzWulyam jarA dOzWulyam maraNa dOzWulyam pariSrama dOzWulyam dRXa dOzWulyam OdArika dOzWulyam maDya dOzWulyam sUkzma dOzWulyam samApatti AvaraNa dOzWulyam jQeya AvaraNa dOzWulyam ca	len dang / nyon mongs pa'i sgrib pa'i gnas len dang / las kyi sgrib pa'i gnas len dang / rnam par smin pa'i sgrib pa'i gnas len dang / grib pa'i gnas len dang / rtog pa'i gnas len dang / zas kyi gnas ngan len dang / 'khrig pa'i gnas len dang / rmi lam gyi gnas ngan len dang / nad kyi gnas ngan len dang / rga ba'i gnas ngan len dang / 'chi ba'i gnas ngan len dang / yongs su ngal ba'i gnas ngan len dang / gnas ngan len brtan pa dang / gnas ngan len chen po dang / gnas ngan len 'bring po dang / gnas ngan len chung ngu dang / nyin mongs pa'i sgrib pa'i gnas ngan len dang / snyoms par 'jug pa'i sgrib pa'i gnas ngan len dang / shes bya'i sgrib pa'i gnas ngan len to //	66.89019814522246
saMyogaH katamaH	'phrad pa'i 'thob pa rnams gang zhe na /	67.64523196220398
dOzWulya Acitezu saMyoga lABa ta iti vijQaptiH	gnas ngan len bsags pa la 'thob pas zhes gdags so //	85.08981836759128
visaMyogaH katamaH	'bras ba'i 'thob pa rnams gang zhe na /	59.35023478361276
dOzWulya vikziptezu visaMyoga lABata iti vijQaptiH	gnas ngan len zad pa la bral ba'i 'thob pa zhes gdags so //	88.01308241062654
vajra upamaH samADiH katamaH	rdo rje lta bu'i ting nge 'dzin gang zhe na /	95.42910634146796
BAvanA mArga gatasya tad uttaram saMyojana prahANa mArgava sTAyAm yaH samADiH prayoga mArga saMgrahaH vA Anantarya mArga saMgrahaH vA	sbyor ba'i lam gyis bsdus pa dang / bar chad med pa'i lam gyis bsdus pa'o //	59.65285846565441
prayoga mArga saMgrahaH tu tatas param sarvEH AvaraNEH acCAdyaH sarva AvarANAnAm ca BedakaH iti	sbyor ba'i lam gyis bsdus pa ni gang phan chad sgrib pa thams cad kyis mi phyed cing / sgrib pa thams cad ni shigs pa'o //	84.91785071770859
Anantarya mArga saMgrahaH tu yad anantaram kzaya jQAna anutpAda jQAna utpattiH	bar chad med pa'i lam gyis bsdus pa ni gang gi 'og tu zad par shes pa dang / mi skye ba shes pa 'byung ba ste /	91.69936291205353
sa ca samADiH nirantaraH dRXaH ekarasaH vyApI ca	ting nge 'dzin de yang bar med pa brtan pa / sra ba / ro gcig pa / khyab pa'o // 'di la dgongs nas bcom ldan 'das kyis dper na / brag chen po ma grub pa / ser ka med pa /	76.75123676303053
etad arTa pratibimbana arTam aBiDs	khong stong ma yin pa /	45.91628771242888
BagavatA uktam tat yaTA mahA SEla parvataH KaNxaH cCidraH SuziraH eka GanaH su saMvRttaH daSa diS vAta akampyaH ca	gcig 'dus pa / shin tu mkhregs pa de ni shar phyogs kyi rlung gis kyang mi sgul cing mi g-yos so // shar phyogs ji lta bar phyogs thams cad kyang de bzhin no zhes gsungs so //	87.23543852459393
katamA nAma nirantara ASraya pravRttiH	gnas ma lus par gyur pa gang zhe na /	72.9104967890559
aSEkza mArga lABinaH triviDA ASraya pravRttiH katamAH tisraH citta ASrayam apravRttiH mAryA Srapa pravRttiH dOzWulya ASraya pravRttiH ca	gang mi slob pa'i lam thob pa'i sems kyi gnas gyur pa dang / lam gyi gnas gyur pa dang gnas ngan len @100b gyi gnas gyur pa'o //	77.90221350260092
kzaya jQAnam katamat	zad pa shes pa gang zhe na /	93.90357964379447
hetu kzayeNa yat SAnam laByate kzaya vizayA lambanam vA	rgyu zad nas shes pa gang yin pa'am / zad pa la dmigs pa'o //	87.02173012277598
anutpAda jQAnam katamat	mi skye ba shes pa gang zhe na /	92.39542818069458
Pala prahANena yat jQAnam laByate Pala anutpatti vizaya Alambanam vA	'bras bu spangs nas shes pa gang yin pa'am / 'bras bu mi skye ba la dmigs pa'o //	90.07392784991151
daSA SEkzAH DarmAH tu aSEkzANAm SIla skanDam samADi skanDam prajQA skanDam vimukti skanDam vimukti jQAna darSana skanDam ca aDikRtya vedita	mi slob pa'i chos bcu ni mi slob pa'i tshul khrims kyi phung po dang / ting nge 'dzin gyi phung po dang / shes rab kyi phung po dang / rnam par grol ba'i phung po dang / rnam par grol ba'i ye shes mthong ba'i phung po'i dbang du byas par shes par bya'o //	89.00135238169908
taTA ca mArga satyasya catvAraH prakAra BedAH	yang lam gyi bden pa'i rnam pa ni mtshan nyid bzhir rig par bya ste /	90.73673762708702
mArga lakzaNam nyAya lakzaNam pratipad lakzaNam nEryANika lakzaNam ca	lam gyi mtshan nyid dang / rigs pa'i mtshan nyid dang / sgrub pa'i mtshan nyid dang nges par 'byin pa'i mtshan nyid do //	93.92595033289402
kim upAdAya mArga lakzaNam	ci'i phyir lam gyi mtshan nyid ces bya zhe na /	93.97725075863778
tattva arTa parimArgaNa tAm upAdAya	de kho na'i don yongs su tshol ba'i phyir ro //	75.60096270480055
kim upAdAya nyAya lakzaNam	ci'i phyir rigs pa'i mtshan nyid ces bya zhe na /	92.5895730524647
kleSa pratipakzatAm upAdAya	nyon mongs pa'i gnyen po'i phyir ro //	88.38149078268754
kim upAdAya pratipad lakzaNam	ci'i phyir sgrub pa'i mtshan nyid ces bya zhe na /	92.2493670463562
citta aviparyAsa pratipAdana AtAm upAdAya	sems phyin ci ma log par sgrub pa'i phyir ro //	85.24585119206854
kim upAdAya nEryANika lakzaNam	ci'i phyir nges par 'byin pa'i mtshan nyid ces bya zhe na /	84.83931910789619
nitya padayAna tAm upAdAya	rtag pa'i gnas su 'gro ba nyid kyi phyir ro //	72.4508134489474
satyezu zoxaSa AkArAH lOkikAH lokottarAH ca	bden pa rnams la rnam par bcu drug ni 'jig rten pa yang yod 'jig rten las 'das pa yang yod de /	91.91254596457422
lOkikAnAm loka uttarANAm ca katamaH praBedaH	'jig rten pa rnams dang / 'jig rten las 'das pa dag byed brag ci yod ce na /	83.65862612235136
jQeye akuSala praveSa kuSalya praveSa stra BAva praBedataH sa AvaraNa nirAvaraNa svaBAva praBedataH sa vikalpa nirvikalpa svaBAva praBedataH ca kena hetunA satyezu anitya duHKa AdayaH zoxaSa lOOkika AkArAH taTAgata aprativeDataH kleSa anuSayataH aBilApa muKena prapaQcanataH ca	shes bya la legs par ma zhugs pa dang / legs par zhugs pa dang / sgrib pa dang / bcas pa dang / sgrib pa med pa dang ; rnam par rtog pa dang bcas pa dang / rnam par rtog pa med pa'i phyir te / 'di ni bye brag go //	34.3605178980642
loka uttara AkArAH tad viparyayeNa loka uttara AkArezu varttamAnaH nitya arTam paSyati sAkzAt anuBavati na utu a nityam paSyati aBilApa prapaQca muKena	'di ltar 'jig rten las 'das pa'i rnam pa la 'jug pa na mi rtag pa'i don mthong gi mi rtag pa nyid ces bya bar mthong ba ni ma yin no //	71.67559747639525
yaTA anitya AkArAH anitya arTe evam SizWA karAH Sizwa arTezu yaTAyogam veditavyAH aBiDs	mi rtag pa nyid kyi don la ji lta ba de bzhin du rnam pa lhag ma rnams la yang ji ltar mthun mthun du sbyar bar yin no //	78.77340628224373
aTa viniScaye Darma paricCedaH dvitIyaH BAgaH	rig par bya'o // bden pa rnam par nges pa zhes bya ba ste / kun las btus pa gnyis pa'o /	90.35276193847133
Darma viniScayaH katamaH	// / chos rnam par nges pa gang zhe na /	94.74416971206665
Arya SAsanam dvAdaSa aFga DarmaH	chos zhes bya ba ni mdo'i sde dang / dbyangs kyis bsnyad pa'i @101a * //	74.84427996647521
katamAni dvAdaSa aFgAni sUtram geyam vyAkaraNam gATAH udAnam nidAnam avadAnam itivRtakam jAtakam vEpulyam adButa DarmaH upadeSaH ca	sde dang / lung du bstan pa'i sde dang / tshigs su bcad pa'i sde dang / ched du brjod pa'i sde dang / gleng gzhi'i sde dang / rtogs pa brjod pa'i sde dang / de lta bu byung ba'i sde dang / skyes pa'i rabs kyi sde dang / shin tu rgyas pa'i sde dang / rmad du byung ba'i chos kyi sde dang / gtan la dbab par bstan pa'i sde'o //	73.37462164690339
sUtram katamat	mdo'i sde gang zhe na /	90.8687121660813
yat aBipreta arTam sUcana AkAreNa gadya BAzitam	gang smos pa'i tshul gyis rkyang par gsungs pa ste /	74.31036081680885
daSa anuSaMsAn saMpaSyan taTAgataH sUcana AkAreNa Darmam deSayati suKam vyavasTApayati suKam deSayati	phan yon bcu gzigs nas de bzhin gshegs pa mdor smos pa'i tshul gyis chos ston te /	78.41444609330897
SrotA api suKam udgRNhAti Darma gOrava tayA kzipram boDi saMBArAn paripUrayati ASu Darma tAm prativiDyati budDe veti aprasAdam laBate Darme saMGe ca avetya prasAdam laBate parama dRzwa Darma suKa vihAram spRSati sAMkaTya viniScayena satAm cittam ArADayati	rnam par gzhag par sla ba dang / bshad sla ba dang / gzung sla ba dang / chos la gus pas myur du tshogs yongs su rdzogs par byed pa dang / myur du chos nyid rtogs par 'gyur ba dang / sangs rgyas la shes nas dad pa thob pa dang / chos dang dge 'dun la shes nas dad pa thob pa dang / mthong ba'i chos la bde bar gnas pa'i mchog la reg pa dang / 'brel ba'i gtam gyis gtan la 'bebs pas dam pa rnams kyi sems mgu bar byed de /	89.90251256159628
paNxitaH paNxitaH iti saMKyAm gacCati	mkhas pa zhes bya ba'i grangs su 'gro ba'o //	60.68582521544562
geyam katamat	dbyangs kyis bsnyad pa'i sde gang zhe na /	86.13399160475959
sUtrANAm maDye vE ante vA gATayA yat gIyate	mdo'i sde de nyid du dbus dang mtha' mar tshigs su bcad de dbyangs kyis bsnyad pa'o //	76.7899165806567
sUtrezu anirUpitaH rTaH vA yat vyAKyAyate atas geyam iti ucyate	yang drang ba'i don gyi mdo sde rtogs par byed pas dbyangs kyis bsnyad pa'o //	80.60140912656192
vyAkaraNam katamat	lung du bstan pa'i sde gang zhe na //	81.51150301984839
tat sTAnezu samatikrAntAnAm atItAnAm Arya SrAvakANAm prApti utpatti praBeda vyAkaraNam	gang las nyan thos 'das te shi ba'i 'dus byas pa dang 'byung ba lung ston pa'o //	68.78960617631047
api ca sUtrezu nirUIpita arTasya sPuwIkaraNam vivRtya aBisanDi vyAkaraNAt	yang nges ba'i don gyi mdo sde ni lung du bstan pa'i sde'o //	76.99168844604243
gATA katamA	tshigs su bcad pa'i sde gang zhe na /	66.69259153185664
sUtrezu pAda yogena deSyate	tshigs su sbyar nas gsungs pa ste /	69.46273793492999
dvipadI tripadI catuzpadI paMcapadI zawpadI vA	de ni rtsa ba gnyis pa dang / rtsa ba gsum pa dang / rtsa ba bzhi pa dang / rtsa ba lnga pa dang / rtsa ba drug pa'o //	63.04192793253755
udAnam katamat	ched du brjod pa'i sde gang zhe na /	83.03682404094272
sUtrezu kadAcid taTAgatena Atta manaskena yat udAhRtam	gang yin rangs nas brjod pa'o //	58.58234620094299
nidAnam katamat	gleng gzhi'i sde gang zhe na /	89.70806503295898
pRzwena yat BAzitam sa utpattikam SikzA prajQAptekam vA atas pi nidAnam	gang gi ched du gsungs pa dang / byung ba dang bcas pa'i bslab pa bcas pa gsungs pa'o //	70.0396049516136
avadAnam katamat	rtogs pa brjod pa'i sde gang zhe na /	84.29182930250425
sUtrezu sa dRzwAntakam BAzitam	dpe dang bcas par gsungs pa'o //	86.35813570022583
iti vRttakam katamat	de lta bu @101b byung ba'i sde gang zhe na /	82.27163414521651
yat A Arya SrAvakANAm pUrva lOkikam vRttam deSayati	gang sngon gyi sbyor ba dang ldan pa'o //	60.866927920318226
jAtakam katamat	skyes pa'i rabs kyi sde gang zhe na /	90.37760165575388
yat boDisattva carita piwaka saMprayuktam vRttam deSayati aBiDs	gang byang chub sems dpa'i spyod pa dang ldan pa'o //	63.112390740090454
vEpulyam katamat	shin tu rgyas pa'i sde gang zhe na /	89.38042571809557
boDisattva piwaka saMprayuktam BAzitam	gang byang chub sems dpa'i sde snod dang ldan pa'o //	72.51067297413664
yat ucyate vEpulyam tat vEdalyam api ucyate vEtulyam api ucyate	shin tu rgyas pa ji lta ba de bzhin du rnam par 'thag pa dang mtshungs bral yang de bzhin no //	68.98924861775582
kimarTam vEpulyam ucyate	ci'i phyir shin tu rgyas pa zhes bya zhe na /	77.81755860646565
sarva sattvAnAm hita suKa aDizWAnataH udAra gamBIra Darma deSanAtaH ca	sems can thams cad la phan pa dang bde ba'i gnas yin pa dang / rgyas pa dang / rgya che ba dang / zab ba'i rnam par chos bstan pa'i phyir ro //	87.01639160202139
kimarTam ucyate vEdalyam	ci'i phyir rnam par 'thag pa zhes bya zhe na /	66.949254564617
sarva AvaraNa vidalanataH	sgrib pa thams cad rnam par 'thag pa'i phyir ro //	83.18092727661133
kimarTam ucyate vEtulyam	ci'i phyir mtshungs bral zhes bya zhe na /	57.84973560060773
upamAna DarmANAm tulanA BAvataH	mtshungs pa med pa'i phyir ro //	61.93699336051941
adButa DarmaH katamaH	rmad du byung ba'i chos kyi sde gang zhe na /	76.61893240610759
yatra SrAvaka boDisattva taTA gatAnAm paramA dButa AScarya DarmANAm deSanA	gang las nyan thos dang / byang chub sems dpa' dang / sangs rgyas rnams kyi ngo mtshar rmad du byung ba'i chos bstan pa'o //	81.5177710641638
upadeSaH katamaH	gtan la dbab par bstan pa'i sde gang zhe na /	78.21543380949232
sarva gamBora gUXa Darma lakzaNAnAm aviparItam vyAKyAnam	gang du chos kyi mtshan nyid phyin ci ma log par bstan pa'o //	75.85570319223181
evam sUtra AdIni dvAdaSa aFgAni Arya SAsanAni trizu piwakezu saMgRhItAni Bavanti katamAni trINi sUtra piwakam vinaya piwakam aBiDarma piwakam ca tAni punar dviviDAni SrAvaka piwakam boDisattva piwakam ca	mdo'i sde la sogs pa 'di dag ni sde snod gsum du 'gyur te /	10.0
sUtram geyam vyAkaraNam gATAH udAnam ca etAni paQca SrAvakANAm piwakasya sUtra piwake saMgRhItAni Bavanti	mdo'i sde dang / dbyangs kyis bsnyad pa'i sde dang / lung du bstan pa'i sde dang / tshigs su bcad pa'i sde dang / ched du brjod pa'i sde gang yin pa 'di ni nyan thos kyi mdo sde'i sde snod do //	89.03255337556914
nidAnam avadAnam iti vRttakam jAtakam ca etAni catvAri dvayoH piwakayoH sa parivAre vinaya piwake saMgRhItAni Bavanti	gleng gzhi'i sde dang / rtogs pa brjod pa'i sde dang / da lta bu byung ba'i sde dang / skyes pa'i rabs kyi sde 'khor dang bcas pa 'di ni 'dul ba'i sde snod do //	83.5807760300644
vEpulyam adButa DarmaH ca ete dve boDisattva piwakasya sUtra piwake saMgRhIte BavataH	shin tu rgyas pa'i sde dang / rmad du byung ba'i chos kyi sde gang yin pa 'di ni byang chub sems dpa'i mdo sde'i sde snod do //	88.2667479692878
upadeSaH ekaH SrAvaka boDisattva piwakayoH aBiDarma piwake saMgRhItaH Bavati	gtan la dbab par bstan pa'i sde ni gnyi ga'i chos mngon pa'i sde snod do //	82.54788935237877
kim upAdAya taTAgatasya piwaka traya vyavasTAnam	ci'i phyir de bzhin gshegs pa rnams kyis sde snod gsum rnam par gzhag ce na /	91.39567148049214
vicikitsA upakleSa pratipakzakAH matAm upAdAya sUtra piwaka vyavasTAnam	nye ba'i nyon mongs pa the tshom gyi gnyen po'i phyir mdo sde'i sde snod rnam par gzhag go //	89.38153885199851
anta dvaya anuyoga upakleSa pratipakza kAma tAm upAdAya vinaya piwaka vyavasTAnam	nye ba'i nyon mongs pa mtha' gnyis dang ldan pa'i gnyen po'i phyir 'dul ba'i sde snod rnam par gzhag go //	87.99203728297222
svayaMdRzwi parAmarSa graha upakleSa pratipakza kAma tAm upAdAya aBiDarma piwaka vyavasTAnam	rang gi lta ba mchog tu 'dzin pa @102a * // nye ba'i nyon mongs pa'i gnyen po'i phyir chos mngon pa'i sde snod rnam par gzhag go //	89.8252235512831
punar SikzA traya vyutpatti kAma tAm upAdAya sUtra piwaka vyavasTAnam	yang bslab pa gsum brjod pa'i phyir mdo sde'i sde snod rnam par gzhag go //	87.2168803965325
aDi SIla aDicitta SikzA nizpAdana kAma tAm upAdAya vinaya piwaka vyavasTAnam	lhag pa'i tshul khrims dang lhag pa'i sems kyi bslab pa bsgrub pa'i phyir 'dul ba'i sde snod rnam par gzhag go //	90.4752304783218
aDiprajQa SikzA nizpAdana kAma tAm upAdAya aBiDarma piwaka vyavasTAnam	lhag pa'i shes rab kyi bslab pa mngon par bsgrub pa'i phyir chos mngon pa'i sde snod rnam par gzhag go //	90.18498431146827
punar samyak Darma arTa vyutpatti kAma tAm upAdAya sUtra piwaka vyavasTAnam	yang chos dang don brjod pa'i phyir mdo sde'i sde snod rnam pa ci'i phyir gzhag go //	85.69753211437698
aBiDs  Darma arTa sAkzAt kriyA pada sTAna praBAvitA mupAdAya vinaya piwaka vyavasTAnam	chos dang don mngon du bya ba'i gzhi'i gnas kyi phyir 'dul ba'i sde snod rnam par gzhag go //	86.10163263881938
jQAninAm sAMkaTya viniScaya Darma saMBoga suKa vihAra ASraya tAm upAdAya aBiDarma piwaka vyavasTAnam	'bel ba'i gtam gyis gtan la 'bebs pas chos la rdzogs par longs spyod pas bde ba la reg par gnas par bya ba'i phyir / chos mngon pa'i sde snod rnam par gzhag go //	91.73288494437716
saH eza piwaka traya saMgRhItaH DarmaH kasya gocaraH	chos 'di dag gang gi spyod yul yin zhe na /	79.55894069338953
Sruta maya cintA Amaya BAvanAmayAnAm citta cEtasikAnAm DarmANAm gocaraH	thos pa las byung ba dang / bsams pa las byung ba dang / bsgoms pa las byung ba'i sems dang sems las byung ba'i chos rnams kyi spyod yul lo //	90.89397434759023
yat uktam sutre citta cEtasikAH DarmAH sa AlambanAH sa AkAraH sa ASrayAH sa saMprayogAH ca	sems dang sems las byung ba'i chos rnams ni dmigs pa dang bcas pa dang / rnam pa dang bcas pa dang / gnas dang bcas pa dang / mtshungs par ldan pa zhes kyang bya'o //	93.71077925162083
tezAm asmin Darme Alambanam katamat	chos kyi nang nas de dag gi dmigs pa gang zhe na /	89.26777148246765
sUtra Adikam	mdo'i sde la sogs pa'o //	90.24458770751953
AkAraH katamaH	rnam pa gang zhe na /	88.66259988149007
skanDa AdayaH tad saMprayuktAH ca arTAH	phung po la sogs pa dang ldan pa'i don rnams so //	90.4258198261261
ASrayaH katamaH para vijQaptiH smRtiH vAsanA ca	gnas gang zhe na ; gzhan las rnam par rig pa dang / dran pa dang / bag chags so //	94.32299542434659
saMprayogaH katamaH	mtshungs par ldan pa gang zhe na /	93.15560070206136
anyaH nyasahAya BAvena Alambane AkArEH saMpratipattiH	gcig gi grogs gcig yin pa'i tshul gyis rnam pas dmigs pa yang dag par rtogs pa'o //	80.78194943629785
Darme Alambana praBedaH katamaH	chos la dmigs pa'i rab tu dbye ba gang zhe na /	92.57145302346413
saMkzepeNa caturviDaH AKyAtaH vyApya Alambanam carita viSoDana Alambanam kOSalya Alambanam kleSa viSoDana Alambanam ca	khyab pa'i dmigs pa dang / spyod pa rnams par sbyong ba'i dmigs pa dang / mkhas pa'i dmigs pa dang / nyon mongs pa rnam par sbyong ba'i dmigs pa'o //	82.89007419253294
vyApya Alambanam punar caturviDam	khyab pa'i dmigs pa gang zhe na /	81.83149909973145
sa vikalpa pratibimba Alambanam nirvikalpa prativimba Alambanam vastu paryanta Alambanam kArya parinizpatti Alambanam ca	rnam par rtog pa dang bcas pa'i gzugs brnyan dang / rnam par @102b mi rtog pa'i gzugs brnyan dang / dngos po'i mtha' dang / dgos pa yongs su grub pa'o //	85.29356425263165
sa vikalpa pratibimba Alambanam katamat	rnam par rtog pa dang bcas pa'i gzugs brnyan gang zhe na /	91.62704834444769
aDimuktimanaskAreNa yat SamaTa vipaSyanA vizaya Alambanam	mos pa yid la byed pas gang zhe gnas dang lhag mthong gi dmigs pa'o //	90.73789055693696
nirvikalpa prativimba Alambanam katamat	rnam par mi rtog pa'i gzugs brnyan gang zhe na /	88.43804097175598
tattva manaskAreNa yat SamaTa vipaSyanA vizaya Alambanam	de kho na yid la byed pas gang zhe gnas dang / lhag mthong gi dmigs pa'o //	91.1583105142281
vastu paryanta Alambanam katamat	dngos po'i mtha' gang zhe na /	74.88233598073325
sarva DarmANAm kzaya BAvika tA yaTAvat BAvika tA ca kzaya BAvika tA katamA	gang chos rnams kyi ji snyed yod pa dang / ji lta ba bzhin du yod pa'o // ji snyed yod pa ni /	81.54768241230276
skanDa DAtu AyatanAni	phung po dang / khams dang ; skye mched rnams so // ji lta ba bzhin du yod pa ni /	90.07387528894736
yaTAvat BAvika tA katamA catvAri Arya satyAni zoxaSa AkArAH taTatA sarve anityAH saMskArAH sarve duHKA saMskArAH sarve na AtmAnaH DarmAH nirvANam SAntam SUnyaca	'phags pa'i bden pa bzhi dang / rnam pa bcu drug dang / de bzhin nyid dang / 'du byed thams cad mi rtag pa dang / 'du byed thams cad sdug bsngal ba dang / chos thams cad bdag med pa dang / mya ngan las 'das pa zhi ba dang / stong pa nyid dang / smon pa med pa dang / mtshan ma med pa'o //	87.8039931887736
kArya parinizpatti Alambanam katamat	dgos pa yongs su grub pa gang zhe na /	87.6329868843681
ASraya parivRttiH iyam ASraya parivRttiH acintyA	gnas gyur pa'o //	64.65604709176456
zoxaSa AkArezu SUnye kati AkArAH saMgRhItAH Bavanti	rnam pa bcu drug gi nang nas stong pa nyid kyi rnam pa du zhe na /	86.8048089943176
dvO	gnyis so //	89.24204395034097
apraNihite kati AkArAH saMgRhItAH Bavanti	smon pa med pa'i rnam pa du zhe na /	85.01396460003323
zax	drug go //	79.72862434387207
animitte kati AkArAH saMgRhItAH Bavanti  azwO aBiDs	mtshan ma med pa'i rnam pa du zhe na / brgyad do //	88.96495813521675
carita viSoDana Alambanam paQcaviDam	spyod pa rnams par sbyong ba'i dmigs pa gang zhe na /	90.09079025376518
BUyas rAga caritAnAm aSuBa vizaya Alambanam	'dod chags la spyod pa rnams kyi ni mi sdug pa'o //	87.41110191158221
BUyas dveza caritAnAm karuNA BAvanA vizaya Alambanam	zhe sdang la spyod pa rnams kyi ni byams pa'o //	83.09503332773845
BUyas moha caritAnAm nikAya pratyaya tA pratItyasamutpAda vizaya Alambanam	gti mug la spyod pa rnams kyi ni rkyen 'di las byung ba rten cing 'brel par 'byung ba'o //	85.23807393799618
mada mAna caritAnAm DAtu praBeda vizaya Alambanam	nga rgyal la spyod pa rnams kyi ni khams rab tu dbye ba'o //	80.61053629246425
vitarkka caritAnAm avatAra aprativANi smRti vizaya Alambanam	rnam par rtog pa la spyod pa rnams kyi ni dbugs 'byung ba dang / rngub ba rjes su dran pa'o //	80.26982157171044
kOSalya Alambanam paQcaviDam	mkhas pa'i dmigs pa gang zhe na /	78.27858091845657
skanDa kOSalyam DAtu kOSalyam Ayatana kOSalyam prati ityua samutpAda kOSalyam sTAna AsTAna kOSalyam ca	phung po la mkhas pa dang / khams la mkhas pa dang / skye mched la mkhas pa dang / rten cing 'brel par 'byung ba la mkhas pa dang / gnas dang gnas ma yin pa la mkhas pa'o //	94.68444809253809
sTAna AsTAna kOSalyena kam arTam paSyati	gnas dang gnas ma yin pa la mkhas pa ji ltar blta zhe na /	85.75453508311305
jQeye pratitya samutpAda kOSalyam paSyati	rten cing 'brel par 'byung ba la mkhas pa las blta'o //	86.35299663110213
sTAna AsTAna kOSalya pratItya samutpAda kOSalyayoH kaH praBedaH	rten cing 'brel par 'byung ba la @103a * // mkhas pa dang / gnas dang gnas ma yin pa la mkhas pa bye brag ci yod ce na /	86.76828832666729
yat DarmAH DarmAn aBinizyandayanti na hi ezAm nirhetukaH na api vizama hetukaH utpAdaH iti idam pratItyasamutpAda kOSalyam	chos rnams las chos rnams mngon par 'byung ba'i phyir rgyu med pa dang mi mthun pa'i rgyu yongs su spangs pas rten cing 'brel par 'byung ba la mkhas pa'o //	77.10454871830846
hetu Pala AnurUpye vedayita utpAdaH iti idam sTAna AsTAna kOSalyam	rgyu dang mthun par 'bras bu 'byung ba yongs su gzung ba'i phyir gnas dang gnas ma yin pa la mkhas pa'o //	77.8809340924387
kleSa viSoDana lambanam katamat	nyon mongs pa rnam par sbyong ba'i dmigs pa gang zhe na /	91.76441502989384
yat aDas BUmikAnAm Odarika tA UrDva BUmikAnAm SAnta tA taTatA catvAri asatyAni ca etAni kleSa viSoDana AlambanAni nAma	sa 'og ma rnams kyi ni rags pa nyid do // sa gong ma rnams kyi ni zhi ba nyid do // de bzhin nyid dang / 'phags pa'i bden pa bzhi'o //	81.75810631115802
tatra DarmamImAMsA kAmena katiBiH yuktiBiH vicAryate catasRBiH yuktiBiH	chos la brtson pa chos la rnam par dpyod pa na rigs pa du zhig gis rnam par dpyod ce na / bzhis dpyod de /	87.7081573910792
apekzA yuktiH kArya kAraNa yuktiH upapatti sADana yuktiH Darma tAyuktiH ca apekzA yuktiH katamA	ltos pa'i rigs pa dang / bya ba byed pa'i rigs pa dang / gtan tshigs bsgrub pa'i rigs pa dang / chos nyid kyi rigs pa'o ; / ltos pa'i rigs pa gang zhe na /	93.54594399714115
yA saMskArANAm utpattO pratyaya apekzA	gang 'du byed rnams 'byung ba na rkyen la ltos pa'o //	92.7430454271811
kArya kAraNa yuktiH katamA	bya ba byed pa'i rigs pa gang zhe na /	92.1110402408399
pRTak lakzaNAnAm DarmANAm pratyekam kArya kAraNAni	gang rang gi mtshan nyid tha dad pa'i chos rnams so so rang gi bya ba byed pa'o //	84.62072966685173
upapatti sADana yuktiH katamA	gtan tshigs bsgrub pa'i rigs pa gang zhe na /	90.61709997389052
upapatti sADana arTam sADyasya arTasya prAmANa avirudDaH upadeSaH	gang bsgrub pa'i don tshad ma dang mi 'gal bar ston pa'o //	85.63299003653857
DarmatAyuktiH katamA	chos nyid kyi rigs pa gang zhe na /	90.84199128832135
anAdi kAlAt sva lakzaNa sAmAnya lakzaNa sTita Darmezu yA Darma tA parinizpattiH sA Darma tA iti Darmezu vicAraNA	thog ma med pa'i dus nas rang dang spyi'i mtshan nyid gnas pa'i chos rnams la chos nyid du grags pa'o //	73.35954256919648
Darmezu katamAH paryezaNAH saMBavanti	chos la rigs pas dpyod pa la brtson pa'i kun tu tshol ba gang zhe na /	75.40232076886966
catasraH paryezaNAH saMBavanti	kun tu tshol ba bzhi ste /	82.06874933609596
nAma paryezaNA vastu paryezaNA svaBAva prajQapti paryezaNAH viSeza prajQapti paryezaNA ca	ming kun tu tshol ba dang / dngos po kun tu tshol ba dang / ngo bo nyid du 'dogs pa kun tu tshol ba dang / bye brag tu 'dogs pa kun tu tshol ba'o //	93.8677109967359
nAma paryezaNA katamA	ming kun tu tshol ba gang zhe na /	94.72171752593097
Darmezu nAma kAya padakAya vyaQjana kAyAnAm aparinizpannam sva lakzaNam iti aBiDs yA santi IraNA	gang ming gi tshogs dang / tshig gi tshogs dang / yi ge'i tshogs rnams kyi rang gi mtshan nyid yongs su grub pa med par rtog pa'o //	84.806727521392
vastu paryezaNA katamA	dngos po kun tu tshol ba gang zhe na /	94.89158120908236
DarmANAm skanDa DAtu AyatanAnAm apari nizpakzam Ka lakzaNam iti yA saMtIraNA	gang de bzhin du phung po dang / khams dang / skye mched kyi mtshan nyid yongs su grub pa med par rtog pa'o //	83.5260167854929
svaBAva prajQapti paryezaNA katamA	ngo bo nyid du 'dogs pa kun tu tshol ba @103b gang zhe na /	95.1297143515894
DarmANA maBiDAna aBiDeya saMbanDe svaBAva prajQapti mAtrasya vyavahAra nimitta tA santi IraNA	gang brjod pa dang / brjod par bya ba 'brel pa la ngo bo nyid du 'dogs pa tsam gyi tha snyad kyi rgyu nyid du rtog pa'o //	83.99449376745844
viSeza prajQapti paryezaNA katamA	khyad par du 'dogs pa kun tu tshol ba gang zhe na /	94.56498262461494
DarmANAm aBiDAna aBiDeya sambanDe viSeza prajQapti mAtrasya vyavahAra nimitta tA santi IraNA	gang brjod pa dang brjod par bya ba 'brel pa la khyad par du 'dogs pa tsam gyi tha snyad kyi rgyu nyid du rtog pa'o //	83.8481421617
iti Darma paryezaNa aBAvanA Darmezu yaTABUta parijQAnAni katamAni saMBavanti	chos kun tu tshol ba la brtson pa'i yang dag pa ji lta ba bzhin tu yongs su shes pa gang zhe na /	83.4879261237839
catvAri yaTABUta parijQAnAni	yang dag par ji lta ba bzhin du yongs su shes pa bzhi ste /	93.06618512282937
nAma paryezitam yaTABUta parijQAnam vastu paryezitam yaTABUta parijQAnam svaBAva prajQapti paryezitam yaTABUta parijQAnam viSeza prajQayaTABUta parijQAnam	ming tshol bar rtogs pa yang dag pa ji lta ba bzhin du yongs su shes pa dang / dngos po tshol bar rtogs pa dang / ngo bo nyid du 'dogs pa tshol bar rtogs pa dang / khyad par du 'dogs pa tshol bar rtogs pa yang dag pa ji lta ba bzhin du yongs su shes pa'o //	84.83828228409124
