catvAraH DAtavaH dve ca Ayatane tad anyezAm ca skanDa DAtu AyatanAnAm eka deSaH	khams bzhi dang / skye mched gnyis dang / de las gzhan pa'i phung po dang / khams dang / skye mched rnams kyi phyogs gcig go //	95.86268030165408
kAma avIta rAga Atma aBiniveSa tyAjana arTam	bdag 'dod pa la 'dod chags dang ma bral bar mngon par zhen pa spang ba'i phyir ro //	94.95201300240026
kaTam rUpa pratisaMyuktAni kim arTam rUpa pratisaMyukta parIkzA	ji ltar na gzugs dang rab tu ldan pa yin / gzugs dang rab tu ldan pa rnams ni du zhig / ci'i phyir gzugs dang rab tu ldan par brtag ce na /	90.63950477964335
kAma vIta rAgasya rUpAvIta rAgasya kuSala Avya kRtam rUpa pratisaMyuktam drazwavyam	'dod pa la 'dod chags dang bral la // gzugs la 'dod chags dang ma bral ba'i dge ba dang / lung du ma bstan pa ni gzugs dang rab tu ldan par blta'o //	93.11041114676487
caturaH DAtUna dve ca Ayatane sTApayitA tad anyezAm skanDa DAtu AyatanAnAm eka deSaH	khams bzhi dang skye mched gnyis ma gtogs par de las gzhan pa'i phung po dang / khams dang skye mched rnams kyi phyogs gcig go //	93.15189441416925
aBiDs  kAma vIta rAga AtmaBiniveSa tyAjana arTam	bdag 'dod pa la 'dod chags dang bral bar mngon par zhen pa spang ba'i phyir ro //	88.077931567897
kaTam ArUpapya pratisaMyuktam kati ArUpya pratisaMyuktAni kim arTam ArUpya pratisaMyuktA parIkzA	ji ltar na gzugs med pa dang rab tu ldan pa yin / gzugs med pa dang rab tu ldan pa rnams ni du zhig / ci'i phyir gzugs med pa dang rab tu ldan par brtag ce na /	96.11158967018127
rUpa vIta rAgasya ArUpya avIta rAgasya kuSala avya akRtam vArUpya pratisaMyuktam drazwavyam	gzugs la 'dod chags dang bral la / gzugs med pa la 'dod chags dang ma bral ba'i dge ba dang lung du ma bstan pa ni gzugs med pa dang rab tu ldan pa blta'o //	94.69857240070183
caturNAnskanDAnAm dvayaH ScAyatanayoH pradeSaH	phung po bzhi dang / khams gsum dang @64a * // skye mched gnyis kyi phyogs so //	90.05453387064354
rUpa vIta rAga Atma aBiniveSa tyAjana arTam	bdag gzugs la 'dod chags dang bral bar mngon par zhen pa spang ba'i phyir ro // 'dod chags dang bral ba nyid kyang /	92.04367536544457
vErAgyam punar eka deSa vErAgyam skala vErAgyam prativeDa vErAgyam upaGAta vErAgyam samudGAta vErAgyam ca drazwavyam	phyogs gcig las 'dod chags dang bral ba nyid dang / mtha' dag las 'dod chags dang bral ba nyid dang ; rtogs pas 'dod chags dang bral ba nyid dang / gnod pa'i 'dod chags dang bral ba nyid dang / legs par bton pa'i 'dod chags dang bral ba nyid du blta'o //	77.73357151071491
api Kalu daSa vErAgyANi	yang 'dod chags dang bral ba nyid bcu ste /	91.60701639707698
prakRti vErAgyam upaGAta vErAgyam upastamBa vErAgyam samutkarza vErAgyam sammoha vErAgyam	rang bzhin gyis 'dod chags dang bral ba nyid dang / gnod pas 'dod chags dang bral ba nyid dang / nye bar brtan pas 'dod chags bral ba nyid dang / phul du byung bas 'dod chags dang bral ba nyid dang / rmongs pas 'dod chags dang bral ba nyid do //	77.8610191477604
pratipakza vErAgyam parijQA vErAgyam prahANi vErAgyam sa uttara vErAgyam niruttara vErAgyam	rang bzhin gyis 'dod chags dang bral ba nyid dang / yongs su shes pas 'dod chags dang bral ba nyid dang / spad bas 'dod chags dang bral ba nyid dang / gong ma dang bcas pa'i 'dod chags dang bral ba nyid dang / gong na med pa'i 'dod chags dang bral ba nyid do //	75.52324973918755
prakRti vErAgyam katamat	rang bzhin gyis 'dod chags dang bral ba nyid gang zhe na /	88.71092002145176
duHKAyAm vedanAyAm duHKa sTAnIyezu ca Damazu yA pratikula tA	sdug bsngal gyi tshor ba dang ; sdug bsngal gyi tshor ba'i gnas kyi chos rnams la gang mi 'phrod par 'dzin pa nyid do //	90.02563981571069
upaGAta vErAgyam katamat	gnod pas 'dod chags dang bral ba nyid gang zhe na /	93.72407249843373
mETuna prayuktasya dAha vigame yA pratikUla tA	'khrig pa la zhugs pa gdung ba dang bral nas gang mi 'phrod par 'dzin pa nyid do //	84.88531302948675
upastamBa vErAgyam katamat	nye bar brtan pas 'dod chags dang bral ba nyid gang zhe na /	90.4848619302114
su BuktavataH mRzwe pi Bojane yA pratikUla tA	'brangs par bzos pa zas zhim po la yang gang mi 'phrod par 'dzin pa nyid do //	83.02879612393484
samutkarza vErAgyam katamat	phul du byung bas 'dod chags dang bral ba nyid gang zhe na / thabs shin tu chen po thob pa /	84.58065614008413
uccataram sTAnam prAptava taH nirhIne sTAne yA pratikUla tA	thabs dma' ba la gang mi 'phrod par 'dzin pa nyid do /	73.96174733566163
sammoha vErAgyam katamat	rmongs pas 'dod chags dang bral ba nyid gang zhe na /	91.8811382572606
bAlAnAm nirvANe yA pratikUla tA	byis pa rnams mya ngan las 'das pa la gang mi 'phrod par 'dzin pa nyid do //	87.1053733848123
pratipakza vErAgyam katamat	gnyen pos 'dod chags dang bral ba nyid gang zhe na /	94.29530928685115
lOkikena vA loka uttareNa vA mArgeNa yat kleSa prahANam	'jig rten pa'am 'jig rten las 'das pa'i lam gyi nyon mongs pa spong ba gang yin pa'o //	91.64317793979359
parijQA vErAgyam katamat	yongs su shes pas 'dod chags dang @64b bral ba nyid gang zhe na /	92.0796184356396
pratilabDa darSana mArgasya trEDAtuke yA pratikUla tA	mthong ba'i lam thob pa / khams gsum pa la gang mi 'phrod par 'dzin pa nyid do //	89.4267370311891
prahANi vErAgyam katamat	spong bas 'dod chags dang bral ba nyid gang zhe na /	88.60427192541269
BUmO BUmO kleSAn prajahataH yA pratikUla tA	sa dang sar nyon mongs pa rab tu spong ba'i mi mthun par 'dzin pa nyid gang yin pa'o //	77.71666099059891
sa uttara vErAgyam katamat	gong ma dang bcas pa'i 'dod chags dang bral ba nyid gang zhe na /	91.949294090271
lOkikAnAm SrAvaka pratyekabudDAnAm ca yat vErAgyam	'jig rten pa dang / nyan thos dang / rang sangs rgyas rnams kyi 'dod chags dang bral ba nyid gang yin pa'o //	92.98501951227571
niruttaram vErAgyam katamat	gong na med pa'i 'dod chags dang bral ba nyid gang zhe na /	90.57927096900293
yat budDa boDisattvAnAm vErAgyam sarva sattva hita suKa aDizWAna tA mupAdAya	sangs rgyas dang byang chub sems dpa' rnams kyi 'dod chags dang bral ba nyid gang yin pa ste / sems can thams cad la phan pa dang bde ba'i gnas yin pa'i phyir ro //	87.3447088417615
kaTam SEkzam kati SEkzANi kim arTam SEkza parIkzA	ji ltar na slob pa yin / slob pa rnams ni du zhib // ci'i phyir slob par brtag ce na /	95.82599880743956
mokza prayuktasya kuSalam SEkzam drazwavyam	thar pa la brtson pa'i dge ba ni slob par blta'o //	89.19345960430071
skanDAnAH daSAnAm DAtUnAm caturNAm ca AyatanAm eka deSaH	phung po rnams dang / khams bcu dang / skye mched bzhi'i phyogs so //	91.87459028688548
mokza prayukta AtmA aBiniveSa tyAjana arTam	bdag thar pa la brtson par mngon par zhen pa spang ba'i phyir ro //	94.21239271390478
kaTam aSEkzam kati aSEkzANi kim arTam aSEkza parIkzA	ji ltar na mi slob pa yin / mi slob pa rnams ni du zhig / ci'i phyir mi slob par brtag ce na /	96.09081102718815
SikzAyAm nizWA gatasya kuSalam aSEkzam drazwavyam	bslab pa mthar phyin pa'i dge ba ni mi slob par blta'o //	89.58661102884714
skanDAnAm daSAnAm DAtUnAm caturNAm ca AyatanAnAm pradeSaH	phung po rnams dang / khams bcu dang / skye mched bzhi'i phyogs so //	93.66324268640996
Bukta AtmA aBiniveSa tyAjana arTam	bdag grol bar mngon par zhen pa spang ba'i phyir ro //	93.93319922906382
kaTam na eva SEkzAn ASEkzam kati na eva SEkzAn ASEkzAni kim arTam na eva SEkzAn ASEkza parIkzA	ji ltar na slob pa yang ma yin mi slob pa yang ma yin / slob pa yang ma yin mi slob pa yang ma yin pa rnams ni du zhig / ci'i phyir slob pa yang ma yin mi slob pa yang ma yin par brtag ce na /	92.0940458518343
pRTagjanasya kuSala akuSala avya kRtam SEkzasya klizwa avyAkRtam aSEkzasya ca avyAkRtam asaMskRtam ca na eva SEkzAn ASEkzam drazwavyam	so so'i skye bo'i dge ba dang / mi dge ba dang lung du ma bstan pa dang / slob pa'i nyon mongs pa can dang / lung du ma bstan pa dang / mi slob pa'i lung du ma bstan pa dang / 'dus ma byas ni slob pa yang ma yin mi slob pa yang ma yin par blta'o //	94.1728508227587
azwO DAtavaH zwA vA AyatanAni tad anyezAm aBiDs skanDa DAtu AyatanAnAm pradeSaH	khams brgyad dang / skye mched brgyad dang / de las gzhan pa'i phung po dang khams dang skye mched rnams kyi phyogs gcig go //	91.10552444018904
amukta Atma aBiniveSa tyAjana arTam	bdag grul ba ma yin par mngon par zhen pa spang ba'i phyir ro // ji ltar na mthong ba bas spang bar bya ba yin /	89.62605069258322
kaTam darSana prahAtavyam kati darSana prahAtavyAni kim arTam darSana prahAta vya parIkzA	mthong bas spang bar bya ba @65a * // rnams ni du zhig / ci'i phyir mthong bas spang bar bya bar brtag ce na /	91.21545996797376
parikalpitA klizwA dRzwiH vicikitsA dRzwi sTAnam ye ca dRzwO vipratipannAH kleSa upakleSAH yat ca dRzwyA samutTApitam kAyavA kkarma sarvam cApAyikam skanDa DAtu Ayatanam darSana prahAtavyam drazwavyam	nyon mongs pa can gyi lta ba kun tu brtags pa rnams dang / the tshom dang lta ba'i gnas dang lta ba la log par zhugs pa'i nyon mongs pa dang nye ba'i nyon mongs pa gang yin pa dag dang / gang yang lta bas kun nas bslang ba'i lus kyi las dang / dag gi las dang / ngan song ba'i phung po dang / khams dang / skye mched thams cad ni mthong ba spang bar bya bar blta'o //	86.93174928855427
sarvezAm eka deSaH	thams cad kyi phyogs gcig go //	93.53935104031717
darSana saMpanna AtmA aBiniveSa tyAjana arTam	bdag mthong ba phun sum tshogs par mngon par zhen pa spang ba'i phyir ro //	95.0920581817627
kaTam BAvanA prahAtavyam kati BAvanA prahAtavyAni kim arTam BAvanA prahAta vyaparIkzA	ji ltar na bsgom pas spang bar bya ba yin / bsgom pas spang bar bya ba rnams ni du zhig / ci'i phyir bsgom pas spang bar bya bar brtag ce na /	95.24082157944225
labDa darSana mArgasya tad UrDvam darSana prahAtavya viparyayeNa sa AsravAH DarmAH sarvezAm eka deSaH	mthong ba'i lam thob pa de yan chad kyi mthong bas spang bar bya ba las bzlog pa zag pa dang bcas pa'i chos rnams so ; / thams cad kyi phyogs gcig go //	94.10680163202085
BAvanA saMpanna AtmA aBiniveSa tyajana arTam	bdag sgom pa phun sum tshogs par mngon par zhen pa spang ba'i phyir ro // ji ltar na spang bar bya ba ma yin /	90.63055273646869
kaTam aprahAtavyam kati aprahAtavyAni kimamarTam aprahAta vya parIkzA	spang bar bya ba ma yin pa rnams ni du zhig / ci'i phyir spang bar bya ba ma yin par brtag ce na /	78.93461884030714
anAsravam aprahAtavyam drazwavyam sTApayitvA nirveDa BAgIyam	zag pa med pa ni spang bar bya ba ma yin par blta'o //	84.05819258792238
skaMDAnAm daSAnAm DAtUnAm caturNAm ca AyatanAnAm pradeSaH	des par 'byed pa'i cha dang mthun pa ma gtogs par phung po rnams dang / khams gsum dang / skye mched gnyis kyi phyogs so //	87.00258421414827
sidDa AtmA aBiniveSa tyAjana arTam	bdag grub par mngon par zhen pa spang ba'i phyir ro //	92.93955403787119
kaTam pratItyasamutpannam kati pratItyasamutpannAni kim arTam pratItyasamutpanna parIkzA	ji ltar na rten cing 'brel par 'byung ba yin / rten cing 'brel par 'byung ba rnams ni du zhig / ci'i phyir rten cing 'brel par 'byung bar brtag ce na /	93.60940318976961
lakzaNataH pyaFga viBAgataH pi aFga samAsatas pyaFga pratyaya tva vyavasTAnataH pi aFga karma vyavasTAnataH pi aFga saMkleSa saMgrahataH pi arTataH pi gAmBIryataH pi praBedataH pi anulomapratiloma taH pi pratItyasamutpannam drazwavyam	mtshan nyid dang / yan lag rnam par dbye ba dang / yan lag mdor bsdu pa dang / yan lag rkyen nyid du rnam par gzhag pa dang / yan lag gi las rnam par gzhag pa dang / yan lag kun nas nyon mongs par bsdu ba dang / don dang / zab pa dang / rab tu dbye ba dang / lugs dang mthun pa dang / lugs dang mthun pa dang / lugs dang mi mthun pas kyang rten cing 'brel par 'byung bar blta'o //	78.69027689537684
sarvANi DarmaDAtu Ayatana eka deSam sTApayitvA	chos kyi khams dang / chos kyi skye mched kyi phyogs gcig ma gtogs pa thams cad do /	91.39348463130464
ahetu vizama hetuka Atma aBiniveSa tyAjana arTam	@65b bdag dang chos rgyu med pa dang mi mthun pa'i rgyu las byung ba mngon par zhen pa spang ba'i phyir ro //	89.33527373674711
kaTam lakzaNataH	mtshan nyid kyis ji lta bu zhe na /	92.24023512431555
nirIha pratyaya utpatti tAm upAdAya anitya pratyaya utpatti tAm upAdAya samarTa pratyaya utpatti tAm upAdAya	g-yo ba med pa'i rkyen las byung ba dang / mi rtag pa'i rkyen las byung ba dang / nus pa'i rkyen las byung ba'i phyir ro //	67.36128850524392
kaTam aFga viBAgataH	yan lag rnam par dbye bas ji ltar bu zhe na /	90.02423932817247
dvAdaSa aFgAni	yan lag bcu gnyis rnams te /	90.52288436889648
dvAdaSa aFgaH pratItyasamutpAdaH avidyA saMskArAH vijQAnam nAma rUpam zaz Ayatanam sparSaH vedanA tRzNA upadAnam BavaH jAti rjarA maraNam	rten cing 'brel par 'byung ba'i yan lag bcu gnyis ni / ma rig pa dang / 'du byed dang / rnam par shes pa dang / ming dang gzugs dang / skye mched drug dang / reg pa dang / tshor ba dang / sred pa dang / sred pa dag / len pa dang srid pa dang / skye ba dang / rga shi'o //	88.8256116959204
kaTam aFga samAsatas pi	yan lag mdor bsdu bas ji ltar bu zhe na /	91.73113666511163
Akzepaka aFgam Akzipta aFgam aBinirvarttaka aFgam aBinirvRtti aFgam ca	'phen pa'i yan lag dang / 'phags pa'i yan lag dang / mngon par 'grub par byed pa'i yan lag dang / mngon par grub pa'i yan lag go //	89.1372298982286
Akzepaka aFgam katamat	'phen pa'i yan lag gang zhe na /	92.54819965362549
avidyA saMskArAH vijQAnam ca	ma rig pa dang / 'du byed dang / rnam par shes pa'o //	95.0177833945663
Akziptaka aFgam katamat	'phags pa'i yan lag gang zhe na /	85.2098813345938
nAma rUpam zaz Ayatanam sparSaH vedanA ca	ming dang gzugs dang / skye mched drug dang / reg pa dang / tshor ba'o //	96.8439462128022
aBinrivarttaka aFgam katamat	mngon par 'grub par byed pa'i yan lag gang zhe na /	86.2221008235333
tRzNAH upAdAnam BavaH ca	sred pa dang / len pa dang / srid pa'o //	93.84763226858
aBinirvRtti aFgam katamat	mngon par grub pa'i yan lag gang zhen /	93.04208395419977
jAti rjarA maraNam ca	skye ba dang / rga shi'o //	86.84756983651056
kaTam aFga pratyaya tva vyavasTAnataH	yan lag rkyen nyid du rnam par bzhag pas ji ltar bu zhe na /	91.68649895985921
vAsanAtas pyAveDataH pi manasikArataH pi sahaBAvataH pya aFgAnAm pratyaya tva vyavasTAnam veditavyam tat ca yaTAyogam	bag chags dang / shugs dang / yid la byed pa dang / lhan cig 'byung bas kyang yan lag rnams rkyen nyid du rnam par gzhag par rig par bya ste / de yang ci rigs su sbyar ro //	84.97534668626783
kaTam aFga karma vyavasTAnataH	yan lag gi las rnam par gzhan pas ji ltar bu zhe na /	90.08045658975277
avidyA kiMkarmikA	ma rig pa ci'i las can zhe na /	92.22396562945458
Bave ca sattvAn saMmohayati pratyayaH ca aBiDs Bavati saMskArANAm	srid pa la sems can rnams rmongs par byed pa dang / 'du byed rnams kyi rkyen kyang yin no //	90.36860323480066
saMskArAH kiMkarmakAH	'du byed ci'i las can zhe na /	92.32777261734009
gatizu ca sattvAn viBajanti pratyayAH ca Bavanti vijQAna vAsanAyAH	'gro ba rnams su sems can dag rnam par 'byed pa dang / rnam par shes pa'i bag chags kyi rkyen kyang yin no //	89.40673172788391
vijQAnam kim karmakam	rnam par shes pa ci'i las can zhes na /	89.26080223230215
sattvAnAm karma banDam ca DArayati pratyayaH ca Bavati nAma rUpasya	sems can rnams kyi las 'ching ba 'dzin pa dang / ming dang gzugs kyi rkyen kyang yin no //	91.51192885961021
nAma rUpam ca kiMkarmakam	ming dang gzugs ci'i las can zhe na / sems can rnams @66a * //	89.77376034951979
Atma BAvam ca sattvAn grAhayati pratyayaH ca Bavati zaz Ayatanasya	lus len du 'jug pa dang / skye mched drug gi rkyen kyang yin no //	85.99356696805698
zaz Ayatanam kiMkarmakam	skye mched drug ci'i las can zhe na /	89.133161970087
Atma BAva paripUrim ca sattvAn grAhayati pratya yaH ca Bavati sparSasya	sems can rnams lus yongs su rdzogs par len du 'jug pa dang / reg pa'i rkyen kyang yin no //	89.64312940840979
sparSaH kiMkarmakaH	reg pa ci'i las can zhe na /	93.03631792749677
vizaya upaBoge ca sattvAn pravarttayati pratyayaH ca Bavati vedanAyAH	yul gyi longs spyod la sems can rnams 'dzud pa dang / tshor ba'i rkyen kyang yin no //	90.54726624765988
vedanA kiMkarmikA	tshor ba ci'i las can zhe na /	93.53630510965984
janma upaBoge ca sattvAn pravarttayati pratyayaH ca Bavati tRzNAyAH	skye ba'i longs spyod la sems can rnams 'dzud pa dang / sred pa'i rkyen kyang yin no //	92.03412320420341
tRzNA kiMkarmikA	sred pa ci'i las can zhe na /	91.14230599074529
janmani ca sattvAn Akarzayati pratyayaH ca Bavati upAdAnasya	sems can rnams kyi skye ba 'dren pa dang / len pa'i rkyen kyang yin no //	84.7758015097902
upAdAnam kiMkarmakam	len pa ci'i las can zhe na /	90.43623440606254
punarBava AdAna arTam sa upAdAnam ca sattvAnAm vijQAnam karoti pratyayaH ca Bavati Bavasya	yang srid pa len pa'i phyir sems can rnams kyi rnam par shes pa nye bar len pa dang bcas par byed pa dang / srid pa'i rkyen kyang yin no //	92.12159062686702
BavaH kiMkarmakaH	srid pa ci'i las can zhe na /	91.7457044864523
punarBave ca sattva anaBimuKIkaroti pratyayaH ca Bavati jAteH	yang srid par sems can rnams mngon du phyogs par byed pa dang / skye ba'i rkyen kyang yin no //	88.08396028606992
jAtiH kiMkarmikA	skye ba ci'i las can zhe na /	89.38482131629155
nAma rUpa zaz Ayatana sparSa vedanA AnupUrvyA ca sattvAn aBinirvarttayati pratyayaH ca Bavati jarA maraNasya	ming dang gzugs dang / skye mched drug dang / rig pa dang / tshor ba'i rim gyis sems can rnams mngon par 'grub par byed pa dang / rga shi'i rkyen kyang yin no //	89.60592300207273
jarA maraNam kiMkarmakam	rga shi ci'i las can zhe na /	89.13380923764458
punar punar vayaH pariNAmena jIvita pariNAmena ca sattvAni ojayati	yang dang yang na tshod 'gyur ba dang / srog 'gyur ba la sems can rnams sbyor ba'o //	75.61856255495297
kaTam aFga saMkle SasaMgrahataH	yan lag kun nas nyon mongs par bsdu bas ji lta bu zhe na /	87.85937016585777
yA ca avidyA yA ca tRzNA yat ca upAdAnam iti ayam saMkleSa saMgrahaH	ma rig pa gang yin pa dang / sred pa gang yin pa dang / len pa gang yin pa 'di ni nyon mongs pa'i kun nas nyon mongs par bsdu'o //	94.33271666869742
ye ca saMskArAH yat ca vijQAnam yaH ca BavaH iti ayam karma saMkleSa saMgrahaH	'du byed gang yin pa dang / rnam par shes pa gang yin pa dang / srid pa gang yin pa 'di ni las kyi kun nas nyon mongs pa bsdu'o //	91.99126362800598
SezANi janma saMkleSa saMgrahaH	lhag ma rnams ni tshe'i kun nas nyon mongs par bsdu'o //	92.50706304822648
kaTam arTataH	don gyis ji lta bu zhe na /	88.4182746498673
niHkartRka arTaH pratItyasamutpAda arTaH sa hetuka arTaH niHsattva arTaH para taMtra arTaH nirohaka arTaH anitya arTaH kzaNikA arTaH hetu Pala prabanDa an upacCeda arTaH anurUpa hetu Pala arTaH vicitra hetu Pala arTaH pratiniyata hetu Pala arTaH ca pratItya	byed pa po med pa'i don ni rten cing 'brel par 'byung ba'i don dang / rgyu dang bcas pa las byung ba'i don dang / sems can med pa'i don dang / gzhan gyi dbang gi don dang / g-yo ba med pa'i don dang / mi rtag pa'i don dang / skad cig pa'i don dang / rgyu dang 'bras bu rgyud rgyun mi 'chad pa'i don dang / rgyu dang 'bras bur @66b mthun pa'i don dang / rgyu dang 'bras bu sna tshogs kyi don dang / rgyu dang 'bras bu so sor nges pa'i don ni rten cing 'brel par 'byung ba'i don to //	83.84007974232286
kaTam gAmBIryataH	zab pas ji lta bu zhe na /	90.48433986076941
hetu gAmBIryataH pi lakzaNa gAmBIH yataH pi utpatti BAga amBIH yatas pi sTiti gAmBIryataH pi vRtti gAmBIryataH pi gAmBIryam drazwavyam	rgyus zab pa dang / mtshan nyid kyis zab pa dang / skye bas zab pa dang / gnas pas zab pa dang / 'byung bas zab pas kyang zab par blta'o //	73.34380904599278
api Kalu kzaNikaH pratItyasamutpAdaH sTititaH ca upalaByate	yang rten cing 'brel par 'byung ba skad cig pa yang yin la / gnas par yang dmigs /	89.99544786851183
nirIhaka pratyayaH pratItyasamutpAdaH samarTa pratyayaH ca upalaByate	rten cing 'brel par 'byung ba g-yo ba med pa'i rkyen las 'byung ba'ang yin la / nus pa'i rkyen las 'byung bar yang dmigs /	90.01753063439199
niHsattvaH pratItyasamutpAdaH attvataH ca upalaByate	rten cing 'brel par 'byung ba sems can med pa yang yin la sems can du yang dmigs / rten cing 'brel par 'byung ba byed pa po yang med la /	78.95128612306749
na svatas na paratas na dvAByAm na svayaMkAra apara	las dang 'bras bu chud mi za bar yang dmigs shing bdag las ma yin gzhan las ma yin gnyi ga las ma yin /	85.0912920542092
kAra ahetu samutpannaH	rang gi byed pa dang / gzhan gyi byed pa dang / rgyu med pa las byung ba yang ma yin te /	69.48806940470989
atas pi gamBIraH	de'i phyir zab pa'o //	56.0339855931022
kaTam aBiDs praBedataH	rab tu dbye bas ji lta bu zhe na /	82.31133458193611
vijQAna utpatti praBedataH cyuti upapatti praBedataH vAhya Sasya utpatti praBedataH saMvartta vivartta praBe dattaH AhAra upastamBa praBedataH izwa anizwa gati viBAga praBedataH viSudDi praBedataH praBAva praBedataH ca praBedaH drazwavyaH	rnam par shes pa 'byung ba'i rab tu dbye ba dang / 'chi 'pho dang skye ba'i rab tu dbye ba dang / phyi'i lo tog 'byung ba'i rab tu dbye ba dang / 'jig pa dang chags pa'i rab tu dbye ba dang / zas kyis brtan pa'i rab tu dbye ba dang / 'dod pa dang mi 'dod pa'i 'gro ba rnam par 'byed pa'i rab tu dbye ba dang / rnam par dag pa'i rab tu dbye ba dang / mthu stobs kyi rab tu dbye bas kyang rab tu dbye bar blta'o //	87.98648005991312
kaTam anuloma pratilomataH	lugs dang mthun pa dang lugs dang mi mthun pas ji lta bu zhe na / kun nas nyon mongs pa'i lugs dang mthun pa dang lugs dang mi mthun pa dang / rnam par byang ba'i lugs dang mthun pa dang lugs dang mi mthun pas kyang /	69.85457125923564
saMkleSAH nulomapratilomataH pi vyavadAna anuloma pratilomataH pi pratItyasamutpAdasya anuloma pratiloma nirddeSaH drazwavyaH aTa mUlavastuni triDama paricCede praTame tRtIyaH BAgaH	rten cing 'brel par 'byung ba'i lugs dang mthun pa dang lugs dang mi mthun pa bstan par blta'o //	44.0021435557874
kaTam pratyayaH kati pratyayAH kim arTam pratyaya parIkzA	ji ltar na rkyen yin / rkyen rnams ni du zhig / ci'i phyir rkyen du brtag ce na /	94.73747544463963
hetutaH pi samanantarataH pi AlambanataH pyaDipatitaH pi pratyayaH drazwavyaH	rgyu dang de ma thag pa dang / dmigs pa dang bdag pos kyang rkyen du blta'o //	77.31223432943104
sarvANi pratyayaH	thams cad kyang rkyen du blta'o //	67.72292160987854
Atma hetuka Darma aBiniveSa tyAjana arTam	chos bdag gi rgyu las byung bar mngon par zhen pa spang ba'i phyir ro //	95.3165566289333
hetu pratyayaH katamaH	rgyu'i rkyen gang zhe na @67a * //	95.54146763857673
AlayavijQAnam kuSala vAsanA ca	kun gzhi rnam par shes pa dang dge ba'i bag chags so //	88.43547053770585
api Kalu svaBAvataH pi praBedataH pi saha Ayatas pi saMpratipattitaH pi paripanTataH pi parigrahataH pi hetu pratyayaH drazwavyaH	yang ngo bo nyid dang / rab tu dbye ba dang / grogs dang / mthun par rtogs pa dang / rgyas pa dang / bar du gcod pa dang / yongs su 'dzin pas kyang rgyu'i rkyen du blta'o //	74.01705509404852
kaTam svaBAvataH	ngo bo nyid kyis ji lta bu zhe na /	89.31414774485998
kAraNam hetu svaBAvataH	byed rgyu ste rgyu'i ngo bo nyid do //	91.35794571826332
kaTam praBedataH	rab tu dbye bas ji lta bu zhe na /	86.46245650684132
utpatti kAraNam tat yaTA cakzuH sAmagrI vijQAnasya	'byung ba'i byed rgyu ni / dper na rnam par shes pa'i ni rnam par shes pa'i tshogs pa lta bu'o //	92.88150226446959
sTiti kAraNam tat yaTA AhAraH BUtAnAm sattvAnAm saMBava eziNAm ca	gnas pa'i byed rgyu ni dper na sems can byung ba rnams dang 'byung bar 'dod pa rnams kyi zas lta bu'o //	91.2830946152508
DRti kAraNam tat yaTA pRTivI sattvAnAm	rten pa'i byed rgyu ni dper na sems can rnams kyis lta bu'o //	87.7458213529279
prakASa kAraNam tat yaTA pradIpaH rUpANAm	gsal ba'i byed rgyu ni / dper na gzugs rnams kyi sgron ma lta bu'o // 'gyur ba'i byed rgyu ni /	87.9566026715521
vikAra kAraNam tat yaTA agniH inDanasya	dper na shing gi me lta bu'o // 'bral ba'i byed rgyu ni /	90.22156108053106
viyoga kAraNam tat yaTA dAtram Cedyasya	dper na rnga bar byed pa'i zor ba lta bu'o //	74.7021470864614
pariNati kAraNam tat yaTA Silpa sTAnAH dikam hiraNya AdInAm	bsgyur ba'i byed rgyu ni / dper na gser la sogs pa'i bzo'i gnas la sogs pa lta bu'o //	86.61237289796048
saMpratyaya kAraNam tat yaTA DUmaH gneH	yid ches pa'i byed rgyu ni / dper na me'i du ba lta bu'o //	93.85603992009567
saMpratyAyana kAraNam tat yaTA pratijQA hetu dRzwAntAH sADyasya	yid ches par byed pa'i byed rgyu ni / dper na bsgrub pa'i dam bca' ba dang / gtan tshigs dang dpe rnams lta bu'o //	93.67416084212823
prApaNa kAraNam tat yaTA mArgaH nirvANasya	'thob pa'i byed rgyu ni / dper na mya ngan las 'das pa'i lam lta bu'o //	93.64167391013291
vyavahAra kAraNam tat yaTA nAma saMjQA dRzwiH ca	tha snyad kyi byed rgyu ni / dper na ming dang mtshan ma dang / mthong ba lta bu'o //	88.46532343333973
apekzA kAraNam yat apekzya yatra arTi tvam utpadyate	ltos pa'i byed rgyu ni / gang la ltos nas gang don du gnyer ba 'byung ba ste /	93.1751194711658
tat yaTA jiGatsAm apekzya Bojane	dper na bkres pa la ltos nas zas lta bu'o //	85.88861105658792
Akzepa kAraNam vidUraH pratyayaH	'phen pa'i byed rgyu ni /	76.65552682876586
tat yaTA avidyA jarA maraNasya	rgyang ring po'i rkyen te / dper na rga shi'i ma rig pa lta bu'o //	92.27424065390629
aBinirvRtti kAraNam AsannaH pratyayaH	mngon pa 'grub pa'i byed rgyu ni nye ba'i rkyen te /	89.35864874032828
tat yaTA avidyA saMskArANAm	dper na 'du byed rnams kyi ma rig pa lta bu'o //	92.66605043411255
parigraha kAraNam tad anyaH pratyayaH	yongs su 'dzin pa'i byed rgyu ni de las gzhan pa'i rkyen te /	91.57574502757339
tat yaTA kzetra udaka pAsyA  vApyA dikam sasya udayasya	dper na lo tog 'byung ba'i zhing dang chu dang lud la sogs pa lta bu'o //	76.14846145541982
AvAhaka kAraNam anukUlataH pratyayaH	chud par byed pa'i byed rgyu ni mthun pa'i rkyen te /	87.03262494195182
tat yaTA samyak rAjA sevA rAja ArADanAyAH	dper na rgyal po mnyes par byed pa'i phyir rgyal po la legs par brten pa lta bu'o //	82.72273513940392
prati niyama kAraNam pratyaya vEcitryam	so sor nges pa'i byed rgyu ni rkyen sna tshogs pa ste /	89.30316463383761
tat yaTA paQca gati pratyayAH paQcAnAm gatInAm	dper na 'gro ba lnga po dag gi 'gro ba lnga'i rkyen lta bu'o //	92.83292625363929
sahakAri kAraNam pratyaya sAmagrI	lhan cig byed pa'i @67b byed rgyu ni rkyen rnams tshogs pa ste /	90.85903310775757
