		10.0
Darma kIrti hetu bindu namaH budDAya	@238a # // rgya gar skad du /he tu bin du n'a ma pra ka ra na / bod skad du / gtan tshigs kyi thigs pa zhes bya ba'i rab tu byed pa / 'jam dpal gzhon nur gyur pa la phyag 'tshal lo //	66.6758023740574
parokza arTa pratipatteH anumAna ASraya tvAt eva tat vyutpAdana arTa saMkzepate idam AraByate pakza DarmaH tad aMSena vyAptaH hetuH triDA eva saH	don lkog tu gyur pa sgrub pa'i rten ni / rjes su dpag pa nyid yin pas / de bye brag tu rtogs par @238b bya ba'i phyir / mdor bsdus nas 'di brtsam mo // phyogs chos de'i chas khyab pa ni // gtan tshigs de ni rnam gsum nyid //	92.46704734801425
avinA aBAva niyamAt hetvABAsAH tatas pare	med na mi 'byung nges phyir ro // gtan tshigs ltar snang de las gzhan //	87.49721401571308
pakzaH DarmI	phyogs ni chos can te /	78.5616162341574
avayave samudAya upacArAt	yan lag la spyi nye bar brtags pa'i phyir ro //	73.82083026399003
prayojana aBAvAt anupacAraH iti ced  na	gal te dgos pa med pa'i phyir nye bar gdags par mi bya'o zhe na /	90.02414345741272
sarva Darmi Darma pratizeDa arTa tvAt upacArasya	ma yin te nye bar gdags pa ni chos can gyi chos thams cad dgag pa'i phyir te /	79.84391144705195
evam hi cAkzuza tva Adi parihRtam Bavati	de ltar na mig gis gzung bar bya ba yin pa'i phyir ro zhes bya ba la sogs pa yongs su spangs pa yin no // gal te chos ni gzhan la brten pa yin pas kyang /	71.92836141993786
Darma vacanena api para ASraya tvAt Darmasya Darmya ASraya sidDO pratyAsatteH sADya DarmiNaH eva sidDiH iti ced  na	rten chos can 'grub la / chos can smos pas kyang nye ba yin pa'i phyir / bsgrub par bya ba'i chos can yin par 'grub po zhe na /	82.98355791008144
pratyAsatteH dRzwAnta DarmiNaH pi	dpe'i chos can yang nye ba yin pa'i phyir ro //	81.8037523005871
sidDe tad aMSa vyAptyA dRzwAnta DarmiNi sattve punar DarmiNaH vacanam dRzwAnta DarmiNaH eva yaH DarmaH sa hetuH iti niyama arTam ASaMkyeta	de'i chos khyab pas dpe'i chos can la yod par grub pa'i phyir ; chos can gyi chos smos pas ni / bsgrub par bya ba'i chos can yongs su bsdus so // bsgrub kyang nges par bya ba'i phyir yang smos su dogs par 'gyur te /	91.3673507484175
dRzwam sajAtIyaH eva sattvam iti avaDAraNena sADya aBAve sidDe pi vyatireke sADya aBAve asattva vacanam	mthun pa la yod pa kho nas ldog pa la de med par grub mod kyi / bsgrub par bya ba med pa la med pa zhes smos pa bzhin du / de'i chos khyab pa smos pas /	90.05454957920962
taTA iha api tad aMSa vyApti vacanAt sidDe pi dRzwAnta DarmiNi sattve tatra eva BAva niyama arTa Darmi vacanam ASaMkyeta	dpe'i chos can la yang yod par grub mod kyi / de nyid la yod par nges par bya ba'i phyir / chos can smos su dogs par 'gyur ro //	82.2279143619272
tasmAt sAmarTyAt arTa pratItO= api upacAra mAtrAt samAna nirdeSAt pratipatti gOravam ca parihRtam Bavati pakzasya Darma tve tad viSezaNa apekzasya anyatra ananuvRtteH asADAraNa tA iti ced  na	de bas na shugs kyis don go yang nye bar brtags pa tsam yi ge mnyam pas sgrub dka' ba yang yongs su spangs pa yin no // gal te phyogs kyi chos nyid yin na / de'i khyad par la ltos pa gzhan du mi 'jug go zhe na /	75.21141546836763
ayoga vyavacCedena viSezaNAt yaTA cEtraH DanurDaraH iti	ma yin te ma 'brel ba rnam par bcad pas bye brag tu byas pa'i phyir dper na nag pa gzhu thogs so zhes bya ba lta bu yin gyi / dper na srid sgrub gzhu thogs pa lta bu'o /	79.61368559947138
na anya yoga vyavacCedena yaTA pArTaH DanurDaraH iti	zhes gzhan dang 'brel ba rnam par bcad pas ni ma yin no //	74.13741483534167
tad aMSaH taDarmaH	de'i cha ni de'i chos so //	71.90094526608785
tasya vyAptiH hi vyApakasya tatra BAvaH eva	khyab pa ni de la khyab par byed pa yod pa kho na'am /	86.98951878371062
vyApyasya vA tatra eva BAvaH	yang na de kho na la khyab par bya ba yod pa'o //	86.22875867571149
etena anvayaH vyatirekaH vA pakza DarmaH ca yaTAsvam pramANena niScitaH uktaH	'dis rjes su 'gro ba'am / ldog pa dang phyogs kyi chos rang gi tshad ma ji lta bdag gis nges par bshad @239a * // pa yin te /	90.99157419976693
sarvatra hetO sADya vEDarmye vyApti asidDeH vyApaka anivRttO nivRtti aBAvAt vA	gtan tshigs thams cad la bsgrub par bya ba'i chos med na / khyab pa mi 'grub pa'i phyir ram / yang na khyab par byed pa log na ldog pa med pa'i phyir ro //	92.06297129425464
anvaya vyatireka aniScayAByAm hi tad Darma vyApti niScayaH	rjes su 'gro ba dang / ldog pa nges pa dag gis ni / de'i chos khyab pa nges pa yin no //	89.36901116486817
tatra pakza Darmasya sADya DarmiNi pratyakzataH numAnataH vA prasidDiH	de la bsgrub par bya ba'i chos can la / phyogs kyi chos mngon sum mam / rjes su dpag pa'i sgo nas rab tu grub pa ni nges pa ste /	87.78607429017167
taTA pradeSe DUmasya	dper na phyogs na du ba'am /	87.03732722146171
Sabde vA kRtaka tvasya	sgra la byas pa nyid lta bu'o //	78.82741904258728
sa DUmam hi pradeSam arTa antara vivikta rUpam asADAraNa AtmanA dRzwavataH smArtam yaTAdRzwa Beda vizayam liFga jQAnam utpadyate	du ba dang bcas pa'i phyogs don gzhan gyis dpe na pa'i ngo bo can thun mong ma yin pa'i bdag nyid du mngon sum gyis mthong ba la / ji ltar mthong ba tha dad pa'i yul can dran pa rtags shes pa skye'o //	91.3083913751841
tatra yat Adyam asADAraNa vizayam darSanam tat eva pramANam	de la dang po yul thun mong ma yin pa mthong ba gang yin pa de kho na tshad ma yin no //	91.90535293859406
tasmin= taTABUte darSanena dRzwesati sa yena yena asADAraNaH tat asADAraNa tAm tatas Bedam aBilapantI ata dvaya AvRti vizayA smRtiH utpatrApratyakza balena na pramANam	de de ltar mthong nas mngon sum gyi stobs kyis de dang dang gang gis thun mong ma yin pa de'i thun mong ma yin pa nyid de las tha dad pa mngon par brjod pa de ma yin pa las log pa'i yul can gyi dran pa skyes pa ni /	82.34712903655124
yaTA dRzwa AkAra grahaNAt	ji ltar yongs su mthong ba'i rnam pa 'dzin pa'i phyir tshad ma ma yin te /	76.77907274864816
prAc asADAraNam dRzwvA asADAraNaH iti aBilapataH apUrva arTa aDigama aBAvAt	sngar thun mong ma yin pa mthong nas / thun mong ma yin pa'o zhes mngon par brjod pas ni / sngon ma rtogs pa'i don rtogs pa med pa'i phyir ro //	83.98257675198491
arTa kriyA sADanasya AlocanA jQAnena darSanAt ca	don byed pa sgrub pa mthong zin pa'i phyir /	79.41979893771085
adRzwasya punar tad sADanasya vikalpena apratipatteH anumAna vat	rnam par rtog pas ni rjes su dpag pa ni de sgrub pa'i rang gi ngo bo ma mthong ba yang rtogs pa med pa'i phyir ro // don byed pa don du gnyer ba rtogs pa dang ldan pa thams cad ni tshad ma'am /	79.3277264824625
arTa kriyA arTI hi sarvaH prekzAvAn pramANam apramANam vA anvezate	tshad ma ma yin pa tshol na /	63.068360139583724
na ca sAmAnyam sva lakzaNa pratipatteH UrDvam tad sAmarTya utpatra vikalpa vijQAna grAhyam kAQcid arTa kriyAm upakalpayati	spyi ni don byed cung zad kyang mi nus te / rang gi mtshan nyid rtogs pa'i 'og tu de'i mthu las skyes pa rnam par rtog pa can gyi rnam par shes pa'i gzung ba yin pas /	85.79389768825779
yaTA nIlam dRzwvA nIlam iti jQAne	dper na sngon po mthong nas sngon po'o mthong nas sngon po'o snyam pa'i rnam par shes pa la snang ba bzhin te /	78.23343139090683
tat eva hi nIla sva lakzaNam taTAviDa sADya arTa kriyA kAri	sngon po'i rang gi mtshan nyid de nyid de lta bus bsgrub par bya ba / don bya ba byed pa yin la /	88.0897447800154
tat ca tena AtmanA dRzwam eva AlocanA pratyayena	de yang de'i bdag nyid du mngon sum gyis mthong ba kho na yin no //	83.84637564097129
na ca tad sva lakzaNa grahaNa uttara kAla BAvinaH nIla vikalpasya vizayeNa nIla sADya arTa kriyA kriyate	de'i rang gi mtshan nyid gzung ba'i 'og tu 'byung ba sngon po rnam par rtog pa'i yul @239b gyis ni / sngon po don gyis bsgrub par bya ba'i don bya ba sgrub par mi byed de /	92.44311496222723
tasmAt anaDigata arTa vizayam pramANam iti api anaDigate sva lakzaNe iti viSezaNIyam	de lta bas na don ma rtogs pa'i yul can tshad ma yin zhes bya ba yang rang gi mtshan nyid ma rtogs pa zhes khyad par du bya'o //	85.96890541932123
aDigate tu sva lakzaNe tad sAmarTya janmA vikalpaH tad anukArI kAryataH tad vizaya tvAt smRtiH eva	rang gi mtshan nyid rtogs nas de'i mthu las skyes pa can rnam par rtog pa de dang mthun par byed pa ni bya ba'i sgo nas de'i yul can yin pa'i phyir dran pa kho na yin gyi /	92.43148467012614
na pramANam	tshad ma ni ma yin te /	85.90982932629792
anaDigata vastu rUpasya anaDigateH	dngos po'i ngo bo ma rtogs pa med pa'i phyir ro //	75.19133253097534
vastu aDizWAna tvAt pramANa vyavasTAyAH	tshad ma rnam par gzhag pa ni dngos po la brten pa can nyid yin pa'i phyir ro //	83.47487655294395
arTa kriyA yogya vizaya tvAt tad arTinAm pravRtteH	de'i don du 'jug pa ni don byed par rung ba'i yul can yin pa'i phyir ro //	92.19449915367241
arTa kriyA yogya lakzaNam hi vastu	dngos po ni don byed par rung ba'i mtshan nyid can yin pa'i phyir ro //	79.04059188659635
tatas pi vikalpAt vastuni eva tat aDyavasAyena puruzasya pravRtteH	rnam par rtog pa de las kyang de la lhag par chags pas / dngos po kho na la 'jug pa'i phyir ro //	82.81110218423201
pravRttO pratyakzeNa aBinna yogakzema tvAt	zhugs nas mngon dang rnam par rtog pa grub pa dang bde ba mi dad pa'i phyir ro //	74.54651717954813
pUrva pratyakza kzaNena aBinna yogakzema tvAt uttarezAm kvacid aprAmANya prasaFgaH iti ced  na	gal te mngon sum snga ma dang phyi ma rnams su 'ga' zhig la nye bar sbyor ba tha mi dad pa'i phyir ro // tshad ma nyid ma yin par thal bar 'gyur ro zhe na / ma yin te skad cig ma'i bye brag gis bsgrub par bya ba'i don du 'dod pa la grub pa dang /	79.35112389196946
kzaNa viSeza sADya arTa vAQcAyAm nAnA yoga kzema tvAt sADAraNe hi kArye na tezAm sAmarTya BedaH	bde ba tha dad pa'i phyir ro //	32.35158594736327
apara apara DUma pramita satri kRzwa agnizu iva anumAna jQAnAnAm agni mAtra sADye rTe	'bras bu thun mong ba zam gyi bsgrub par bya ba'i don la du ba gzhan dang gzhan gyis gzhal ba'i me nye ba bzhin no //	80.98909418797044
etena Darmi Darma liFga Adi vikalpasya pramANa pRzWa BAvinaH prAmANyam pratyuktam	'dis ni chos dang chos can dang rtags la sogs pa'i rnam par rtog pa tshad ma'i rjes la 'byung ba tshad ma nyid du bsal ba yin no //	87.87446550201382
anvaya niScayaH pi svaBAva hetO sADya Darmasya vastutas tad BAva tayA sADana Darma BAva mAtra anubanDa sidDiH	rjes su 'gro ba nges pa yang rang bzhin gyi gtan tshigs kyi ni bsgrub par bya ba'i chos dngos su na de'i ngo bo can nyid yin pas / sgrub pa'i chos kyi ngo bo tsam dang rjes su 'brel par grub pa yin no //	92.0674287535852
sA hi sADya viparyaye hetoH bADaka pramANa vRttiH yaTA sat tat kzaNikam eva	de ni bsgrub par bya ba las bzlog pa la gtan tshigs kyi gnod pa can gyi tshad ma 'jug pa yin te dper na gang yod pa de ni skad cig ma kho na yin no //	91.6787149586426
akzaNika tve rTa kriyA viroDAt tad lakzaNam vastu tvam hIyate	skad cig ma nyid ma yin na don byed pa dang 'gal ba'i phyir de'i mtshan nyid dngos po nyid nyams par 'gyur blta bu'o //	84.28151952696615
kArya hetO kArya kAraNa BAva sidDiH	'bras bu'i tshigs kyi rgyu dang 'bras bu'i ngo bo grub pa yin te /	89.08564629367835
yaTA idam asya upalamBe upalabDi lakzaNa prAptam anupalabDam upalaByate	'di lta ste 'di dmigs na dmigs pa'i @240a * // rig byar gyur pa sngon po mi dmigs pa 'di dmigs pa yin no //	86.20257969144845
satsu api anyezu hetuzu asya aBAve na Bavati iti yaH tad BAve BAvaH tad aBAve BAvaH ca pratyakza anupalamBa sADanaH kArya kAraNa BAvaH tasya s	rgyu gzhan dag yod kyang 'di med na med pa'i phyir / de yod na ni yod med na ni med bas / rgyu dang 'bras bu'i ngo bo ni mngon sum dang mi dmigs pa'i grub pa can yin te /	83.36384352186197
kArya kAraNa BAvaH eva hi arTa antarasya evam syAt yatra DUmaH tatra avaSyam agniH iti	de grub pa'o // de ltar na rgyu dang 'bras bu'i ngo bo ni don tha dad pa kho nar 'gyur la / gang na du ba yod pa de na gdon mi za bar me yod de /	95.98600899671695
agni BAvaH eva hi BAvaH DUmasya tat kAryatvam iti	me yod na yod pa kho na de'i 'bras bu nyid du ba yin pa'i phyir ro //	91.40714266116443
anupalabDO= api anvaya niScayaH asa dvaya vahArasya upalabDi lakzaNa prAptasya anupalabDi mAtra vRtti sADanam	mi dmigs pa'i rjes su 'gro ba nges pa yang med pa'i tha snyad dmigs pa'i rig byar gyur pa mi dmigs pa tsam 'jig pa'i sgrub pa can yin te /	87.28165794592955
nimitta antara aBAva upadarSanAt vyatireka niScayaH pi kArya svaBAva hetvoH kAraNa vyApaka anupalabDiByAm dRSya vizayAByAm	rgyu mtshan gzhan med par mthong ba'i phyir ro //	46.24821781332606
kArya kAraNa vyApya vyApaka BAva sidDO satyAm sADya aBAve BAva sidDiH uddizwa vizayasya aBAva upadarSane	ldog pa nges pa yang 'bras bu dang rang bzhin gyi gtan tshigs dag gis ni rgyu dang 'bras bu dang khyab par bya ba dang / khyab par byed pa'i ngo bo grub na yul bltar rung ba rgyu dang khyab par byed pa dag mi dmigs pas / bsgrub par bya ba med na gtan tshigs 'grub pa'o // yul bstan pa can med par nye bar ston pa la /	79.96605203864631
anupalabDi lakzaNa prAptasya anyaTA kvacid aBAva asidDeH	de lta ma yin na dmigs pa'i rig byar ma gyur pa gang du yang med par mi 'grub pa'i phyir ro // yul ma bstan pa can ni bsgrub par bya ba med na med par ston pa yin phyir ro // te /	81.14625517723518
anuddizwa vizayam sADya aBAve hetvaBAva KyApanam pratibanDa mAtra sidDO siDyati iti na tatra vyatireka sADane anupalabDyoH dRSya vizaya tA	'brel pa tsam grub na 'grub pas de las ni ldog pa bsgrub par bya ba mi dmigs pa yul ltar rung ba ltos pa phyir ro // te / ma yin no //	79.04168032266615
vyatireka aniScayaH nupalabDO= upalabDi lakzaNa prAptAt sataH nupalamBa aBAva darSanam	mi dmigs pa'i log pa nges pa ni dmigs pa'i rig byar gyur pa mi dmigs pa med pa nye bar phyir ro // te / ma yin no // ston pa'o // mtshan nyid de lta bu can de ni phyir ro // te / ma yin no //	83.02158310139887
etad lakzaNaH triDA eva saH hetuH tri prakAraH eva	ston pa'o // rnam pa gsum / gtan tshigs ni rnam pa gsum kho na ste /	84.93531888381402
svaBAvaH kAryam anupalabDiH ca iti	rang bzhin dang 'bras bu dang / mi dmigs pa yin te /	87.92302098641028
yaTA anitye kasmiMScid sADye sattvam iti agnimati pradeSe DUmaH iti aBAve ca upalabDi lakzaNa prAptasya anupalabDiH iti	dper na 'ga' zhig mi rtag pa bsgrub par bya ba la yod pa lta bu dang / me dang ldan pa'i phyogs la du ba lta bu dang / med pa la dmigs pa'i rig byar gyur pa mi dmigs pa zhes bya ba lta bu'o //	91.30917749035272
atra eva triviDa hetO= avinABAvasya niyamAt	rnam pa gsum po 'di kho nar / med na mi 'byung nges phyir ro //	80.09681726306876
pakza Darmasya yaTA uktA vyAptiH avinA aBAvaH	phyogs kyi chos kyi khyab pa ji skad du / bshad pa ni med na mi 'byung ba yin te /	83.01356189822177
na sa triviDAt hetoH anyatra asti iti atra eva niyataH ucyate	de ni gtan tshigs rnam pa gsum las med pas 'di nyid du nges pa zhes bya'o //	83.09147087571048
tatra sADana Darma BAva mAtra anvayini sADya Darme svaBAvaH hetuH	de la sgrub pa'i chos kyi ngo bo tsam dang ldan @240b pa can ni bsgrub par bya ba'i chos kyi rang bzhin gyi gtan tshigs yin no //	90.60270158449234
apara apara vyAvRtti Bedena Darma Bede sati api vastutas liFga svaBAvaH eva	phan tshun ldog pa'i bye brag gis chos tha dad pa yin yang / dngos su na gtan tshigs ni rtags can gyi rang bzhin kho na yin no //	90.6608815495887
hetu svaBAve sADya Darme nu ayavyaBicAra aBAvAt lakzaNe tanmAtra anvayena iti viSezaNam parama tApekzam	rang bzhin la rjes su 'gro ba 'khrul pa med pa las mtshan nyid la gzhan gyi lugs la ltos nas / de tsam dang ldan pa can gyis khyad par du byas so //	85.45536795050877
pare hi arTa antara nimittam atad BAva mAtra anvayinam api svaBAvam iccanti	gzhan dag ni don gzhan gyi rgyu mtshan can de'i ngo bo tsam dang ldan pa ma yin pa'i chos kyang rang bzhin du 'dod pas /	86.39788458493443
tena ca viSezaNena taTaviDasya atatsvaBAva tAm tasmin sADye hetoH vyaBicAram ca Aha	khyad par gyis de lta bu rang bzhin ma yin pa nyid dang / bsgrub par bya ba de la gtan tshigs 'khrul par bstan de /	84.53618751504717
yaTA hetumati vinASe kRtaka tvasya	dper na 'jig pa rgyu dang ldan pa la byas pa lta bu'o //	79.14213105610439
tasya dviDA prayogaH	de'i sbyor ba ni rnam par gnyis te /	82.68190381262038
sADarmyeNa ekaH vEDarmyeNa aparaH	chos mthun pa nyid can dang // chos mi mthun pa can gnyis kyis so //	85.4346682184219
yaTA yat sat tat sarvam kzaNikam	dper na gang yod pa de thams cad ni skad cig ma ste /	92.99269303735697
yaTA Gawa AdayaH san= ca SabdaH iti	dper na bum pa la sogs pa lta bu'o //	79.09716376098427
taTA kzaNika tva aBAve sattva aBAvaH san= ca SabdaH iti	sgra yang yod pa yin pas zhes bya ba dang / de bzhin du skad cig ma nyid med na yod pa yang med pa yin na / sgra ni yod pas zhes bya ba lta bu ste / rjes su 'gro ba'am /	83.60555767169123
sarva upasaMhAreNa vyApti pradarSana lakzaNO sADarmya vEDarmya prayogO= uktO	ldog pas thams cad nye bar bsdus nas / khyab pa rab tu ston pa'i mtshan nyid can gyis chos mthun pa can dang / chos mi mthun pa can gyi sbyor ba dag yin no //	89.26123032952366
atra pakza Darma sambanDa vacana mAtra sAmarTyAt eva pratijQA arTasya pratIteH na pratijQAyAH prayogaH upadarSitaH	'dir ni shugs kho nas dam bcas pa'i don rtogs pa'i phyir dam bcas pa'i sbyor ba mi bya'o //	76.22495525470241
apradarSite prameye kaTam tad pratItiH iti ced svayam pratipattO prameyasya kaH upadarSayitA	gal te gzhal bya'i don rab tu ma bstan na / de ci ltar rtogs she na /	70.10905176835821
pradeSa sTam DUmam upalabDavataH tasya agninA vyApteH smaraNe tad sAmarTyAt eva agniH atra iti pratijQA arTa pratItiH Bavati	bdag nyid kyis rtogs pa la gzhan bya nye bar ston par byed pa su zhig yod de / phyogs na yod pa'i du ba nye bar dmigs pas de la mes khyab pa dran na / de'i mthu kho nas 'di na me yod do snyam du shes so //	93.50493819238618
na ca tatra kaScid agniH atra iti asmE nivedayati	de na 'di la 'ga' yang 'di na me yod do zhes ston par yang mi byed la /	84.25395444938087
na api svayam api prAk eva pratipadyate kiQcid	bdag nyid kyis kyang cung zad kyang mi rtogs te /	80.98154073345418
pramANam antareNa evam pratIteH nimitta aBAvAt pratItO liFgasya vEyarTyam	tshad ma ma rtogs par de ltar rtogs pa'i rgyu mtshan med pa'i phyir ro // rtogs na ni rtogs don med pa nyid du 'gyur ro // bdag nyid kyis bab col du 'di na me yod do snyam du @241a * // gzhal bya rnam par bzhag nas /	78.06413526566503
svayam eva akasmAt agniH atra iti vyavasTApya tad pratipattaye paScAt liFgam anusarati iti kaH yam pratipatteH kramaH	phyis de rab tu sgrub pa'i yan lag gi rjes su 'brang ngo snyam na / rtogs pa'i rim pa 'di ni ci zhig yin /	71.61637065744522
pareNa api tat ucyamAnam plavate eva upayoga aBAvAt	de gzhan gyis brjod na yang dgos pa med pa'i phyir cha chung ngo //	78.20612085285867
vizaya upadarSanam upayogaH iti ced	gal te dgos pa yul bstan pa yin no zhe na /	83.01408059098
tena eva tAvat darSyamAnena kaH rTaH	re zhig bstan pa de nyid kyis ci zhig phan /	80.38968831842595
yadi pratItiH anyaTA na syAt tadA sarvam SoBeta	gal te gzhan du na rtogs par mi 'gyur na ni / thams cad legs par 'gyur ro // de lta bas na 'dis bdag nyid kyis rtogs pa na /	86.69283401355437
tasmAt eza svayaMpratItO kenacid vizaya upasTApakena vinA api pratiyan asmAn kAryiNaH dRzwvA parva brAhmaNaH iva vyaktam mUlyam mRgayat	yul nye bar 'god pa 'ga' yang med par rtogs la / kho bo don du gnyer ba mthong nas / dus ston gyi bram ze bzhin du / gsal bar rngan pa sgugs par byed pa yin no //	80.88327358338533
asmad vacanAt api svayam sidDam eva liFgam anusRtya sADyam pratyeti iti kaH nayoH avasTayoH viSezaH dRzwA ca pakza Darma sambanDa vacana mAtrAt sADarmya vat prayoga AdeH pratijQA vacanam antareNa api pratItiH iti kaH tasya upayogaH	kho bos brjod kyang bdag nyid grub zin pa'i rtags kho na'i rjes su 'brangs na rtogs par 'gyur bas gnas skabs 'di gnyis la khyad par ci zhig yod / dam bca' ba smos pa med par yang phyogs kyi chos dang 'brel pa smos pa tsam gyis rtogs pa yang mthong ba'i phyir de dgos pa ci zhig / yod /	76.4446819343876
sva niScaya vat anyezAm api niScaya utpAdanAya sADanam ucyate	rang la nges pa bzhin du gzhan dag la nges pa bskyed par 'dod pa'i phyir sgrub / yod /	83.4154670229969
tatra svayam prameya upadarSanena vinA api pratipadya param pratipAdayatrapUrva kramam ASrayate iti kim atra kAraNam	pa zhes bya'o // de la 'di dag nyid kyis gzhal bya nye bar bstan pa med par yang rtogs la / gzhan khong du chud par byed pa na / don gyi rim pa sngon ma byung ba ma bstan to zhes bya ba 'di la rgyu ci zhig yod / de lta bas na gzhan du na yang rtogs pa skye ba'i phyir /	79.23914940914881
tasma atra prameyasya vacanena kiQcid prayojanam anyaTA api pratipatteH utpatteH	gzhal bya smos pa ni cung zad kyang kyang mi dgos so //	65.62160208082132
etena upanaya nigamana Adikam api pratyuktam	'dis ni nye bar gtod pa dang / mjug sdud pa la sogs pa yang spangs pa yin te /	78.87040600368317
etAvatA eva sADya pratIteH BAvAt	sbyor ba 'di tsam kho nas rtogs par btub pa'i phyir ro //	71.20219965566669
xiNxika rAgam parityajya akziNI nimIlya cintaya tAvat kimiyatA pratItiH syA atra vA iti	re zhig kha bya'i chags pa yongs su bor la mig tshums te / ci 'di tsam gyis rtogs par btub bam / 'on te mi btub ces soms shig /	82.60416731645877
BAve kim prapaQca mAlayA iti iyAna iva sADana vAkye prayogaH jyAyAn	btub pa ltar na ni spros pa'i phreng pas ci zhig bya / sgrub pa'i tshig la sbyor ba 'di tsam kho na zhig sbyar bar bya'o //	79.34658622217603
atra pUrvam hetuH prayoktavyaH paScAt dRzwAntaH iti krama niyamaH pi na kaScid sarvaTA gamaka tvAt	'di la yang phyogs kyi chos dang 'brel pa smos pa dag gi rim pa nges pa ni 'ga' yang med de ji ltar yang rtogs par byed pa'i phyir ro //	84.8442058101137
sambanDa vacane pi na arTa BedaH pi kaScid	@241b 'brel pa smos pa la yang sbyor ba 'ba' zhig tha dad par zad de /	81.57933950424194
uBayaTA api tad BAvasya eva KyApanAt	gnyi ga ltar yang chos tha dad kyang de'i ngo bo kho na ston pa'i phyir ro //	80.21061666931666
na hi atad svaBAvasya BAve ekAntena anyasya BAvaH kRtaka tvasya BAve prayatna AnantarIyaka tva vat	de'i rang bzhin ma yin pa yod na gzhan yod par nges pa med de / byas pa nyid yod na brtsal nas 'byung ba'i chos nyid bzhin no //	81.34052303760487
kAryasya api atad svaBAvasya aBAve na tad nivRttiH	de'i rang bzhin ma yin pa log na yang 'bras bu ma yin pa de ldog pa med de /	91.75620620875772
yaTA anayoH eva na eka nivRttO= anya nivRttiH tasmAt anvaya vi atirekayoH yaTAlakzaNam ekaH pi prayoktaH dvitIyam Akzipati iti na ekatram sADana vAkye dvayoH prayogaH izyate vEyarTyAt	dper na chos 'di gnyis kho na bzlog pa bzhin no // de lta bas na rjes su 'gro ba dang ldog pa dag las mtshan nyid ji lta ba gcig rab tu sbyar bas kyang gnyis pa 'phen pas sgrub pa'i tshig gcig la gnyi ga sbyor bar mi 'dod de / don med pa'i phyir ro //	85.50738382191427
tad svaBAva tayA anvaya sidDO tad aBAve BAvaH pi siDyati eva	de'i rang bzhin yin pa nyid kyis rjes su 'gro ba grub na / de med na med pa 'grub pa'i phyir la /	93.71552225443027
taTA sidDO ca anvayasya api sidDeH iti	de med na med pa grub na de'i rjes su 'gro ba grub pa'i phyir ro //	89.48391056535152
tad aBAvaH eva hetoH aBAva KyAtiH yaTA syAt na anyatra vipakze virudDe vA iti niyama KyApana arTaH pi vyatireka prayogaH na yuktaH	ldog pa sbyor ba ni / ji ltar na de med pa kho na la med pa yin par ston par 'gyur ba ste / gzhan la yang ma yin la 'gal ba la yang ma yin no zhes nges par bstan pa'i don du yang nges pa ma yin te /	89.34971526402632
anya virudDayoH api vipakza tvAt	gzhan dang 'gal ba dag kyang mi mthun pa'i phyogs yin pa'i phyir ro //	89.85689791324923
kaTam idam avagamyate sat avaSyam naSvara svaBAvam iti yena anvaya vyatireka samBavaH iti ced	gang gis na rjes su 'gro ba dang ldog pa dag tu 'gyur ba yod pa gdon mi za bar 'jig pa'i rang bzhin yin na zhes bya ba 'di ji ltar khong du chud ce na /	88.8511289504079
vinASa hetu ayogAt	'jig pa'i rgyu mi rung ba'i phyir ro //	87.94162920805124
svaBAvataH eva BAvAH naSvarAH na ezAm sva hetuByaH nizpatrAnAm anyatas vinASa utpattiH	dngos po rnams ni rang gi ngo bo kho nas 'jig pa yin gyi grub pa rnams gzhan las 'jig pa 'byung ba 'di ni med de /	87.67442678774567
tasya asAmarTyAt	de la nus pa med pa'i phyir ro //	77.01470742081152
na hi vinASa hetuH BAvasya svaBAvam eva karoti tasya sva hetuByaH nirvRtteH na api BAva antaram eva	'jig pa'i rgyus dngos po'i rang gi ngo bo kho na byed pa ni ma yin te / de grub zin pa'i phyir ro // ngo bo nyid gzhan zhig byed na yang dngos po de'i so na 'dug pa la cung zad kyang mi byed pas /	90.12618631042287
BAva antara karaNe BAvasya tad avasTa tvAt taTA upalabDi Adi prasaFgaH	de bzhin du dmigs pa la sogs par thal bar 'gyur ro //	64.98929459538311
na api svaBAva antaram asya AvaraNam tad avasTe tasmin= AvaraNa ayogAt	ngo bo nyid gzhan ni 'di'i sgrib pa yin te / de'i so na 'dug na de la sgrib par yang mi rung ba'i phyir ro //	86.17147514681722
na api vinASa hetunA BAva aBAvaH kriyate	'jig pa'i rgyus dngos po med par byed par yang ma yin te /	93.2403539460281
aBAvasya viDinA anyatayA upagame vyatireka avyatireka vikalpa anatikramAt	med pa'i tshul du khas len na tha dad pa dang / tha dad pa ma yin par rnam par rtog pa las ma 'das pa'i phyir ro //	83.0585602392411
BAva pratizeDa karaNe na tasya kiQcid Bavati na Bavati eva kevalam iti	dngos po dgag pa'i ngo bo nyid gcig yin na ni /	61.36037446261848
evam ca kartA na Bavati iti akartuH ahetutvam iti na vinASa hetuH kaScid	dngos po mi byed ces bya bar @242a * // 'gyur ro // de lta na byed pa po ma yin pa ni rgyu nyid ma yin pas 'jig pa'i rgyu 'ga' yang med do //	89.0590986172889
vEyarTyAt ca	don med pa'i yang phyir te /	78.40458502088275
yadi svaBAvataH naSvaraH sva Atmani anavasTAyI BAvaH tasya na kiQcid nASa kAraNEH	gal te dngos po rang gi ngo bos 'jig pa yin na / de la 'jig pa'i rgyu cung zad kyang mi dgos te /	85.88406765542977
tad svaBAva tayA eva svayam nASAt	de'i ngo bo nyid yin pa kho nas bdag nyid 'jig pa'i phyir ro //	89.97156973112197
yaH hi yat svaBAvaH sa sva hetoH eva utpadyamAnaH tAdRSaH Bavati	gang zhig gang gi ngo bo nyid yin pa de ni rang gi rgyu kho na las skye ba na de lta bur 'gyur gyi /	94.28046023957204
na punar tad BAve hetu antaram apekzate	de ngo bor bya ba la rgyu gzhan la ni mi ltos te /	89.86420698165894
prakASa drava uzNa kaWina dravya Adi vat	gsal ba dang / gsher ba dang / dro ba dang / sra ba la sogs pa'i rdzas dang 'dra'o //	87.00607693413042
