Darma kIrti		10.0
nyAya bindu prakaraNa kArikA sUtra pAWaH praTamaH pratyakza paricCedaH	@231b * // rgya gar skad du /ny'a ya bin du na n'a ma pra ka ra na / bod skad du / rigs pa'i thigs pa zhes bya ba'i rab tu byed pa / 'jam dpal gzhon nur gyur pa la phyag 'tshal lo //	75.08031625182846
samyak jQAna pUrvikA sarva puruza arTa sidDiH iti tat vayutpAdayate	yang dag pa'i shes pa ni / skyes bu'i don thams cad 'grub pa'i sngon du 'gro ba can yin pas na de bstan to //	93.57569191498317
dviviDam samyak jQAnam pratyakzam	yang dag pa'i shes pa ni rnam pa gnyis te /	89.33004840584688
anumAnam ca iti	mngon sum dang rjes su dpag pa'o //	77.4854337147304
tatra pratyakzam kalpanA apoXam aBra antam	de la mngon sum ni rtog pa dang bral zhing ma 'khrul pa'o // rtog pa ni /	82.65390211740011
aBilApa saMsarga yogya pratiBAsa pratItiH kalpanA	shes pa la brjod pa dang 'drer rung ba snang ba ste de dang bral ba'o //	84.09168662764215
tayA rahitam timira ASu BramaNa nOyAna samBrama Adi anAhita viBramam jQAnam pratyakzam	rab rib dang / myur du bskor ba dang / grur zhugs pa dang / 'khrug pa la sogs pas 'khrul pa ma skyes pa'i shes pa ni mngon sum mo //	81.42715349944973
tat caturviDam	de ni rnam pa bzhi ste /	96.65558918317159
indriya jQAnam sva vizaya anantara vizaya sahakAriNA indriya jQAnena samanantara pratyayena janitam tad manaH vijQAnam	dbang po'i shes pa dang / rang gi yul gyi de ma thag pa yul lhan cig byed pa can / dbang po'i shes pa mtshungs pa de ma thag pa'i rkyen gyis bskyed pa'i yid kyi rnam par shes pa dang /	95.47784817307388
sarva citta cEttAnAm Atma saMvedanam BUta arTa BAvanA prakarza paryanta jam yogi jQAnam ca iti	sems dang sems las byung ba thams cad kyi rang rig pa dang / yang dag pa'i don bsgom pa'i rab kyi mtha' las byung ba rnal 'byor pa'i shes pa'o //	90.9819433530647
tasya vizayaH sva lakzaNam	de'i yul ni rang gi mtshan nyid de /	95.19743405448065
yasya arTasya sanniDAna AsanniDAnAByAm jQAna pratiBAsa BedaH tad sva lakzaNam	don gang nye ba dang mi nye ba dag las shes pa la snang ba tha dad pa de ni rang gi mtshan nyid do //	85.44231201817513
tat eva paramArTa sat arTa kriyA sAmarTya lakzaNa tvAt vastunaH	de nyid don dam par yod pa ste dngos po'i mtshan nyid ni don byed mtshan nyid kho na yin pa'i phyir ro //	93.5639500617981
anyat sAmAnya lakzaNam	gzhan ni spyi'i mtshan nyid de /	91.55795788764954
saH numAnasya vizayaH atdeva ca pratyakzam jQAnam pramANa Palam	de ni rjes su dpag pa'i yul yin no // mngon sum gyi shes pa de nyid tshad ma'i 'bras bu ste /	91.30601842119724
arTa pratIti rUpa tvAt	don rtogs pa'i ngo bo kho na yin pa'i phyir ro //	89.41461920251652
arTa sArUpyam asya pramANam	don dang 'dra ba nyid de'i tshad ma ste /	88.55872694457449
tad vaSAt arTa pratIti sidDara iti	de'i dbang gis don rtogs pa 'grub pa'i phyir ro // rigs pa'i thigs pa zhes bya ba'i rab tu byed pa las /	83.58686381201733
iti praTamaH pratyakza paricCedaH dvitIyaH sva arTa anumAna paricCedaH	mngon sum gyi le'u ste dang po'o /	66.72514838332016
anumAnam dviDA	// / rjes su dpag pa ni rnam pa gnyis te /	79.1529868443807
sva arTa para arTa ca	rang gi don dang gzhan gyi don no //	91.49442895253499
tatra sva arTa trirUpAt liFgAt yat anumeye jQAnam tad anumAnam	de la rang gi don gyi rjes su dpag par bya ba la tshul gsum pa'i rtags las shes pa gang yin pa'o //	94.50405387279876
pramANa lakzaNa vyavasTAtrA api pUrvavat	'dir yang tshad ma'i 'bras bu rnam par gzhag pa ni mngon sum dang 'dra'o //	79.02430636320503
trErUpyam punar liFgasya anumeye sattvam eva sa pakzaH eva sattvam	tshul gsum pa nyid kyi rtags ni rjes su dpag par bya ba la yod pa nyid dang / @232a * // mthun pa'i phyogs nyid la yod pa dang / mi mthun pa'i phyogs la med pa nyid du nges pa'o //	85.05302589762168
asapakze ca asattvam eva niScitam anumeyaH tra jijQAsita viSezaH DarmI sADya Darma sAmAnyena samAnaH rTaH sa pakza	rjes su dpag par bya ba ni 'dir shes par 'dod pa'i bye brag dang ldan pa'i chos can no // mthun pa'i phyogs ni bsgrub par bya ba'i chos kyi spyi dang don mthun pa'o //	88.76845822367906
na sa pakzaH sa pakzaH	mi mthun pa'i phyogs ni mthun pa'i phyogs ma yin pa ste /	81.38938969478272
tatas nyasta dvi rudDaH tad aBAvaH ca iti	de las gzhan pa dang / de dang 'gal ba dang / de med pa'o //	82.48781247019153
trirUpANi ca trINi eva liFgAni	tshul gsum po dag ni rtags gsum kho na dang ldan pa ste /	91.22246747267873
anupalabDiH svaBAvaH kArya ca iti	mi dmigs pa dang / rang bzhin dang / 'bras bu'o //	93.99384679794312
tatra anupalabDiH yaTA na pradeSa viSeze kvacid GawaH	de la mi dmigs pa ni dper na phyogs kyi bye brag 'ga' zhig na bum pa med de /	91.68069434610477
upalabDi kzaNa prAptasya anupalabDeH iti	dmigs pa'i rig byar gyur pa las mi dmigs pa'i phyir ro zhes bya ba lta bu'o //	88.55448316470158
upalabDi lakzaNa prApti rUpa lamBa pratyaya antarasAkalyam svaBAva viSezaH ca	dmigs pa'i rig byar gyur pa ni dmigs pa'i rkyen gzhan tshang ba nyid dang rang bzhin khyad par can te /	87.86710675388257
yaH svaBAvaH sat svanyezu Uza lamBa pratyayezu san pratyakzaH eva Bavati sa svaBAva viSezaH	rang bzhin gang yod la dmigs pa'i rkyen gzhan dag kyang yod na mngon sum kho nar 'gyur te /	71.65590415081975
svaBAvaH sva sattA mAtra praBAvini sADya Darme hetuH	ba'o // rang bzhin ni rang yod pa tsam du gyur pa / bsgrub par bya ba'i chos kyi gtan tshigs te /	90.62944221175103
yaTA vRkzaH yam SiSapA tvAt iti	dper na shing sha pa yin pa'i phyir /	75.07074071265556
kArya yaTA bahniH atra DUmAt iti	'di ni shing ngo zhes bya ba lta bu'o // 'bras bu ni dper na du ba yod pa'i phyir / de na me yod do zhes bya ba lta bu'o //	87.03323633306849
atra dvO vastu sADanO	'di la gnyis ni dngos po sgrub pa'o //	83.39204178358379
ekaH pratizeDa hetuH	gcig ni dgag pa'i gtan tshigs so // rang bzhin 'brel pa yod na /	79.10504961013794
svaBAva pratibanDe hi satyarTaH rTa gamayet	don gyis don go bar byed de /	48.01740523864483
tad apratibadDasya tat avyaBicAra niyama aBAvAt	de dang ma 'brel na der mi 'khrul bar nges pa med pa'i phyir ro //	92.653989579703
sa ca pratibanDaH sADye rTe liFgasya	bsgrub par bya ba'i don la rtags 'brel pa de yang / dngos su na bsgrub par bya ba'i don gyi rang bzhin yin pa'i phyir dang / bsgrub par bya ba'i don las 'byung ba'i phyir te /	76.20686413964167
vastutas tAt AtmyAt tad utpatteH ca atad svaBAvasya Atad utpatteH ca tatra apratibadDa svaBAva tvAt	de'i rang bzhin ma yin pa dang / de las byung ba ma yin pa ni de dang 'brel pa med pa'i rang bzhin yin pa'i phyir ro // de'i bdag nyid dang de las byung ba de gnyis kyang /	88.56277969708756
te ca tAdAtmya tad utpattI svaBAva kAryayoH eva iti tAByAm eva vastu sidDiH	rang bzhin dang 'bras bu kho na yin te / de gnyis kho nas dngos po grub po //	83.44929318318903
pratizeDa sidDiH api yaTA uktAyAH eva anupalabDeH	dgag pa sgrub kyang mi dmigs pa ji skad smos pa kho na las 'gyur te /	84.59616758639636
sati vastuni tasyAH asamBavAt	dngos po yod na ni de mi srid pa'i phyir ro //	89.96332232848458
anyaTA ca anupalabDi lakzaNa prAptezu deSa kAla svaBAva viprakRzwezu arTezu Atma pratyakza nivRtteH aBava niScaya aBAvAt	gzhan du ni yul dang / dus dang / rang bzhin gyis bskal pa'i don dmigs pa'i rig byar ma @232b gyur pa rnams la / rang gi mngon sum log kyang dngos po med par nges pa med pa'i phyir ro //	91.95909945449293
amUXa smRti saMskArasya atItasya vartamAnasya ca pratipattR pratyakzasya nivRttiH aBAva vyavahAra prasADanI	mi rmongs par dran pa'i 'du byed sgrub pa po'i mngon sum 'das pa dang / da ltar gyi log na dngos po med pa'i tha snyad 'jug ste /	85.18012284384358
tasyAH eva aBAva niScayAt	de nyid kyi dngos po med par nges pa'i phyir ro //	90.73609614372253
sA ca prayoga BedAt ekAdaSa prakArA	de ni sbyor ba'i bye brag gis rnam pa bcu gcig ste /	92.90105264003459
svaBAva anupalabDiH yaTA na atra DUmaH upalabDi lakzaNa prAptasya anupalabDeH iti	rang bzhin mi dmigs pa ni dper na 'di na du ba med de dmigs pa'i rig byar gyur pa las mi dmigs pa'i phyir ro // zhes bya ba lta bu'o // 'bras bu mi dmigs pa ni /	90.41169083980598
kArya anupalabDiH yaTA na atra apratibadDa sAmarTyAni DUma kAraNAni santi	dper na 'di na du ba'i rgyu nus pa thogs pa med pa dag med de /	86.47751848298655
DUma aBAvAt iti	du ba med pa'i phyir ro zhes bya ba lta bu'o //	84.97890295880907
vyApaka an upalabDiH yaTA na atra SiSapA	khyab par byed pa mi dmigs pa ni / dper na 'di na shing med pa'i phyir shing sha pa med do // zhes bya ba lta bu'o //	77.61726027071224
vRkza aBAvAt iti svaBAva virudDa upalabDiH yaTA na atra SIta sparSaH vahneH iti	rang bzhin 'gal ba dmigs pa ni dper na 'di na me yod pa'i phyir grang ba'i reg pa med do zhes pa lta bu'o //	91.73389210614317
virudDa kArya upalabDiH yaTA na atra SIta sparSaH DUmAt iti	'gal ba'i 'bras bu dmigs pa ni dper na 'di na du ba yod pa'i phyir / grang ba'i reg pa med do zhes bya ba lta bu'o //	93.45948520289392
virudDa vyApta upalabDiH yaTA na Druva BAvI BUtasya api BAvasya vinASaH	'gal ba khyab pa dmigs pa ni dper na dngos po byung ba yang 'jig par nges par 'gyur ba med de /	90.30018318594671
hetu antara apekzaNAt iti	rgyu gzhan la ltos pa'i phyir ro zhes bya ba lta bu'o //	92.3814767428807
kArya virudDa upalabDiH yaTA na iha apratilbadDa sAmarTyAni SIta kAraNAni santi vahneH iti	'bras bu 'gal ba dmigs pa ni dper na 'di na me yod pa'i phyir grang ba'i rgyu'i nus pa thogs pa med pa dag med do zhes bya ba lta bu'o //	93.64090438377298
vyApaka virudDa upalabDiH yaTA na atra tuzAraspaSaH vahneH iti	khyab par byed pa 'gal ba dmigs pa ni dper na 'di na me yod pa'i phyir ba mo'i reg pa med do zhes bya ba lta lta bu'o //	90.41915637271603
kAraNa anupalabDiH yaTA na atra DUmaH vahni aBAvAt iti	bu'o // rgyu mi dmigs pa ni dper na 'di na me med pa'i phyir du ba med do zhes bya ba lta bu'o //	93.7100892403299
kAraNa virudDa upalabDiH yaTA na asya romaharza Adi viSezAH	rgyu 'gal ba dmigs pa ni dper na 'di na spu long zhes bya ba la sogs pa'i bye brag med de /	85.59631401890915
sannihita dahana viSeza tvAt iti	gdung bar byed pa'i bye brag nye ba nyid kyi phyir ro zhes bya ba lta bu'o med de /	78.12578286551035
kAraNa virudDakAyapilabDiH yaTA na roma harza Adi viSeza yukta puruza avAn ayam pradeSaH DUmAt iti	// rgyu 'gal ba'i 'bras bu dmigs pa ni dper na phyogs 'di na du ba yod med de / // pa'i phyir / spu long zhes byed pa la sogs pa'i bye brag dang ldan pa'i mi dang ldan pa ma yin no zhes bya ba med de / // pa'i phyir / lta bu'o // don gzhan yod pa dang dgag pa dag gis sbyor ba tha dad kyang /	76.87405303574714
ime sarve kArya anupalabDi AdayaH daSa anupalabDi prayogAH svaBAva anupalabDO saMgraham upayAnti pAramparyeNa arTa antara viDi pratizeDAByAm prayoga Bede pi	brgyud pa'i sgo nas 'bras bu mi dmigs pa la sogs pa mi dmigs pa'i sbyor ba bcu po de dag thams cad ni rang bzhin mi @233a * //	69.66475886963718
prayoga darSana aByAsAt svayam api evam vyavacCeda pratItiH Bavati sva arTe pyanumAne syAH prayoga nirdeSaH	dmigs pa'i nang du bsdu bar 'gyur ro // sbyor ba mthong ba goms pa las bdag nyid kyang de bzhin du rnam par gcod pa rtogs par 'gyur bas / bdag gi don gyi rjes su dpag pa la yang bye brag bstan to //	87.74946616204252
sarvatra ca asya AmaBAva vyavahAra sADanyAm anupalabDO yezAm svaBAva virudDa dInAm upalabDyA	med pa'i tha snyad sgrub pa'i mi dmigs pa de dag thams cad la yang rang bzhin 'gal ba la sogs pa dmigs pa dang / rgyu la sogs pa mi dmigs pas /	88.5593004321077
kAraNa AdInAm anupalabDyA ca pratizeDaH uktaH tezAm upalabDi lakzaNa prAptAnAm evipa labDiH ca veditavyA	dgag pa bshad pa gang yin pa de dag ni dmigs pa'i rig byar gyur pa kho na dag las dmigs pa dang / mi dmigs par yang rig par bya'o //	81.76472133479743
anyezAm viroDa kArya kAraNa BAva asidDeH	gzhan dag la ni 'gal ba dang // rgyu dang 'bras bu yod pa dang / med pa mi 'grub pa'i phyir ro //	89.34838127083441
viprakRzwa vizayA punar anupalabDiH pratyakza anumAna nivRtti lakzaNA saMSaya hetuH	bskal pa'i yul mi dmigs pa'i mngon sum dang rjes su dpag pa'i mtshan nyid ni the tshom gyi rgyu yin te /	80.95331336843495
pramANa nivRttO= api arTa aBAva asidDeH iti	tshad ma log kyang don med par mi 'grub pa'i phyir ro // rigs pa'i thig pa zhes bya ba'i rab tu byed pa las /	88.2029411956398
iti dvitIyaH sva arTa anumAna paricCedaH	bdag gi don rjes su dpag pa'i le'u ste gnyis pa'o /	90.19015360813515
tRtIyaH para arTa anumAna paricCedaH trirUpa liFga AKyAnam para arTam anumAnam	// / gzhan gyi don gyi rjes su dpag pa ni tshul gsum pa'i rtags brjod pa ste /	84.90172413711302
kAraNe kArya upacArAt	rgyu la 'bras bu btags pa'i phyir ro //	94.52586527971121
tat dviviDam prayoga BedAt	sbyor ba'i bye brag gis de ni rnam pa gnyis te /	92.52810422579446
sADamya vat vEDamya vat ca	chos mthun pa nyid can dang / chos mi mthun pa nyid can no //	70.67624028002629
nAnA yoH arTataH kaScid BedaH anyatra prayoga BedAt	sbyor ba'i bye brag ma gtogs par 'di gnyis don du ni bye brag ci yang med do //	79.00694275238237
tatra sADarmya vat prayogaH yat upalabDi lakzaNa prAptam sanna upalaByate saH sat vyavahAra vizayaH sidDaH	de la chos mthun pa nyid can ni dmigs pa'i rig byar gyur pa gang ma dmigs pa de ni med pa'i tha snyad kyi yul du grub ste /	85.2292803422149
yaTA anyaH dRzwaH kaScid SaSavizANa AdiH	dper na ri bong gi rva la sogs pa gzhan 'ga' zhig mthong ba bzhin te /	77.4719527688236
na upalaByate ca kvacid pradeSa viSeze upalabDi lakzaNa prApaH GawaH iti anupalabDi prayogaH	phyogs kyi bye brag gang na dmigs pa'i rig byar gyur pa bum pa mi dmigs so zhes bya ba lta bu'o //	81.47246657465168
taTA svaBAva hetoH prayogaH yat sat tat sarvam anityam	de bzhin du rang bzhin gyi gtan tshigs kyi sbyor ba ni gang yod pa de thams cad ni mi rtag ste /	92.31440665438184
yaTA GawAdiH iti SudDasya svaBAva hetoH prayogaH	dper na bum pa la sogs pa lta bu'o zhes bya ba ni rang bzhin dag pa'i sbyor ba'o //	81.83476730795688
yat utpattimat tat anityam iti svaBAva BUta Darma Bedena svaBAvasya prayogaH yat kRtakam tat anityam iti upADi Bedena	gang skye ba dang ldan pa de ni mi rtag pa'o zhes bya ba ni rang bzhin du gyur pa'i chos kyi bye brag gis rang bzhin gyi sbyor ba'o // gang byas pa de ni mi rtag pa'o zhes bya ba de ni khyad par gyi bye brag gis // te /	89.46254334140711
apekzita para vyApAraH hi BAvaH svaBAva nizpattO kRtakaH iti	rang gi ngo bo 'grub par bya ba'i phyir gzhan gyi byed pa la ltos pa'i @233b ngo bo ni byas pa'o zhes bya'o //	91.78718046138428
evam prayatna antarIyaka pratyaya Beda Bedi tva AdayaH pi drazwavyAH	brtsal ma thag tu byung ba dang / rkyen gyi bye brag gis tha dad pa can nyid la sogs pa la yang de bzhin du blta bar bya'o //	88.91620959768778
san= utpattimAn kRtakaH vA SabdaH iti pakza Darma upadarSanam	yod pa'am skye ba dang ldan pa 'am byas pa zhes bya ba'i sgra ni phyogs kyi chos nye bar ston pa'o //	92.89045145008818
sarve ete sADana DarmAH yaTAsvam pramANEH sidDa sADana Darma mAtra anubanDe eva sADya Darme vagantavyAH	sgrub pa'i chos de dag thams cad ni rang gi ngo bo sgrub pa ci lta bu dag gis sgrub pa'i chos tsam dang bsgrub par bya ba'i chos rjes su 'brel par grub pa kho nar khong du chud par bya ste /	91.35025663950131
tasya eva tad svaBAva tvAt svaBAvasya ca hetu tvAt	dngos su na de nyid de'i rang bzhin yin pa'i phyir dang / rang bzhin yang gtan tshigs yin pa'i phyir te /	93.75868541279534
vastutas tayoH tAdAtmyam tad nizpatta a= anizpannasya tad svaBAva tva aBAvAt vyaBicAra samBavAt ca	de grub la de ma grub na ni de'i rang bzhin nyid med pa'i phyir dang / 'khrul pa yang srid pa'i phyir ro //	85.42473903971377
kArya hetoH prayogaH  yatra DUmaH tatra agniH yaTA mahAnasa AdO	'bras bu'i gtan tshigs kyi sbyor ba ni gang na du ba yod pa de na me yod de / dper na tshang bang la sogs pa bzhin te /	95.74912346405422
asti ca iha DUmaH iti	'di na yang du ba yod do zhes bya ba lta bu'o //	94.51145076751709
iha api sidDe eva kArya kAraNa BAve kAraNe sADye kArya hetuH vaktavyaH	'dir yang rgyu dang 'bras bu'i dngos por grub pa kho na la rgyu bsgrub par bya ba la 'bras bu'i gtan tshigs su brjod par bya'o //	93.45584095467667
vEDarmyavataH prayogaH yat sat upalabDi lakzaNa prAptam tat upalaByate eva	chos mi mthun pa nyid can gyi sbyor ba ni gang yod la dmigs pa'i rig byar gyur pa de ni dmigs pa kho nar 'gyur te /	87.15662013038803
yaTA nIla Adi viSezaH na ca evam iha upalabDi lakzaNa prAptasya sataH upalabDiH Gawasya iti anupalabDi prayogaH	dper na sngon po la sogs pa'i bye brag lta bu yin na 'di na ni dmigs pa'i rig byar gyur pa bum pa de ltar mi dmigs so zhes bya ba ni mi dmigs pa'i sbyor ba'o //	89.88201264373672
asatya nitya tve na asti sattvam utpattimat tvam kRtaka tvam vA san= ca SabdaH utpattimAn kRtakaH vA iti svaBAva hetoH prayogaH	mi rtag pa nyid med na yod pa'am skye ba dang ldan pa'am byas pa med pa nyid yin na / sgra ni yod pa'am skye ba dang ldan pa'am / byas pa'o // zhes bya ba ni rang bzhin gyis sbyor ba'o //	90.24230247279188
asati agnO na Bavati eva DUmaH	me med na du ba mi 'byung ba nyid la /	90.01020137887252
atra ca asti DUmaH iti kArya hetoH prayogaH	'di na ni du ba yod do zhes bya ba ni 'bras bu'i gtan tshigs kyi sbyor ba'o //	96.04668745330983
sADarmyeNa api hi prayoge rTAt vEDarmya gatiH iti	don gyis na chos mthun pas kyang sbyor ba la chos mi mthun pa nyid rtogs te /	92.72052247109002
asati tasmin sADyena hetoH anvaya aBAvAt	de med na ni bsgrub par bya ba gtan tshigs kyi rjes su 'gro ba med pa'i phyir ro //	91.16768009021364
taTA vEDarmyeNa api anvaya gatiH	de bzhin du chos mi mthun pas kyang rjes su 'gro ba rtogs te /	91.87623182419807
asati tasmin sADya aBAve hetu aBAvasya asidDeH	de med na ni bsgrub par bya ba med na gtan tshigs med par mi 'grub pa'i phyir ro //	96.00512575646124
na hi svaBAva pratibanDe sati ekasya nivRttO= aparasya niyamena nivRttiH	rang bzhin 'brel pa med na ni cig log pas gzhan nges par ldog pa ma yin no //	83.44063763317592
sa ca dvi prakAraH sarvasya tAdAtmya lakzaNaH tad utpati lakzaNaH ca iti uktam	de yang thams cad kyi rnam pa gnyis te / de'i bdag nyid dang de las byung ba zhes smos pa @234a * // yin no //	84.46683124794316
tena hi nivRtti kaTayatA pratibanDaH darSanIyaH	des na ldog pa brjod pas 'brel pa bstan par bya'o //	80.40004220375648
tasmAt nivRtti vacanam Akzipta pratibanDa upadarSanam eva Bavati	de lta bas na ldog pa'i tshig gis ni 'brel pa bsdus pa kho na yin la /	76.95932026907431
yat ca pratibanDa upadarSanam tat eva anvaya vacanam iti ekena api vAkyena anvaya muKena vyatireka muKena	'brel pa bstan pa gang yin pa de yang rjes su 'gro ba zhes bya ste / de lta bas na rjes su 'gro ba'i sgo yang rung ldog pa'i sgo yang rung ste / tshig gcig brjod pas kyang /	83.95969551133985
vA prayuktena sa pakzAsa pakzayoH liFgasya sat asat tva KyApanam kRtam Bavati iti na avaSayam vAkya dvaya prayogaH	mthun pa'i phyogs dang mi mthun pa'i phyogs la rtags yod pa dang med pa bstan par 'gyur bas de ltar na tshig gnyis kyis sbyor ba bstan par nges pa med do //	82.5098982741952
anupalabDO= api  yat sat upalabDi lakzaNa prAptaMtat upalaByate eva iti ukte	mi dmigs pa la yang gang yod la dmigs pa'i rig byar gyur pa de ni pa med do // / dmigs pa kho nar 'gyur ro zhes bstan par mi dmigs na /	87.24974281743877
anupalaByamAnam tAdRSam asat iti pratIreH anvaya sidDiH	de lta bu med do zhes bya bar rtogs pa'i phyir rjes su 'gro ba grub po //	74.45952808292226
dvayoH api anayoH prayogayoH na avaSyam pakza nirdeSaH	sbyor ba 'di gnyi ga la yang phyogs bstan par nges pa med de /	78.14686796425552
yasmAt sADarmya vat prayoge pi yat upalabDi lakzaNa prAptam sanna upalaByate saH sa dvaya vahAra vizayaH na upalaByate ca atra upalabDi lakzaNa prAptaH GawaH iti ukte sAmarTyAt eva na iha GawaH iti Bavati	'dir chos mthun pa nyid can gyi sbyor ba la yang dmigs pa'i rig byar gyur pa gang dmigs pa de ni med pa'i tha snyad kyi yul yin la / 'di na yang dmigs pa'i rig byar gyur pa bum pa mi dmigs so zhes bstan par shugs kyis 'di na bum pa med do zhes bya bar 'gyur / ro //	80.51187669775506
taTA vEDarmya vat prayoge pi yaH sat vyavahAra vizayaH upalabDi lakzaNa prAptaH saH upalaByate eva	de bzhin du chos mi mthun pa nyid can gyi sbyor ba la yang yod pa'i tha snyad kyi yul gang yod la / dmigs pa'i rig byar gyur pa de ni dmigs pa kho nar 'gyur na /	94.32464897284778
na taTA atra tAdRSaH GawaH upalaByate iti ukte sAmarTyAt eva na iha sa dvayavahAra vizayaH iti Bavati	'di na de 'dra ba'i bum pa de ni mi dmigs so zhes bstan pas shugs nyid kyis 'dir yod pa'i tha snyad kyi yul med do zhes bya bar 'gyur ro //	90.40397967483617
kIdRSaH punar pakzaH iti nirdeSyaH	phyogs ji lta bu zhig bstan par bya zhe na /	86.93662121079184
sva rUpeNa eva svayam izwaH nirAkRtaH pakzaH iti	rang gi ngo bo kho na dang / bdag nyid dang / 'dod pa dang / ma bstsal bar bstan par bya ba ni phyogs so zhes bstan par bya ba yin te /	83.88704643910958
sva rUpeNa iti sADya tvena izwaH	rang gi ngo bo zhes bya ba ni bsgrub par bya ba kho nar 'dod pa'o //	87.81771115695729
sva rUpeNa eva iti sADya tvena eva izwaH na sADana tvena api yaTA Sabdasya anitya tve sADye cAkzuza tvam hetuH	rang gi ngo bo kho na zhes bya ba ni bsgrub par bya ba kho na 'dod pa yin gyi sgrub pa nyid yin yang rung ba ma yin te / dper na sgra mi rtag pa nyid du bsgrub par bya ba la gtan tshigs mig gis gzung ba nyid ni sgra la ma grub pa'i phyir bsgrub par bya ba yin na /	85.58168776369905
Sabde sidDa tvAt sADyam Bavati iti na punar tat iha sADya tvena eva izwam sADana tvena api aBiDAnAt	de 'dir ni sgrub pa kho nar brjod pa'i phyir bsgrub par bya ba nyid kho nar ni mi 'dod do //	83.36436285418752
svayam iti vAdinA yaH tadA sADanam Aha	bdag nyid ces bya ba ni de'i tshe rgol bas bsgrub pa smras pa gang yin pa'o //	89.0200689667085
etena yadi api kvacid SAstre sTitaH sADanam Aha	@234b des na gal te bstan bcos 'ga' zhig la brten te sgrub pa smras na yang /	82.2862120138206
tad SAstra kAreNa tasmin DarmiNI aneka Darma aByupagame pi yaH tadA tena vAdinA DarmaH svayam sADayitu mizwaH saH eva sADyaH na itaraH iti uBavati	bstan bcos de byed pas chos can de la chos mang zhig khas len du zin kyang de'i tshe rgol ba des chos gang sgrub par 'dod pa de nyid bsgrub par bya ba yin gyi / cig shos na ma yin no zhes bstan par 'gyur ro //	89.58442722629756
izwaH iti yatra arTe vivAdena sADanam upanyastam tasya sidDim icCatA saH nuktaH pi vacanena sADyaH Bavati	'dod pa zhes bya ba don gang la rtsod pas sgrub pa bkod pa de sgrub par 'dod pa'o // de ni tshig tu ma smras kyang bsgrub par bya ba yin te /	88.10361140682895
tad aDikaraNa tvAt vivAdasya	de ni rtsod pa'i gzhi yin pa'i phyir ro //	89.76880248387654
yaTA para arTAH cakzuH AdayaH saFGAta tvAt Sayana Asana Adi aFga vat iti	dper na 'dus pa yin pa'i phyir / mig la sogs pa ni gzhan gyi don byed de / mal cha dang stan la sogs pa'i yan lag bzhin no zhes bya ba lta bu'o //	85.81214038334583
atra Atma arTAH iti anuktO= api Atma arTa tA eva sADyA	'dir bdag gi don zhes ma brjod kyang bdag gi don nyid du bsgrub par bya ba yin te /	78.95063731507214
tena na ukta mAtram eva sADyam iti uktam Bavati anirAkRtaH iti etad lakzaNa yoge pi yaH sADayitum izwaH pi arTaH pratyakza anumAna pratIti sva vacanEH nirAkriyate na sa pakzaH iti pradarSana arTam	des na smras pa tsam kho na ni bsgrub par bya ba ma yin no zhes bstan par 'gyur ro // ma bsal ba zhes bya ba ni mtshan nyid de dag dang ldan du zin kyang sgrub par 'dod pa'i don gang zhig la mngon sum dang / rjes su dpag pa dang / grags pa dang / rang gi tshig rnams kyis bsal ba gang yin pa de ni phyogs ma yin no zhes bstan pa'i phyir te /	93.4870100807958
tatra pratyakza nirAkRtaH yaTA aSrAvaNaH SabdaH iti	de la mngon sum gyis bsal ba ni / dper na sgra ni mnyan du mi rung ngo zhes bya ba lta bu'o //	88.70202001691314
anumAna nirAkRtaH yaTA nityaH SabdaH iti	rjes su dpag pas bsal ba ni dper na bum pa ni rtag pa'o zhes bya ba lta bu'o // grags pas bsal ba ni /	87.35789694424314
pratIti nirAkRtaH yaTA acandraH SaSI iti	dper na ri bong can ni zla ba ma yin no zhes bya ba lta bu'o //	72.1134512622488
sva vacana nirAkRtaH yaTA na anumAnam pramANam iti	rang gi tshig gis bsal ba ni / dper na rjes su dpag pa ni tshad ma ma yin no zhes bya ba lta bu ste /	92.32220707129157
iti catvAraH pakza ABAsa nirAkRtAH Bavanti evam sidDasya asidDasya api sADana tvena aBimatasya	phyogs ltar snang ba bzhi bsal ba yin no //	59.44479738174311
svayam vAdinA tadA sADayitum anizwasya ukta mAtrasya nirAkRtasya ca viparyeNa sADyaH iti	de ltar na grub pa dang ma grub kyang sgrub pa nyid du 'dod pa dang / de'i tshe rgol ba bdag nyid kyis sgrub par mi 'dod pa dang / smras pa tsam dang bsal ba las bzlog pa ni bsgrub par bya ba yin no //	85.39400361569307
tena eva sva rUpeNa aBimataH vAdinaH izwaH nirAkRtaH pakzaH iti pakza lakzaNam anavadyam darSitam Bavati	de nyid kyi ngo bo dang / rgol ba'i 'dod pa dang / ma bsal ba ni phyogs yin te / de ltar na phyogs kyi mtshan nyid kha na ma tho ba med par bstan pa yin no //	89.22322554170951
trirUpa liFga AKyAnam para arTa anumAnam iti uktam	gzhan gyi don gyi rjes su dpag pa ni tshul gsum pa'i rtags brjod pa ste zhes smras pa de las /	89.2282947740503
tatra trayANAm rUpANAm ekasya api rUpasya anuktaH sADana ABAsaH	tshul gsum las gcig ma smras na yang sgrub pa ltar snang ba yin no // smras kyang go bar bya ba @235a * //	78.6673725169807
uktO= api asidDO sandehe vA pratipAdya pratipAdaka yo	dang go bar byed pa gnyis las ma grub pa'am /	72.61470998658073
ekasya rUpasya Darmi sambanDasya asidDaH sandehe vA asidDaH hetvABAsaH	the tshom za na yang ngo // chos can dang 'brel pa'i tshul gcig ma grub pa'am / the tshom za na ma grub pa'i gtan tshigs ltar snang ba yin te /	91.26613720939748
yaTA  anityaH SabdaH iti sADye cAkzuza tvam uBaya asidDam	dper na sgra mi rtag pa'o zhes sgrub pa la / mig gis gzung ba nyid ni gnyi ga la ma grub pa lta bu'o // shing rnams la sems yod par sgrub pa la /	83.10864865485729
cetanAH taravaH iti sADye sarva tvac apaharaNe maraNam prativAdya sidDam	shun pa thams cad bshus nas 'chi ba ni phyir rgol ba la ma grub ste /	75.17183194493028
vijQAna indriya AyuH niroDa lakzaNasya maraNa sya anena aByupagamAt	de ni rnam par shes pa dang / dbang po dang / tshe 'gags pa'i mtshan nyid la 'chi ba yin par khas len pa'i phyir ro //	91.77747484785846
tasya ca taruzu asamBavAt	de yang shing dag la mi srid pa'i phyir ro //	89.46590778562758
