skt	tib
 || saddharmalaṅkāvatārasūtram || oṃ namo ratnatrayāya | oṃ namaḥ sarvabuddhabodhisattvebhyaḥ || start parivarta 1 rāvaṇādhyeṣaṇāparivartaḥ prathamaḥ |	༄༨༧བ་། །རྒྱ་གར་སྐད་དུ་། ཨའརྱ་ལངཀ་ཨཨ་བ་ཏའ་ར་མཧའ་ཡའ་ན་སའུ་ཏྲ་། བོད་སྐད་དུ་། འཕགས་པ་ལངཀར་༄༨༨ཨ་༌༎ གཤེགས་པའི་ཐེག་པ་ཆེན་པོའི་མདོ་། བམ་པོ་དང་པོ་། སངས་རྒྱས་དང་བྱང་ཆུབ་སེམས་དཔའ་ཐམས་ཅད་ལ་ཕྱག་འཚལ་ལོ་༎
 evaṃ mayā śrutam |	འདི་སྐད་བདག་གིས་ཐོས་པ་དུས་གཅིག་ན་།
 ekasmin samaye bhagavāṃllaṅkāpure samudramalayaśikhare viharati sma nānāratnagotrapuṣpapratimaṇḍite mahatā bhikṣusaṃghena sārdhaṃ mahatā ca bodhisattvagaṇena nānābuddhakṣetrasaṃnipatitairbodhisattvairmahāsattvaiḥ	བཅོམ་ལྡན་འདས་ལངཀའི་གྲོང་རྡལ་ན་། རྒྱ་མཚོའི་རི་མ་ལ་ཡའི་རྩེ་མོ་རིན་པོ་ཆེའི་རིགས་དང་། མེ་ཏོག་སྣ་ཚོགས་ཀྱིས་བརྒྱན་པ་ལ་དགེ་སློང་གི་དགེ་འདུན་ཆེན་པོ་དང་། བྱང་ཆུབ་སེམས་དཔའ་སེམས་དཔའ་ཆེན་པོ་སངས་རྒྱས་ཀྱི་ཞིང་སྣ་ཚོགས་པ་ནས་འདུས་པ་ཏིང་ངེ་འཛིན་དང་། 
 anekasamādhivaśitābalābhijñāvikrīḍitairmahāmatibodhisattvapūrvaṃgamaiḥ sarvabuddhapāṇyabhiṣekābhiṣiktaiḥ	དབང་དང་། སྟོབས་དང་། མངོན་པར་ཤེས་པ་དུ་མས་རྣམ་པར་རོལ་པ་།
 svacittadṛśyagocaraparijñānārthakuśalairnānāsattvacittacaritrarūpanayavinayadhāribhiḥ	བྱང་ཆུབ་སེམས་དཔའ་བློ་གྲོས་ཆེན་པོ་ལ་སོགས་པ་དག་སངས་རྒྱས་ཐམས་ཅད་ཀྱི་ཕྱག་གི་དབང་བསྐུར་བས་དབང་བསྐུར་བ་བདག་གི་སེམས་སྣང་བའི་སྤྱོད་ཡུལ་ཡོངས་སུ་ཤེས་པའི་དོན་ལ་མཁས་པ་། སེམས་ཅན་གྱི་སེམས་སྣ་ཚོགས་དང་། གཟུགས་དང་། ཚུལ་དང་། འདུལ་བ་རྣམ་པ་ཐ་དད་པའི་ཆ་བྱད་འཆང་བ་།
 pañcadharmasvabhāvavijñānanairātmyādvayagatiṃgataiḥ ||	ཆོས་ལྔ་དང༏་རང་བཞིན་དང་། རྣམ་པར་ཤེས་པ་དང་། བདག་མེད་པ་གཉིས་ཁོང་དུ་ཆུད་པར་རྟོགས་པའི་བྱང་ཆུབ་སེམས་དཔའ་དག་གི་ཚོགས་ཆེན་པོ་དང་ཐབས་གཅིག་ཏུ་བཞུགས་ཏེ་།
 tena khalu punaḥ samayena bhagavān sāgaranāgarājabhavanāt saptāhenottīrṇa 'bhūt |	ཡང་དེའི་ཚེ་ན་བཅོམ་ལྡན་འདས་རྒྱ་མཚོའི་ཀླུའི་རྒྱལ་པོའི་གནས་ནས་ཞག་བདུན་ལོན་ཏེ་བྱུང་ནས་བརྒྱ་བྱིན་དང་། 
 anekaśakrabrahmanāgakanyākoṭibhiḥ pratyudgamyamāno laṅkāmalayamavalokya smitamakarot	ཚངས་པ་དང་། ཀླུའི་བུ་མོ་བྱེ་བ་དུ་མས་བསུ་བ་དང་ལངཀའི་རི་མ་ལ་ཡ་ལ་༄༨༨བ་གཟིགས་ཏེ་།
 - pūrvakairapi tathāgatairarhadbhiḥ samyaksaṃbuddhairasmiṃllaṅkāpurīmalayaśikhare svapratyātmāryajñānatarkadṛṣṭitīrthyaśrāvakapratyekabuddhāryaviṣaye tadbhāvito dharmo deśitaḥ |	ལངཀའི་གྲོང་རྡལ་གྱི་རི་མ་ལ་ཡའི་རྩེ་མོ་འདིར་སྔོན་གྱི་དེ་བཞིན་གཤེགས་པ་དགྲ་བཅོམ་པ་ཡང་དག་པར་རྫོགས་པའི་སངས་རྒྱས་རྣམས་ཀྱིས་ཀྱང་འཕགས་པ་སོ་སོ་རང་གིས་རིག་པའི་ཡེ་ཤེས་། རྟོག་གེའི་ལྟ་བ་མུ་སྟེགས་ཅན་དང་། ཉན་ཐོས་དང་། རང་སངས་རྒྱས་དང་། འཕགས་པའི་ཡུལ་མ་ཡིན་པ་དེ་དག་གིས་བསྒོམས་པའི་ཆོས་བསྟན་ཏེ་།
 yannvahamapi atraiva rāvaṇaṃ yakṣādhipatimadhikṛtya etadevodbhāvayan dharmaṃ deśayeyam ||	ངས་ཀྱང་དེ་ཉིད་དུ་གནོད་སྦྱིན་གྱི་བདག་པོ་འབོད་སྒྲོགས་ཀྱི་ཕྱིར་དེ་ཉིད་བསྙད་ཅིང་ཆོས་བསྟན་ཏོ་སྙམ་ནས་འཛུམ་པ་མཛད་དོ་༎
 aśrauṣīdrāvaṇo rākṣasādhipatistathāgatādhiṣṭhānāt - bhagavān kila sāgaranāgarājabhavanāduttīrya	དེ་ནས་གནོད་སྦྱིན་གྱི་བདག་པོ་འབོད་སྒྲོགས་དེ་བཞིན་གཤེགས་པའི་བྱིན་གྱི་རླབས་ཀྱིས་བཅོམ་ལྡན་འདས་རྒྱ་མཚོའི་ཀླུའི་རྒྱལ་པོའི་གནས་ནས་བྱུང་སྟེ་།
 anekaśakrabrahmanāgakanyākoṭibhiḥ parivṛtaḥ puraskṛtaḥ samudrataraṃgānavalokya ālayavijñānodadhipravṛttivijñānapavanaviṣaye preritāṃstebhyaḥ saṃnipatitebhyaścittānyavalokya tasminneva sthitaḥ udānamudānayati	བརྒྱ་བྱིན་དང་། ཚངས་པ་དང་། ཀླུའི་བུ་མོ་བརྒྱ་སྟོང་དུ་མས་བསྐོར་ཅིང་མདུན་དུ་བདར་ནས་རྒྱ་མཚོའི་རླབས་ལ་གཟིགས་ཏེ་། ཀུན་གཞི་རྣམ་པར་ཤེས་པའི་རྒྱ་མཚོ་ལ་འཇུག་པའི་རྣམ་པར་ཤེས་པ་ཡུལ་གྱི་རླུང་གིས་བསྐྱོད་ཅིང་དེ་དག་གི་སེམས་འབྱུང་བར་གཟིགས་ཏེ༏་ཆེད་དུ་བརྗོད་པ་ཆེད་དུ་བརྗོད་པ་མཛད་དོ་ཞེས་ཐོས་ནས་། 
 sma - yannvahaṃ gatvā bhagavantamadhyeṣya laṅkāṃ praveśayeyam |	བདག་སོང་ལ་བཅོམ་ལྡན་འདས་ལ་གསོལ་བ་བཏབ་སྟེ་ལངཀར་གཤེགས་པར་བྱའོ་༎
 tanme syāddīrgharātramarthāya hitāya sukhāya devānāṃ ca manuṣyāṇāṃ ca ||	དེ་ནི་བདག་དང་ལྷ་དང་མི་རྣམས་ལ་ཡུན་རིང་པོའི་དོན་དང་། ཕན་པ་དང་བདེ་བར་འགྱུར་རོ་སྙམ་སྟེ་།
 atha rāvaṇo rākṣasādhipatiḥ saparivāraḥ pauṣpakaṃ vimānamadhiruhya yena bhagavāṃstenopajagāma |	དེ་ནས་གནོད་སྦྱིན་གྱི་བདག་པོ་འབོད་སྒྲོགས་འཁོར་དང་བཅས་པ་མེ་ཏོག་གི་གཞལ་མེད་ཁང་དུ་ཞུགས་༄༨༩ཨ་༌༎ 
 upetya vimānādavatīrya saparivāro bhagavantaṃ triṣkṛtvaḥ pradakṣiṇīkṛtya tūryatālāvacaraiḥ pravādyadbhirindranīlamayena	ནས༏་བཅོམ་ལྡན་འདས་ག་ལ་བ་དེར་སོང་སྟེ་བྱིན་པ་དང་། འཁོར་དང་བཅས་ཏེ་གཞལ་མེད་ཁང་ནས་བབས་ནས་རྔ་དང་སིལ་སྙན་རྣམས་རབ་ཏུ་བསྒྲགས་ཏེ་། བཅོམ་ལྡན་འདས་ལ་ལན་གསུམ་བསྐོར་བ་བྱས་ནས་པི་ཝང་གི་ཁོག་པ་ཨཻནདྲ་ནའི་ལ་ལ་བེཨེ་དའུརྱ་དང་། མུ་ས་རས་སྤྲས་པ་།
 daṇḍena vaiḍūryamusāra(galva)	གོས་ངུར་ཀ་པྲི་ཡང་ཀུ་འདྲ་བ་རིན་ཐང་མེད་པས་ཚར་དུ་དབྱངས་ཏེ་། འཁོར་རྣམས་རབ་ཏུ་དགའ་བར་བྱས་ནས་། གླུའི་དབྱངས་།
 pratyuptāṃ vīṇāṃ priyaṅgupāṇḍunā anardhyeṇa vastreṇa pārśvāvalambitāṃ kṛtvā ṣaḍjarṣabhagāndhāradhaivataniṣādamadhyamakaiśikagītasvaragrāmamūrchanādiyuktenānusārya	ཤརཛའ་དང་། རི་ཤ་བྷ་དང་། གའ་ན་དྷ་ར་དང་། དྷེཨེ་བའ་ཏ་དང་། ནི་ཤའ་ད་དང་། མ་དྷྱ་མ་དང༏་ཀོཨོ་ཤི་ཀ་དང་། གླུའི་དབྱངས་མང་པོར་སྦྱར་བ་ལ་སོགས་པ་དང་ལྡན་ཞིང་།
 salīlaṃ vīṇāmanupraviśya gāthābhigītairanugāyati sma -	རྒྱང་རྗེས་སུ་མཐུན་པ་དང་པི་ཝང་གི་ནང་དུ་ཆུད་པར་བྱས་ཏེ་ཚིགས་སུ་བཅད་པའི་དབྱངས་ཀྱིས་གླུ་བླངས་པ་།
 cittasvabhāvanayadharmavidhiṃ nairātmyaṃ dṛṣṭivigataṃ hyamalam |	སེམས་ཀྱི་རང་བཞིན་ཚུལ་ཉིད་ཆོས་ཀྱི་གཏེར་༎ བདག་མེད་ལྟ་དང་རྣམ་བྲལ་དྲི་མ་མེད་༎
 pratyātmavedyagatisūcanakaṃ deśehi nāyaka iha dharmanayam || lank_1|1 || (vaidya 2)	སོ་སོ་རང་རིག་ཤེས་པ་སྟོན་པ་ཡི་༎ ཆོས་ཚུལ་མགོན་པོ་འདིར་ཡང་བཤད་དུ་གསོལ༏་༏དགེ་བའི་ཆོས་ཀྱིས་ཡང་དག་བསགས་པའི་སྐུ་༎
 śubhadharmasaṃcitatanuṃ sugataṃ nirmāṇanirmitapradarśanakam |	བདེ་གཤེགས་འཕྲུལ་པས་སྤྲུལ་བ་སྟོན་པ་སྟེ་༎
 pratyātmavedyagatidharmarataṃ laṅkāṃ hi gantu samayo 'dya mune || lank_1|2 ||	སོ་སོ་རང་རིག་རྟོགས་པའི་ཆོས་དགྱེས་པ་༎ ཐུབ་པ་དེང་ནི་ལངཀར་གཤེགས་པའི་དུས་༎
 laṅkāmimāṃ pūrvajinādhyuṣitāṃ putraiśca teṣāṃ bahurūpadharaiḥ |	ལངཀ་འདི་ན་སྔོན་གྱི་རྒྱལ་བ་དང་༎ དེ་ཡི་སྲས་རྣམས་གཟུགས་མང་འཆང་བ་བཞུགས་༎
 deśehi nātha iha dharmavaraṃ śroṣyanti yakṣa bahurūpadharāḥ || lank_1|3 ||	མགོན་པོ་འདིར་ནི་ཆོས་རབ་བཤད་དུ་གསོལ་༎ གཟུགས་༄༨༩བ་མང་ལྡན་པའི་གནོད་སྦྱིན་ཀུན་ཀྱང་ཉན་༎
 atha rāvaṇo laṅkādhipatiḥ toṭakavṛttenānugāyya punarapi gāthābhigītenānugāyati sma -	དེ་ལྟར་ལངཀའི་བདག་པོ་འབོད་སྒྲོགས་ཀྱིས་ཏོ་ཏ་ཀའི་རྒྱུད་དུ་གླུ་བླངས་ནས་ཡང་ཚིགས་སུ་བཅད་པའི་དབྱངས་ཀྱིས་གླུ་བླངས་པ་། བཅོམ་ལྡན་འདས་ནི་དགུང་བདུན་ཏེ་༎ ཆུ་སྲིན་གནས་ཀྱི་རྒྱ་མཚོ་ཡི་༎
 saptarātreṇa bhagavān sāgarānmakarālayāt |	རྒྱ་མཚོའི་དབང་པོའི་གནས་ནས་ནི་༎
 sāgarendrasya bhavanāt samuttīrya taṭe sthitaḥ || lank_1|4 ||	སླད་དུ་བྱུང་སྟེ་འགྲམ་ན་བཞུགས་༎
 sthitamātrasya buddhasya rāvaṇo hyapsaraiḥ saha |	སངས་རྒྱས་བཞུགས་མ་ཐག་ཏུ་ཡང་༎
 yakṣaiśca nānāvividhaiḥ śukasāraṇapaṇḍitaiḥ || lank_1|5 ||	ནེ་ཙོ་ས་ར་ནས་བརྒྱན་པའི་༎ གནོད་སྦྱིན་རྣམ་པ་མང་པོ་དང་༎ འབོད་སྒྲོགས་ལྷ་མོ་ལྷན་ཅིག་ཏུ་༎
 ṛddhyā gatvā tamadhvānaṃ yatra tiṣṭhati nāyakaḥ |	མགོན་པོ་གང་ན་བཞུགས་པ་ཡི་༎ ལམ་དེར་འཕྲུལ་གྱིས་སོང་ནས་ནི་༎
 avatīrya pauṣpakādyānādvandya pūjya tathāgatam |	མེ་ཏོག་བཞོན་ལས་བབས་ནས་ཀྱང་༎ དེ་བཞིན་གཤེགས་ལ་མཆོད་ཕྱག་འཚལ་༎
 nāma saṃśrāvayaṃstasmai jinendreṇa adhiṣṭhitaḥ || lank_1|6 ||	རྒྱལ་བའི་དབང་པོས་བྱིན་བརླབས་ནས་༎ དེ་ལ་མངོན་པར་མི་བསྙན་པ་༎
 rāvaṇo 'haṃ daśagrīvo rākṣasendra ihāgataḥ |	བདག་ནི་འབོད་སྒྲོགས་མགྲིན་བཅུ་སྟེ༏་༏སྲིན་པོའི་དབང་པོ་འདིར་མཆིས་སོ་༎
 anugṛhṇāhi me laṅkāṃ ye cāsmin puravāsinaḥ || lank_1|7 ||	གྲོང་རྡལ་འདི་ན་སུ་གནས་དང་༎ བདག་གི་ལངཀ་རྗེས་སུ་བཟུང་༎
 pūrvairapi hi saṃbuddhaiḥ pratyātmagatigocaram |	རྫོགས་པའི་སངས་རྒྱས་སྔ་མས་ཀྱང་༎ སོ་སོ་རང་རིག་སྤྱོད་ཡུལ་ནི་༎
 śikhare ratnakhacite puramadhye prakāśitam || lank_1|8 ||	རྩེ་མོ་རིན་ཆེན་བརྒྱན་པ་ཡི་༎ གྲོང་རྡལ་དབུས་སུ་རབ་ཏུ་བཤད་༎
 bhagavānapi tatraiva śikhare ratnamaṇḍite |	བཅོམ་ལྡན་གྱིས་ཀྱང་དེ་ཉིད་ཀྱི་༎ རྩེ་མོ་རིན་ཆེན་བརྒྱན་པ་ལ་༎
 deśetu dharma virajaṃ jinaputraiḥ parīvṛtaḥ |	རྒྱལ་བའི་སྲས་ཀྱིས་ཡོངས་བསྐོར་ཅིང་༎ རྡུལ་མེད་ཆོས་ནི་བཤད་དུ་གསོལ་༎
 śrotukāmā vayaṃ cādya ye ca laṅkānivāsinaḥ || lank_1|9 ||	གང་རྣམས་ལངཀར་གནས་པ་དང་༎ བདག་ཅག་དེ་རིང་ཉན་པར་འཚལ་༎
 deśanānayanirmuktaṃ pratyātmagatigocaram |	བཤད་པའི་ཚུལ་ལས་རྣམ་གྲོལ་བ་༎ སོ་སོ་རང་རིག་སྤྱོད་ཡུལ་ཏེ་༎
 laṅkāvatārasūtraṃ vai pūrvabuddhānuvarṇitam || lank_1|10 ||	ལངཀར་གཤེགས་པའི་མདོ་༄༩༠ཨ་༌༎ སྡེ་ནི་༎
 smarāmi pūrvakairbuddhairjinaputrapuraskṛtaiḥ |	སངས་རྒྱས་སྔ་མས་གསུངས་པའོ་༎ རྒྱལ་བའི་སྲས་ཀྱིས་ཡོངས་བསྐོར་ཅིང་༎ སྔོན་གྱི་སངས་རྒྱས་དག་གིས་ཀྱང་༎
 sūtrametannigadyate bhagavānapi bhāṣatām || lank_1|11 ||	མདོ་སྡེ་འདི་ནི་བཤད་པར་དྲན་༎ བཅོམ་ལྡན་འདས་ཀྱིས་བཤད་དུ་གསོལ་༎
 bhaviṣyantyanāgate kāle buddhā buddhasutāśca ye |	མ་འོངས་དུས་ན་འབྱུང་བ་ཡི་༎ སངས་རྒྱས་སངས་རྒྱས་སྲས་དག་ཀྱང་༎ འཕྲུལ་གྱི་ཚུལ་ཏེ་འདི་ཉིད་ནི་༎
 etameva nayaṃ divyaṃ śikhare ratnabhūṣite |	རྩེ་མོ་རིན་ཆེན་བརྒྱན་པ་ལ་༎
 deśayiṣyanti yakṣāṇāmanukampāya nāyakāḥ || lank_1|12 ||	གནོད་སྦྱིན་རྣམས་ལ་ཐུགས་བརྩེ་ཕྱིར་༎ འདྲེན་པ་རྣམས་ནི་སྟོན་པར་འགྱུར་༎ འཕྲུལ་གྱི་ལངཀའི་གྲོང་རྡལ་འདི་༎
 divyalaṅkāpurīramyāṃ nānāratnairvibhūṣitām | prāgbhāraiḥ śītalaiḥ ramyai ratnajālavitānakaiḥ || lank_1|13 ||	མདངས་དགའ་རིན་ཆེན་སྣ་ཚོགས་དང་༎ ཐལ་སྡིངས་རྡོ་སྟེང་དགའ་བ་དང་༎ རིན་ཆེན་དྲ་བའི་བླ་བྲེས་བརྒྱན་༎
 rāgadoṣavinirmuktāḥ pratyātmagaticintakāḥ |	རྣལ་འབྱོར་ཉེས་དང་རྣམ་བྲལ་བ་༎ སོ་སོ་རང་རིག་སེམས་པ་ཡི་༎
 santyatra bhagavan yakṣāḥ pūrvabuddhaiḥ kṛtārthinaḥ |	བཅོམ་ལྡན་འདི་ན་གནོད་སྦྱིན་དག་། སངས་རྒྱས་སྔ་མས་མཛད་སྲུང་པ་༎
 mahāyānanaye śraddhā niviṣṭānyonyayojakāḥ || lank_1|14 ||	ཐེག་ཆེན་ཚུལ་ལ་དད་པ་ཡི་༎ མངོན་པར་ཞེན་ཅིང་གཞན་འཛུད་པ་༎
 (vaidya 3) yakṣiṇyo yakṣaputrāśca mahāyānabubhutsavaḥ |	གནོད་སྦྱིན་མོ་དང་གནོད་སྦྱིན་བུ་༎ ཐེག་ཆེན་རྟོགས་པར་འཚལ་བ་མཆིས༏་༏ལངཀ་མ་ལ་ཡ་ཡི་རིར་༎
 āyātu bhagavān śāstā laṅkāmalayaparvatam || lank_1|15 ||	སྟོན་པ་སངས་རྒྱས་གཤེགས་སུ་གསོལ་༎ བུམ་པ་རྣ་ལ་སོགས་པ་རྣམས་༎
 kumbhakarṇapuroigāśca rākṣasāḥ puravāsinaḥ |	སྲིན་པོ་གྲོང་རྡལ་གནས་པ་དག་།
 śroṣyanti pratyātmagatiṃ mahāyānaparāyaṇāḥ || lank_1|16 ||	ཐེག་པ་ཆེ་ལ་རྟོན་པ་རྣམས་༎ སོ་སོ་རང་རིག་ཉན་པར་འཚལ་༎
 kṛtādhikārā buddheṣu kariṣyantyadhunā ca vai |	སངས་རྒྱས་རྣམས་ལ་བགྱི་བ་བགྱིས་༎ ད་ལྟར་ན་ཡང་ཤིན་ཏུ་བགྱིད་༎
 anukampārthaṃ mahyaṃ vai yāhi laṅkāṃ sutaiḥ saha || lank_1|17 ||	བདག་ལ་རྗེས་སུ་ཐུགས་བརྩེའི་ཕྱིར་༎ ལངཀར་༄༩༠བ་སྲས་དང་བཅས་ཏེ་གཤེགས་༎
 gṛhamapsaravargāśca hārāṇi vividhāni ca |	ཁྱིམ་དང་ལྷ་མོ་ཚོགས་རྣམས་དང་༎ སེ་མོ་དོ་ཡང་སྣ་ཚོགས་དང་༎ མདངས་དགའ་ཨཨ་ཤོ་ཀ་ཡི་ཚལ་༎
 ramyāṃ cāśokavanikāṃ pratigṛhṇa mahāmune || lank_1|18 ||	ཐུབ་པ་ཆེན་པོ་བཞེས་སུ་གསོལ་༎
 ājñākaro 'haṃ buddhānāṃ ye ca teṣāṃ jinātmajāḥ |	བདག་ནི་རྒྱལ་སྲས་དེ་དག་དང་༎ སངས་རྒྱས་རྣམས་ཀྱི་བཀའ་བཞིན་བགྱིད་༎
 nāsti tadyanna deyaṃ me anukampa mahāmune || lank_1|19 ||	བདག་གིས་མི་དབུལ་གཅིག་མ་མཆིས་༎ ཐུབ་པ་ཆེན་པོ་ཐུགས་བརྩེར་དགོངས་༎
 tasya tadvacanaṃ śrutvā uvāca tribhaveśvaraḥ |	དེ་ཡི་ཚིག་དེ་གསན་པ་ན་༎ སྲིད་གསུམ་དབང་པོས་གསུངས་པ་ནི་༎
 atītairapi yakṣendra nāyakai ratnaparvate || lank_1|20 ||	གནོད་སྦྱིན་དབང་པོ་འདས་པ་ཡི་༎ མགོན་པོ་རིན་ཆེན་རི་བོ་ལ་༎
 pratyātmadharmo nirdiṣṭaḥ tvaṃ caivāpyanukampitaḥ |	སོ་སོ་རང་རིག་ཆོས་རྣམས་བསྟན་༎ ཁྱོད་ཉིད་ལ་ཡང་ཐུགས་བརྩེར་དགོངས་༎ རིན་ཆེན་རྣམ་བརྒྱན་རི་བོ་ལ་༎
 anāgatāśca vakṣyanti girau ratnavibhūṣite || lank_1|21 ||	མ་འོངས་རྣམས་ཀྱང་གསུང་བར་འགྱུར་༎ འདི་ནི་རྣལ་འབྱོར་ལྡན་པ་དག་།
 yogināṃ nilayo hyeṣa dṛṣṭadharmavihāriṇām |	མཐོང་བའི་ཆོས་ལ་སྤྱོད་པའི་གནས་༎ ང་དང་སྲས་རྣམས་དག་གིས་ཀྱང་༎
 anukampyo 'si yakṣendra sugatānāṃ mamāpi ca || lank_1|22 ||	གནོད་སྦྱིན་དབང་པོ་བརྩེར་དགོངས་རིགས་༎
 adhivāsya bhagavāṃstūṣṇīṃ śamabuddhyā vyavasthitaḥ |	བཅོམ་ལྡན་གནང་ནས་མི་གསུང་བར་༎ ཞི་བའི་བློ་ཡིས་རྣམ་པར་བཞུགས་༎ འབོད་སྒྲོགས་ཀྱིས་ནི་ཕུལ་བ་ཡི་༎
 ārūḍhaḥ puṣpake yāne rāvaṇenopanāmite || lank_1|23 ||	མེ་ཏོག་བཞོན་པར་བཞུགས་པར་གྱུར་༎
 tatraiva rāvaṇo 'nye ca jinaputrā viśāradāḥ |	དེ་ཉིད་དུ་ནི་འབོད་སྒྲོགས་དང་༎ འཇིགས་མེད་རྒྱལ་སྲས་གཞན་ཡང་སྟེ་༎ ལྷ་མོས་བཞད་གད་རོལ་མོ་ཡིས་༎
 apsarairhāsyalāsādyaiḥ pūjyamānāḥ purīṃ gatāḥ || lank_1|24 ||	རབ་ཏུ་མཆོད་ཅིང་གྲོང་དུ་གཤེགས་༎
 tatra gatvā purīṃ ramyāṃ punaḥ pūjāṃ pralabdhavān |	དགའ་བའི་གྲོང་རྡལ་དེར་གཤེགས་ནས་༎ མཆོད་པ་རབ་ཏུ་ཡང་བརྙེས་སོ་༎
 rāvaṇādyairyakṣavargairyakṣiṇībhiśca pūjitaḥ |	འབོད་སྒྲོགས་ལ་༄༩༡ཨ་༌༎ སོགས་གནོད་སྦྱིན་གྱི་༎ སྡེ་དང་གནོད་སྦྱིན་མོས་ཀྱང་མཆོད་༎
 yakṣaputrairyakṣakanyābhī ratnajālaiśca pūjitaḥ || lank_1|25 ||	གནོད་སྦྱིན་བུ་མོ་གནོད་སྦྱིན་བུས་༎ རིན་པོ་ཆེ་ཡི་དྲ་བས་མཆོད་༎
 rāvaṇenāpi buddhasya hārā ratnavibhūṣitāḥ |	འབོད་སྒྲོགས་ཀྱིས་ཀྱང་སངས་རྒྱས་ཀྱི་༎ རིན་ཆེན་བརྒྱན་པའི་སེ་མོ་དོ་༎
 jinasya jinaputrāṇāmuttamāṅgeṣu sthāpitāḥ || lank_1|26 ||	རྒྱལ་བའི་སྲས་དང་རྒྱལ་བ་ཡི་༎ སྟོད་ཀྱི་ཡན་ལག་རྣམས་ལ་བཏགས་༎
 pragṛhya pūjāṃ bhagavān jinaputraiśca paṇḍitaiḥ |	བཅོམ་ལྡན་རྒྱལ་སྲས་མཁས་བཅས་པ་༎ མཆོད་པ་ཕུལ་བ་བཞེས་ནས་ནི་༎
 dharmaṃ vibhāvayāmāsa pratyātmagatigocaram || lank_1|27 ||	སོ་སོ་རང་རིག་སྤྱོད་ཡུལ་གྱི་༎ ཆོས་ནི་རྣམ་པར་བསྟན་པ་མཛད་༎
 rāvaṇo yakṣavargāśca saṃpūjya vadatāṃ varam |	གནོད་སྦྱིན་སྡེ་དང་འབོད་སྒྲོགས་ཀྱིས་༎ སྨྲ་བ་རྣམས་ཀྱི་མཆོག་མཆོད་དེ་༎ བློ་གྲོས་ཆེན་པོ་རབ་མཆོད་ཅིང་༎
 mahāmatiṃ pūjayanti adhyeṣanti punaḥ punaḥ |	གསོལ་བ་ཡང་དང་ཡང་འདེབས་པ་༎
 tvaṃ praṣṭā sarvabuddhānāṃ pratyātmagatigocaram || lank_1|28 ||	ཁྱོད་ནི་སངས་རྒྱས་ཐམས་ཅད་ལ་༎ རང་རིག་སྤྱོད་ཡུལ་འདྲི་བ་ཡིན་༎
