skt	tib
 atha kuḍyakaṭavapraprākārabhūjalapavanāgnivyavahitātidūrasāmīpyānnopalabhate bālavṛddhāndhayogavadvaikalyādindriyāṇāṃ jñānaṃ nopalabhate | tadyadevaṃ nopalabhate,	དེ་སྟེ་རྩིག་པ་དང་། རེ་ལྡེ་དང་། རྫིང་དང་། ར་བ་དང་། ས་དང་། ཆུ་དང་། རླུང་དང་། མེས་ཆོད་པ་རྣམས་དང་། རྒྱང་རིང་པོ་དང་། ཉེ་བའི་ཕྱིར་མི་དམིགས་པ་དང་། ཕྱིས་པ་དང་། རྒན་པོ་དང་། ལོང་བར་གྱུར་བས་དབང་པོ་རྣམས་མ་ཚང་བའི་ཕྱིར་ཤེས་པས་མི་དམིགས་ན་ནི་། བཅོམ་ལྡན་འདས་། བློ་མ་ཚང་བའི་ཕྱིར་ཡོད་པའི་དོན་མི་དམིགས་ཏེ་།
 na tadbhagavan jñānam | ajñānameva tadvidyamānamarthaṃ buddhivaikalyāt ||	དེ་ནི་ཤེས་པ་མ་ལགས་ཀྱི་མི་ཤེས་པའོ་༎
 bhagavānāha - na hi tanmahāmate evamajñānaṃ bhavati | jñānameva tanmahāmate, nājñānam |	བཅོམ་ལྡན་འདས་ཀྱིས་བཀའ་སྩལ་པ་། བློ་གྲོས་ཆེན་པོ༏་དེ་ནི་དེ་ལྟར་ན་མི་ཤེས་པ་མ་ཡིན་ཏེ་ཤེས་པའོ་༎ བློ་གྲོས་ཆེན་པོ་།
 na caitatsaṃdhāyoktaṃ mayā - yadā tvālambyamarthaṃ nopalabhate jñānaṃ tadā vijñaptimātravyavasthānaṃ bhavatīti |	ངས་དེ་ལ་དགོངས་ཏེ་ནམ་མི་དམིགས་པའི་དོན་ཤེས་པས་མི་དམིགས་པ་དེ་ནི་རྣམ་པར་རིག་པ་ཙམ་དུ་གཞག་པ་ཡིན་ནོ་ཞེས་མ་བཤད་དེ་། 
 kiṃ tu svacittadṛśyamātrāvabodhātsadasatorbāhyabhāvābhāvājjñānamapyarthaṃ nopalabhate |	རང་གི་སེམས་སྣང་བ་ཙམ་དུ་ཁོང་དུ་ཆུད་པ་དང་། ཡོད་པ་དང་མེད་པ་ལས་ཕྱི་རོལ་གྱི་དངོས་པོ་དངོས་པོ་མེད་པའི་ཕྱིར་ཤེས་པས་༄༡༩༦བ་དོན་མ་དམིགས་སོ་༎ 
 tadanupalambhājjñānajñeyayorapravṛttiḥ |	དེ་མི་དམིགས་པའི་ཕྱིར་ཤེས་བྱ་དང་ཤེས་པ་མི་འབྱུང་ངོ་༎
 vimokṣatrayānugamājjñānasyāpyanupalabdhiḥ |	རྣམ་པར་ཐར་པ་གསུམ་མ་རྗེས་སུ་རྟོགས་པས་ཤེས་པའང་མི་དམིགས་ཏེ་།
 na ca tārkikā anādikālabhāvābhāvaprapañcavāsitamataya evaṃ prajānanti |	རྟོག་པ་ཅན་ཐོག་མ་མེད་པའི་དུས་ནས་དངོས་པོ་དང་དངོས་པོ་མེད་པར་སྤྲོས་པའི་བག་ཆགས་ཀྱིས་བསྒོས་པའི་བློ་ཅན་རྣམས་ཀྱིས་ནི་དེ་ལྟར་མི་ཤེས་སོ་༎ 
 te cāprajānanto bāhyadravyasaṃsthānalakṣaṇabhāvābhāvaṃ kṛtvā vikalpasyāpravṛttiṃ cittamātratāṃ nirdekṣyanti |	དེ་དག་མི་ཤེས་པས་ཕྱི་རོལ་གྱི་རྫས་དང་། དབྱིབས་དང་མཚན་ཉིད་ཀྱི་དངོས་པོ་མེད་དོ་ཞེས་བྱས་ནས་རྣམ་པར་རྟོག་པ་མི་འབྱུང་བ་ནི་སེམས་ཙམ་དུ་སྟོན་ཏོ་༎
 ātmātmīyalakṣaṇagrāhābhiniveśābhiniviṣṭāḥ svacittadṛśyamātrānavabodhājjñānaṃ jñeyaṃ prativikalpayanti |	བདག་དང་བདག་གི་མཚན་ཉིད་དུ་འཛིན་པ་ལ་མངོན་པར་ཆགས་ཤིང་ཞེན་པ་རང་གི་སེམས་སྣང་བ་ཙམ་དུ་ཁོང་དུ་མ་ཆུད་པས་ཤེས་པ་དང་ཤེས་བྱ་སོ་སོར་རྣམ་པར་རྟོག་སྟེ་།
 te ca jñānajñeyaprativikalpanayā bāhyabhāvābhāvapravicayānupalabdherucchedadṛṣṭimāśrayante ||	དེ་དག་ཤེས་པ་དང་ཤེས་བྱར་སོ་སོར་རྣམ་པར་རྟོག་པས་ཕྱི་རོལ་གྱི་དངོས་པོ་དང་དངོས་པོ་མེད་པ་ལ་རབ་ཏུ་རྣམ་པར་འབྱེད་པ་མི་དམིགས་པས་ཆད་པར་ལྟ་བ་ལ་རབ་ཏུ་རྟེན་ཏོ་༎ 
 tatredamucyate -	དེ་ལ་འདི་སྐད་ཅེས་བྱ་སྟེ་།
 vidyamānaṃ hi ālambyaṃ yadi jñānaṃ na paśyati |	དེ་སྟེ་དམིགས་བྱ་ཡོད་བཞིན་དུ་༎ ཤེས་པས་མཐོང་བར་མི་འགྱུར་ན་༎
 ajñānaṃ taddhi na jñānaṃ tārkikāṇāmayaṃ nayaḥ || lank_3|58 ||	དེ་ནི་ཤེས་མིན་མི་ཤེས་པ་༎ དེ་དག་རྟོག་ཅན་རྣམས་ཀྱི་ཚུལ་༎ གཞན་མིན་མཚན་ཉིད་མེད་པ་དང་༎ ཆོད་པ་དང་ནི་ཉེ་རིང་ཕྱིར་༎
 ananyalakṣaṇābhāvājjñānaṃ yadi na paśyati |	དེ་སྟེ་ཤེས་པས་མི་མཐོང་ན་༎
 vyavadhānadūrasāmīpyaṃ mithyājñānaṃ taducyate || lank_3|59 || (vaidya 70) bālavṛddhāndhayogācca jñānaṃ yadi na jāyate |	དེ་ནི་ལོག་པའི་ཤེས་ཞེས་བྱ་༎ བྱིས་པ་རྒན་པོ་ལྡོངས་གྱུར་པ་༎
 vidyamānaṃ hi tajjñeyaṃ mithyājñānaṃ taducyate || lank_3|60 ||	ཤེས་བྱ་དེ་ཡང་ཡོད་བཞིན་དུ་༎ གལ་ཏེ་ཤེས་པ་མི་སྐྱེ་ན་༎ དེ་ཡང་ལོག་པའི་ཤེས་ཞེས་༄༡༩༧ཨ་༌༎
 punaraparaṃ mahāmate bālapṛthagjanā anādikālaprapañcadauṣṭhulyasvaprativikalpanā	བྱ༏་༏གཞན་ཡང་། བློ་གྲོས་ཆེན་པོ་། བྱིས་པ་སོ་སོའི་སྐྱེ་བོ་རྣམས་ཐོག་མ་མེད་པའི་དུས་ཀྱི་སྤྲོས་པ་ལུས་ཀྱི་གནས་ངན་ལེན་རང་གི་སོ་སོར་རྣམ་པར་རྟོག་པའ་གར་ཐབས་སུ་གར་བྱེད་ཅིང་། རང་གི་གྲུབ་པའི་མཐའི་ཚུལ་བསྟན་པ་ལ་མི་མཁས་ཏེ་།
 nāṭake nṛtyantaḥ svasiddhāntanayadeśanāyāmakuśalāḥ svacittadṛśyabāhyabhāvalakṣaṇābhiniviṣṭā upāyadeśanāpāṭhamabhiniviśante,	རང་གི་སེམས་སྣང་བ་ཕྱི་རོལ་གྱི་དངོས་པོའི་མཚན་ཉིད་དུ་མངོན་པར་ཆགས་པས་ཐབས་སུ་བསྟན་པ་བརྗོད་པ་ལ་མངོན་པར་ཆགས་ཏེ་།
 na svasiddhāntanayaṃ cātuṣkoṭikanayaviśuddhaṃ prativibhāvayanti |	མཐའ་བཞིའི་ཚུལ་རྣམ་པར་དག་པ་རང་གི་གྲུབ་པའི་མཐའི་ཚུལ་ལ་ནི་རབ་ཏུ་མི་སྒོམ་མོ་༎ བློ་གྲོས་ཆེན་པོས་གསོལ་པ༏་བཅོམ་ལྡན་འདས་།
 mahāmatirāha - evametadbhagavan yathā vadasi |	དེ་དེ་བཞིན་ཏེ་། བཀའ་སྩལ་པ་བཞིན་ནོ་༎ བཅོམ་ལྡན་འདས་།
 deśayatu me bhagavān deśanāsiddhāntanayalakṣaṇaṃ yena ahaṃ ca anye ca bodhisattvā mahāsattvā anāgate 'dhvani deśanāsiddhāntanayakuśalā na vipralabhyeran kutārkikaistīrthakaraśrāvakapratyekabuddhayānikaiḥ |	གང་གིས་བདག་དང་། བྱང་ཆུབ་སེམས་དཔའ་སེམས་དཔའ་ཆེན་པོ་གཞན་རྣམས་མ་འོངས་པའི་དུས་ན་བཤད་པ་དང་། གྲུབ་པའི་མཐའི་ཚུལ་ལ་མཁས་པས་མུ་སྟེགས་ཅན་དང་། ཉན་ཐོས་དང་། རང་སངས་རྒྱས་ཀྱི་ཐེག་པ་པ་ལོག་པར་རྟོག་པ་ཅན་རྣམས་ཀྱིས་སླུ་བར་མི་འགྱུར་བའི་བཤད་པ་དང་། གྲུབ་པའི་མཐའི་ཚུལ་གྱིས་མཚན་ཉིད་བདག་ལ་བཤད་དུ་གསོལ་།
 bhagavānāha - yena hi mahāmate śṛṇu,	བཅོམ་ལྡན་འདས་ཀྱིས་བཀའ་སྩལ་པ་། བློ་གྲོས་ཆེན་པོ་།
 sādhu ca suṣṭhu ca manasikuru | bhāṣiṣye 'haṃ te |	དེའི་ཕྱིར་ཤིན་ཏུ་ལེགས་པར་ཉོན་ལ་ཡིད་ལ་ཟུངས་ཤིག་དང་། ངས་ཁྱོད་ལ་བཤད་དོ་༎ ལེགས་སོ་༎
 sādhu bhagavanniti mahāmatirbodhisattvo mahāsattvo bhagavataḥ pratyaśrauṣīt |	བཅོམ་ལྡན་འདས་ཞེས་གསོལ་ནས་། བྱང་ཆུབ་༄༡༩༧བ་སེམས་དཔའ་སེམས་དཔའ་ཆེན་པོ་བློ་གྲོས་ཆེན་པོས་བཅོམ་ལྡན་འདས་ལ་སླར་ཉན་པ་དང་། བཅོམ་ལྡན་འདས་ཀྱིས་དེ་ལ་འདི་སྐད་ཅེས་བཀའ་སྩལ་ཏོ་༎
 bhagavāṃstasyaitadavocat - dviprakāro mahāmate atītānāgatapratyutpannānāṃ tathāgatānāmarhatāṃ samyaksaṃbuddhānāṃ dharmanayo yaduta deśanānayaśca siddhāntapratyavasthānanayaśca |	བློ་གྲོས་ཆེན་པོ་། འདས་པ་དང་། མ་འོངས་པ་དང་། ད་ལྟར་བྱུང་བའི་དེ་བཞིན་གཤེགས་པ་དགྲ་བཅོམ་པ་ཡང་དག་པར་རྫོགས་པའི་སངས་རྒྱས་རྣམས་ཀྱི་ཆོས་ཀྱི་ཚུལ་ནི་རྣམ་པ་གཉིས་སོ་༎ འདི་ལྟ་སྟེ་། བསྟན་པའི་ཚུལ་དང་། གྲུབ་པའི་མཐའ་སོ་སོར་གཞག་པའི་ཚུལ་ལོ་༎ དེ་ལ་བསྟན་པ་བརྗོད་པའི་ཚུལ་གང་ཞེ་ན་།
 tatra deśanāpāṭhanayo mahāmate yaduta vicitrasaṃbhārasūtropadeśaḥ |	འདི་ལྟ་སྟེ་། བློ་གྲོས་ཆེན་པོ་། ཆོས་སྣ་ཚོགས་ཀྱི་མདོ་བཤད་པ་སྟེ་།
 yathācittādhimuktikatayā deśayanti sattvebhyaḥ |	སེམས་ཅན་རྣམས་ལ་སེམས་དང་། མོས་པ་ཇི་ལྟ་བ་བཞིན་དུ་སྟོན་པའོ་༎
 tatra siddhāntanayaḥ punarmahāmate katamaḥ?	བློ་གྲོས་ཆེན་པོ་། དེ་ལ་གྲུབ་པའི་མཐའི་ཚུལ་གང་ཞེ་ན་། འདི་ལྟ་སྟེ་།
 yena yoginaḥ svacittadṛśyavikalpavyāvṛttiṃ kurvanti yaduta ekatvānyatvobhayatvānubhayatvapakṣāpatanatācittamanomanovijñānātītaṃ	གང་གིས་རྣལ་འབྱོར་ཅན་རྣམས་རང་གི་སེམས་སྣང་བ་ནི་རྣམ་པར་རྟོག་པ་རྣམ་པར་ལྡོག་པར་བྱེད་པའོ་༎ འདི་ལྟ་སྟེ་། གཅིག་པ་དང་། ཐ་དད་པ་དང་། གཉིས་ཀ་དང་། གཉིས་ཀ་མ་ཡིན་པའི་ཕྱོགས་དང་བྲལ་བ་སེམས་དང་། ཡིད་དང་། ཡིད་ཀྱི་རྣམ་པར་ཤེས་པ་ལས་འདས་པ་བདག་གི་སོ་སོ་རང་གིས་རིག་པ་འཕགས་པའི་སྤྱོད་ཡུལ་རྒྱུ་དང་། 
 svapratyātmāryagatigocaraṃ hetuyuktidṛṣṭilakṣaṇavinivṛttamanālīḍhaṃ sarvakutārkikaistīrthakaraśrāvakapratyekabuddhayānikairnāstyastitvāntadvayapatitaiḥ, tamahaṃ siddhānta iti vadāmi |	ལྟ་བ་དང་། རིགས་པའི་མཚན་ཉིད་ལས་རྣམ་པར་བཟློག་པ་། མུ་སྟེགས་བྱེད་དང་། ཉན་ཐོས་དང་། རང་སངས་རྒྱས་ཀྱི་ཐེག་པ་པ་ལོག་པའི་རྟོག་པ་ཅན་༄༡༩༨ཨ་༌༎ ཡོད་པ་དང་། མེད་པའི་མཐར་ལྷུང་བ་རྣམས་ཀྱིས་མ་མྱངས་པ་དེ་ནི་ངས་གྲུབ་པའི་མཐར་བཤད་དོ་༎
 etanmahāmate siddhāntanayadeśanālakṣaṇaṃ yatra tvayā ca anyaiśca bodhisattvairmahāsattvairyogaḥ karaṇīyaḥ ||	བློ་གྲོས་ཆེན་པོ་། དེ་ལྟར་གྲུབ་པའི་མཐའི་ཚུལ་དང་། བསྟན་པའི་མཚན་ཉིད་དེ་ལ་ཁྱོད་དང་བྱང་ཆུབ་སེམས་དཔའ་སེམས་དཔའ་ཆེན་པོ་གཞན་དག་གིས་བརྩོན་པར་བྱའོ་༎ 
 tatredamucyate -	དེ་ལ་འདི་སྐད་ཅེས་བྱ་སྟེ་།
 nayo hi dvividho mahyaṃ siddhānto deśanā ca vai |	ང་ཡི་ཚུལ་ནི་རྣམ་གཉིས་ཏེ་། གྲུབ་པའི་མཐའ་དང་བསྟན་པའོ་༎
 deśemi yā bālānāṃ siddhāntaṃ yogināmaham || lank_3|61 ||	བྱིས་པ་རྣམས་ལ་བརྗོད་པ་བཤད་༎ རྣལ་འབྱོར་ཅན་གྱི་གྲུབ་མཐའོ་༎
 atha khalu mahāmatirbodhisattvo mahāsattvaḥ punarapi bhagavantametadavocat - uktametadbhagavaṃstathāgatenārhatā	དེ་ནས་ཡང་བྱང་ཆུབ་སེམས་དཔའ་སེམས་དཔའ་ཆེན་པོ་བློ་གྲོས་ཆེན་པོས་། བཅོམ་ལྡན་འདས་ལ་འདི་སྐད་ཅེས་གསོལ་ཏོ་༎ བཅོམ་ལྡན་འདས་།
 samyaksaṃbuddhena ekasmin kāle ekasmin samaye yathā lokāyatiko vicitramantrapratibhāno	རེ་ཞིག་དུས་གཅིག་གི་ཚེ་། དེ་བཞིན་གཤེགས་པ་དགྲ་བཅོམ་པ་ཡང་དག་པར་རྫོགས་པའི་སངས་རྒྱས་ཀྱིས་བཀའ་སྩལ་པ་། འདི་ལྟ་སྟེ་། འཇིག་རྟེན་རྒྱང་པན་པ་སྔགས་དང་། སྤོབས་པ་སྣ་ཚོགས་ཅན་ལ་མི་བསྟེན་ཏོ༏་༏མི་འགྲོགས་སོ་༎
 na sevitavyo na bhaktavyo na paryupāsitavyaḥ,	བསྙེན་བཀུར་མི་བྱ་སྟེ་།
 yaṃ ca sevamānasya lokāmiṣasaṃgraho bhavati na dharmasaṃgraha iti |	དེ་ལ་བརྟེན་པས་འཇིག་རྟེན་གྱི་ཟང་ཟིང་ཀུན་སྡུད་དེ་། ཆོས་སྡུད་པ་མ་ཡིན་ནོ་ཞེས་གསུངས་ན་།
 kiṃ kāraṇaṃ punarbhagavatedamuktaṃ lokāyatiko vicitramantrapratibhānaḥ,	ཅིའི་སླད་དུ་འཇིག་རྟེན་རྒྱང་པན་པ་སྔགས་དང་། སྤོབས་པ་སྣ་ཚོགས་ཅན་དེ་ལ་བསྟེན་པས་འཇིག་རྟེན་གྱི་ཟང་ཟིང་ཀུན་སྡུད་དེ་།
 yaṃ ca sevamānasya lokāmiṣasaṃgraho bhavati na dharmasaṃgrahaḥ?	ཆོས་སྡུད་པར་མི་འགྱུར་རོ་ཞེས་བཅོམ་ལྡན་འདས་ཀྱིས་༄༡༩༨བ་གསུངས་།
 bhagavānāha - vicitramantrapratibhāno mahāmate lokāyatiko vicitrairhetupadavyañjanairbālān vyāmohayati na yuktiyuktaṃ nārthopasaṃhitam |	བློ་གྲོས་ཆེན་པོ་། འཇིག་རྟེན་རྒྱང་པན་པ་ནི་སྔགས་དང་། སྤོབས་པ་སྣ་ཚོགས་ཅན་ཏེ་། རྒྱུ་དང་ཚིག་དང་ཡི་གེ་སྣ་ཚོགས་ཀྱིས་བྱིས་པ་དག་རྣམ་པར་རྨོངས་པར་བྱེད་དེ་། རིགས་པ་དང་ལྡན་པས་མ་ཡིན་། དོན་དང་ལྡན་པས་མ་ཡིན་ནོ་༎
 atha yāvadeva yatkiṃcidbālapralāpaṃ deśayati |	འདི་ལྟར་གྱི་ན་བྱིས་པའི་སྨྲ་བ་སྟོན་ཏེ་།
 etena mahāmate kāraṇena lokāyatiko vicitramantrapratibhāna ityucyate |	བློ་གྲོས་ཆེན་པོ་། དེའི་ཕྱིར་འཇིག་རྟེན་རྒྱང་པན་པ་སྔགས་དང་། སྤོབས་པ་སྣ་ཚོགས་ཞེས་བྱའོ་༎
 akṣaravaicitryasauṣṭhavena bālānākarṣati, na tattvanayapraveśena praviśati |	ཡི་གེ་སྣ་ཚོགས་སྙན་པས་བྱིས་པ་རྣམས་ཡང་དག་པའི་ཚུལ་ལ་རབ་ཏུ་འཇུག་པས་ནི་མི་འཇུག་གོ་། 
 svayaṃ sarvadharmānavabodhādantadvayapatitayā dṛṣṭyā bālān vyāmohayati,	བདག་ཉིད་ཆོས་ཐམས་ཅད་ཁོང་དུ་མ་ཆུད་ཅིང་མཐའ་གཉིས་སུ་ལྷུང་བའི་ལྟ་བས་བྱིས་བ་དག་རྣམ་པར་རྨོངས་པར་བྱེད་དེ་།
 svātmānaṃ ca kṣiṇoti |	འགྲོ་བའི་མཚམས་ལས་རབ་ཏུ་མཐར་བའི་ཕྱིར་བདག་ཉིད་ཀྱང་ཕུང་བར་བྱེད་དེ་།
 gatisaṃdhyapramuktatvātsvacittadṛśyamātrānavabodhādbāhyabhāvasvabhāvābhiniveśādvikalpasya vyāvṛttirna bhavati | ata etasmātkāraṇānmahāmate lokāyatiko (vaidya 71)	རང་གི་སེམས་སྣང་བ་ཙམ་དུ་ཁོང་དུ་མ་ཆུད་ཅིང་ཕྱི་རོལ་གྱི་དངོས་པོའི་རང་བཞིན་ལ་མངོན་པར་ཆགས་པས་རྣམ་པར་རྟོག་པ་ལྡོག་པར་མི་འགྱུར་རོ་༎ དེས་ན་དེའི་ཕྱིར་། བློ་གྲོས་ཆེན་པོ་།
 vicitramantrapratibhāno 'parimukta eva jātijarāvyādhimaraṇaśokaparidevaduḥkhadaurmanasyopāyāsādibhyo vicitraiḥ padavyañjanairhetudṛṣṭāntopasaṃhārairbālān vyāmohayati ||	འཇིག་རྟེན་རྒྱང་པན་པ་སྔགས་དང་། སྤོབས་པ་སྣ་ཚོགས་ཅན་ནི་སྐྱེ་བ་དང་། རྒ་བ་དང་། ན་བ་དང་། འཆི་བ་དང་། སློབ་པའི་མྱ་ངན་དང་། སྨྲེ་སྔགས་འདོན་པ་དང་། སྡུག་བསྔལ་བ་དང་། ཡིད་མི་བདེ་བ་དང་། འཁྲུག་པ་ལ་སོགས་པ་ལས་ཡོངས་སུ་མ་ཐར་ཏེ་། ཚིག་དང་ཡི་གེ་སྣ་ཚོགས་དང་། རྒྱུ་དང་དཔེ་ཉེ་བར་སྒྲུབས་པས་བྱིས་པ་༄༡༩༩ཨ་༌༎ དག་རྣམ་པར་རྨོངས་པར་བྱེད་དོ་༎ བློ་གྲོས་ཆེན་པོ་།
 indro 'pi mahāmate anekaśāstravidagdhabuddhiḥ svaśabdaśāstrapraṇetā |	དེའི་སློབ་མ་ཀླུའི་གཟུགས་དང་ཆ་བྱད་འཛིན་པས་དབང་པོའང་གཙུག་ལག་མང་པོ་ལ་མཁས་པའི་བློ་སྟེ༏་རང་གི་སྒྲའི་གཙུག་ལག་སྟོན་པ་ཡིན་མོད་ཀྱི་། 
 tacchiṣyeṇa nāgaveśarūpadhāriṇā svarge indasabhāyāṃ pratijñāṃ kṛtvā tava vā sahasrāro ratho bhajyatāṃ mama vā ekaikanāgabhāvasya phaṇācchedo bhavatviti |	མཐོ་རིས་སུ་དབང་པོའི་འཁོར་འདུས་པར་དམ་བཅའ་བར་བྱས་ཏེ་། ཡང་ན་ཁྱོད་ཀྱི་ཤིང་རྟ་རྩིབ་མ་སྟོང་པ་བཅག་གོ་།
 sahadharmeṇa ca nāgaveśadhāriṇā lokāyatikaśiṣyeṇa devānāmindraṃ vijitya sahasrāraṃ rathaṃ bhaṅktvā punarapīmaṃ lokamāgataḥ |	ཡང་ན་ངའི་ཀླུའི་ལུས་དང་། མགོ་གདེངས་ཀ་ཅན་རེ་རེ་ནས་བཅད་དོ་ཞེས་དམ་བཅད་ནས་འཇིག་རྟེན་རྒྱང་བན་པའི་སློབ་མ་ཀླུའི་གཟུགས་ཅན་དང་། ཆ་བྱད་འཛིན་པས་བརྒྱ་བྱིན་ལྷའི་དབང་པོ་ཆོས་དང་ལྡན་པས་ཕམ་པར་བྱས་ཏེ་། ཤིང་རྟའི་རྩིབ་མ་སྟོང་པ་བཅག་ནས་སླར་འཇིག་རྟེན་འདིར་འོངས་སོ་༎ དེ་ལྟར་།
 evamidaṃ mahāmate lokāyatikavicitrahetudṛṣṭāntopanibaddhaṃ yena tiryañco 'pyadhītya devāsuralokaṃ vicitrapadavyañjanairvyāmohayati | āyavyayadṛṣṭābhiniveśenābhiniveśayati kimaṅga punarmānuṣān |	བློ་གྲོས་ཆེན་པོ་། འཇིག་རྟེན་རྒྱང་བན་པ་ནི་རྒྱུ་དང་དཔེ་སྣ་ཚོགས་སུ་འབྲེལ་བ་སྟེ་། འདི་ལྟར་བྱོལ་སོང་ལས་བསླབས་པས་ཀྱང་ལྷ་དང་ལྷ་མ་ཡིན་གྱི་འཇིག་རྟེན་གྱི་ཚིག་དང་ཡི་གེ་སྣ་ཚོགས་ཀྱིས་རྣམ་པར་རྨོངས་པར་བྱེད་དོ་༎ འདུད་དང་ཟད་པར་ལྟ་བར་མངོན་པར་ཆགས་པ་ལ་རབ་ཏུ་འགོད་ན་མི་རྣམས་ལྟ་ཅི་༎ སྨོས་། 
 ata etasmātkāraṇānmahāmate lokāyatikaḥ parivarjitavyo duḥkhajanmahetuvāhakatvāt,	དེས་ན་དེའི་ཕྱིར་། བློ་གྲོས་ཆེན་པོ་། འཇིག་རྟེན་རྒྱང་བན་པ་ནི་སྡུག་བསྔལ་སྐྱེ་བའི་རྒྱུ་འཐོབ་པར་བྱེད་པས་ཡོངས་སུ་སྤང་པར་བྱ་བ་ཡིན་ཏེ་། མི་བསྙེན་ཏོ་༎ མི་སྟེན་ཏོ་༎
 na sevitavyo na bhajitavyo na paryupāsitavyaḥ |	བསྙེན་བཀུར་མི་བྱའོ་༎
 śarīrabuddhiviṣayopalabdhimātraṃ hi mahāmate lokāyatikairdeśyate vicitraiḥ padavyañjanaiḥ |	བློ་གྲོས་ཆེན་པོ་། འཇིག་རྟེན་རྒྱང་བན་༄༡༩༩བ་རྣམས་ནི་ལུས་དང་། བློ་དང་ཡུལ་དམིགས་པ་ཙམ་དུ་ཚིག་དང་ཡི་གེ་སྣ་ཚོགས་ཀྱིས་སྟོན་ཏོ་༎ བློ་གྲོས་ཆེན་པོ་།
 śatasahasraṃ mahāmate lokāyatam | kiṃ tu paścime loke paścimāyāṃ pañcāśatyāṃ bhinnasaṃhitaṃ bhaviṣyati kutarkahetudṛṣṭipraṇītatvāt |	འཇིག་རྟེན་རྒྱང་བན་པ་ནི་འབུམ་ལས་ཕྱི་མའི་དུས་ཕྱི་མའི་ཚེ་ལྔ་བརྒྱ་ཐ་མ་ལ་ངན་པའི་རྟོག་པའི་རྒྱུར་ལྟ་བ་བསྟན་པས་བསྡུས་བགྱེས་པར་འགྱུར་རོ་༎ 
