skt	tib
 lakṣaṇahetuḥ punaraparaṃ mahāmate anantarakriyālakṣaṇoparibaddhaṃ janayati |	བློ་གྲོས་ཆེན་པོ་། མཚན་ཉིད་ཀྱི་རྒྱུ་ནི་དེ་མ་ཐག་ཏུ་བྱེད་པའི་མཚན་ཉིད་དང་འབྲེལ་བ་སྐྱེད་དོ་༎
 kāraṇahetuḥ punarmahāmate ādhipatyādhikārakṛtyaṃ karoti cakravartinṛpavat |	བློ་གྲོས་ཆེན་པོ་། བྱེད་པའི་རྒྱུ་ནི་དབང་བར་གཏོགས་པའི་བྱ་བ་བྱེད་དེ་། འཁོར་ལོས་བསྒྱུར་བའི་རྒྱལ་པོ་བཞིན་ནོ་༎
 vyañjanahetuḥ punarmahāmate utpannasya vikalpasya bhāvasya lakṣaṇoddyotanakṛtyaṃ karoti pradīpavadrūpādīnām |	བློ་གྲོས་ཆེན་པོ་། སྣང་བར་བྱེད་པའི་རྒྱུ་ནི་རྣམ་པར་༄༡༤༠ཨ་༌༎ རྟོག་པའི་དངོས་པོ་སྐྱེས་པའི་མཚན་ཉིད་སྣང་བའི་བྱ་བ་བྱེད་དེ་། གཟུགས་ལ་སོགས་པ་ལ་མར་མེ་བཞིན་ནོ་༎
 upekṣāhetuḥ punarmahāmate vinivṛttikāle prabandhakriyāvyucchittiṃ karotyavikalpotpattau ||	བློ་གྲོས་ཆེན་པོ་། ལྟོས་པའི་རྒྱུ་ནི་རྣམ་པར་ལྡོག་པའི་དུས་ན་རྣམ་པར་མི་རྟོག་པའི་དངོས་པོ་འབྱུང་བའི་ཕྱིར་རྒྱུན་གྱི་བྱ་བ་མི་འཆད་པར་བྱེད་དོ་༎ འདི་དག་ནི་།
 ete hi mahāmate svavikalpakalpitā bālapṛthagjanairna kramavṛttyā na yugapatpravartante |	བློ་གྲོས་ཆེན་པོ་། བྱིས་པ་སོ་སོའི་སྐྱེ་བོ་རྣམས་ཀྱི་རང་གི་སེམས་ཀྱི་རྣམ་པར་རྟོག་པས་བརྟགས་པ་སྟེ་། རིམ་གྱིས་འཇུག་པས་ཀྱང་མ་ཡིན་ནོ་༎ ཅིག་ཅར་ཡང་མི་འབྱུང་ངོ་༎
 tatkasya hetoḥ? yadi punarmahāmate yugapatpravarteran,	དེ་ཅིའི་ཕྱིར་ཞེ་ན་། བློ་གྲོས་ཆེན་པོ་།
 kāryakāraṇavibhāgo na syādapratilabdhahetulakṣaṇatvāt |	གལ་ཏེ་ཅིག་ཅར་འབྱུང་ན་ནི་རྒྱུའི་མཚན་ཉིད་དུ་མ་རེག་པའི་ཕྱིར་བྱ་བ་དང་བྱེད་པའི་བྱེ་བྲག་ཀྱང་མེད་པར་འགྱུར་རོ་༎
 atha kramavṛttyā pravarteran, alabdhasya lakṣaṇātmakatvātkramavṛttyā na pravartate |	དེ་སྟེ་རིམ་གྱིས་འཇུག་པས་འབྱུང་ན་ནི་མཚན་ཉིད་དུ་མ་རེག་པའི་བདག་ཉིད་ལས་རིམ་གྱིས་འཇུག་པར་མི་འབྱུང་སྟེ་།
 ajātaputrapitṛśabdavanmahāmate kramavṛttisaṃbandhayogā na ghaṭante |	བློ་གྲོས་ཆེན་པོ་། བུ་མ་སྐྱེས་པར་ཕ་ཞེས་གདགས་པ་དང་འདྲ་བར་རྟོག་པ་པ་རྣམས་ཀྱི་རིམ་གྱིས་འཇུག་པས་འབྲེལ་བའི་ཚུལ་ཡང་མི་རུང་ངོ་༎
 tārkikāṇāṃ hetvārambaṇanirantarādhipatipratyayādibhirjanyajanakatvānmahāmate kramavṛttyā notpadyante |	བློ་གྲོས་ཆེན་པོ་། རྒྱུ་དང་། དམིགས་པ་དང་། དེ་མ་ཐག་པ་དང་། བདག་པོའི་རྐྱེན་ལ་སོགས་པས་བསྐྱེད་པར་བྱ་བ་དང་། སྐྱེད་པའི་ཕྱིར་རིམ་གྱིས་འཇུག་པས་མི་སྐྱེ་སྟེ་།
 parikalpitasvabhāvābhiniveśalakṣaṇānmahāmate yugapannotpadyante |	བློ་གྲོས་ཆེན་པོ་། ཀུན་བརྟགས་པའི་རང་བཞིན་ལ་མངོན་པར་ཞེན་པའི་མཚན་ཉིད་ཀྱི་ཕྱིར་རིམ་གྱིས་སམ་ཅིག་ཅར་མི་སྐྱེའོ་༎ 
 svacittadṛśyadehabhogapraviṣṭhānatvātsvasāmānyalakṣaṇabāhyabhāvābhāvānmahāmate krameṇa yugapadvā notpadyante |	བློ་གྲོས་ཆེན་པོ་། རང་གི་སེམས་སྣང་བའི་ལུས་༄༡༤༠བ་དང༏་ལོངས་སྤྱོད་ཅན་ཡིན་པའི་ཕྱིར་རང་དང་། སྤྱིའི་མཚན་ཉིད་ཀྱི་ཕྱི་རོལ་གྱི་དངོས་པོ་མེད་པའི་ཕྱིར་རིམ་གྱིས་སམ་ཅིག་ཅར་ཡང་མི་སྐྱེ་སྟེ་། 
 anyatra svacittadṛśyavikalpavikalpitatvādvijñānaṃ pravartate |	གཞན་དུ་ན་རང་གི་སེམས་སྣང་བའི་རྣམ་པར་རྟོག་པས་རྣམ་པར་བརྟགས་པའི་ཕྱིར་རྣམ་པར་ཤེས་པ་འབྱུང་ངོ་༎
 tasmāttarhi mahāmate hetupratyayakriyāyogalakṣaṇakramayugapaddṛṣṭivigatena te bhavitavyam ||	བློ་གྲོས་ཆེན་པོ་། དེ་ལྟ་བས་ན་ཁྱོད་ཀྱིས་རྒྱུ་དང་རྐྱེན་དང་། བྱེད་པ་དང་ལྡན་པའི་མཚན་ཉིད་རིམ་པའམ་ཅིག་ཅར་དུ་ལྟ་བ་དང་བྲལ་བར་བྱའོ་༎
 tatredamucyate -	དེ་ལ་འདི་སྐད་ཅེས་བྱ་སྟེ་།
 na hyatrotpadyate kiṃcitpratyayairna nirudhyate |	འདི་ལ་གང་ཡང་རྐྱེན་རྣམས་ཀྱིས་༎ སྐྱེ་བ་མེད་ཅིང་འགག་པ་མེད་༎
 utpadyante nirudhyante pratyayā eva kalpitāḥ || lank_2|138 || (vaidya 36)	བཏགས་པའི་རྐྱེན་རྣམས་ཁོ་ན་ནི་༎ སྐྱེ་ཞིང་འགག་པར་འགྱུར་ཡིན་ནོ་༎
 na bhaṅgotpādasaṃkleśaḥ pratyayānāṃ nivāryate |	སྐྱེ་འཇིག་རྐྱེན་ལ་འབྲེལ་པ་ནི་༎ རྣམ་པར་བཟློག་པར་མི་བྱ་སྟེ་༎
 yatra bālā vikalpanti pratyayaiḥ sa nivāryate || lank_2|139 ||	བྱིས་པ་རྐྱེན་གྱིས་གང་རྟོག་པ་༎ དེ་ནི་རྣམ་པར་བཟློག་པར་བྱ་༎ བག་ཆགས་རྣམས་ཀྱིས་རྨོངས་བྱས་སེམས་༎
 yaccāsataḥ pratyayeṣu dharmāṇāṃ nāsti saṃbhavaḥ | vāsanairbhrāmitaṃ cittaṃ tribhave khyāyate yataḥ |	སྲིད་གསུམ་དག་ན་སྣང་བའི་ཕྱིར་༎ རྐྱེན་རྣམས་ཡོད་དང་མེད་ལས་ཀྱང་༎ ཆོས་རྣམས་འབྱུང་བ་མེད་པའོ་༎
 nābhūtvā jāyate kiṃcitpratyayairna virudhyate || lank_2|140 ||	མ་བྱུང་རྐྱེན་གྱིས་སྐྱེ་བ་མེད་༎ གང་ཡང་འགག་པར་མི་འགྱུར་ཏེ་༎
 vandhyāsutākāśapuṣpaṃ yadā paśyanti saṃskṛtam |	ནམ་མཁའི་མེ་ཏོག་མོ་གཤམ་བུར་༎ གང་ཚེ་འདུས་བྱས་མཐོང་བ་ན་༎
 tadā grāhaśca grāhyaṃ ca bhrāntiṃ dṛṣṭvā nivartate || lank_2|141 ||	དེ་ཚེ་གཟུང་དང་འཛིན་པ་ཡང་༎ ནོར་པར་མཐོང་བར་ཕྱིར་ལྡོག་གོ་།
 na cotpādyaṃ na cotpannaḥ pratyayo 'pi na kiṃcana |	སྐྱེས་མེད་བསྐྱེད་པར་བྱ་བ་མེད་༎ རྐྱེན་རྣམས་དང་ནི་གང་དག་ཀྱང་༎ གག་ཀྱང་གང་ཚེའང་ཡོད་པ་མིན་༎
 saṃvidyate kvacitkecidvayavahārastu kathyate || lank_2|142 ||	སྤྱོད་པ་དག་ཏུ་བརྗོད་པ་ཡིན་༎
 atha khalu mahāmatirbodhisattvo mahāsattvaḥ punarapi bhagavantametadavocat - deśayatu	དེ་ནས་ཡང་བཅོམ་ལྡན་འདས་ལ་བྱང་ཆུབ་སེམས་དཔའ་སེམས་དཔའ་ཆེན་༄༡༤༡ཨ་༌༎ པོ་བློ་གྲོས་ཆེན་པོས་འདི་སྐད་ཅེས་གསོལ་ཏོ་༎ བཅོམ་ལྡན་འདས་།
 me bhagavān vāgvikalpalakṣaṇahṛdayaṃ nāma dharmaparyāyaṃ yena vāgvikalpalakṣaṇahṛdayena bhagavan suprativibhāgavinibaddhena ahaṃ ca anye ca bodhisattvā mahāsattvā abhilāpābhilāpyārthadvayagatiṃgatāḥ	ཚིག་གི་རྣམ་པར་རྟོག་པའི་མཚན་ཉིད་ཀྱི་སྙིང་པོ་ཐ་དད་པའི་བྱེ་བྲག་ཤིན་ཏུ་རྟོགས་པ་གང་གིས་བདག་དང་། བྱང་ཆུབ་སེམས་དཔའ་སེམས་དཔའ་ཆེན་པོ་གཞན་རྣམས་བརྗོད་པ་དང་། བརྗོད་དུ་མ་མཆིས་པའི་དོན་གཉིས་རྟོགས་པར་ཁོང་དུ་ཆུད་ནས་།
 kṣipramanuttarāṃ samyaksaṃbodhimabhisaṃbudhya abhilāpābhilāpyārthadvayagatiṃ sarvasattvānāṃ viśodhayeyuḥ |	མྱུར་དུ་བླ་ན་མེད་པ་ཡང་དག་པར་རྫོགས་པའི་བྱང་ཆུབ་ཏུ་མངོན་པར་རྫོགས་པར་སངས་རྒྱས་ཏེ་། སེམས་ཅན་ཐམས་ཅད་ཀྱི་བརྗོད་པ་དང་། བརྗོད་དུ་མ་མཆིས་པའི་དོན་གཉིས་ཀྱི་རྟོགས་པ་རྣམ་པར་སྦྱོང་བར་འགྱུར་བ་ཚིག་གི་རྣམ་པར་རྟོག་པའི་མཚན་ཉིད་ཀྱི་སྙིང་པོ་ཞེས་བགྱི་བའི་ཆོས་ཀྱི་གཞུང་བཅོམ་ལྡན་འདས་ཀྱིས་བདག་ལ་བཤད་དུ་གསོལ་། 
 bhagavānāha - tena hi mahāmate śṛṇu,	བཅོམ་ལྡན་འདས་ཀྱིས་བཀའ་སྩལ་པ་། བློ་གྲོས་ཆེན་པོ་།
 sādhu ca suṣṭhu ca manasikuru | bhāṣiṣye 'haṃ te |	དེའི་ཕྱིར་ཤིན་ཏུ་ལེགས་པར་ཉོན་ལ་ཡིད་ལ་གཟུང་ཞིག་དང་ངས་ཁྱོད་ལ་བཤད་དོ་༎ བཅོམ་ལྡན་འདས་།
 sādhu bhagavan iti mahāmatirbodhisattvo mahāsattvo bhagavataḥ pratyaśrauṣīt |	ལེགས་སོ་ཞེས་གསོལ་ནས་བྱང་ཆུབ་སེམས་དཔའ་སེམས་དཔའ་ཆེན་པོ་བློ་གྲོས་ཆེན་པོ་བཅོམ་ལྡན་འདས་ལ་ཕྱིར་ཉན་ཏོ་༎
 bhagavānasyaitadavocat - caturvidhaṃ mahāmate vāgvikalpalakṣaṇaṃ bhavati |	བཅོམ་ལྡན་འདས་ཀྱིས་དེ་ལ་འདི་སྐད་ཅེས་བཀའ་སྩལ་ཏོ་༎ བློ་གྲོས་ཆེན་པོ་། ཚིག་གི་རྣམ་པར་རྟོག་པའི་མཚན་ཉིད་རྣམ་པ་བཞི་ཡོད་དེ་།
 yaduta lakṣaṇavāk svapnavāk dauṣṭhulyavikalpābhiniveśavāk anādivikalpavāk ||	འདི་ལྟར་མཚན་ཉིད་ཀྱི་ཚིག་དང་། རྨི་ལམ་གྱི་ཚིག་དང་། གནས་ངན་ལེན་ལ་མངོན་པར་ཞེན་པའི་ཚིག་དང་། ཐོག་མ་མེད་༄༡༤༡བ་བའི་དུས་ཀྱི་རྣམ་པར་རྟོག་པའི་ཚིག་གོ་།
 tatra mahāmate lakṣaṇavāk svavikalparūpanimittābhiniveśātpravartate |	བློ་གྲོས་ཆེན་པོ་། དེ་ལ་མཚན་ཉིད་ཀྱི་ཚིག་ནི་རང་གི་རྣམ་པར་རྟོག་པའི་གཟུགས་ལ་མཚན་མར་མངོན་པར་ཞེན་པ་ལས་འབྱུང་ངོ་༎
 svapnavāk punarmahāmate pūrvānubhūtaviṣayānusmaraṇātprativibuddhaviṣayābhāvācca pravartate |	བློ་གྲོས་ཆེན་པོ་། རྨི་ལམ་གྱི་ཚིག་ནི་སྔོན་མྱོང་བའི་ཡུལ་རྗེས་སུ་དྲན་པ་དང་། རྟོགས་པའི་ཡུལ་མེད་པ་ལས་འབྱུང་ངོ་༎
 dauṣṭhulyavikalpābhiniveśavāk punarmahāmate śatrupūrvakṛtakarmānusmaraṇātpravartate |	ཡང་བློ་གྲོས་ཆེན་པོ་། གནས་ངན་ལེན་གྱི་རྣམ་པར་རྟོག་པའི་ཚིག་ནི་སྔོ་ནད་གྲས་བྱས་པའི་ལས་རྗེས་སུ་དྲན་པ་ལས་འབྱུང་ངོ་༎ 
 anādikālavikalpavāk punarmahāmate anādikālaprapañcābhiniveśadauṣṭhulyasvabījavāsanātaḥ pravartate |	བློ་གྲོས་ཆེན་པོ་། ཐོག་མ་མེད་པའི་དུས་ནས་རྣམ་པར་རྟོག་པའི་ཚིག་ནི་ཐོག་མ་མེད་པའི་དུས་ཀྱི་སྤྲོས་པ་ལ་མངོན་པར་ཞེན་པའི་གནས་ངན་ལེན་གྱི་རང་གི་ས་བོན་ལས་འབྱུང་སྟེ་།
 etaddhi mahāmate caturvidhaṃ vāgvikalpalakṣaṇamiti me yaduktam, idaṃ tatpratyuktam ||	འདི་ནི་། བློ་གྲོས་ཆེན་པོ་། ཚིག་རྣམ་པར་རྟོག་པའི་མཚན་ཉིད་རྣམ་པ་བཞིའོ་ཞེས་གང་བརྗོད་པ་དེ་ལ་ཕྱིར་བཤད་པའོ་༎
 atha khalu mahāmatirbodhisattvo mahāsattvaḥ punarapi bhagavantametamevārthamadhyeṣate sma - deśayatu me bhagavān punarapi vāgvikalpābhivyaktigocaram	དེ་ནས་ཡང་བཅོམ་ལྡན་འདས་ལ་བྱང་ཆུབ་སེམས་དཔའ་སེམས་དཔའ་ཆེན་པོ་བློ་གྲོས་ཆེན་པོས་དོན་དེ་ཉིད་ཀྱི་ཕྱིར་གསོལ་བ་བཏབ་པ་། བཅོམ་ལྡན་འདས་།
 kutra kasmāt kathaṃ kena bhagavan nṛṇāṃ vāgvijñaptivikalpaḥ pravartate?	ད་དུང་ཡང་བཅོམ་ལྡན་འདས་ཀྱིས་མི་རྣམས་ཀྱིས་ཚིག་རྣམ་པར་རིག་པ་རྟོག་པ་གང་དུ་ཅི་ལས་ཇི་ལྟར་གང་གིས་འབྱུང་བའི་ཚིག་གི་རྣམ་པར་རྟོག་པ་མངོན་པར་ཞེན་པའི་སྤྱོད་ཡུལ་བདག་ལ་བཤད་དུ་གསོལ་། བཅོམ་ལྡན་འདས་ཀྱིས་བཀའ་སྩལ་པ་།
 bhagavānāha - śirauronāsākaṇṭhatālvoṣṭhajihvādantasamavāyānmahāmate vāk pravartamānā pravartate |	བློ་གྲོས་ཆེན་པོ་། ཚིག་འབྱུང་བ་ནི་མགོ་དང་། བྲང་དང་། སྣ་དང་། མགུལ་དང་། རྐན་དང་། མཆུ་དང་། ལྕེ་དང་། སོ་རྣམས་འདུས་པ་ལས་༄༡༤༢ཨ་༌༎ འབྱུང་ངོ་༎
 mahāmatirāha - kiṃ punarbhagavan vāg vikalpādanyā uta ananyā?	བློ་གྲོས་ཆེན་པོས་གསོལ་པ་། བཅོམ་ལྡན་འདས་། རྣམ་པར་རྟོག་པ་དང་ཚིག་ཏུ་ཐ་དད་དམ་། འོན་ཏེ་གཅིག་གམ་ཅི་ལགས་།
 bhagavānāha - na hi mahāmate vāg vikalpādanyā nānanyā |	བཅོམ་ལྡན་འདས་ཀྱིས་བཀའ་སྩལ་པ་། བློ་གྲོས་ཆེན་པོ་། ཚིག་ནི་རྣམ་པར་རྟོག་པ་དང་ཐ་དད་པའང་མ་ཡིན་། གཅིག་པའང་མ་ཡིན་ནོ་༎
 tatkasya hetoḥ?	དེ་ཅིའི་ཕྱིར་ཞེ་ན་།
 yaduta taddhetūtpattilakṣaṇatvānmahāmate vāgvikalpaḥ pravartate |	འདི་ལྟ་སྟེ་། དེའི་རྒྱུ་ལས་བྱུང་བའི་མཚན་ཉིད་ཀྱི་ཕྱིར་ཚིག་གི་རྣམ་པར་རྟོག་པར་འབྱུང་ངོ་༎ བློ་གྲོས་ཆེན་པོ་།
 yadi punarmahāmate vāg vikalpādanyā syāt,	དེ་སྟེ་ཚིག་འདི་རྣམ་པར་རྟོག་པ་དང་ཐ་དད་པ་ཞིག་ཡིན་ན་ནི་།
 avikalpahetukī syāt |	རྣམ་པར་རྟོག་པའི་རྒྱུ་ལས་བྱུང་བ་མ་ཡིན་པར་འགྱུར་རོ་༎
 athānanyā syāt, arthābhivyaktitvādvāg na kuryāt |	དེ་སྟེ་གཅིག་པ་ཞིག་ཡིན་ན་ནི་ཚིག་དེ་དོན་གསལ་བར་བྱེད་པར་ཡང་མི་འགྱུར་ན་།
 sā ca kurute |	དེ་ནི་བྱེད་དེ་།
 tasmānnānyā nānanyā || (vaidya 37)	དེ་བས་ན་ཐ་དད་པའང་མ་ཡིན་། གཅིག་པའང་མ་ཡིན་ནོ་༎
 punarapi mahāmatirāha - kiṃ punarbhagavan vacanameva paramārthaḥ,	ཡང་བློ་གྲོས་ཆེན་པོས་གསོལ་པ་། བཅོམ་ལྡན་འདས་། ཚིག་ཉིད་དོན་དམ་པ་ལགས་སམ་།
 uta yadvacanenābhilapyate sa paramārthaḥ?	འོན་ཏེ་ཚིག་གིས་གང་བརྗོད་པར་བགྱི་བ་དེ་དོན་དམ་པ་ལགས་སམ་ཅི་ལགས་།
 bhagavānāha - na mahāmate vacanaṃ paramārthaḥ,	བཅོམ་ལྡན་འདས་ཀྱིས་བཀའ་སྩལ་པ་། བློ་གྲོས་ཆེན་པོ་། ཚིག་ཀྱང་དོན་དམ་པ་མ་ཡིན་ནོ་༎
 na ca yadvacanenābhilapyate sa paramārthaḥ |	ཚིག་གིས་གང་བརྗོད་པར་བྱ་བའང་དོན་དམ་པ་མ་ཡིན་ཏེ་།
 tatkasya hetoḥ?	དེ་ཅིའི་ཕྱིར་ཞེ་ན་། འདི་ལྟ་སྟེ་།
 yaduta paramārthāryasukhābhilāpapraveśitvātparamārthasya vacanaṃ na paramārthaḥ |	འཕགས་པའི་ཡེ་ཤེས་དོན་དམ་པའི་བདེན་པ་བརྗོད་པས་དོན་དམ་པ་ལ་འཇུག་པའི་ཕྱིར་ཚིག་ཉིད་ནི་དོན་དམ་པ་མ་ཡིན་ནོ་༎
 paramārthasyu mahāmate āryajñānapratyātmagatigamyo na vāgvikalpabuddhigocaraḥ |	བློ་གྲོས་ཆེན་པོ་། དོན་དམ་པ་ནི་འཕགས་༄༡༤༢བ་པ་སོ་སོ་རང་གིས་རིག་པའི་ཡེ་ཤེས་ཀྱིས་རྟོགས་པར་བྱ་བ་ཡིན་ཏེ་། ཚིག་གི་རྣམ་པར་རྟོག་པའི་བློའི་སྤྱོད་ཡུལ་མ་ཡིན་ནོ་༎
 tena vikalpo nodbhāvayati paramārtham |	དེ་བས་ན་རྣམ་པར་རྟོག་པ་ནི་དོན་དམ་པ་བརྗོད་པར་མི་བྱེད་དོ་༎
 vacanaṃ punarmahāmate utpannapradhvaṃsi capalaṃ parasparapratyayahetusamutpannam |	བློ་གྲོས་ཆེན་པོ་། ཚིག་ནི་སྐྱེས་ནས་འཇིག་ཅིང་མི་བརྟན་པ་། ཕན་ཚུན་གྱི་རྒྱུ་དང་རྐྱེན་ལས་བྱུང་ངོ་༎
 yacca mahāmate parasparapratyayahetusamutpannaṃ tatparamārthaṃ nodbhāvayati |	བློ་གྲོས་ཆེན་པོ་། གང་ཕན་ཚུན་གྱི་རྒྱུ་དང་རྐྱེན་ལས་བྱུང་བ་དེ་ནི་དོན་དམ་པར་བརྗོད་པར་མི་བྱེད་དོ་༎ བློ་གྲོས་ཆེན་པོ་།
 svaparalakṣaṇābhāvānmahāmate bāhyalakṣaṇaṃ nodbhāvayati ||	བདག་དང་གཞན་གྱི་མཚན་ཉིད་མེད་པའི་ཕྱིར་ཚིག་ནི་མཚན་ཉིད་བརྗོད་པར་མི་བྱེད་དོ་༎
 punaraparaṃ mahāmate svacittadṛśyamātrānusāritvādvividhavicitralakṣaṇabāhyabhāvābhāvādvāgvikalpaḥ paramārthaṃ na vikalpayati |	བློ་གྲོས་ཆེན་པོ་། གཞན་ཡང་རང་གི་སེམས་སྣང་བ་ཙམ་གྱི་རྗེས་སུ་འབྲང་བ་དང་། ཕྱི་རོལ་གྱི་དངོས་པོ་རྣམ་པ་ཐ་དད་པ་སྣ་ཚོགས་ཀྱི་མཚན་ཉིད་མེད་པས་རྣམ་པར་རྟོག་པ་ནི་དོན་དམ་པ་ལ་མི་རྟོག་གོ་། དེ་བས་ན་།
 tasmāttarhi mahāmate vāgvicitravikalparahitena te bhavitavyam ||	བློ་གྲོས་ཆེན་པོ་། ཁྱོད་ཀྱིས་ཚིག་རྣམ་པ་སྣ་ཚོགས་ཀྱི་རྣམ་པར་རྟོག་པ་དང་བྲལ་བར་བྱའོ་༎
 tatredamucyate -	དེ་ལ་འདི་སྐད་ཅེས་བྱ་སྟེ་༎
 sarvabhāvo 'svabhāvo hi sadvacanaṃ tathāpyasat |	དངོས་པོ་ཀུན་གྱི་རང་བཞིན་མེད་༎ ཚིག་ཀྱང་དེ་བཞིན་མེད་པ་སྟེ་༎
 śūnyatāśūnyatārthaṃ vā bālo 'paśyan vidhāvati || lank_2|143 ||	སྟོང་པ་ཉིད་དམ་སྟོང་ཉིད་དོན་༎ བྱིས་པས་མ་མཐོང་རྣམ་པར་རྒྱུག་།
 sarvabhāvasvabhāvā ca vacanamapi nṛṇām |	དངོས་པོ་ཐམས་ཅད་རང་བཞིན་མེད་༎ མི་ཡི་ཚིག་ཀྱང་བརྟགས་པ་སྟེ་༎
 kalpanā sāpi nāsti nirvāṇaṃ svapnatulyam |	དེ་ཡང་ཡོད་པ་མ་ཡིན་ནོ་༎ སྙིང་པོ་རྨི་ལམ་སྤྲུལ་འདྲ་བར་༎
 bhavaṃ parīkṣeta na saṃsāre nāpi nirvāyāt || lank_2|144 ||	ཡོངས་སུ་བརྟགས་པར་བྱས་པ་ནི་༎ མི་འཁོར་མྱ་ངན་འདའ་མི་བྱ་༎
 rājā śreṣṭhī yathā putrān vicitrairmṛnmayairmṛgaiḥ |	ཇི་ལྟར་རྒྱལ་པོ་ཚོང་དཔོན་དག་། འཇི་བའི་རི་དབ༹གས་སྣ་ཚོགས་ཀྱིས་༎ བུ་རྣམས་༄༡༤༣ཨ་༌༎
 pralobhya krīḍayitvā ca bhūtān dadyāttato mṛgān || lank_2|145 ||	བྲིད་དེ་རྩེར་བཅུག་ཅིང་༎ དེ་ནས་རི་དབ༹གས་དངོས་བྱིན་པ་༎
 tathāhaṃ lakṣaṇaiścitrairdharmāṇāṃ pratibimbakaiḥ |	དེ་བཞིན་ངས་ཀྱང་ཆོས་རྣམས་ཀྱི་༎ མཚན་ཉིད་སྣ་ཚོགས་གཟུགས་བརྙན་གྱིས་༎
 pratyātmavedyāṃ putrebhyo bhūtakoṭiṃ vadāmyaham || lank_2|146 ||	སོ་སོ་རང་རིག་ཡང་དག་མཐའ༎ བུ་རྣམས་ལ་ནི་ངས་བཤད་དོ་༎
