skt	tib
 ru ru ru ru | 4 |	དུ་དུ་དུ་དུ།
 phu phu phu phu | 4 | svāhā ||	དྷུ་དྷུ་དྷུ་དྷུ་སབ༹འཧའ་།
 imāni mahāmate mantrapadāni laṅkāvatāre mahāyānasūtre |	བློ་གྲོས་ཆེན་པོ་། ལངཀར་གཤེགས་པའི་མདོའི་སྔགས་ཀྱི་ཚིག་ནི་འདི་དག་ཡིན་ནོ་༎
 yaḥ kaścinmahāmate kulaputro vā kuladuhitā vā imāni mantrapadānyudgrahīṣyati dhārayiṣyati vācayiṣyati paryavāpsyati,	རིགས་ཀྱི་བུའམ་། རིགས་ཀྱི་བུ་མོ་གང་ལ་ལ་སྔགས་ཀྱི་ཚིག་འདི་དག་འཛིན་པ་དང་། འཆང་བ་དང་། ཀློག་པ་དང་། ཀུན་ཆུབ་པར་བྱེད་པར་འགྱུར་བ་དེ་ལ་སུས་ཀྱང་སྐབས་མི་རྙེད་དེ་། ལྷའམ་། ལྷ་མོའམ་།
 na tasya kaścidavatāraṃ lapsyate devo vā devī vā nāgo vā nāgī vā yakṣo vā yakṣī vā	ཀླུའམ་། ཀླུ་མོའམ་། གནོད་སྦྱིན་ནམ་། གནོད་སྦྱིན་མོའམ་། ལྷ་མ་ཡིན་ནམ་། ལྷ་མ་ཡིན་མོའམ་། ནམ་མཁའ་ལྡིང་ངམ་། ནམ་མཁའ་ལྡིང་མོའམ་། མིའམ་ཅིའམ་། མིའམ་ཅི་མོའམ་།
 asuro vā asurī vā garuḍo vā garuḍī vā kinnaro vā kinnarī vā mahorago vā mahoragī	ལྟོ་འཕྱེ་ཆེན་པོའམ་། ལྟོ་འཕྱེ་ཆེན་པོ་མོའམ་། དྲི་ཟའམ་།
 vā gandharvo vā gandharvī vā bhūto vā bhūtī vā kumbhāṇḍo vā kumbhāṇḍī vā piśāco vā	དྲི་ཟ་མོའམ་། འབྱུང་པོའམ་། འབྱུང་པོ་མོའམ་། གྲུལ་བུམ་མམ་། གྲུལ་བུམ་མོའམ་། ཤ་ཟའམ་། ཤ་ཟ་མོའམ་། གནོན་པོའམ་། གནོད་པོ་མོའམ་། བརྗེད་བྱེད་དམ་།
 piśācī vā ostārako vā austārakī vā apasmāro vā apasmārī vā rākṣaso vā rākṣasī vā	བརྗེད་བྱེད་མོའམ་། ༄༢༥༤ཨ་༌༎ སྲིན་པོའམ་། སྲིན་མོའམ་། ཕྲ་མེན་ཕའམ་། ཕྲ་མེན་མའམ་། མདངས་འཕྲོག་བའམ་།
 ḍāko vā ḍākinī vā ojohāro vā ojohārī vā kaṭapūtano vā kaṭapūtanī vā amanuṣyo vā amanuṣyī vā,	མདངས་འཕྲོག་མའམ་། ལུས་སྲུལ་པོའམ་། ལུས་སྲུལ་མོའམ་། མིའམ་།
 sarve te 'vatāraṃ na lapsyate |	མི་མ་ཡིན་པ་དེ་ཐམས་ཅད་ཀྱིས་ཀྱང་དེ་ལ་གླགས་མི་རྙེད་དེ་།
 sa cedviṣamagraho bhaviṣyati, so 'syāṣṭottaraśatābhimantritena rodan krandanto kaṃ diśaṃ dṛṣṭvā yāsyati ||	གལ་ཏེ་གདོན་དྲག་པོ་ཞིག་བྱུང་ན་དེ་ལ་བརྒྱ་རྩ་བརྒྱད་དུ་བསྔགས་པས་དུ་འབོད་ཅིང་ཕྱོགས་གཅིག་ཏུ་བལྟ་སྟེ་། འགྲོ་བར་འགྱུར་རོ་༎
 punaraparāṇi mahāmate mantrapadāni bhāṣiṣye |	བློ་གྲོས་ཆེན་པོ་། ཡང་སྔགས་ཀྱི་ཚིག་གཞན་དག་ཀྱང་བཤད་པར་བྱའོ་༎
 tadyathā - padme padmadeve |	འདི་ལྟ་སྟེ་། པད་མེ་། པད་མ་དེ་བེ་།
 hine hini hine |	ཧེ་ནེ་ཧི་ན་ཧི་ནེ་།
 cu cule culu cule |	ཙུ་ལེ་ཙུ་ལའ་ཙུ་ལེ་།
 phale phula phule |	ཧུ་ལེ་ཧུ་ལ་ཧུ་ལེ་།
 yule ghule yula yule |	ཡུ་ལེ་ཡུ་ལ་ཡུ་ལེ་། པ་ལེ་པ་ལ་པ་ལེ་། མུན་ཙེ་།
 ghule ghula ghule |	ཚིན་དྷེ་།
 pale pala pale |	བྷིན་དྷེ་།
 muñce 3 |	བྷན་ཚེ་།
 chinde bhinde bhañje marde pramarde dinakare svāhā ||	མརྡེ་པྲ་མ་རྡེ་དི་ན་ཀ་རེ་སབ༹འཧའ་།
 imāni mahāmate mantrapadāni yaḥ kaścitkulaputro vā kuladuhitā vā udgrahīṣyati dhārayiṣyati vācayiṣyati paryavāpsyati,	བློ་གྲོས་ཆེན་པོ་། རིགས་ཀྱི་བུའམ་རིགས་ཀྱི་བུ་མོ་གང་ལ་ལ་སྔགས་ཀྱི་ཚིག་འདི་དག་འཛིན་པ་དང་། འཆང་བ་དང་། ཀློག་པ་དང་། ཀུན་ཆུབ་པར་བྱེད་ན་། ལྷའམ་། ལྷ་མོའམ་།
 tasya na kaścidavatāraṃ lapsyate devo vā devī vā nāgo vā nāgī vā yakṣo vā yakṣī vā	ཀླུའམ་། ཀླུ་མོའམ་། གནོད་སྦྱིན་ནམ་། གནོད་སྦྱིན་མོའམ་། ལྷ་མ་ཡིན་ནམ་། ལྷ་མ་ཡིན་མོའམ་། ནམ་མཁའ་ལྡིང་ངམ་། ནམ་མཁའ་ལྡིང་མོའམ་། མིའམ་ཅིའམ་། མིའམ་ཅི་མོའམ་།
 asuro vā asurī vā garuḍo vā garuḍī vā kinnaro vā kinnarī vā mahorago vā mahoragī	ལྟོ་འཕྱེ་ཆེན་པོའམ་། ལྟོ་འཕྱེ་ཆེན་པོ་མོའམ་། དྲི་ཟའམ་།
 vā gandharvo vā gandharvī vā bhūto vā bhūtī vā kumbhāṇḍo vā kumbhāṇḍī vā piśāco vā	དྲི་ཟ་མོའམ་། འབྱུང་པོའམ་། འབྱུང་མོའམ་། གྲུལ་བུམ་མམ་། གྲུལ་བུམ་མོའམ་།
 piśācī vā ostārako vā ostārakī vā,	ཤ་ཟའམ་། ༄༢༥༤བ་ཤ་ཟ་མོའམ་། གནོན་པོའམ་། གནོན་མོའམ་། བརྗེད་བྱེད་དམ་།
 apasmāro vā apasmārī vā,	བརྗེད་བྱེད་མོའམ་།
 rākṣaso vā rākṣasī vā,	སྲིན་པོའམ་། སྲིན་མོའམ་། ཕྲ་མེན་ཕའམ་།
 ḍāko vā ḍākinī vā,	ཕྲ་མེན་མའམ་།
 ojoharo vā ojoharī vā,	མདངས་འཕྲོག་ཕའམ་། མདངས་འཕྲོག་མའམ་།
 kaṭapūtano vā kaṭapūtanī vā,	ལུས་སྲུལ་པོའམ་། ལུས་སྲུལ་མོའམ་།
 manuṣyo vā manuṣyī vā,	མིའམ་།
 sarve te 'vatāraṃ na lapsyate |	མི་མ་ཡིན་པ་དེ་དག་ཐམས་ཅད་ཀྱིས་ཀྱང་གླགས་མི་རྙེད་དོ་༎
 ya imāni mantrapadāni paṭhiṣyati,	གསང་སྔགས་ཀྱི་ཚིག་འདི་དག་ཀློག་པར་བྱེད་པ་དེས་ལང་ཀར་གཤེགས་པའི་མདོ་ཐམས་ཅད་བཀླགས་པར་འགྱུར་རོ་༎ 
 tena laṅkāvatārasūtraṃ paṭhitaṃ bhaviṣyati | imāni bhagavatā mantrapadāni bhāṣitāni rākṣasānāṃ nivāraṇārtham ||	སྔགས་ཀྱི་ཚིག་འདི་དག་ནི་བཅོམ་ལྡན་འདས་ཀྱིས་སྲིན་པོ་རྣམས་བཟློག་པའི་ཕྱིར་གསུངས་འགྱུར་རོ་༎ 
 iti laṅkāvatāre dhāraṇīparivarto nāma navamaḥ || start parivarta 10	སོ་༎༎ འཕགས་པ་ལང་ཀར་གཤེགས་པ་། བམ་པོ་བརྒྱད་པ་།
 (vaidya 107) sagāthakam | atha khalu mahāmatirbodhisattvo mahāsattvo bhagavantametadavocat -	དེ་ནས་བཅོམ་ལྡན་འདས་ལ་བྱང་ཆུབ་སེམས་དཔའ་སེམས་དཔའ་ཆེན་པོ་བློ་གྲོས་ཆེན་པོས་འདི་སྐད་ཅེས་གསོལ་ཏོ་༎ 
 utpādabhaṅgarahito lokaḥ khepuṣpasaṃnibhaḥ |	འཇིག་རྟེན་འདི་ནི་སྐྱེ་འཇིག་བྲལ་༎ ནམ་མཁའི་མེ་ཏོག་རབ་ཏུ་འདྲ་༎
 sadasannopalabdho 'yaṃ prajñayā kṛpayā ca te || lank_10|1 ||	ཁྱོད་ཀྱི་ཤེས་རབ་ཐུགས་རྗེ་ཡིས་༎
 śāśvatocchedavarjyaśca lokaḥ svapnopamaḥ sadā |	ཡོད་དང་མེད་པར་མ་དམིགས་སོ༏་༏འཇིག་རྟེན་རྟག་དང་ཆད་སྤངས་པ་༎ ཁོར་ཟུག་རྨི་ལམ་འདྲ་བ་སྟེ་༎
 sadasannopalabdho 'yaṃ prajñayā kṛpayā ca te || lank_10|2 ||	ཁྱོད་ཀྱི་ཤེས་རབ་ཐུགས་རྗེ་ཡིས་༎ ཡོང་དང་མེད་པར་མ་དམིགས་སོ་༎
 māyopamāḥ sarvadharmāścittavijñānavarjitāḥ |	ཆོས་རྣམས་ཐམས་ཅད་སྒྱུ་མ་བཞིན་༎ སེམས་དང་རྣམ་པར་ཤེས་པ་སྤངས་༎
 sadasannopalabdhāste prajñayā kṛpayā ca te || lank_10|3 ||	ཁྱོད་ཀྱི་ཤེས་རབ་ཐུགས་རྗེ་ཡིས་༎ ཁྱོད་ཀྱིས་ཡོད་དང་མེད་མ་དམིགས་༎
 dharmapudgalanairātmyaṃ kleśajñeyaṃ ca te sadā |	ཆོས་དང་གང་ཟག་བདག་མེད་དང་༎ ཁྱོད་ཀྱི་ཉོན་༄༢༥༥ཨ་༌༎ མོངས་ཤེས་བྱའི་རྣམས་༎
 viśuddhamanimittena prajñayā kṛpayā ca te || lank_10|4 ||	ཁྱོད་ཀྱི་ཤེས་རབ་ཐུགས་རྗེ་དང་༎ མཚན་མ་མེད་པས་རྟག་ཏུ་དག་།
 na nirvāsi na nirvāṇe na nirvāṇaṃ tvayi sthitam |	མྱ་ངན་མི་འདའ་འདའ་ལ་མིན་༎ ཁྱོད་ལ་མྱ་ངན་འདའ་མི་གནས་༎ བློ་དང་རིག་པར་བགྱི་དང་བྲལ་༎
 buddhiboddhavyarahitaṃ sadasatpakṣavarjitam || lank_10|5 ||	ཡོད་དང་མེད་པའི་ཕྱོགས་ཀྱང་སྤངས་༎ དེ་ལྟར་སྐྱེ་འཇིག་སྤངས་པ་ཡི་༎
 ye paśyanti muniṃ śāntamevamutpattivarjitam |	ཐུབ་པ་ཞི་བ་སུས་མཐོང་བ་༎ དེ་དག་འདི་དང་སླད་མར་ཡང་༎
 te bhavantyanupādānā ihāmutra nirañjanāḥ || lank_10|6 ||	ཆགས་མེད་ཉེ་ལེན་མེད་པར་འགྱུར་༎ སེམས་སླུ་བ་ཡི་སྨིག་རྒྱུ་བ་༎
 mṛgatṛṣṇā yathā grīṣme spandate cittamohanī |	ཇི་ལྟར་དཔྱིད་ཀ་ག-ཡོ་བ་ན་༎
 mṛgā gṛhṇanti pānīyaṃ vastu tasya na vidyate || lank_10|7 ||	རི་དབ༹གས་རྣམས་ནི་ཆུར་འཛིན་ཏེ་༎ དེ་ལ་དངོས་པོ་ཡོད་པ་མིན་༎
 evaṃ vijñānabījo 'yaṃ spandate dṛṣṭigocare |	དེ་བཞིན་རྣམ་ཤེས་ས་བོན་ཡང་༎ ལྟ་བའི་ཡུལ་ལ་རབ་ཏུ་ག-ཡོ་༎
 bālā gṛhṇanti jāyantaṃ timiraṃ taimirā yathā || lank_10|8 ||	བྱིས་པ་རྣམས་ནི་སྐྱེ་བར་འཛིན་༎ རབ་རིབ་ཅན་གྱི་རབ་རིབ་བཞིན་༎
 dhyātā dhyānaṃ ca dhyeyaṃ ca prahāṇaṃ satyadarśanam |	བསམ་གཏན་བསམ་བྱ་བསམ་གཏན་པ་༎ སྤོང་དང་བདེན་པ་མཐོང་བ་དང་༎ དེ་དག་རྟོག་པ་ཙམ་ཡིན་པར་༎
 kalpanāmātramevedaṃ yo budhyati sa mucyati || lank_10|9 ||	གང་གིས་རྟོགས་པ་དེ་འགྲོལ་ལོ་༎
 asārakā ime dharmā manyanāyāḥ samutthitāḥ |	ཆོས་འདི་དག་ནི་སྙིང་པོ་མེད་༎ རློམ་སེམས་ལས་ནི་བྱུང་བ་ཡིན་༎ གང་གིས་སྟོང་ཞེས་སྙེམས་པ་ཡི་༎
 sāpyatra manyanā śūnyā yayā śūnyeti manyate || lank_10|10 ||	སྙེམས་པ་དེ་ཡང་སྟོང་པའོ་༎
 jalavṛkṣacchāyāsadṛśāḥ skandha vijñānapañcamāḥ |	ཕུང་པོ་རྣམ་པར་ཤེས་དང་ལྔ་༎ ཆུ་ལ་ཤིང་གི་གྲིབ་མ་བཞིན་༎
 māyāsvapnopamaṃ dṛśyaṃ vijñaptyā na vikalpayet || lank_10|11 ||	སྣང་བ་སྒྱུ་མ་རྨི་ལམ་འདྲ་༎ རྣམ་པར་རིག་པར་མ་རྟོག་ཅིག་།
 māyāvetālayantrābhaṃ svapnaṃ vidyuddhanaṃ sadā |	སྒྱུ་མ་རོ་ལངས་འཁྲུལ་འཁོར་དང་༎ རྨི་ལམ་གློག་དང་སྤྲིན་ལྟ་བུར་༎ ནམ་ཡང་རྒྱུད་གསུམ་རྣམ་འཆད་པར་༎
 trisaṃtativyavacchinnaṃ jagatpaśyan vimucyate || lank_10|12 ||	སྐྱེ་བོས་མཐོང་ན་རྣམ་པར་འཐར་༎
 ayoniśo vikalpena vijñānaṃ saṃpravartate |	༄༢༥༥བ་ཚུལ་བཞིན་མ་ཡིན་རྣམ་རྟོག་པས་༎
 aṣṭaghā navadhā citraṃ taraṃgāṇi mahodadhau || lank_10|13 || (vaidya 108)	སྣ་ཚོགས་རྣམ་པ་བརྒྱད་དམ་དགུར་༎ རྣམ་པར་ཤེས་པ་འཇུག་འགྱུར་ཏེ་༎ ཇི་ལྟར་རྒྱ་མཚོའི་རླབས་བཞིན་ནོ་༎
 vāsanairbṛṃhitaṃ nityaṃ buddhyā mūlaṃ sthirāśrayam |	རྟག་ཏུ་བག་ཆགས་དག་གིས་བསྐྱེད་༎ རྩ་བ་ཟུག་ཅིང་གནས་ཀྱང་བརྟན་༎
 bhramate gocare cittamayaskānte yathāyasam || lank_10|14 ||	སྤྱོད་ཡུལ་དག་ཏུ་སེམས་འཁྱམ་སྟེ་༎ ཁབ་ལོང་གིས་ནི་ལྕགས་བཞིན་ནོ་༎
 āśritā sarvabhūteṣu gotrabhūstarkavarjitā |	སེམས་ཅན་ཀུན་ལ་གནས་པ་སྟེ་༎ རིགས་ཀྱིས་ནི་རྟོག་པ་སྤངས་༎
 nivartate kriyāmuktā jñānajñeyavivarjitā || lank_10|15 ||	ཤེས་རབ་ཤེས་བྱ་རྣམ་སྤངས་ཤིང་༎ བྱེད་ལས་གྲོལ་ན་རྣམ་པར་ལྡོག་།
 māyopamaṃ samādhiṃ ca daśabhūmivinirgatam |	ས་བཅུ་ལས་ནི་རྣམ་བྱུང་བ་༎
 paśyatha cittarājānaṃ saṃjñāvijñānavarjitam || lank_10|16 ||	སྒྱུ་མ་ལྟ་བུའི་ཏིང་འཛིན་དང་༎ འདུ་ཤེས་རྣམ་ཤེས་སྤངས་པ་ཡི་༎
 parāvṛttaṃ yadā cittaṃ tadā tiṣṭhati śāśvatam |	སེམས་ཀྱི་རྒྱལ་པོ་བལྟ་བར་བྱ༏་༏སེམས་ནི་ནམ་ཞིག་གྱུར་པ་ན་༎
 vimāne padmasaṃkāśe māyāgocarasaṃbhave || lank_10|17 ||	པདམོ་འདྲ་བའི་གཞལ་མེད་ཁང་༎ སྒྱུ་མའི་སྤྱོད་ཡུལ་འབྱུང་བ་ན་༎ དེ་ཡི་ཚེ་ན་ཐེར་ཟུག་གནས་༎
 tasmin pratiṣṭhito bhavatyanābhogacariṃ gataḥ |	དེ་ན་གནས་པར་གྱུར་ནས་ནི་༎ ལྷུན་གྱིས་གྲུབ་པའི་སྤྱོད་རིག་པས་༎
 karoti sattvakāryāṇi viśvarūpāmaṇiryathā || lank_10|18 ||	སྣ་ཚོགས་གཟུགས་ཀྱི་ནོར་བུ་བཞིན་༎ སེམས་ཅན་ཀུན་གྱི་དོན་བྱེད་དོ་༎
 saṃskṛtāsaṃskṛtaṃ nāsti anyatra hi vikalpanāt |	རྣམ་པར་རྟོག་ལས་གུད་ན་ནི་༎ འདུས་བྱས་འདུས་མ་བྱས་མེད་ན་༎ མོ་གཤམ་རྨི་ལམ་བུ་བཞིན་ནོ་༎
 bālā gṛhṇanti dhiṅbhūḍhā vandhyāḥ svapne yathā sutam || lank_10|19 ||	བྱིས་པ་ཕྱོགས་བསླད་འཛིན་པར་བྱེད་༎
 naiḥsvābhāvyamanutpādo pudgalaḥ skandha saṃtatiḥ |	རང་བཞིན་མེད་དང་མི་སྐྱེ་དང་༎ གང་ཟག་དང་ནི་ཕུང་པོའི་རྒྱུད་༎
 pratyayā dhātavo jñeyā śūnyatā ca bhavābhavam || lank_10|20 ||	རྐྱེན་དང་ཁམས་དང་ཤེས་བྱ་དང་༎ སྟོང་པ་སྲིད་དང་མི་སྲིད་རྣམས་༎
 upāyadeśanā mahyaṃ nāhaṃ deśemi lakṣaṇam |	ངས་ནི་ཐབས་སུ་བཤད་པ་སྟེ་༎ ང་ནི་མཚན་ཉིད་མི་འཆད་ན་༎
 bālā gṛhṇanti bhāvena lakṣaṇaṃ lakṣyameva ca || lank_10|21 ||	མཚན་གྱི་གཞི་དང་མཚན་ཉིད་དུ་༎ བྱིས་པ་རྣམས་ནི་དངོས་པོར་འཛིན་༎ ཐམས་ཅད་མཁྱེན་༄༢༥༦ཨ་༌༎
 sarvasya vettā na ca sarvavettā sarvasya madhye na ca sarvamasti |	ཀྱང་ཐམས་ཅད་མཁྱེན་པ་མིན་༎ ཐམས་ཅད་ཀྱི་ཡང་དབུས་ལ་ཐམས་ཅད་མེད་༎
 bālā vikalpenti budhaśca loko na cāpi budhyāmi na ca bodhayāmi || lank_10|22 ||	བྱིས་པ་འཇིག་རྟེན་སངས་རྒྱས་འདི་ཞེས་རྟོག་། ཤེས་པར་མི་བྱེད་སྟོན་པར་ཡང་མི་བྱེད་༎
 prajñaptirnāmamātreyaṃ lakṣaṇena na vidyate |	བཏགས་པ་འདི་ནི་མིང་ཙམ་སྟེ་༎ མཚན་ཉིད་ཀྱིས་ནི་མེད་པའོ་༎
 skandhāḥ keśoṇḍukākārā yatra bālairvikalpyate || lank_10|23 ||	གང་ལ་དེ་ནི་རྣམ་བརྟག་པའི་༎ ཕུང་པོ་སྐྲ་ཤད་འཛིངས་པ་འདྲ་༎
 nābhūtvā jāyate kiṃcitpratyayairna vinaśyate |	མེད་ལས་འབྱུང་བ་ཅུང་ཟད་མེད་༎ རྐྱེན་རྣམས་ཀྱིས་ནི་འཇིག་མི་འགྱུར་༎
 vandhyāsutākāśapuṣpaṃ yadā paśyati saṃskṛtam |	ནམ་མཁའི་མེ་ཏོག་མོ་གཤམ་བུ་༎ དེ་ལྟར་འདུས་བྱས་ནམ་མཐོང་བ་༎
 tadā grāhaśca grāhyaṃ ca bhrāntiṃ dṛṣṭvā nivartate || lank_10|24 ||	དེ་ཚེ་གཟུང་དང་འཛིན་པ་ནི་༎ ནོར་བ་མཐོང་ནས་ལྡོག་པར་འགྱུར་༎
 nāhaṃ nirvāmi bhāvena kriyayā lakṣaṇena ca |	མཚན་ཉིད་དང་ནི་བྱ་བ་དང་༎ དངོས་པོར་མྱ་ངན་ཡི་མི་འདའ༎
 vikalpahetuvijñānanivṛtternirvṛto hyaham | (na vinaśyati lakṣaṇaṃ yatra bālairvikalpyate) || lank_10|25 ||	རྣམ་རྟོག་རྣམ་ཤེས་བཟློག་པ་ན་༎ ང་ནི་མྱ་ངན་འདས་པའོ་༎
 yathā kṣīṇe mahatyoghe taraṃgāṇāmasaṃbhavaḥ |	ཇི་ལྟར་ཆུ་ཆེན་ཟད་པའི་ཚེ་༎ རླབས་རྣམས་འབྱུང་བར་མི་འགྱུར་བ་༎
 tathā vijñānavaicitryaṃ niruddhaṃ na pravartate || lank_10|26 || (vaidya 109)	དེ་བཞིན་འགགས་པར་གྱུར་ན་ནི་༎ རྣམ་ཤེས་སྣ་ཚོགས་མི་འབྱུང་ངོ་༎
 śūnyāśca niḥsvabhāvāśca māyopamā ajātakāḥ |	སྟོང་པ་ངོ་བོ་ཉིད་མེད་པ་༎ སྒྱུ་མ་བཞིན་དུ་མ་སྐྱེས་རྣམས་༎
 sadasanto na vidyante bhāvāḥ svapnopamā ime || lank_10|27 ||	ཡོད་དང་མེད་པ་མ་ཡིན་ཏེ་༎ དངོས་པོ་འདི་དག་རྨི་ལམ་བཞིན་༎
 svabhāvamekaṃ deśemi tarkavijñaptivarjitam |	ང་ནི་རང་བཞིན་གཅིག་འཆད་པ་༎ རྟོག་གེ་མཚན་མ་རིག་སྤངས་པ་༎
 āryāṇāṃ gocaraṃ divyaṃ svabhāvadvayavarjitam || lank_10|28 || khadyotā iva mattasya yathā citrā na santi ca | dṛśyante dhātusaṃkṣobhādevaṃ lokaḥ svabhāvataḥ || lank_10|29 || tṛṇakāṣṭhakaṭhalleṣu yathā māyā virājate | na cāsau vidyate māyā evaṃ dharmāḥ svabhāvataḥ || lank_10|30 ||	འཕགས་པའི་ལྷ་ཡི་སྤྱོད་ཡུལ་ཏེ༏་༏རང་བཞིན་རྣམ་གཉིས་སྤངས་པའོ་༎
 na grāhako na ca grāhyaṃ na bandhyo na ca bandhanam |	འཛིན་པ་མེད་ཅིང་གཟུང་བ་མེད་༎ ཐར་པ་མེད་ཅིང་འཆིང་བ་མེད་༎
 māyāmarīcisadṛśaṃ svapnākhyaṃ timiraṃ yathā || lank_10|31 ||	སྒྱུ་མ་དང་ནི་སྨིག་རྒྱུ་འདྲ་༎ རྨི་ལམ་རབ་རིབ་ཇི་བཞིན་དུ་༎
 yadā paśyati tattvārthī nirvikalpo nirañjanaḥ |	༄༢༥༦བ་གང་ཚེ་ཡང་དག་དོན་འདོད་པ་༎ རྣམ་པར་མི་རྟོག་ཆགས་མེད་པས་༎ མཐོང་བ་དེ་ལ་རྣལ་འབྱོར་ཞུགས་༎
 tadā yogaṃ samāpanno drakṣyate māṃ na saṃśayaḥ || lank_10|32 ||	ཐེ་ཚོམ་མེད་པར་ང་ཡང་མཐོང་༎
 na hyatra kācidvijñaptirnabhe yadvanmarīcayaḥ |	དེ་ལ་རྣམ་རིག་གང་ཡང་མེད་༎ ཇི་ལྟར་ནམ་མཁའི་སྨིག་རྒྱུ་བཞིན་༎
 evaṃ dharmān vijānanto na kiṃcitpratijānati || lank_10|33 ||	ཆོས་རྣམས་དེ་ལྟར་ཤེས་ན་ནི་༎ ཅི་ཡང་ཤེས་པ་མེད་པའོ་༎ ཁམས་རྣམས་རབ་ཏུ་འཁྲུགས་པའི་ཕྱིར་༎ སྲིན་བུ་མེ་ཁྱེར་ལྟ་བུ་དག་། མེད་ཀྱང་མྱོས་ལ་སྣ་ཚོགས་སྣང་༎ དེ་བཞིན་འཇིག་རྟེན་རང་བཞིན་ནི་༎ རཙབ༹་དང་ཤིང་དང་གྱོ་མོ་ལས་༎ སྒྱུ་མ་རྣམ་པར་མཛེས་གྱུར་ཀྱང་༎ སྒྱུ་མ་དེ་ནི་མེད་པ་སྟེ་༎ ཆོས་ཀྱི་རང་བཞིན་དེ་བཞིན་ནོ་༎
 sadasataḥ pratyayeṣu dharmāṇāṃ nāsti saṃbhavaḥ |	རྐྱེན་རྣམས་ཡོད་དམ་མེད་པ་ལས་༎ ཆོས་རྣམས་འབྱུང་བ་མེད་པ་སྟེ་༎
 bhrāntaṃ traidhātuke cittaṃ vicitraṃ khyāyate yataḥ || lank_10|34 ||	ཁམས་གསུམ་ན་ནི་ནོར་བ་ཡི་༎ དེ་ཕྱིར་སྣ་ཚོགས་སྣང་བར་འགྱུར་༎ འཇིག་རྟེན་རྨི་ལམ་ངོ་བོ་ཉིད་མཚུངས་ཏེ་༎
 svapnaṃ ca lokaṃ ca samasvabhāvaṃ rūpāṇi citrāṇi hi tatra cāpi |	དེ་ན་སྣ་ཚོགས་ཀྱི་ཡང་གཟུགས་རྣམས་སྣང་༎
 dṛśyanti bhogaṃ spariśaṃ samānaṃ dehāntagaṃ lokaguruṃ kriyāṃ ca || lank_10|35 ||	རེག་དང་ལོངས་སྤྱོད་ལུས་ཀྱི་མཐར་འགྲོ་དང་༎ འཇིག་རྟེན་གཙོ་དང་བྱེད་པ་རྣམས་མཚུངས་སོ་༎
 cittaṃ hi traidhātukayoniretadbhrāntaṃ hi cittamihamutra dṛśyate |	སེམས་འདི་ཁམས་གསུམ་སྐྱེ་གནས་གྱུར་པ་ཡིན་༎ སེམས་འཁྲུལ་འདི་དང་ཕ་རོལ་སྣང་བའོ་༎ འཇིག་རྟེན་མེད་ཕྱིར་དེ་ལ་བརྟག་མི་བྱ་༎
