skt	tib
 svabhāvato 'sattve 'pi saṃvṛtimadhikṛtyāha- tenocyate cittadhāreti iti |	རང་བཞིན་མེད་དུ་ཟིན་ཀྱང་ཀུན་རྫོབ་ལ་བརྟེན་ནས་གསུངས་ཏེ་། དེ་ཉིད་ཀྱི་ཕྱིར་སེམས་ཀྱི་རྒྱུན་ཞེས་བྱའོ་ཞེས་གསུངས་སོ་༎
 anyathā paramārthataḥ sarvavāggocarātītatvānna vaktuṃ śakṣyata ityabhiprāyaḥ |	དེ་ལྟ་མ་ཡིན་པ་དོན་དམ་པར་ནི་བརྗོད་པའི་སྤྱོད་ཡུལ་ཐམས་ཅད་ལས་འདས་པའི་ཕྱིར་བརྗོད་པར་མི་འགྱུར་རོ་སྙམ་དུ་དགོངས་པའོ་༎
 cittadhāretyupalakṣaṇam |	སེམས་ཀྱི་རྒྱུན་ཞེས་སྨོས་པ་ནི་མཚོན་པ་སྟེ་།
 māṃsacakṣurādīnyapi cakṣuḥsvabhāvarahitānyeva uktānīti kathanaṃ prakṛtaṃ sākṣānnoktam |	ཤའི་སྤྱན་ལ་སོགས་པ་ཡང་སྤྱན་གྱི་རང་བཞིན་མེད་པ་ཉིད་དུ་གསུངས་སོ་ཞེས་བརྗོད་པར་བྱ་བའི་སྐབས་ཡིན་ཏེ་། མངོན་སུམ་གསུངས་སོ་༎
 atra kathaṃ cittaṃ pragrahītavyamiti tadabhidhātumāha tatkasya hetoḥ? iti |	འདི་ལ་ཇི་ལྟར་སེམས་རབ་ཏུ་གཟུང་བར་བྱ་བ་དེ་བསྟན་པའི་ཕྱིར་དེ་ཅིའི་སླད་དུ་ཞེས་བྱ་བ་དེ་ཞུས་ཏེ་།
 adhāretyanena saha yojanīyam |	རྒྱུན་མེད་ཅེས་བྱ་བ་དང་སྦྱར་རོ་༎
 atītādīnāṃ cittānāṃ paramārthato 'nutpannatvād anupalambhaḥ |	འདས་པ་ལ་སོགས་པའི་༄༢༥༢ཨ་༌་༎ སེམས་ནི་དོན་དམ་པར་མ་སྐྱེས་པའི་ཕྱིར་མི་དམིགས་ཀྱི་།
 sattve 'pi grahaṇānupapattyā nānupalambhaḥ |	ཡོད་ཀྱང་འཛིན་པར་མི་འཐད་པས་མི་དམིགས་པ་ནི་མ་ཡིན་ནོ་༎
 tathā sati acittadhārādeśanamapi na bhavet,	དེ་ལྟ་ན་ནི་སེམས་ཀྱི་རྒྱུན་མེད་པར་བསྟན་པར་མི་འགྱུར་ཏེ་།
 na cānupalambhamātreṇa bhāvānāṃ niḥsvabhāvatvaṃ syāt |	མི་དམིགས་པ་ཙམ་གྱིས་ནི་དངོས་པོ་རྣམས་ཀྱི་རང་བཞིན་མེད་པར་མི་འགྱུར་རོ་༎
 yathā traikālikacittasya paramārthato 'bhāvastathā pūrvamuktaṃ vakṣyate ca |	ཇི་ལྟར་དུས་གསུམ་གྱི་སེམས་དོན་དམ་པར་མེད་པ་དེ་ལྟར་ནི་སྔར་ཡང་བཤད་དེ་། སྟོན་པར་ཡང་འགྱུར་རོ་༎
 cittoktirūpalakṣaṇam,	སེམས་སྨོས་པ་ནི་མཚོན་པ་སྟེ་།
 tato 'tītādimāṃsacakṣurādīnyapyanupalabdhānyeva |	དེས་ན་ཤའི་མིག་ལ་སོགས་པ་འདས་པ་ལ་སོགས་པ་ཡང་མི་དམིགས་པ་ཉིད་དོ་༎
 atra adhārā ityādibhiḥ padairgāmbhīryamuktam,	འདི་ལ་རྒྱུན་མེད་ཅེས་བྱ་བ་ལ་སོགས་པའི་ཚིག་གིས་ནི་ཟབ་པ་བརྗོད་དོ་༎
 śeṣairaudāryam |	ལྷག་མ་རྣམས་ཀྱིས་ནི་རྒྱ་ཆེ་བའོ་༎
 4| prāptapuṇyaskandhādhipatyasampad : yadi nāsti traikālikaṃ cittaṃ tadā puṇyaskandho 'pi na syāt, cittāśritatvāttasya |	གལ་ཏེ་དུས་གསུམ་གྱི་སེམས་མེད་ན་དེའི་ཚེ་བསོད་ནམས་ཀྱི་ཕུང་པོ་ཡང་མེད་པར་འགྱུར་ཏེ་། དེ་ནི་སེམས་ལ་བརྟེན་པའི་ཕྱིར་རོ་༎
 tataḥ tathāgatasya puṇyaskandhādhipatyasampadaṃ sampādayituṃ kathaṃ bodhisattvo yatnaṃ kūryāditi vicintya puṇyaskandhādhipatyasampadamadhikṛtya- tatkiṃ manyase subhūte ityādyāha |	དེ་བས་ན་དེ་བཞིན་གཤེགས་པའི་བསོད་ནམས་ཀྱི་ཕུང་པོ་ལ་མངའ་བ་ཕུན་སུམ་ཚོགས་པ་བསྒྲུབ་པའི་ཕྱིར་བྱང་ཆུབ་སེམས་དཔའ་ཇི་ལྟར་འབད་པར་བྱ་སྙམ་པ་ལ་བརྟགས་ཏེ་། བསོད་ནམས་ཀྱི་ཕུང་པོ་ལ་མངའ་བ་ཕུན་སུམ་ཚོགས་པའི་དབང་དུ་མཛད་ནས་། རབ་འབྱོར་འདི་ཇི་སྙམ་དུ་སེམས་ཞེས་བྱ་བ་ལ་སོགས་པ་གསུངས་སོ་༎
 anena kulaputro vā kuladuhitā vā yo 'ntaśo ratnādikaṃ bāhyavastu tyajati, so 'pi (yadi) mahāpuṇyaskandhena yukto bhavati (tadā)	འདིས་ནི་རིགས་ཀྱི་བུ་འམ་རིགས་ཀྱི་བུ་མོ་ཐ་ན་གང་ཕྱིའི་དངོས་པོ་ནི་རིན་པོ་ཆེ་ལ་སོགས་པ་གཏོང་བར་བྱེད་པ་དེ་ཡང་བསོད་ནམས་ཀྱི་ཕུང་པོ་ཆེན་པོ་དང་ལྡན་པར་འགྱུར་ན་། 
 kathaṃ na tathāgatasya asaṃkhyeyāprameyakalpeṣu duṣkarānekaśatānyabhyasyataḥ puṇyaskandhādhipatyaṃ syādityevaṃ deśitam |	དེ་བཞིན་གཤེགས་པ་བསྐལ་པ་གྲངས་མེད་དཔག་ཏུ་མེད་པར་བྱ་དཀའ་བ་བརྒྱ་ཕྲག་དུ་མ་གོམས་པར་མཛད་པས་བསོད་ནམས་ཀྱི་ཕུང་པོ་ལ་མངའ་བར་ཅིའི་ཕྱིར་མི་འགྱུར་ཞེས་དེ་སྐད་ན་། སྟོན་ཏོ་༎ 
 ata eva paramārthato 'satyapi puṇyaskandhe saṃvṛtau sattvād bodhisattvena tatra vaśībhāvaṃ niṣpādayituṃ chandapraṇidhānābhyāṃ sthātavyamityādarśitam	དེས་ན་དོན་དམ་པར་བསོད་ནམས་ཀྱི་ཕུང་པོ་མེད་དུ་ཟིན་ཀྱང་ཀུན་རྫོབ་ཏུ་ཡོད་པས་ན་བྱང་ཆུབ་སེམས་དཔས་དེ་ལ་དབང་བ་བསྒྲུབ་པའི་ཕྱིར་འདུན་པ་དང་། སྨོན་ལམ་གྱིས་གནས་པར་བྱའོ་ཞེས་བསྟན་ཏེ་།
 anenaudāryamapyuktam |	འདི་ནི་རྒྱ་ཆེ་བ་ཡང་བརྗོད་དོ་༎
 kathaṃ na paramārthataḥ puṇyaskandhasattvaṃ vyavasthāpyata iti vicintya 'bodhisattvenātra kathaṃ pratipattavyam, kathañca cittaṃ pragrahītavyam,	བསོད་ནམས་ཀྱི་ཕུང་པོ་དོན་དམ་པར་ཡོད་པར་ཅིའི་ཕྱིར་རྣམ་པར་མི་གཞག་སྙམ་པ་ལ་བརྟགས་ནས་བྱང་ཆུབ་སེམས་དཔས་འདི་ལ་ཇི་ལྟར་བསྒྲུབ་པར་བྱ་བ་དང་། སེམས་རབ་ཏུ་གཟུང་བར་བྱ་བ་དང་། གཉི་ག་བསྟན་པའི་ཕྱིར་།
 '; ityubhayaṃ sandarśiyituṃ sacet subhūte ityādyāha |	རབ་འབྱོར་གལ་ཏེ་ཞེས་བྱ་བ་ལ་སོགས་པ་གསུངས་སོ་༎
 sacet iti 'yadi'; ityarthaḥ |	གལ་ཏེ་ཞེས་བྱ་བ་ནི་ཇི་༄༢༥༢བ་སྟེ་ཞེས་བྱ་བའི་ཐ་ཚིག་གོ་༎
 na tathāgato 'bhāṣiṣyat iti paramārthato 'bhidhānaṃ nācariṣyat |	དེ་བཞིན་གཤེགས་པ་མི་གསུང་ངོ་ཞེས་བྱ་བ་ནི་དོན་དམ་པར་བརྗོད་པ་མི་སྤྱོད་པའི་ཕྱིར་ཏེ་། 
 anirdeśe 'pi tathā khyāyata ityabhiprāyaḥ |	མ་བསྟན་པར་ཡང་དེ་ལྟར་གྲགས་པར་འགྱུར་རོ་སྙམ་དུ་དགོངས་པའོ་༎
 yathā paramārthataḥ puṇyaskandhasyābhāvastathā prāgvarṇitaḥ |	ཇི་ལྟར་བསོད་ནམས་ཀྱི་ཕུང་པོ་དོན་དམ་པར་མེད་པ་དེ་ལྟར་སྔར་བསྟན་ཟིན་ཏོ་༎
 anena tathāgatasya puṇyaskandhādhipatyasampadaṃ pariniṣpādayituṃ prasthitena bodhisattvena paramārthatastadanupalambhena yogasamāpattyā pratipattavyam paramārthatastadālambanābhiniveśaparihāreṇa (vajraṭ_196) cittaṃ pragrahītatavyam ityubhayaṃ deśitam,	འདིས་ནི་དེ་བཞིན་གཤེགས་པའི་བསོད་ནམས་ཀྱི་ཕུང་པོ་མངའ་བ་ཕུན་སུམ་ཚོགས་པ་བསྒྲུབ་པའི་ཕྱིར་ཞུགས་པའི་བྱང་ཆུབ་སེམས་དཔས་དོན་དམ་པར་དེ་མི་དམིགས་པར་རྣལ་འབྱོར་དུ་སྙོམས་པར་འཇུག་པས་བསྒྲུབ་པར་བྱ་བ་དང་། དོན་དམ་པར་དེ་དམིགས་པ་ལ་མངོན་པར་ཞེན་པ་སྤོང་པས་སེམས་རབ་ཏུ་གཟུང་བར་བྱ་བ་གཉི་ག་བསྟན་ཏེ་།
 gāmbhīryamapyuktam | 5| kāyasampad : (a) rūpakāyasampad	ཟབ་པ་ཡང་བརྗོད་དོ་༎
 yadi puṇyaskandho naiva syāt tadā tathāgatānāṃ dvividhā kāyalakṣaṇasampad-anuvyañjanakāyasampad,	གལ་ཏེ་བསོད་ནམས་ཀྱི་ཕུང་པོ་མེད་པ་ཉིད་ཡིན་ན་། དེའི་ཚེ་དེ་བཞིན་གཤེགས་པ་རྣམས་ཀྱི་སྐུ་ཕུན་སུམ་ཚོགས་པ་རྣམ་པ་གཉིས་པོ་དཔེ་བྱད་བཟང་པོའི་སྐུ་ཕུན་སུམ་ཚོགས་པ་དང་། མཚན་གྱི་སྐུ་ཕུན་སུམ་ཚོགས་པ་བསོད་ནམས་བླ་ན་མེད་པ་ལས་སྐྱེས་པར་འདོད་པ་གང་ཡིན་པ་དེ་ཡང་རྒྱུ་མེད་པའི་ཕྱིར་མེད་པར་འགྱུར་རོ་༎ 
 lakṣaṇakāyasampacca yānuttarapuṇyenābhinirvartayitumiṣyate, sā naiva syāt,	དེ་བས་ན་དེ་བཞིན་གཤེགས་པའི་སྐུ་ཕུན་སུམ་ཚོགས་པ་རྣམ་པ་གཉིས་ཡོངས་སུ་བསྒྲུབ་རོ་༎ 
 kāraṇābhāvāt |	པའི་ཕྱིར་། 
 tasmāt tathāgatasya dvividhāṃ kāyasampadaṃ pariniṣpādayituṃ kathaṃ bodhisattvairyatno	བྱང་ཆུབ་སེམས་དཔས་ཇི་ལྟར་འབད་པར་བྱ་སྙམ་དུ་སེམས་པ་དེའི་ཆེད་དུ་དེ་བཞིན་གཤེགས་པ་རྣམས་ཀྱི་གཟུགས་ཀྱི་སྐུ་ཕུན་སུམ་ཚོགས་པའི་དབང་དུ་མཛད་ནས་།
 'nuṣṭheya iti vicintayadbhyastathāgatasya rūpakāyasampadamadhikṛtya- tatkiṃ manyase subhūte ityādyāha |	རབ་འབྱོར་འདི་ཇི་སྙམ་དུ་སེམས་ཞེས་བྱ་བ་ལ་སོགས་པ་གསུངས་སོ་༎
 rūpakāyaḥ ityanuvyañjanakāyarūpeṇa draṣṭavyaḥ |	གཟུགས་ཀྱི་ལུས་ཞེས་བྱ་བ་ནི་དཔེ་བྱད་བཟང་པོའི་སྐུ་ཡིན་པར་བལྟ་བར་བྱའོ་༎
 lakṣaṇakāyaḥ paścād vakṣyate gobalivardanyāyena |	མཚན་གྱི་སྐུ་ནི་འོག་ནས་འཆད་དེ་བ་ལང་དང་གླང་ཞེས་བྱ་བའི་ཚུལ་དུ་།
 tato 'yamatrāryasubhūterāśayaḥ- yathā paramārthato 'skandha eva puṇyaskandhastathā rūpakāyo 'pyunutpanna eva |	འདི་ལས་འཕགས་པ་རབ་འབྱོར་གྱི་བསམ་པ་ནི་འདི་ཡིན་ཏེ་། ཇི་ལྟར་བསོད་ནམས་ཀྱི་ཕུང་པོ་དོན་དམ་པར་ཕུང་པོ་མེད་པ་ཁོ་ན་ཡིན་པ་དེ་བཞིན་དུ་གཟུགས་ཀྱི་སྐུ་ཡང་མ་སྐྱེས་པ་ཁོ་ན་སྟེ་། 
 ataḥ paramārthataḥ na rūpakāyapariniṣpattyā tathāgato draṣṭavyaḥ ityucyate |	དེ་བས་ན་དོན་དམ་པར་གཟུགས་ཀྱི་སྐུ་ཡོངས་སུ་གྲུབ་པས་དེ་བཞིན་གཤེགས་པར་བལྟ་བར་མི་བགྱི་ལགས་སོ་ཞེས་བྱའོ་༎
 saṃvṛtau māyānirmitabuddhavad vidyata eva rūpakāyaḥ, tata upapanna eva (tasya)	ཀུན་རྫོབ་ཏུ་ནི་སྒྱུ་མས་སྤྲུལ་པའི་སངས་རྒྱས་བཞིན་དུ་གཟུགས་ཀྱི་སྐུ་ཡོད་པ་ཉིད་དེ་།
 puṇyaskandhādudbhavaḥ |	དེ་བས་ན་བསོད་ནམས་ཀྱི་ཕུང་པོ་ལས་བྱུང་བར་རུང་བ་ཉིད་དོ་༎
 tasmād bodhisattvena māyānirmitabuddhasya tathāvidharūpādhimuktayā tatpratipattaye chanda-praṇidhānābhyāṃ sthātavyamiti deśitam |	དེ་བས་ན་བྱང་ཆུབ་སེམས་དཔས་སྒྱུ་མས་སྤྲུལ་པའི་སངས་རྒྱས་༄༢༥༣ཨ་༌་༎ ཀྱི་གཟུགས་ལ་མོས་པ་དེ་ལྟ་བུས་དེ་བསྒྲུབ་པའི་ཕྱིར་འདུན་པ་དང་སྨོན་ལམ་གྱིས་གནས་པར་བྱ་བ་བསྟན་པ་ཡིན་ནོ་༎
 nāpyatra punaruktitā |	འདིར་ཚིག་ཟློས་པར་ཡང་མི་འགྱུར་ཏེ་།
 pūrvamadhimukticaryābhūmau rūpakāyāptikāmatākāle tathāgatapūjāsatkārakāle ca tathāvidho 'bhiniveśaḥ parivarjitaḥ,	སྔར་མོས་པས་སྤྱོད་པའི་ས་ན་གཟུགས་ཀྱི་སྐུ་ཐོབ་པར་འདུན་པའི་དུས་དང་། དེ་བཞིན་གཤེགས་པ་མཆོད་པ་དང་རིམ་གྲོ་བྱ་བའི་དུས་ན་དེ་ལྟར་མངོན་པར་ཞེན་པ་ཡོངས་སུ་སྤང་བ་ཡིན་ལ་།
 samprati śuddhādhyāśayabhūmau tathāgatarūpakāyasampadaṃ (vajraṭ_197) pariniṣpādayituṃ samprasthitasya bodhisattvasya rūpe 'bhiniveśo bhavatīti yāsāṃ prasiddhistāsāṃ pariṣadāṃ durvikalpo nirākṛta ityuktatvāt |	ད་ནི་ལྷག་པའི་བསམ་པ་དག་པའི་ས་ན་དེ་བཞིན་གཤེགས་པའི་གཟུགས་ཀྱི་སྐུ་ཕུན་སུམ་ཚོགས་པ་བསྒྲུབ་པའི་ཕྱིར་ཞུགས་པའི་བྱང་ཆུབ་སེམས་དཔའ་གཟུགས་ལ་མངོན་པར་ཞེན་པ་ཡོད་དོ་ཞེས་གྲག་ཅེས་འཁོར་གང་དག་གི་རྣམ་པར་རྟོག་པ་ངན་པ་དེ་བསལ་བར་གསུངས་པའི་ཕྱིར་རོ་༎
 evaṃ tarhi tathāgatānāṃ rūpakāyaḥ kasmād deśita iti vicintya tatkasya hetoḥ? ityapṛcchat |	འོ་ན་དེ་བཞིན་གཤེགས་པ་རྣམས་ཀྱི་གཟུགས་ཀྱི་སྐུ་ཇི་ལྟར་བསྟན་སྙམ་དུ་སེམས་ཤིང་། དེ་ཅིའི་སླད་དུ་ཞེས་དྲིས་ཏེ་།
 na rūpakāyapariniṣpattyā tathāgato draṣṭavyaḥ ityanena yojanīyam |	གཟུགས་ཀྱི་སྐུ་ཡོངས་སུ་གྲུབ་པས་དེ་བཞིན་གཤེགས་པར་བལྟ་བར་མི་བྱ་ཞེས་བྱ་བ་དང་སྦྱར་རོ་༎ 
 nāsau tāvat sidhyati,	འདི་ནི་གྲུབ་པ་མེད་དེ་གཟུགས་ཀྱི་སྐུ་ཡན་ལག་ཅན་གྱི་རང་བཞིན་ནམ་།
 avapavirūpeṇa paramāṇusañcayarūpeṇa vā rūpasyāsiddhatvād, yathā vicāritaṃ prāk |	རྡུལ་ཕྲ་རབ་བསགས་པའི་རང་བཞིན་དུ་མ་གྲུབ་པར་ཇི་ལྟར་སྔར་དཔྱད་པ་བཞིན་ནོ་༎
 anena bodhisattvena kathaṃ pratipattavyam, tannirdiṣṭam |	འདིས་ནི་བྱང་ཆུབ་སེམས་དཔས་ཇི་ལྟར་བསྒྲུབ་པར་བྱ་བ་དེ་བསྟན་ཏོ་༎
 tena iti ityaṃ saṃvṛtau bhāvaḥ,	དེས་ན་ཞེས་བྱ་བ་ནི་འདི་ལྟར་ཀུན་རྫོབ་ཏུ་ཡོད་དོ་།
 na tu śaśaviṣāṇavat sarvathābhāvaḥ |	རི་བོང་གི་རབ༹་བཞིན་དུ་རྣམ་པ་ཐམས་ཅད་དུ་མེད་པ་ནི་མ་ཡིན་པའི་ཕྱིར་རོ་༎
 anena cāpavādāntaṃ parihṛtya kathaṃ cittaṃ pragrahītavyam, (iti) etannirdiṣṭam |	འདིས་ནི་སྐུར་པ་འདེབས་པའི་མཐའ་བཀག་ནས་ཇི་ལྟར་སེམས་རབ་ཏུ་གཟུང་བར་བྱ་བ་དེ་བསྟན་ཏོ་༎ 
 anena sarvasthānena gāmbhīryaṃ pradarśitam |	གནས་འདི་ཐམས་ཅད་ཀྱིས་ནི་ཟབ་པ་བསྟན་ཏོ་༎
 saṃvṛtau tathāgatasya rūpakāyasampadaṃ niṣpādayituṃ bodhisattvaiḥ karaṇīyānāṃ yatnānāṃ nidarśanena ādāryamapi dīpitam |	ཀུན་རྫོབ་ཏུ་དེ་བཞིན་གཤེགས་པའི་གཟུགས་ཀྱི་སྐུ་ཕུན་སུམ་ཚོགས་པ་བསྒྲུབ་པའི་ཕྱིར་བྱང་ཆུབ་སེམས་དཔའ་རྣམས་ཀྱིས་འབད་པར་བྱ་བ་བསྟན་པས་ནི་རྒྱ་ཆེ་བ་ཡང་བསྟན་ཏོ་༎
 (ba) lakṣaṇakāyasampad :	མཚན་གྱི་སྐུ་ཕུན་སུམ་ཚོགས་པའི་དབང་དུ་མཛད་ནས་།
 lakṣaṇakāyasampadamadhikṛtya tatkiṃ manyase subhūte ityadyāha |	རབ་འབྱོར་འདི་ཇི་སྙམ་དུ་སེམས་ཞེས་བྱ་བ་ལ་སོགས་པ་གསུངས་ཏེ་།
 atra pūrvavat sarvamabhihiatam | 6| vākasampad :	འདིར་བཤད་པ་ཐམས་ཅད་ནི་སྔ་མ་དང་འདྲའོ་༎
 yadi rūpakāyapariniṣpattyāa na tathāgato draṣṭavya iti cet,	གལ་ཏེ་གཟུགས་ཀྱི་སྐུ་ཡོངས་སུ་གྲུབ་པས་དེ་བཞིན་གཤེགས་པར་བལྟ་བར་མི་བྱ་ན་།
 tadā deśanāpi bhagavatā naiva bhavet,	དེའི་ཚེ་བཅོམ་ལྡན་འདས་ཀྱིས་བསྟན་པ་ཡང་མེད་པར་འགྱུར་ཏེ་།
 rūpakāyena saṃgṛhītvāt tasyāḥ? ato (vajraṭ_198)	དེ་ནི་གཟུགས་ཀྱི་༄༢༥༣བ་སྐུས་བསྡུས་པའི་ཕྱིར་རོ་༎
 bodhisattavaistathāgatasya vāksampadaṃ niṣpādayituṃ kathaṃ yatnaḥ karttavya iti vicintayadbhyo vāksampadamadhikṛtya tatkiṃ manyase subhūte ityādyāha	དེ་བས་ན་བྱང་ཆུབ་སེམས་དཔས་དེ་བཞིན་གཤེགས་པའི་གསུང་ཕུན་སུམ་ཚོགས་པ་བསྒྲུབ་པའི་ཕྱིར་ཇི་ལྟར་འབད་པར་བྱ་སྙམ་དུ་སེམས་པ་དེའི་ཆེད་དུ་གསུང་ཕུན་སུམ་ཚོགས་པའི་དབང་དུ་མཛད་ནས་། རབ་འབྱོར་འདི་ཇི་སྙམ་དུ་སེམས་ཞེས་བྱ་བ་ལ་སོགས་གསུངས་སོ་༎
 paramārthato vācya-vācaka-vacanānāmabhāvāt na tathāgatasyaivaṃ bhavati mayā dharmo deśita iti |	དོན་དམ་པར་འཆད་པ་པོ་དང་། བཤད་པར་བྱ་བ་དང་། བཤད་པ་མེད་པའི་ཕྱིར་དེ་བཞིན་གཤེགས་པ་འདི་སྙམ་དུ་ངས་ཆོས་བསྟན་ཏོ་སྙམ་དུ་མི་དགོངས་སོ་༎ 
 anyathā viparyayānna bhavet sarvajñaḥ |	དེ་ལྟར་མ་ཡིན་ན་ཕྱིན་ཅི་ལོག་ཏུ་འགྱུར་བའི་ཕྱིར་ཐམས་ཅད་མཁྱེན་པར་མི་འགྱུར་སོ་༎ 
 yathā vācakāḥ ātmādayaḥ,	རོ་༎ 
 vācyā bāhyādhyātmikā bhāvāḥ,	ཇི་ལྟར་འཆད་པ་པོ་སྟེ་བདག་ལ་སོགས་པ་དང་། བཤད་པར་བྱ་བ་སྟེ་ཕྱི་ནང་གི་དངོས་པོ་དང་། བཤད་པ་སྟེ་།
 vacanāni karaṇarūpāṇi śabdasvabhāvābhāvātmakāni vā tathā vistareṇa prāgevoktāni |	བྱེད་པ་གཟུགས་སམ་སྒྲའི་བདག་ཉིད་མེད་པ་དེ་ལྟར་ནི་སྔར་རྒྱས་པར་བསྟན་ཟིན་ཏེ་།
 sarve bhāvāḥ śūnyatvavyāptāḥ prāgeva pratipāditāḥ |	དངོས་པོ་མཐའ་དག་ལ་སྟོང་པ་ཉིད་ཀྱིས་ཁྱབ་པར་སྔར་བསྒྲུབས་པའི་ཕྱིར་རོ་༎
 saṃvṛtau vācya-vācaka-vacanānām avicāraramaṇīyatvena vyavahāramātra eva (te)	ཀུན་རྫོབ་ཏུ་འཆད་པ་པོ་དང་། བཤད་པར་བྱ་བ་དང་། བཤད་པ་མ་བརྟགས་ན་དགའ་བས་ཐ་སྙད་འདོགས་པ་འབའ་ཞིག་ཏུ་ཟད་ཀྱི་དོན་དམ་པར་ནི་མ་ཡིན་ནོ་༎ 
 bhavanti, na tu paramārthe | yadi vastutattvasyaivamabhidhāne 'pi vyāmohena kicit paramārthatastrayāṇāṃ (teṣāṃ) parāmārthasattvaṃ kalpayeyastadā 'kiṃ nu syāt';	གལ་ཏེ་དངོས་པོའི་དེ་ཁོ་ན་ཉིད་དེ་ལྟ་བུ་བསྟན་དུ་ཟིན་ཀྱང་ཁ་ཅིག་མགོ་རྨོངས་ཏེ་དོན་དམ་པར་གསུམ་པོ་ཡོད་པར་སེམས་ན་དེའི་ཚེ་ཅིར་འགྱུར་སྙམ་པ་ལ་མ་ཡིན་ནོ་༎ 
 iti vicintya yaḥ subhūte ityādyāha | abhyācakṣīta ityabhyālapet |	། རབ་འབྱོར་སུ་ཞིག་ཅེས་བྱ་བ་ལ་སོགས་པ་གསུངས་སོ་༎ སྐུར་པ་ནི་དོན་མེད་པར་གླེང་བའི་ཕྱིར་རོ་༎
 kathaṃ tadabhūtamālapituṃ śakyata iti vicāraṇāyāmāha asatodgṛhītena iti |	ཇི་ལྟར་མེད་པ་དེས་གླེང་བར་ནུས་སྙམ་པ་ལ་།
 viparītābhiniveśato vitathagrahaṇāt tadabhūtamityarthaḥ |	ལོག་པར་འཛིན་པས་ཞེས་བྱ་བ་གསུངས་ཏེ་། ཕྱིན་ཅི་ལོག་ཏུ་མངོན་པར་ཞེན་པས་ལོག་པར་ཟིན་པའི་ཕྱིར་དེ་མེད་ཅེས་བྱ་བའི་ཐ་ཚིག་གོ་༎ 
