skt	tib
 arthataḥ paramārthe sattvabhājanalokīyabhāvābhiniveśo vipakṣatvena paridīpitaḥ |	དོན་གྱིས་ན་དོན་དམ་པར་སྣོད་དང་སེམས་ཅན་གྱི་འཇིག་རྟེན་ལ་དངོས་པོར་མངོན་པར་ཞེན་པ་མི་མཐུན་པའི་ཕྱོགས་སུ་ཡོངས་སུ་བསྟན་ཏོ་༎
 tatprahāṇārthaṃ ca chandaḥ praṇidhānaṃ ca nirdiṣṭe |	དེ་སྤང་བར་༄༢༣༦ཨ་༌་༎ བྱ་བའི་ཕྱིར་འདུན་པ་དང་། སྨོན་ལམ་གདབ་པ་ཡང་བསྟན་ཏེ་།
 trisāhasramahāsāhasre lokadhātau iti nimittamātrābhidhānena sarvabhāvānāṃ niḥsvabhāvatvabhāvanā sandarśitā |	སྟོང་གསུམ་གྱི་སྟོང་ཆེན་པོའི་འཇིག་རྟེན་གྱི་ཁམས་ཞེས་མཚན་མ་ཙམ་ཞིག་ཡོངས་སུ་བརྗོད་པས་དངོས་པོ་མཐའ་དག་རང་བཞིན་མེད་པར་བསྒོམ་པར་ཡོངས་སུ་སྟོན་ཏོ་༎ 
 arajastat iti adhātuḥ ityābhyāṃ paramārthavyavasthāpanayā yogasamāpattyā kathaṃ pratipattavyamiti tat paridīpitam |	དེ་རྡུལ་མ་མཆིས་པར་ཞེས་བྱ་བ་དང་། ཁམས་མ་མཆིས་པར་ཞེས་བྱ་བ་འདིས་ནི་དོན་དམ་པར་རྣམ་པར་འཇོག་པ་འདིས་ནི་རྣལ་འབྱོར་དུ་སྙོམས་པར་འཇུག་པས་ཇི་ལྟར་བསྒྲུབ་པར་བྱ་བ་དེ་ཡོངས་སུ་བསྟན་ཏོ་༎
 tenocyate lokadhātuḥ ityanenāpavādāntaṃ parihṛtya vikṣepanigraho nirdiṣṭaḥ |	དེས་ན་འཇིག་རྟེན་གྱི་ཁམས་ཞེས་བགྱིའོ་ཞེས་བྱ་བ་འདིས་ནི་སྐུར་པ་འདེབས་པའི་མཐའ་བཀག་ནས་ག-ཡེང་བ་ཚར་གཅོད་པ་བསྟན་ཏོ་༎
 11| tathāgatapūjāsatkāra-sthānam : samprati ye bodhisattvāḥ puṇyasambhārapratipattaye 'tyantamupakāritvād bhagavantaṃ pūjayeyusteṣāṃ tasya (bhagavataḥ) avināśikāyo na pūrayati puṇyasambhāram,	ད་ནི་བྱང་ཆུབ་སེམས་དཔའ་གང་དག་བསོད་ནམས་ཀྱི་ཚོགས་བསྒྲུབས་པའི་ཤིན་ཏུ་ཕན་འདོགས་པས་བཅོམ་ལྡན་འདས་ལ་མཆོད་པ་ན་དེའི་སྐུ་རྣམ་པར་མི་འཇིག་པ་དེ་དག་བསོད་ནམས་ཀྱི་ཚོགས་ཡོངས་སུ་རྫོགས་པར་མི་འགྱུར་ཏེ་།
 samyaṅmanasikārāpravṛttatvāt |	ཡང་དག་པ་ཡིད་ལ་བྱེད་པ་ལ་མ་ཞུགས་པའི་ཕྱིར་རོ་༎
 tasmāt teṣāṃ sambhārāsañcayato viyogārthaṃ ekādaśasthānamadhikṛtyāha- tatkiṃ manyase subhūte ityādi |	དེ་བས་ན་དེ་དག་ཆོགས་མ་བསགས་པ་དང་བྲལ་བའི་ཕྱིར་གནས་བཅུ་གཅིག་པའི་དབང་དུ་མཛད་ནས་། རབ་འབྱོར་འདི་ཇི་སྙམ་དུ་སེམས་ཞེས་བྱ་བ་ལ་སོགས་པ་གསུངས་སོ་༎
 sāmānyato 'trāyaṃ saṅgrahārthaḥ,	འདིར་སྤྱིར་བསྡུ་བའི་དོན་ནི་འདི་ཡིན་ཏེ་།
 tathāgatapūjāsatkāreṣu lakṣaṇasampadā tathāgato na draṣṭavyaḥ,	དེ་བཞིན་གཤེགས་པ་ལ་མཆོད་པ་དང་། རིམ་གྲོ་བྱེད་པ་ན་མཚན་ཕུན་སུམ་ཚོགས་པས་དེ་བཞིན་གཤེགས་པར་མི་ལྟའི་།
 atha kathamiti cet?	འོ་ན་ཇི་ལྟ་བུ་ཞེ་ན་།
 paramārthadharmatāyāmityucyate |	དོན་དམ་པ་ཆོས་ཉིད་དུ་ཞེས་བྱ་བའོ་༎
 iha avaśiṣṭavyākhyānaṃ tu rūpakāyāptikāmatāsthānānurūpam |	ལྷག་མའི་བཤད་པ་ནི་གཟུགས་ཀྱི་སྐུ་ཐོབ་པར་འདུན་པའི་གནས་དང་འདིར་མཐུན་ནོ་༎
 na cātra punaruktirapyāśaṅkanīyā |	འདི་ལ་ཚིག་ཟློས་པ་སྙམ་དུ་དོགས་པར་ཡང་མི་བྱ་སྟེ་།
 pūrvaṃ rūpakāyāptikāmatāprasaṅge tu tadvyudāso darśitaḥ,	སྔར་ནི་གཟུགས་ཀྱི་སྐུ་ཐོབ་པར་འདུན་པའི་དུས་ན་དེ་རྣམ་པར་གཞིག་པར་བསྟན་།
 adhunā tathāgatapūjāsatkāraprasaṅge darśitatvād bhinna eva (rūpakāyaḥ) |	ད་ནི་དེ་བཞིན་གཤེགས་པ་ལ་མཆོད་པ་དང་རིམ་གྲོ་བ་པའི་དུས་ན་བསྟན་པས་ཐ་དད་དོ་༎ 
 atrārthataḥ rūpakāye tathāgatābhiniveśaṃ vipakṣatvena nirdiśya tatprahānārthaṃ chandaḥ praṇidhānaṃ cāpi pradarśite |	འདིར་དོན་གྱིས་ན་གཟུགས་ཀྱི་སྐུ་ལ་དེ་བཞིན་གཤེགས་པར་མངོན་པར་ཞེན་པ་མི་མཐུན་པའི་ཕྱོགས་སུ་ཡོངས་སུ་བསྟན་ཏེ་། དེ་སྤང་བར་བྱ་བའི་ཕྱིར་འདུན་པ་དང་སྨོན་ལམ་གདབ་པར་ཡང་བསྟན་ཏོ་༎
 lakṣaṇāni ityupalakṣaṇamātroktyā sakalo rūpakāyaḥ paridīpitaḥ |	མཆན་ཕུན་སུམ་ཚོགས་པ་ཞེས་མཚན་མ་ཙམ་ཞིག་བརྗོད་པས་གཟུགས་ཀྱི་སྐུ་མཐའ་དག་ཡོངས་སུ་བསྟན་ཏོ་༎ 
 alakṣaṇāni iti paramārthavyavasthānam |	མཚན་མ་མཆིས་པར་ཞེས་བྱ་བ་ནི་དོན་དམ་པ་རྣམ་པར་འཇོག་པའོ་༎
 tena ityādinā vikṣepanigraho nirdiṣṭaḥ |	དེས་ན་ཞེས་བྱ་བ་ལ་སོགས་པས་ནི་ག-ཡེང་བ་ཚར་གཅོད་པ་བསྟན་ཏོ་༎
 12| kāyacittapariśrāntau viryamyukhyānārambhalābha-satkāravirahitatā : evaṃ sarvadharmāṇāṃ nairātmyāvagamopāye nirdiṣṭe 'pi kāyajīviteṣvāsajya ye lābhasatkārādhyasitāḥ kausīdyalābhasatkārapiṇḍapātānuraktā teṣāṃ tatrānuraktivisaṃyogārthaṃ dvādaśasthānamadhikṛtyāha-	དེ་ལྟར་ཆོས་ཐམས་ཅད་ལ་བདག་མེད་པར་༄༢༣༦བ་རྟོགས་པར་བྱ་བའི་ཐབས་བསྟན་དུ་ཟིན་ཀྱང་ལུས་དང་སྲོག་ལ་ཆགས་ཤིང་རྙེད་པ་དང་བཀུར་སྟི་ལ་གདུ་བ་གང་དག་ལེ་ལོ་དང་རྙེད་པ་དང་བཀུར་སྟི་དང་བསོད་སྙོམས་ལ་ཆགས་པར་གྱུར་པ་དེ་དག་དེ་ལ་ཆགས་པ་དང་བྲལ་བའི་ཕྱིར་གནས་བཅུ་གཉིས་པའི་དབང་དུ་མཛད་ནས་།
 yaśca khalu punaḥ sūbhūte, strī vā puruṣo vā ityādi |	རབ་འབྱོར་སྐྱེས་པའམ་བུད་མེད་གང་གིས་ཞེས་བྱ་བ་ལ་སོགས་པ་གསུངས་སོ་༎
 anena cāsāre 'nekaśatasahasraduḥkhaikasthānatucchātmabhāve tasmin snihyan etāvacchariraparityāgenāpi yatpuṇyaṃ na prāptam,	འདིས་ནི་སྙིང་པོ་མེད་པ་སྡུག་བསྔལ་བརྒྱ་སྟོང་དུ་མའི་གནས་ལུས་གཅིག་གི་ཕྱིར་ཁྱེད་ལ་ཆགས་ནས་ལུས་འདི་སྙེད་ཡོངས་སུ་བཏང་བས་ཀྱང་མི་རྙེད་པའི་བསོད་ནམས་གང་ཡིན་པ་དེའི་བར་ཆད་བྱེད་ཀྱིས་། 
 tadantarāyakaratvāttasmin kāyajīvite nirapekṣacittatayā sarvātmanāsmin (dharmaparyāye) yogaḥ karaṇīya iti paridipitam |	ལུས་དང་སྲོག་ལ་མི་ལྟ་བའི་སེམས་ཀྱིས་བདག་ཉིད་ཐམས་ཅད་ཀྱིས་འདི་ལ་བརྩོན་པར་བྱ་བའི་རིགས་སོ་ཞེས་ཡོངས་སུ་བསྟན་ཏོ་བྱེད་ཀྱིས་། 
 anenārthataḥ kausīdyādayo vipakṣatvena darśitāḥ |	༎ འདིས་ནི་དོན་གྱིས་ན་ལེ་ལོ་ལ་སོགས་པ་མི་མཐུན་པའི་ཕྱོགས་སུ་ཡོངས་བྱེད་ཀྱིས་། ༎ སུ་བསྟན་ཏོ་༎ 
 tatprahāṇāya saddharmasamādānāya ca chandaḥ praṇidhānañcāpi nirdiṣṭe |	དེ་སྤང་པའི་ཕྱིར་དམ་པའི་ཆོས་ཡོངས་སུ་བཟུང་བ་ལ་སོགས་པའི་དོན་དུ་འདུན་པ་དང་སྨོན་ལམ་གདབ་པ་ཡང་སྟོན་ཏོ་༎
 ito dharmaparyāyāt ityupalakṣaṇamātroktyā samastamahāyānaśravaṇādīni ābadhyante |	ཆོས་ཀྱི་རྣམ་གྲངས་འདི་ལས་ཞེས་མཚན་མ་ཙམ་ཞིག་བརྗོད་པས་ནི་ཐེག་པ་ཆེན་པོ་མཐའ་དག་ལ་ཉན་པ་ལ་སོགས་པར་མཛད་པའོ་༎
 bahutaraṃ puṇyam ityanena ādāryamuktam |	བསོད་ནམས་ཆེས་མང་དུ་ཞེས་བྱ་བ་འདིས་ནི་རྒྱ་ཆེ་བ་བརྗོད་དོ་༎
 dharmavegena iti dharmaśraddhābalenetyarthaḥ | āryasubhūtiḥ aśrūṇi prāmuñcat tadapi bhagavato 'dhiṣṭhānenānyeṣu kusīdeṣu janeṣu adbhutamahāyānadharmasyābhidhānena paramaśraddhotpādārthe draṣṭavyam	ཆོས་ཀྱི་ཤུགས་ཀྱིས་ཞེས་བྱ་བ་ནི་ཆོས་ལ་དད་པའི་ཤུགས་ཀྱིས་ཞེས་བྱ་བའི་ཐ་ཚིག་གོ་༎ འཕགས་པ་རབ་འབྱོར་མཆི་མ་བྱུང་བ་དེ་ཡང་བཅོམ་ལྡན་འདས་ཀྱི་བྱིན་གྱིས་རླབས་ཀྱིས་ལེ་ལོ་ཅན་གཞན་དག་ཐེག་པ་ཆེན་པོའི་ཆོས་རྨད་དུ་བྱུང་བ་བརྗོད་པས་ཤིན་ཏུ་དད་པ་བསྐྱེད་པའི་དོན་དུ་བལྟ་བར་བྱའོ་༎
 tasmād hastena aśrūṇi pramṛjya bhagavantametadavocat āścaryaṃ bhagavan,	དེའི་ཕྱིར་ལག་པས་མཆི་མ་ཕྱིས་ནས་བཅོམ་ལྡན་འདས་ལ་འདི་སྐད་ཅེས་གསོལ་ཏོ་༎
 yāvadayaṃ dharmaparyāyastathāgatena bhāṣitaḥ ityāha |	ཆོས་ཀྱི་རྣམ་གྲངས་འདི་དེ་བཞིན་གཤེགས་པ་ཇི་སྙེད་པས་གསུངས་པ་ནི་བཅོམ་ལྡན་འདས་ངོ་མཚར་ལགས་སོ་ཞེས་བྱ་བ་གསོལ་ཏོ་༎
 yāvad iti kāritraviśeṣaḥ |	ཇི་སྙེད་པས་ཞེས་བྱ་བ་ནི་མི་བྱེད་པའི་བྱེ་བྲག་སྟེ་།
 yāvatā prakāreṇa deśānārhāstān bodhisattvānupadiśantviti vākyārthaḥ |	བཤད་པར་བྱ་བར་འོས་པའི་རྣམ་པ་ཇི་སྙེད་ཀྱིས་བྱང་ཆུབ་སེམས་དཔའ་རྣམས་ལ་གསུངས་ཤིག་ཅེས་བྱ་བའི་ཐ་ཚིག་གོ་༏་། ཅིའི་ཕྱིར་སྙམ་པ་ལ་།
 kasmādityākāṅkṣāyāṃ yato me jñānamutpannam ityakathayat |	བདག་གི་ཡེ་ཤེས་སྐྱེས་ཚུན་ཆད་ཅེས་བྱ་བ་གསོལ་ཏོ་༎
 yataḥ ityāryasatyagocarajñānotpādamārabhya etatparyantaṃ dharmaparyāyasya paramapuṇyaphalasya yathoktā deśanā śrāvaka-pratyekabuddhanāmagocarā naivaṃ śrutapūrvetyarthaḥ |	ཚུན་ཆད་ཅེས་བྱ་བ་ནི་འཕགས་པའི་བདེན་པའི་སྤྱོད་ཡུལ་གྱི་ཡེ་ཤེས་སྐྱེས་པ་ནས་བཟུང་སྟེ་། དེའི་བར་གྱི་ཆོས་ཀྱི་རྣམ་གྲངས་བསོད་ནམས་ཀྱི་འབྲས་བུ་མཆོག་ཏུ་ཇི་སྐད་བསྟན་པ་ཉན་ཐོས་དང་རང་སངས་༄༢༣༧ཨ་༌་༎ རྒྱས་ཀྱི་སྤྱོད་ཡུལ་མ་ཡིན་པ་འདི་ལྟ་བུ་སྔོན་ཆད་མ་ཐོས་སོ་ཞེས་བྱ་བའི་ཐ་ཚིག་གོ་༎ 
 etena (vajraṭ_164) daurlabhyaṃ proktam |	འདིས་ནི་རྙེད་དཀའ་བར་བརྗོད་དོ་༎
 evaṃ viśiṣṭaṃ puṇyaṃ śrutvā yeṣāṃ vīryamārabhya pravṛttānāmasmin dharme yathārutasaṃjñā bhavati teṣāṃ taddoṣaparijihīrṣayā parameṇāścaryeṇa ityavocat | vipulapuṇyānyutpādayato 'dhamapuruṣasya tādṛgduṣkaraśraddhādhimuktito 'tyantagambhīrapudgala-dharmanairatmyādhimuktiśca mameva pudgalanairātmyamātraśuddhajñānena, parameṇa te āścaryeṇaṃ samanvāgatā bhaviṣyanti |	དེ་ལྟར་བསོད་ནམས་ཁྱད་ཞུགས་པ་དེ་ཐོས་ནས་བརྩོན་འགྲུས་བརྩམས་ཏེ་འཇུག་པ་གང་དག་ཆོས་འདི་ལ་སྒྲ་ཇི་བཞིན་དུ་འདུ་ཤེས་པར་འགྱུར་བ་དེ་དག་གི་ཉེས་པ་དེ་ཡོངས་སུ་སྤང་བའི་ཕྱིར་ངོ་མཚར་རབ་ཅེས་བྱ་བ་འདི་གསོལ་ཏེ་། བསོད་ནམས་རྒྱ་ཆེན་པོ་སྐྱེད་པ་སྐྱེ་བོ་མ་རབས་ཀྱིས་དད་པར་དཀའ་བ་དེ་ལྟ་བུ་ལ་མོས་པའི་ཕྱིར་དང་། གང་ཟག་དང་ཆོས་ལ་བདག་མེད་པ་ཤིན་ཏུ་ཟབ་པ་ལ་མོས་པའི་ཕྱིར་བདག་ལྟ་བུ་གང་ཟག་ལ་བདག་མེད་པ་ཙམ་རྟོགས་པ་དག་པས་དེ་དེ་དག་ངོ་མཚར་རབ་དང་ལྡན་པར་འགྱུར་རོ་༎ 
 bhūtasaṃjñām ityaviparītārthasaṃjñām,	ཡང་དག་པར་འདུ་ཤེས་ཞེས་བྱ་བ་ནི་།
 na tu śabdābhiniveśenedaṃ bhūtatvamiti saṃjñā |	དོན་ཕྱིན་ཅི་མ་ལོག་པར་འདུ་ཤེས་པ་ལ་བྱའི་སྒྲ་ཇི་བཞིན་དུ་མངོན་པར་ཞེན་ནས་འདི་ནི་ཡང་དག་པའོ་སྙམ་དུ་འདུ་ཤེས་པ་ལ་ནི་མི་བྱའོ་༎ 
 evamatra paramārthabhipretya sarvadharmaniḥsvabhāvatvaṃ nirdiṣṭam, na tu saṃvṛtim, niḥsvabhāvatāyā abhāvāttatra |	འདི་ལྟར་འདིར་ཆོས་ཐམས་ཅད་རང་བཞིན་མེད་པ་དོན་དམ་པ་ལ་དགོངས་ནས་བསྟན་གྱི་ཀུན་རྫོབ་ཏུ་ནི་རང་བཞིན་མེད་པ་མ་ཡིན་པའི་ཕྱིར་རོ་༎
 tasmānna darśanadinā virodha ityabhiprāyaḥ |	དེས་ན་མཐོང་བ་ལ་སོགས་པ་དང་འགལ་བ་མ་ཡིན་ནོ་སྙམ་དུ་དགོངས་པའོ་༎
 nanu bhūtasaṃjñāyāṃ satyāṃ, saṃjñāyā api sattvaṃ paramārthataḥ syāt,	གལ་ཏེ་ཡང་དག་པར་འདུ་ཤེས་པ་ཡོད་པ་ན་འདུ་ཤེས་ཡོད་པར་བྱ་བ་ཡང་དོན་དམ་པར་ཡོད་པར་འགྱུར་ཏེ་།
 asatsu ca saṃjñeyeṣu saṃjñāyā apyabhāvaḥ prasajyeta,	འདུ་ཤེས་པར་བྱ་བ་མེད་ན་འདུ་ཤེས་ཀྱང་མེད་པར་ཐལ་བར་འགྱུར་བའི་ཕྱིར་རོ་༎
 tasmāt kathaṃ paramārthataḥ sarvadharmaniḥsvabhāvatvaṃ sidhyedityupālambhaṃ vicintya tatkasya hetoḥ? ityavocat |	དེའི་ཕྱིར་ཆོས་ཐམས་ཅད་དོན་དམ་པར་རང་བཞིན་མེད་པར་ཇི་ལྟར་འགྲུབ་སྙམ་དུ་སེམས་པའི་ཀླན་ཀ་ལ་བརྟགས་ནས་། དེ་ཅིའི་སླད་དུ་ཞེས་བྱ་བ་གསོལ་ཏེ་།
 yā caiṣā bhagavan, bhūtasaṃjñā ityuadatarat | saṃjñānāma na kācana,	ལན་དུ་བཅོམ་ལྡན་འདས་ཡང་དག་པར་འདུ་ཤེས་པ་གང་ལགས་པ་ཞེས་བྱ་བ་གསོལ་ཏོ་༎
 ekānekasvabhāvena viyogāt, paramārthataḥ sā asaṃjñaiva | ata eva nocyate bhūtasaṃjñeyaṃ bhūtasaṃjñātveneti darśitam,	འདུ་ཤེས་པར་བྱ་བ་དང་། གང་ཡང་མེད་པ་དང་། གཅིག་དང་དུ་མའི་རང་བཞིན་དང་བྲལ་བའི་ཕྱིར་དོན་དམ་པར་དེ་ཉིད་འདུ་ཤེས་མེད་པ་སྟེ་། དེའི་ཕྱིར་ཡང་དག་པར་འདུ་ཤེས་པ་དེ་ལ་ཡང་དག་པར་འདུ་ཤེས་པར་མི་བྱའོ་ཞེས་། བསྟན་ཏོ་༎ 
 yato hyavicāraramaṇīyamātrataḥ vidyate tasmāt tāṃ tathāgato bhāṣate bhūtasaṃjñā,	གང་གི་ཕྱིར་མ་བརྟགས་ན་དགའ་བ་ཙམ་དུ་ཡོད་པ་དེའི་ཕྱིར་དེ་ཡང་དག་པར་འདུ་ཤེས་ཞེས་དེ་བཞིན་གཤེགས་པ་གསུང་། བསྟན་ཏོ་༎ ངོ་༎ 
 anyathā sarvathābhāvānna bhāṣeta |	དེ་ལྟ་མ་ཡིན་ན་རྣམ་པ་ཐམས་ཅད་དུ་མེད་པའི་ཕྱིར་གསུང་བར་མི་འགྱུར་རོ་༎
 tataḥ paramārthavyavasthāyāṃ kathaṃ yogasamāpattyā pratipattavyam,	འདིས་ནི་དོན་དམ་པར་རྣམ་པར་འཇོག་ཅིང་ཇི་ལྟར་རྣལ་འབྱོར་དུ་སྙོམས་པར་འཇུག་པས་བསྒྲུབ་པར་བྱ་བ་དང་། 
 kathaṃ ca vikṣepo nigrahītavya ityubhayaṃ darśitaṃ gāmbhīryañcāpi nigaditam,	ཇི་ལྟར་རྣམ་པར་ག-ཡེང་བ་ཚར་གཅད་པར་བྱ་བ་༄༢༣༧བ་དེ་གཉི་ག་བསྟན་བྱ་བ་དང་། ཏོ་༎ ཟབ་པ་ཡང་བརྗོད་དོ་༎
 adhyāropāpavādāntāvapi parihṛtau |	སྒྲོ་འདོགས་པ་དང་སྐུར་པ་འདེབས་པའི་མཐའ་ཡང་སྤངས་སོ་༎
 teṣu kusīdeṣvevāścaryotpādanārtham na mama bhagavan, āścaryaṃ yadahamimaṃ dharmaparyāyaṃ bhāṣyamāṇamavakalpayāmi, adhimucye, ye 'pi te bhagavan,	ལེ་ལོ་ཅན་དེ་དག་ཉིད་ངོ་མཚར་བ་བསྐྱེད་པའི་ཕྱིར་བདག་ཆོས་ཀྱི་རྣམ་གྲངས་འདི་བཤད་པ་ལ་རྟོག་ཅིང་མོས་པ་ནི་བདག་ལ་ངོ་མཚར་མ་ལགས་ཀྱི་། 
 sattvā bhaviṣyantyanāgate 'dhvani paścime kāle paścime (vajraṭ_165) samaye paścimāyāṃ pañcaśatyāṃ ye imaṃ bhagavan, dharmaparyāyam udgrahīṣyanti,	བཅོམ་ལྡན་འདས་སླད་མའི་ཚེ་སླད་མའི་དུས་ལྔ་བརྒྱ་པ་ཐ་མ་ལ་སེམས་ཅན་གང་དག་ཆོས་ཀྱི་རྣམ་གྲངས་འདི་ལེན་པ་མ་ལགས་ཀྱི་། དང་། 
 dhārayiṣyanti, paryavāpsyanti, te paramāścaryeṇa samanvāgatā bhaviṣyanti ityāha |	འཛིན་པ་དང་། ཀུན་ཆུབ་པར་བགྱིད་པ་དེ་དག་ནི་ངོ་མཚར་རབ་དང་ལྡན་པར་འགྱུར་ལགས་སོ་ཞེས་བྱ་བ་གསོལ་ཏོ་༎ 
 atrāyaṃ sāmānyena samāsārthaḥ- anāgate saddharmavipralopakāle ye bodhisattvā imaṃ dharmaparyāyaṃ dhārayiṣyanti,	འདིའི་ཕྱིར་བསྡུ་བའི་དོན་འདི་ཡིན་ཏེ་མ་འོངས་པ་ན་དམ་པའི་ཆོས་རབ་ཏུ་རྣམ་པར་འཇིག་པར་འགྱུར་བའི་དུས་ན་བྱང་ཆུབ་སེམས་དཔའ་གང་དག་ཆོས་ཀྱི་རྣམ་གྲངས་འདི་འཛིན་གསོལ་ཏོ་༎ པར་འགྱུར་ལ་། 
 na te pudgalādibhirgṛhītā bhaviṣyanti,	དེ་དག་གང་ཟག་ལ་སོགས་པར་འཛིན་པར་མི་འགྱུར་བ་དེ་ལྟ་བུ་དག་ཀྱང་འབྱུང་བར་འགྱུར་ན་།
 mayyapyevaṃ sambhāvanāyāṃ saddharmotthānakāle 'pi yuṣmākametādṛśapratipattyabhāve idamatyantaṃ lajjāsthānaṃ tat syādityucyate |	ཁྱེད་ཅག་དམ་པའི་ཆོས་ཀྱི་དགའ་སྟོན་དང་བཅས་པའི་དུས་ན་ཡང་སྒྲུབ་པ་དེ་འདྲ་བ་མེད་པས་ན་འདི་ནི་ཁྱེད་ཀྱི་ཤིན་ཏུ་ངོ་ཚ་བའི་གནས་ཡིན་ནོ་ཞེས་བྱ་བའོ་༎
 tatra 'aham'; iti padgalanairātmyaṃ bodhyate,	དེ་ལ་བདག་ཅེས་བྱ་བ་ནི་གང་ཟག་ལ་བདག་མེད་པར་རྟོགས་པའོ་༎
 imaṃ ityanena pudgaladharmanairātmyaṃ prakāśyate,	འདི་ཞེས་བྱ་བ་ནི་གང་ཟག་དང་ཆོས་ལ་བདག་མེད་པར་ཡོངས་སུ་སྟོན་པའོ་༎
 bhāṣyamāṇam iti tu sākṣāt prākāśyamānaṃ bhagavatā,	བཤད་པ་ལ་ཞེས་བྱ་བ་ནི་བཅོམ་ལྡན་འདས་ཀྱིས་མངོན་སུམ་དུ་གསལ་བར་མཛད་པའོ་༎
 avakalpayāmi iti prasādākāraḥ prasannatā saṃdarśyate,	རྟོག་པ་ཞེས་བྱ་བ་ནི་དང་བའི་རྣམ་པ་སྟེ་དང་བར་སྟོན་ཏོ་༎
 adhimucye iti sampratyayaśca,	མོས་པ་ཞེས་བྱ་བ་ནི་ཡིད་ཆེས་པའི་རྣམ་པའོ་༎
 te sattvāḥ ityanena bhagavan, anāgate kalpe bhāvinaḥ |	སེམས་ཅན་དེ་དག་ཅེས་བྱ་བ་ནི་བཅོམ་ལྡན་འདས་བསྐལ་པ་མ་འོངས་པའི་དུས་ན་འབྱུང་བ་དག་གོ་༎ 
 atrodgrahīṣyantītyādīni yāni padāni tāni pūrvamevoktāni |	འདིར་ལེན་པ་ལ་སོགས་པའི་ཚིག་སྨོས་པ་གང་ཡིན་པ་དེ་ནི་སྔར་བཤད་པར་དག་གོ་༎ ཟད་དོ་༎ དེ་ནི་འདི་སྐད་དུ་བསྟན་པར་འགྱུར་ཏེ་།
