skt	tib
 vasubandhu: triṃśikāvijñaptikārikā namo buddhāya ||	༄༡༤༦བ་༅་༎ རྒྱ་གར་སྐད་དུ་། ཏྲིམ་ཤི་ཀ་བྷའ་ཤྱམ་། བོད་སྐད་དུ་། སུམ་ཅུ་པའི་བཤད་པ་། བམ་པོ་དང་པོ་། འཇམ་དཔལ་གཞོན་ནུར་གྱུར་པ་ལ་ཕྱག་འཚལ་ལོ་༎
 pudgaladharmanairātmyayor apratipannavipratipannānām aviparītapudgaladharmanairātmyapratipādanārthaṃ triṃśikāvijñaptiprakaraṇārambhaḥ |	གང་ཟག་དང་ཆོས་ལ་བདག་མེད་པ་མ་རྟོགས་པ་དང་ལོག་པར་རྟོགས་པ་རྣམས་ལ་གང་ཟག་དང་ཆོས་ལ་བདག་མེད་པ་མ་ལོག་པར་བསྟན་པའི་ཕྱིར་། རྣམ་པར་རིག་པའི་རབ་ཏུ་བྱེད་པ་སུམ་ཅུ་པ་བརྩམས་སོ་༎
 pudgaladharmanairātmyapratipādanaṃ punaḥ kleśajñeyāvaraṇaprahāṇārtham |	དེ་ལ་གང་ཟག་དང་ཆོས་ལ་བདག་མེད་པར་བསྟན་པའང་ཉོན་མོངས་པ་དང་ཤེས་བྱའི་སྒྲིབ་པ་སྤངས་པའི་ཕྱིར་ཏེ་།
 tathā hy ātmadṛṣṭiprabhavā rāgādayaḥ kleśāḥ pudgalanairātmyāvabodhaś ca satkāyadṛṣṭeḥ pratipakṣatvāt tatprahāṇāya pravartamānaḥ sarvakleśān prajahāti |	འདི་ལྟར་འདོད་ཆགས་ལ་སོགས་པ་ཉོན་མོངས་པ་རྣམས་ནི་བདག་ཏུ་ལྟ་བ་ལས་བྱུང་ངོ་༎ གང་ཟག་ལ་བདག་མེད་པར་ཁོང་དུ་ཆུད་པ་ནི་འཇིག་ཚོགས་ལ་ལྟ་བའི་གཉེན་པོ་ཡིན་པས་ན་དེ་སྤངས་ན་ཉོན་མོངས་པ་ཐམས་ཅད་སྤོང་བར་འགྱུར་རོ་༎ 
 dharmanairātmyajñānād api jñeyāvaraṇapratipakṣatvāt jñeyāvaraṇaṃ prahīyate |	ཆོས་ལ་བདག་མེད་པར་ཤེས་པ་ཡང་ཤེས་བྱའི་སྒྲིབ་པའི་གཉེན་པོ་ཡིན་པས་ཤེས་བྱའི་སྒྲིབ་པ་སྤོང་བར་འགྱུར་རོ་༎
 kleśajñeyāvaraṇaprahāṇam api mokṣasarvajñatvādhigamārtham |	ཉོན་མོངས་པ་དང་ཤེས་བྱའི་སྒྲིབ་པ་སྤང་བ་ཡང་ཐར་པ་དང་ཐམས་ཅད་མཁྱེན་བ་ཐོབ་པར་བྱ་བའི་ཕྱིར་རོ་༎
 kleśā hi mokṣaprāpter āvaraṇam iti atas teṣu prahīṇeṣu mokṣo 'dhigamyate |	ཉོན་མོངས་པ་རྣམས་ནི་ཐར་པ་འཐོབ་པ་ལ་བསྒྲིབས་པས་དེའི་ཕྱིར་དེ་དག་སྤངས་ན་ཐར་པ་འཐོབ་པར་འགྱུར་རོ་༎
 jñeyāvaraṇam api sarvasmin jñeye jñānapravṛttipratibandhabhūtam akliṣṭam ajñānam |	ཤེས་བྱའི་སྒྲིབ་བ་ནི་ཤེས་བྱ་ཐམས་ཅད་ལ་ཡེ་ཤེས་འཇུག་པའི་བར་དུ་གཅོད་པར་གྱུར་པ་ཉོན་མོངས་པ་ཅན་མ་ཡིན་པའི་མི་ཤེས་པ་སྟེ་། 
 tasmin prahīṇe sarvākāre jñeye 'saktam apratihatañ ca jñānaṃ pravartata ity ataḥ sarvajñatvam adhigamyate |	དེ་སྤངས་ན་ཤེས་བྱའི་རྣམ་པ་ཐམས་ཅད་ཀུན་ལ་ཆགས་པ་མེད་པ་དང་། ཐོགས་པ་མེད་པའི་ཡེ་ཤེས་འཇུག་སྟེ་། དེའི་ཕྱིར་ཐམས་ཅད་མཁྱེན་པ་ཐོབ་པར་འགྱུར་རོ་༎
 atha vā dharmapudgalābhiniviṣṭāś cittamātraṃ yathābhūtaṃ na jānantīty ato dharmapudgalanairātmyapradarśanena saphale vijñaptimātre 'nupūrveṇa praveśārthaṃ prakaraṇārambhaḥ |	ཡང་ན་ཆོས་དང་གང་ཟག་ལ་མངོན་པར་ཞེན་པ་དག་སེམས་ཙམ་དུ་ཡང་དག་པ་ཇི་ལྟ་བ་བཞིན་དུ་རབ་ཏུ་མི་ཤེས་ཏེ་། དེའི་ཕྱིར་ཆོས་དང་གང་ཟག་ལ་བདག་མེད་པར་བསྟན་པས་རྣམ་པར་རིག་པ་ཙམ་འབྲས་བུ་དང་བཅས་པ་ལ་མཐར་གྱིས་འཇུག་༄༡༤༧ཨ་༌་༎ པར་བྱ་བའི་ཕྱིར་རབ་ཏུ་བྱེད་པ་འདི་བརྩམས་སོ་༎
 atha vā vijñānavad vijñeyam api dravyata eveti kecin manyante | vijñeyavad vijñānam api saṃvṛtita eva na paramārthata ity asya dviprakārasyāpy ekāntavādasya pratiṣedhārthaḥ prakaraṇārambhaḥ ||	ཡང་ན་རྣམ་པར་ཤེས་པ་བཞིན་དུ་ཤེས་བྱ་ཡང་རྫས་ཉིད་དུ་ཁ་ཅིག་སེམས་པ་དང་། གཞན་དག་ཤེས་བྱ་བཞིན་དུ་རྣམ་པར་ཤེས་པ་ཡང་ཀུན་རྫོབ་ཉིད་དུ་ཡོད་ཀྱི་དོན་དམ་པར་ནི་མེད་དོ་སྙམ་དུ་སེམས་པ་མཐའ་གཅིག་ཏུ་སྨྲ་བ་འདི་རྣམ་པ་གཉིས་དགག་པའི་ཕྱིར་རབ་ཏུ་བྱེད་པ་འདི་བརྩམས་སོ་༎
 ātmadharmopacāro hi vividho yaḥ pravartate | 1ab	བདག་དང་ཆོས་སུ་ཉེར་འདོགས་པ་༎ སྣ་ཚོགས་དག་ནི་གང་བྱུང་བ་༎
 lokaśāstrayor iti vākyaśeṣaḥ |	འཇིག་རྟེན་པ་དང་བསྟན་བཅོས་ལའོ་༎ ཞེས་བྱ་བ་ནི་ཚིག་གི་ལྷག་མའོ་༎
 vijñānapariṇāme 'sau | 1c	དེ་ནི་རྣམ་པར་ཤེས་པར་གྱུར་༎
 ātmadharmopacāra iti saṃbadhyate |	བདག་དང་ཆོས་སུ་ཉེར་འདོགས་པ་༎ ཞེས་བྱ་བ་དང་སྦྱར་རོ་༎
 ātmā dharmāś copacaryanta ity ātmadharmopacāraḥ |	བདག་དང་ཆོས་སུ་ཉེ་བར་འདོགས་པས་། བདག་དང་ཆོས་སུ་ཉེར་འདོགས་པ་སྟེ་།
 sa punar ātmaprajñaptir dharmaprajñaptiś ca |	དེ་ཡང་བདག་ཏུ་བཏགས་པ་དང་། ཆོས་སུ་བཏགས་པའོ་༎
 vividha ity anekaprakāraḥ |	སྣ་ཚོགས་ཞེས་བྱ་བ་ནི་རྣམ་པ་དུ་མ་སྟེ་།
 ātmā jīvo jantur manujo māṇava ity evamādika ātmopacāraḥ skandhā dhātava āyatanāni rūpaṃ vedanā saṃjñā saṃskārā vijñānam ity evamādiko dharmopacāraḥ	བདག་དང་སྲོག་དང་། སྐྱེ་བ་པོ་དང་། ཤེད་ལས་སྐྱེས་པ་དང་། ཤེད་བུ་དང་། དེ་དག་ལ་སོགས་པ་དག་ནི་བདག་ཏུ་ཉེ་བར་འདོགས་པའོ་༎ ཕུང་པོ་དང་། ཁམས་དང་། སྐྱེ་མཆེད་རྣམས་དང་། གཟུགས་དང་། ཚོར་བ་དང་། འདུ་ཤེས་དང་། འདུ་བྱེད་དང་། རྣམ་པར་ཤེས་པ་དང་། དེ་དག་ལ་སོགས་པ་དག་ནི་ཆོས་སུ་ཉེ་བར་འདོགས་པའོ་༎
 ayaṃ dviprakāro 'py upacāro vijñānapariṇāma eva na mukhye ātmani dharmeṣu ceti | kuta etat |	ཉེ་བར་འདོགས་པ་འདི་རྣམས་གཉིས་ནི་རྣམ་པར་ཤེས་པ་གྱུར་པ་ཉིད་དེ་།
 dharmāṇām ātmanaś ca vijñānapariṇāmād bahir abhāvāt |	བདག་གམ་ཆོས་རྣམས་དངོས་པོ་ལ་ཉེ་བར་འདོགས་པ་ནི་མ་ཡིན་ནོ་ཞེས་བྱ་བ་དེ་ཇི་ལྟ་བུ་ཞེན་ཆོས་རྣམས་དང་། བདག་ནི་རྣམ་པར་ཤེས་པ་གྱུར་པ་ལས་ཕྱི་རོལ་ན་མེད་པའི་ཕྱིར་རོ་༎
 ko 'yaṃ pariṇāmo nāma |	གྱུར་ཞེས་བྱ་བ་དེ་གང་ཞེ་ན་།
 anyathātvam |	གཞན་དུ་གྱུར་པ་སྟེ་།
 kāraṇakṣaṇanirodhasamakālaḥ kāraṇakṣaṇavilakṣaṇaḥ kāryasyātmalābhaḥ pariṇāmaḥ |	རྒྱུའི་སྐད་ཅིག་འགག་པ་དང་། དུས་མཉམ་དུ་རྒྱུའི་སྐད་ཅིག་དང་མི་འབྲལ་བ་འབྲས་བུའི་བདག་ཉིད་ཐོབ་པ་ནི་གྱུར་པའོ་༎
 tatrātmādivikalpavāsanāparipoṣād rūpādivikalpavāsanāparipoṣāc cālayavijñānād ātmādinirbhāso vikalpo rūpādinirbhāsaś cotpadyate |	དེ་ལ་བདག་ལ་སོགས་པར་རྣམ་པར་རྟོག་པའི་བག་ཆགས་ཡོངས་སུ་བརྟས་ཤིང་གཟུགས་ལ་སོགས་པ་རྣམ་པར་རྟོག་པའི་བག་ཆགས་ཡོངས་སུ་བརྟས་ན་ཀུན་གཞི་རྣམ་པར་ཤེས་པ་ལས་བདག་ལ་སོགས་པར་སྣང་བ་དང་། གཟུགས་ལ་སོགས་པར་སྣང་བའི་རྣམ་པར་རྟོག་པ་འབྱུང་ངོ་༎
 [tvbh_42] tam ātmādinirbhāsaṃ rūpādinirbhāsañ ca tasmād vikalpād bahirbhūtam ivopādāyātmādyupacāro rūpādidharmopacāraś cānādikālikaḥ pravartate vināpi bāhyenātmanā dharmaiś ca |	དེ་ལ་བདག་ལ་སོགས་པར་སྣང་བ་དང་། གཟུགས་ལ་སོགས་པར་སྣང་བ་ཡང་ཕྱི་རོལ་གྱི་བདག་དང་། ༄༡༤༧བ་ཆོས་རྣམས་མེད་པར་རྣམ་པར་རྟོག་པ་དེ་ལས་ཕྱི་རོལ་དུ་གྱུར་པ་ལྟ་བུ་རྒྱུར་བྱས་ནས་། བདག་ལ་སོགས་པར་ཉེ་བར་འདོགས་པ་དང་། གཟུགས་ལ་སོགས་པ་ཆོས་སུ་ཉེ་བར་འདོགས་པ་ཐོག་མ་མེད་པའི་དུས་ནས་འཇུག་སྟེ་།
 tad yathā taimirikasya keśoṇḍukādyupacāra iti |	དཔེར་ན་རབ་རིབ་ཅན་གྱིས་སྐྲ་ཤད་འཛིངས་པ་ལ་སོགས་པ་མཐོང་བ་བཞིན་ནོ་༎
 yac ca yatra nāsti tat tatropacaryate | tad yathā bāhīke gauḥ |	ཉེ་བར་འདོགས་པ་ཞེས་བྱ་བ་ནི་གང་ལ་གང་མེད་པ་དེ་ལ་དེ་ཉེ་བར་འདོགས་ཏེ་། དཔེར་ན་མི་བླུན་པོ་ལ་བ་ལང་ཞེས་བྱ་བ་ལྟ་བུའོ་༎
 evaṃ vijñānasvarūpe bahiś cātmadharmābhāvāt parikalpita evātmā dharmāś ca na tu paramārthataḥ santīti vijñānavad vijñeyam api dravyata evety ayam ekāntavādo nābhyupeyaḥ |	དེ་ལྟར་ན་རྣམ་པར་ཤེས་པའི་རང་གི་ངོ་བོ་དང་། ཕྱི་རོལ་ན་ཡང་བདག་དང་ཆོས་རྣམས་མེད་པས་བདག་དང་ཆོས་རྣམས་ཀུན་དུ་བརྟགས་པ་ཉིད་དེ་། དོན་དམ་པར་ཡོད་པ་མ་ཡིན་པས་ཤེས་བྱ་ཡང་རྣམ་པར་ཤེས་པ་བཞིན་དུ་རྫས་ཉིད་དོ་ཞེས་མཐའ་གཅིག་ཏུ་སྨྲ་བ་འདི་ཁས་མི་། བླང་ངོ་༎ 
 upacārasya ca nirādhārasyāsaṃbhavād avaśyaṃ vijñānapariṇāmo vastuto 'stīty upagantavyo yatrātmadharmopacāraḥ pravartate |	ཉེ་བར་འདོགས་པ་ནི་གཞི་མེད་པར་མི་སྲིད་པས་གང་ལ་བདག་དང་ཆོས་སུ་ཉེ་བར་འདོགས་པ་འབྱུང་བའི་རྣམ་པར་ཤེས་པ་གྱུར་པ་དངོས་པོ་ཡོད་པར་ངེས་ང་ར་། བླང་ངོ་༎ ཁས་བླང་ངོ་༎ 
 ataś cāyam abhyupagamo na yuktikṣamo vijñānam api vijñeyavat saṃvṛtita eva na paramārthata iti |	དེ་བས་ན་རྣམ་པར་ཤེས་པ་ཡང་ཤེས་བྱ་བཞིན་དུ་ཀུན་རྫོབ་ཉིད་དེ་། དོན་དམ་པར་མེད་དོ་ཞེས་ཁས་ལེན་པ་དེས་རིགས་པ་མི་བཟོད་དེ་།
 saṃvṛtito 'py abhāvaprasaṅgān na hi saṃvṛtir nirupādānā yujyate |	ཀུན་རྫོབ་ཏུ་ཡང་དངོས་པོ་མེད་པར་འགྱུར་བའི་ཕྱིར་རོ་༎ རྟེན་མེད་ན་ཀུན་རྫོབ་དུ་མི་རུང་བ་སྟེ་།
 tasmād ayam ekāntavādo dviprakāro 'pi niryuktikatvāt tyājya ity ācāryavacanam |	དེ་བས་ན་མཐའ་གཅིག་ཏུ་སྨྲ་བ་རྣམ་པ་འདི་གཉིས་ཡང་མི་རིགས་པའི་ཕྱིར་བཏང་ངོ་ཞེས་སློབ་དཔོན་གྱི་ཚིག་གོ་༎
 evañ ca sarvaṃ vijñeyaṃ parikalpitasvabhāvatvād vastuto na vidyate vijñānaṃ punaḥ pratītyasamutpannatvād dravyato 'stīty abhyupeyam |	དེ་ལྟར་ན་ཤེས་བྱ་ཐམས་ཅད་ཀུན་བརྟགས་པའི་ངོ་བོ་ཉིད་ཡིན་པས་དངོས་པོ་མེད་དོ་༎ རྣམ་པར་ཤེས་བ་ནི་རྟེན་ཅིང་འབྲེལ་བར་འབྱུང་བས་རྫས་སུ་ཡོད་པར་ཁས་བླང་ངོ་༎
 pratītyasamutpannatvaṃ punar vijñānasya pariṇāmaśabdena jñāpitam |	རྣམ་པར་ཤེས་པ་རྟེན་ཅིང་འབྲེལ་བར་འབྱུང་བ་ནི་གྱུར་བའི་སྒྲས་བསྟན་པའོ་༎
 katham etad gamyate vinā bāhyenārthena vijñānam evārthākāram utpadyata iti |	ཕྱི་རོལ་གྱི་དོན་མེད་པར་རྣམ་པར་ཤེས་པ་ཉིད་དོན་གྱི་རྣམ་པར་འབྱུང་བ་འདི་ཇི་ལྟར་ཤེས་པར་རུང་ཞེ་ན་།
 bāhyo hy arthaḥ svābhāsavijñānajanakatvena vijñānasyālambanapratyaya iṣyate na kāraṇatvamātreṇa samanantarādipratyayād viśeṣāprasaṅgāt |	ཕྱི་རོལ་གྱི་དོན་ནི་བདག་སྣང་བའི་རྣམ་པར་ཤེས་པ་སྐྱེད་པའི་ཕྱིར་རྣམ་པར་ཤེས་པའི་དམིགས་པའི་རྐྱེན་དུ་འདོད་ཀྱི་བྱེད་རྒྱུ་ཙམ་དུ་འདོད་པ་ནི་མ་ཡིན་ཏེ་། དེ་མ་ཐག་པའི་རྐྱེན་ལ་སོགས་པ་དང་བྱེ་བྲག་མེད་པར་འགྱུར་བའི་ཕྱིར་རོ་༎
 sañcitālambanāś ca pañcavijñānakāyās tadākāratvāt |	རྣམ་པར་ཤེས་པའི་ཚོགས་ལྔ་པོ་དག་ནི་བ་བསྩགས་པ་ལ་དམིགས་པ་སྟེ་། དེའི་རྣམ་པ་དང་འདྲ་བའི་ཕྱིར་རོ་༎ བསྩགས་པ་ནི་ཆ་༄༡༤༨ཨ་༌་༎
 na ca sañcitam avayavasaṃhatimātrād anyad vidyate |	ཤས་འདུས་པ་ཙམ་ལས་གུད་ན་མེད་དེ་།
 tadavayavān apohya sañcitākāravijñānābhāvāt |	ཆ་ཤས་དེ་དག་བརྩལ་ན་བསྩགས་པའི་རྣམ་པའི་རྣམ་པར་ཤེས་པ་མེད་པའི་ཕྱིར་རོ་༎
 tasmād vinaiva bāhyenārthena vijñānaṃ sañcitākāram utpadyate |	དེ་བས་ན་ཕྱི་རོལ་གྱི་དོན་མེད་པར་རྣམ་པར་ཤེས་པ་བསྩགས་པའི་རྣམ་པར་འབྱུང་ངོ་༎
 na ca paramāṇava eva saṃcitās tasyālambanaṃ paramāṇūnām atadākāratvāt |	རྡུལ་ཕྲ་རབ་བསགས་པ་དག་ཉིད་ནི་རྡུལ་ཕྲ་རབ་དག་ནི་དེའི་རྣམ་པ་མ་ཡིན་པའི་ཕྱིར་རོ་༎ 
 na hy asañcitāvasthātaḥ sañcitāvasthāyāṃ paramāṇūnāṃ kaścid ātmātiśayaḥ |	རྡུལ་ཕྲ་རབ་རྣམས་མ་བསྩགས་པའི་དུས་ན་ཡང་རང་བཞིན་བྱེ་བྲག་ཏུ་གྱུར་བ་ཅི་རོ་༎ ཡང་མེད་དེ་། 
 tasmād asañcitavat sañcitā api paramāṇavo naivālambanam |	དེ་བས་ན་རྡུལ་ཕྲ་རབ་རྣམས་མ་བསྩགས་པ་བཞིན་དུ་བསྩགས་པ་ཡང་དམིགས་པར་མི་རུང་ངོ་༎
 anyas tu manyate | ekaika paramāṇur anyanirapekṣyo 'tīndriyo bahavas tu parasparāpekṣā indriyagrāhyāḥ |	གཞན་དག་རྡུལ་ཕྲ་རབ་རེ་རེ་གཞན་ལ་མི་ལྟོས་པ་ནི་དབང་པོས་མི་རྟོགས་ཀྱི་།
 teṣām api sāpekṣanirapekṣāvasthayor ātmātiśayābhāvād ekāntenendriyagrāhyatvam atīndriyatvaṃ vā |	དབང་པོ་ཕན་ཚུན་ལྟོས་པ་ནི་དབང་པོས་བཟུང་བའོ་སྙམ་དུ་སེམས་པ་དེ་དག་གི་ཡང་ལྟོས་པ་དང་མི་ལྟོས་པའི་དུས་ན་རང་བཞིན་བྱེ་བྲག་ཏུ་གྱུར་པ་མེད་པས་དབང་པོས་གཟུང་བའམ་། དབང་པོས་མི་རྟོགས་པ་གཅིག་ཏུ་འགྱུར་རོ་༎
 yadi ca paramāṇava eva parasparāpekṣā vijñānasya viṣayībhavanti |	གལ་ཏེ་ཕན་ཚུན་ལྟོས་པའི་རྡུལ་ཕྲ་རབ་ཉིད་རྣམ་པར་ཤེས་པའི་ཡུལ་དུ་གྱུར་དུ་ཟིན་ན་ནི་། 
 evaṃ sati yo 'yaṃ ghaṭakuḍyādyākārabhedo vijñāne sa na syāt praramāṇūnām atadākāratvāt |	དེ་ལྟ་ན་བུམ་པ་དང་རྩིག་པ་ལ་སོགས་པའི་རྣམ་པ་ཐ་དད་པ་གང་ཡིན་པ་དེ་རྣམ་པར་ཤེས་པ་ལ་འབྱུང་བར་མི་ནི་། འགྱུར་ཏེ་། རྡུལ་ཕྲ་རབ་དག་དེའི་རྣམ་པ་མ་ཡིན་པའི་ཕྱིར་རོ་༎
 na cānyanirbhāsasya vijñānasyānyākāro viṣayo yujyate 'tiprasaṅgāt |	རྣམ་པར་ཤེས་པ་ལ་སྣང་བ་ཡང་གཞན་ལ་ཡུལ་ཡང་རྣམ་པ་གཞན་དུ་ནི་ཧ་ཅང་ཐལ་བར་འགྱུར་བས་མི་རིགས་སོ་༎
 na ca paramāṇavaḥ stambhādivat paramārthataḥ santy| arvāṅmadhyaparabhāgasadbhāvāt |	རྡུལ་ཕྲ་རབ་དག་ཀྱང་ཚུ་རོལ་དང་ཕ་རོལ་དང་དབུས་ཀྱི་ཆ་ཡོད་པས་ཀ་བ་ལ་སོགས་པ་བཞིན་དུ་དོན་དམ་པར་ཡོད་པ་མ་ཡིན་ནོ་༎ 
 tadanabhyupagame vā pūrvadakṣiṇāparottarādidigbhedo yaḥ sa paramāṇor na syāt |	དེ་ནི་ཁས་མི་ལེན་ན་ནི་རྡུལ་ཕྲ་རབ་ལ་ཤར་དང་། ལྷོ་དང་། ནུབ་དང་༏་བྱང་ལ་སོགས་པའི་ཕྱོགས་ཐ་དད་པ་མེད་པར་འགྱུར་རོ་༎
 tataś ca vijñānavat paramāṇor apy amūrtatvam adeśasthatvañ ca prasajyate |	དེའི་ཕྱིར་རྣམ་པར་ཤེས་པ་བཞིན་དུ་རྡུལ་ཕྲ་རབ་ཀྱང་ལུས་པ་མེད་པ་དང་། ཡུལ་ན་མི་གནས་པར་འགྱུར་རོ་༎
 evaṃ bāhyārthābhāvād vijñānam evārthākāram utpadyate svapnavijñānavad ity abhyupeyam |	དེ་ལྟ་ན་འོ་ན་ཕྱི་རོལ་གྱི་དོན་མེད་པའི་ཕྱིར་རྣམ་པར་ཤེས་པ་ཉིད་དོན་གྱིས་རྣམ་པར་འབྱུང་སྟེ་། རྨི་ལམ་གྱི་རྣམ་པར་ཤེས་པ་དང་མཚུངས་པར་ཁས་བླང་ངོ་༎
 vedanādayo 'pi nātītānāgatās tadākāravijñānajanakā niruddhājātatvāt |	ཚོར་བ་ལ་སོགས་པ་དག་ཀྱང་འདས་པ་དང་མ་འོངས་པ་ནི་དེའི་རྣམ་པའི་རྣམ་པར་ཤེས་པ་སྐྱེད་པ་མ་ཡིན་ཏེ་། འགག་པ་དང་མ་སྐྱེས་པའི་ཕྱིར་རོ་༎
 na ca vartamānā vartamānajanakā utpadyamānāvasthāyām asattvāt |	ད་ལྟར་གྱི་དག་ཀྱང་ད་ལྟར་གྱི་རྣམ་པར་ཤེས་པ་སྐྱེད་པ་མ་ཡིན་ཏེ་། སྐྱེ་བའི་༄༡༤༨བ་ཚེ་ན་ནི་མེད་པའི་ཕྱིར་རོ་༎
 [tvbh_46] utpannāvasthāyāṃ vijñānasyāpi tadākāreṇotpannatvān na kiñcit kartavyam astīti manovijñānam apy anālambanam evotpadyate | anyas tv āha |	སྐྱེས་པའི་ཚེ་ན་ནི་རྣམ་པར་ཤེས་པ་ཡང་དེའི་རྣམ་པར་ཤེས་པའི་ཕྱིར་བྱ་བ་ཅུང་ཟད་ཀྱང་མེད་པས་ཡིད་ཀྱི་རྣམ་པར་ཤེས་པ་ཡང་དམིགས་པ་མེད་པ་ཉིད་དུ་སྐྱེའོ་༎
 asaty ātmani mukhye dharmeṣu copacāro na yujyate |	གཞན་དག་ན་རེ་བདག་དང་ཆོས་དམིགས་སུ་མེད་ན་ཉ་བར་འདོགས་པར་མི་རུང་སྟེ་།
 upacāro hi triṣu satsu bhavati nānyatamābhāve mukhyapadārthe tatsadṛśe 'nyasmin viṣaye tayoś ca sādṛśye |	ཉེ་བར་འདོགས་པ་ནི་གསུམ་ཡོད་ན་འགྱུར་གྱི་། གང་ཡང་རུང་བ་ཞིག་མེད་ན་མི་འགྱུར་ཏེ་། དོན་གྱི་དངོས་དང་། དེ་དང་འདྲ་བའི་ཡུལ་གཞན་དང་། དེ་གཉི་ག་དང་འདྲ་བ་སྟེ་།
 tad yathā mukhye 'gnau tatsadṛśe ca māṇavake tayoś ca sādhāraṇe dharme kapilatve tīkṣṇatve vā saty agnir māṇavaka ity upacāraḥ kriyate |	དཔེར་ན་དོན་གྱི་དངོས་མེ་དང་དེ་དང་འདྲ་བ་བྲམ་ཟེའི་ཁྱེའུ་དང་། དེ་གཉི་གའི་ཐུན་མོང་གི་ཆོས་སེར་བ་ཉིད་དམ་རྣོ་བ་ཉིད་ཡོད་ན་བྲམ་ཟེའི་ཁྱེའུ་ལ་མེ་ཉེ་བར་འདོགས་པར་བྱེད་པ་ལྟ་བུའོ་ཞེས་ཟེར་རོ་༎ 
 atra hy agnir māṇavaka iti jātir dravyaṃ vopacaryate | ubhayathāpy upacārābhāvaḥ |	འདི་ལ་བྲམ་ཟེའི་ཁྱེའུ་ལ་མེ་ཉེ་བར་འདོགས་པ་ནི་། རིགས་མ་རྫས་ཤིག་ཉེ་བར་འདོགས་གྲང་ན་ཉེ་བར་འདོགས་པ་གཉི་ག་ཡང་མེད་དོ་༎
