skt	tib
 tadvāsanāśrayo hy ālayavijñānam atas tad āśritya pravartate santānenotpadyata ity arthaḥ |	ཀུན་གཞི་རྣམ་པར་ཤེས་པ་ནི་དེའི་བག་ཆགས་ཀྱི་གནས་ཡིན་ཏེ་། དེ་བས་ན་དེ་ལ་གནས་བཅས་ནས་འབྱུང་སྟེ་། རྒྱུན་གྱིས་སྐྱེ་ཞེས་བྱ་བའི་ཐ་ཚིག་གོ་༎
 atha vā yasmin dhātau bhūmau vālayavijñānaṃ vipākas tad api kliṣṭaṃ manas taddhātukaṃ tadbhūmikaṃ ceti tatpratibaddhavṛttitvāt tad āśritya pravartate	ཡང་ན་ཁམས་སེམས་གང་དུ་ཀུན་གཞི་རྣམ་པར་ཤེས་པ་རྣམ་པར་སྨིན་པ་ཐོབ་པར་ཉོན་མོངས་པ་ཅན་གྱི་ཡིད་དེ་ཡང་ཁམས་དེ་དང་ས་དེའི་ཡིན་ཏེ་། དེ་ཀུན་གཞི་དེ་ལ་རག་ལུས་པས་འཇུག་པའི་ཕྱིར་དེ་ལ་གནས་ཏེ་འབྱུང་དེའི་ཡིན་ཏེ་། 
 tadālambam ity ālayavijñānālambanam eva satkāyadṛṣṭyādibhiḥ saṃprayogād ahaṃ mamety ālayavijñānālambanatvāt |	བའོ་༎ དེ་ལ་དམིགས་པ་ཞེས་བྱ་བ་ནི་ཀུན་གཞི་རྣམ་པར་ཤེས་པ་ཉིད་ལ་དམིགས་པ་སྟེ་། འཇིག་ཚོགས་ལ་ལྟ་བ་ལ་སོགས་པ་དང་མཚུངས་པར་ལྡན་བས་ཀུན་གཞི་རྣམ་པར་ཤེས་པ་ལང་དང་ང་ཡིར་དམིགས་པའི་ཕྱིར་རོ་༎
 kathaṃ punar yata eva cittād utpadyate tad eva tadālambanaṃ bhavati |	ཇི་ལྟར་ན་སེམས་གང་ལས་བྱུང་བ་དེ་ཉིད་དེའི་དམིགས་པར་འགྱུར་ཞེ་ན་།
 yathā tad anicchatāṃ keṣāṃcit kasyāñcid avasthāyāṃ yata eva cittān manovijñānam utpadyate tadālambanam eva tad utpadyate |	ཇི་ལྟར་ཁ་ཅིག་དེ་མི་འདོད་ཀྱང་དུས་ལ་ལར་སེམས་གང་ལས་ཡིད་ཀྱི་རྣམ་པར་ཤེས་པ་འབྱུང་བ་དེ་ཉིད་དམིགས་པ་ཡིན་ཞིང་དེ་འབྱུང་བ་ལྟ་བུའོ་༎ 
 manonāma vijñānam iti mana iti nāma ākhyā yasya vijñānasya tad ālayavijñānam āśritya pravarte tadālambanaṃ ca manonāmety anenālayavijñānāt pravṛttivijñānāc ca vyavacchinatti |	ཡིད་ཅེས་༄༡༥༣ཨ་༌་༎ བྱ་བའི་རྣམ་པར་ཤེས་པ་ནི་ཡིད་ཅེས་བྱ་བའི་རྣམ་པར་ཤེས་པ་ཀུན་གཞི་རྣམ་པར་ཤེས་པ་གང་ཡིན་པ་དེ་ལ་བརྟེན་ཏེ་འབྱུང་བའོ་༎ དེ་ལ་དམིགས་པ་ཡིད་ཅེས་བྱ་༎ ཞེས་བྱ་བ་འདིས་ནི་ཀུན་གཞི་རྣམ་པར་ཤེས་པ་དང་། འཇུག་པའི་རྣམ་པར་ཤེས་པ་ལས་རྣམ་པར་འབྱེད་དོ་༎
 tat punaḥ kiṃ svabhāvam ity āha |	ཡང་དེའི་རང་བཞིན་གང་ཡིན་སྙམ་པ་ལ་།
 mananātmakam iti |	ངར་སེམས་བདག་ཉིད་ཅན་ཞེས་བྱ་བ་སྨོས་ཏེ་།
 evaṃ mananātmakatvān mana ity ucyate nairūktena vidhinā |	དེ་ལྟར་ངར་སེམས་པའི་བདག་ཉིད་ཡིན་པས་ངེས་པའི་ཚིག་གི་ཚུལ་གྱིས་ཡིད་ཅེས་བྱའོ་༎
 vijñānasvarūpatvād avaśyaṃ tac caittaiḥ saṃprayujyate |	རྣམ་པར་ཤེས་པའི་རང་གི་ངོ་བོ་ཡིན་པས་དེ་ངེས་པར་སེམས་ལས་བྱུང་བ་རྣམས་དང་མཚུངས་པར་ལྡན་པར་གྱུར་ན་སེམས་ལས་བྱུང་བ་ནི་གང་དག་དང་ཇི་སྙེད་དུས་ནི་།
 idaṃ tu na jñāyate katamais tac caittaiḥ kiyadbhiḥ kiyantaṃ kālaṃ vā saṃprayujyata ity ata āha |	ཇི་སྲིད་དུ་མཚུངས་པར་ལྡན་པར་འགྱུར་བ་དེ་མི་ཤེས་ཏེ་།
 kleśaiś caturbhiḥ sahitaṃ nivṛtāvyākṛtaiḥ sadā | 6ab	དེའི་ཕྱིར་། བསྒྲིབས་ལ་ལུང་དུ་མ་བསྟན་པའི་༎ ཉོན་མོངས་བཞི་དང་རྟག་ཏུ་འགྲོགས་༎
 caittā hi dviprakārāḥ kleśās tad anye ca |	ཞེས་བྱ་བ་སྨོས་སོ་༎ སེམས་ལས་བྱུང་བ་དག་ནི་རྣམ་པ་གཉིས་ཏེ་། ཉོན་མོངས་པ་དང་དེ་ལས་གཞན་པའོ་༎
 tadanyebhyo vyavacchedārtham āha kleśair iti |	དེ་ལས་གཞན་པ་དག་ལས་རྣམ་པར་དབྱེ་བའི་ཕྱིར་། ཉོན་མོངས་པ་ཞེས་བྱ་བ་སྨོས་སོ་༎
 kleśā api ṣaṭ |	ཉོན་མོངས་པའང་དྲུག་སྟེ་།
 na ca taiḥ saṃprayujyate 'taś caturbhir ity āha | sahitam iti saṃprayuktam |	དེ་དག་ཐམས་ཅད་དང་མཚུངས་པར་ལྡན་པ་མ་ཡིན་པས་དེའི་ཕྱིར་བཞི་ཞེས་བྱ་བ་སྨོས་སོ་༎ འགྲོགས་ཞེས་བྱ་བ་ནི་མཚུངས་པར་ལྡན་པའོ་༎
 kleśā api dvividhāḥ | akuśalā nivṛtāvyākṛtāś ca |	ཉོན་མོངས་བ་ཡང་རྣམ་པ་གཉིས་ཏེ་མི་དགེ་བ་དང་། བསྒྲིབས་ལ་ལུང་དུ་མ་བསྟན་པའོ་༎
 akuśalebhyo viśeṣārtham āha nivṛtāvyākṛtair iti |	མི་དགེ་བ་དག་ལས་བྱེ་བྲག་ཏུ་དབྱེ་བའི་ཕྱིར་བསྒྲིབས་ལ་ལུང་དུ་མ་བསྟན་ཞེས་བྱ་བ་སྨོས་སོ་༎ 
 na hi nivṛtena vijñānenākuśalānāṃ saṃprayogaḥ saṃbhavati |	བསྒྲིབས་པའི་རྣམ་པར་ཤེས་པ་ནི་མི་དགེ་བ་རྣམས་དང་མཚུངས་པར་ལྡན་པ་མི་སྨོས་སོ་༎ 
 nivṛtāḥ kliṣṭatvāt |	།
 avyākṛtāḥ kuśalākuśalatvenāvyākaraṇāt |	ལུང་དུ་མ་བསྟན་པ་ནི་དགེ་བ་དང་མི་དགེ་བ་ཉིད་དུ་ལུང་བསྟན་དུ་མེད་པའི་ཕྱིར་རོ་༎ 
 sadeti sarvakālam |	རྟག་ཏུ་ཞེས་བྱ་བ་ནི་དུས་ཐམས་ཅད་དུ་སྟེ་།
 yāvat tad asti tāvat taiḥ saṃprayuktam |	ཇི་སྲིད་དུ་དེ་ཡོད་པ་དེ་སྲིད་དུ་དེ་དག་དང་མཚུངས་པར་ལྡན་ནོ་༎
 sāmānyanirdeśād viśeṣato na jñāyanta iti viśeṣato nirdiśati |	སྤྱིར་བསྟན་པས་ཁྱད་པར་མི་ཤེས་ནས་ཁྱད་པར་སྟོན་ཏོ་༎
 ātmadṛṣṭyātmamohātmamānātmasnehasaṃjñitaiḥ || 6cd	བདག་ཏུ་ལྟ་དང་བདག་ཏུ་རྨོངས་༎
 upādānaskandheṣv ātmeti darśanam ātmadṛṣṭiḥ satkāyadṛṣṭir ity arthaḥ |	བདག་རྒྱལ་བདག་ཆགས་ཞེས་བྱ་བ་སྟེ་། ཉེ་བར་ལེན་པའི་ཕུང་པོ་རྣམས་ལ་བདག་ཏུ་མཐོང་བ་ནི་བདག་ཏུ་ལྟ་བ་སྟེ་། འཇིག་ཚོགས་ལ་ལྟ་བ་ཞེས་བྱ་བའི་ཐ་ཚིག་གོ་༎
 moho 'jñānam |	རྨོངས་པ་ནི་མི་ཤེས་པ་སྟེ་།
 ātmany ajñānam ātmamohaḥ |	བདག་༄༡༥༣བ་མི་ཤེས་པ་ནི་བདག་ཏུ་རྨོངས་པའོ་༎
 ātmaviṣaye māna ātmamāno 'smimāna ity arthaḥ |	བདག་ཏུ་ང་རྒྱལ་ནི་བདག་གི་ཡུལ་ལ་ངར་སེམས་པ་སྟེ་། ངའོ་སྙམ་པའི་ང་རྒྱལ་ཞེས་བྱ་བའི་ཐ་ཚིག་གོ་༎
 ātmani sneha ātmasneha ātmapremety arthaḥ |	བདག་ཆགས་ནི་བདག་ལ་ཆགས་པ་སྟེ་། བདག་ལ་དགའ་ཞེས་བྱ་བའི་ཐ་ཚིག་གོ་༎
 tatrālayavijñānasvarūpe saṃmūḍhaḥ sann ālayavijñāne ātmadṛṣṭim utpādayati | ātmadarśanād yā cittasyonnatiḥ so 'smimānaḥ |	དེ་ལ་ཀུན་གཞི་རྣམ་པར་ཤེས་པའི་རང་གི་ངོ་བོ་ལ་རྨོངས་པར་གྱུར་ན་ཀུན་གཞི་རྣམ་པར་ཤེས་པ་ལ་བདག་ཏུ་ལྟ་བ་འབྱུང་ངོ་༎ བདག་ཏུ་མཐོང་བས་སེམས་ཁེངས་པ་གང་ཡིན་པ་དེ་ནི་ངའོ་སྙམ་པའི་ང་རྒྱལ་ལོ་༎
 etasmiṃs traye saty ātmābhimate vastuni yo 'bhiṣvaṅgaḥ sa ātmasnehaḥ |	དེ་གསུམ་ཡོད་ན་བདག་ཏུ་བསམས་པའི་དངོས་བོ་ལ་མངོན་བར་ཆགས་པ་གང་ཡིན་པ་དེ་ནི་བདག་ལ་ཆགས་པའོ་༎
 āha ca |	ཡང་སྨྲས་པ་།
 avidyayā cātmadṛṣṭyā cāsmimānena tṛṣṇayā |	མ་རིག་པ་དང་བདག་ལྟ་དང་༎ ངའོ་ང་རྒྱལ་སྲིད་འདི་བཞིས་༎
 ebhiś caturbhiḥ saṃkliṣṭaṃ mananālakṣaṇaṃ manaḥ ||	ཀུན་གཞི་ཉོན་མོངས་ཅན་འགྱུར་ཡིད་༎ ངར་སེམས་པ་ཡི་མཚན་ཉིད་དེ་༎
 viparyāsanimittaṃ tu manaḥ kliṣṭaṃ sadaiva tat |	ཕྱིན་ཅི་ལོག་གི་རྒྱུ་བྱེད་པའང་༎ ཡིད་དེ་དེ་དག་ཉོན་མོངས་ཅན་༎
 kuśalāvyākṛte citte sadāhaṅkārakāraṇam ||	སེམས་དགེ་ལུང་དུ་མ་བསྟན་ཚེ་༎
 ete hy ātmamohādayaḥ kleśā manovan navabhūmikāḥ |	རྟག་ཏུ་ངར་འཛིན་རྒྱུ་ཡིན་ནོ་༏་། བདག་ཏུ་རྨོངས་པ་ལ་སོགས་པ་ཉོན་མོངས་པ་དེ་དག་ཀྱང་ཡིད་བཞིན་དུས་དགུ་པ་སྟེ་། འདིར་སྤྱིར་བརྗོད་པ་ཅི་རང་གིས་པ་ཉིད་དང་མཚུངས་པར་ལྡན་ནམ་།
 iha ca sāmānyenābhidhānān na jñāyate kiṃ svabhūmikair eva saṃprayujyate | utānyabhūmikair apīty ata āha |	འོན་ཏེ་གཞན་གྱིས་པ་དག་དང་མཚུངས་པར་ལྡན་པ་མི་ཤེས་ནས་།
 yatrajas tanmayair 7a	དེའི་ཕྱིར་གང་དུ་སྐྱེས་པ་དེའིའོ་ཞེས་བྱ་བ་སྨོས་སོ་༎
 iti | yatra jāto yatrajaḥ |	གང་དུ་སྐྱེས་པ་ནི་གང་དུ་བྱུང་བའོ་༎
 tanmayair iti yatra dhātau bhūmau vā jātas taddhātukais tadbhūmikair eva ca saṃprayujyate |	དེའིའོ་ཞེས་བྱ་བ་ནི་ཁམས་དང་ས་གང་དུ་སྐྱེས་པ་ཁམས་དེ་དང་ས་དེ་ཉིད་ཀྱི་དང་མཚུངས་པར་ལྡན་ཏེ་།
 nānyadhātukair anyabhūmikair vā |	ཁམས་གཞན་དག་ཀྱང་ས་གཞན་དག་གི་དང་ནི་མ་ཡིན་ནོ་༎
 kiṃ punaś caturbhir eva kleśaiḥ saṃprayujyate | nety āha |	ཅི་དེ་ཉོན་མོངས་པ་བཞི་ཉིད་དང་མཚུངས་པར་ལྡན་ནམ་། སྨྲས་པ་མ་ཡིན་ནོ་༎
 anyaiḥ sparśādyaiś ca | 7b saṃprayujyata iti saṃbadhyate |	འོན་ཀྱང་གཞན་རེག་སོགས་ཀྱང་མཚུངས་པར་ལྡན་ནོ་ཞེས་བྱ་བར་སྦྱར་རོ་༎
 caśabdaḥ samuccayārthaḥ |	ཀྱང་ཞེས་བྱ་བའི་སྒྲ་ནི་བསྡུ་བའི་དོན་ཏོ་༎
 sparśādyair iti sparśamanaskāravedanāsaṃjñācetanābhiḥ |	རེག་སོགས་ཞེས་བྱ་བ་ནི་རེག་པ་དང་། ཡིད་ལ་བྱེད་པ་དང་། ཚོར་བ་དང་། འདུ་ཤེས་དང་། སེམས་བ་སྟེ་།
 ete hi pañca dharmāḥ sarvatragatvāt sarvavijñānaiḥ saṃprayujyante |	ཆོས་ལྔ་པོ་དེ་དག་ནི་ཀུན་དུ་འགྲོ་བས་རྣམ་པར་ཤེས་པ་ཐམས་ཅད་དང་མཚུངས་པར་ལྡན་ཏེ་། 
 etair api yatra jātas tanmayair eva saṃprayujyate nānyadhātubhūmikaiḥ |	དེ་དག་ཀྱང་གང་དུ་སྐྱེས་པ་དེ་ཉིད་དང་མཚུངས་པར་ལྡན་གྱི་། ཁམས་དང་ས་གཞན་གྱི་དང་ནི་མ་ཡིན་ནོ་༎
 atha vānyair iti mūlavijñānasaṃprayuktebhyo vyavacchedārtham	ཡང་ན་གཞན་ཞེས་བྱ་བ་ནི་རྩ་བའི་རྣམ་པར་ཤེས་པ་དང་མཚུངས་པར་ལྡན་པ་དག་ལས་རྣམ་པར་དབྱེ་བའི་ཕྱིར་ཏེ་།
 | mūlavijñāne hy anivṛtāvyākṛtāḥ sparśādayaḥ |	རྩ་བའི་རྣམ་པར་ཤེས་པའི་རེག་པ་ལ་སོགས་པ་ནི་མ་༄༡༥༤ཨ་༌་༎ བསྒྲིབས་ལ་ལུང་དུ་མ་བསྟན་པའོ་༎
 kliṣṭe tu manasi manovan nivṛtāvyākṛtāḥ |	ཉོན་མོངས་པ་ཅན་གྱི་ཡིད་ནི་ཡིད་བཞིན་དུ་བསྒྲིབས་ལ་ལུང་དུ་མ་བསྟན་པའོ་༎
 yadi tat kliṣṭaṃ manaḥ kuśalakliṣṭāvyākṛtāvasthāsv aviśeṣeṇa pravartate na tasya tarhi nivṛttir asti |	གལ་ཏེ་ཉོན་མོངས་པ་ཅན་གྱི་ཡིད་དེ་དགེ་བ་དང་། ཉོན་མོངས་པ་ཅན་དང་། ལུང་དུ་མ་བསྟན་པའི་དུས་ན་ཡང་བྱེ་བྲག་མེད་པར་འབྱུང་ན་ནི་དེའི་ལྡོག་པ་མེད་པར་འགྱུར་རོ་༎ 
 anivṛtte ca tasmin kuto mokṣa iti kathaṃ na mokṣābhāvaḥ prasajyate |	མི་ལྡོག་ན་ནི་དེ་ལ་ཐར་པ་ག་ལ་ཡོད་དེ་ཐར་པ་མེད་པར་ཇི་ལྟར་མི་འགྱུར་ཞེ་ན་།
 na prasajyate yasmād	མི་འགྱུར་ཏེ་༎
 arhato na tat |	འདི་ལྟར་དེ་ལ་དགྲ་བཅོམ་མེད་༎
 na nirodhasamāpattau mārge lokottare na ca || 7bcd	འགོག་པའི་སྙོམས་པར་འཇུག་ལ་མེད་༎ འཇིག་རྟེན་འདས་པའི་ལམ་ནའང་མེད་༎
 arhatas tāvad aśeṣakleśaprahāṇāt kliṣṭaṃ mano naivāsti | tad dhi bhāvāgrikabhāvanāprahātavyakleśavad arhattvaprāptyānantaryamārgeṇaiva prahīyate |	དགྲ་བཅོམ་པ་ནི་ཉོན་མོངས་པ་མ་ལུས་པར་སྤངས་པས་ཉོན་མོངས་པ་ཅན་གྱི་ཡིད་མེད་དེ་། དེ་ནི་སྲིད་པའི་རྩེ་མོའི་ཉོན་མོངས་པ་བསྒོམས་པས་སྤང་བར་བྱ་བ་བཞིན་དུ་དགྲ་བཅོམ་པ་ཉིད་ཐོབ་པ་ན་བར་ཆད་མེད་པའི་ལམ་ཉིད་ཀྱིས་སྤོངས་ཏེ་།
 tad anyakleśavad arhattvāvasthāyān naiva vidyate |	དེ་ན་དགྲ་བཅོམ་པ་ཉིད་ཀྱི་ཚེ་ན་ཉོན་མོངས་པ་གཞན་བཞིན་དུ་མེད་དོ་༎
 ākiñcanyāyatanavītarāgasyāpy anāgāmino nirodhasamāpattilābhino mārgabalena nirodhasamāpatter labhyatvāṃ mārgavan nirodhasamāpattyavasthāyām api nirudhyate |	ཕྱིར་མི་འང་བ་ཅི་ཡང་མེད་པའི་སྐྱེ་མཆེད་ཀྱི་འདོད་ཆགས་དང་བྲལ་བ་འགོག་པའི་སྙོམས་པར་འཇུག་པ་ཐོབ་པ་ཡང་ལམ་གྱི་སྟོབས་ཀྱིས་འགོག་པའི་སྙོམས་པར་འཇུག་པ་ཐོབ་པས་འགོག་པའི་སྙོམས་པར་འཇུག་པའི་དུས་ན་ཡང་ལམ་བཞིན་དུ་འགག་པར་འགྱུར་རོ་༎ 
 nirodhāc ca vyutthitasya punar ālayavijñānād eva pravartate |	འགོག་པ་ལས་ལངས་ནས་ཡང་ཀུན་གཞི་རྣམ་པར་ཤེས་པ་ཉིད་ལས་འབྱུང་ངོ་པར་འགྱུར་རོ་༎ 
 mārge lokottare na ceti (7d)	༎ འཇིག་རྟེན་འདས་པའི་ལམ་ནའང་མེད་༎
 lokottaragrahaṇaṃ laukikavyavacchedārtham |	འཇིག་རྟེན་ལས་འདས་པ་སྨོས་པ་ནི་འཇིག་རྟེན་པ་རྣམ་པར་གཅད་པའི་ཕྱིར་རོ་༎
 laukike tu mārge kliṣṭaṃ manaḥ pravartata eva |	འཇིག་རྟེན་པའི་ལམ་ན་ནི་ཉོན་མོངས་པ་ཅན་གྱི་ཡིད་འབྱུང་བ་ཉིད་དོ་༎
 nairātmyadarśanasyātmadarśanapratipakṣatvān na lokottaramārge pravartitum utsaheta |	བདག་མེད་པར་མཐོང་བ་ནི་བདག་ལ་སོགས་པར་ལྟ་བའི་གཉེན་པོ་ཡིན་པས་འཇིག་རྟེན་ལས་འདས་པའི་ལམ་ན་དེ་འབྱུང་བར་མི་ནུས་ཏེ་།
 vipakṣapratipakṣayor ayaugapadyāl lokottaramārge tan nirudhyate |	གཉེན་པོ་དང་མི་མཐུན་པའི་ཕྱོགས་གཉིས་ཅིག་ཅར་དུ་མེད་པས་འཇིག་རྟེན་ལས་འདས་པའི་ལམ་ན་དེ་འགག་གོ་༎ 
 tasmād api vyutthitasya punar ālayavijñānād evotpadyate |	དེ་ལས་ལངས་ནས་ཡང་ཀུན་གཞི་རྣམ་པར་ཤེས་པ་ཉིད་ལས་འབྱུང་ངོ་༎
 dvitīyaḥ pariṇāmo 'yam 8a	འདི་ནི་གྱུར་བ་ཉིད་པའོ་༎ ཞེས་བསྟན་པ་བཤད་ཟིན་ཏོ་༎
 uddiṣṭo nidiṣṭaś ceti nigamayati |	ཞེས་མཇུག་སྡུད་པའོ་༎
 dvitīyapariṇāmāntaraṃ tṛtīyaḥ pariṇāmo vaktavya ity ata āha |	གྱུར་པ་གཉིས་པའི་འོག་ཏུ་གྱུར་བ་གསུམ་པ་བརྗོད་དགོས་པས་།
 tṛtīyaḥ ṣaḍvidhasya yā |	གསུམ་པ་ཡུལ་རྣམ་དྲུག་པོ་ལ་༎
 viṣayasyopalabdhiḥ sā 8bc	དམིགས་པ་གང་ཡིན་དེ་དག་སྟེ་༎
 tṛtīyo vijñānapariṇāma iti vākyaśeṣaḥ |	ཞེས་བྱ་བ་སྨོས་སོ་༎ གསུམ་༄༡༥༤བ་པ་ནི་རྣམ་པར་ཤེས་པ་གྱུར་པ་ཞེས་བྱ་བའི་ཚིག་གི་ལྷག་མའོ་༎
 ṣaḍvidhasyeti ṣaṭprakārasya rūpaśabdagandharasaspraṣṭavya dharmātmakasya viṣayasya yā upalabdhir grahaṇaṃ pratipattir ity arthaḥ |	རྣམ་དྲུག་ཅེས་བྱ་བ་ནི་རྣམ་པ་དྲུག་སྟེ་། གཟུགས་དང་། སྒྲ་དང་། དྲི་དང་། རོ་དང་། རེག་བྱ་དང་། ཆོས་ཀྱི་བདག་ཉིད་ཀྱི་ཡུལ་ལོ་༎ ཡུལ་ལ་དམིགས་པ་གང་ཡིན་པ་ནི་འཛིན་པ་དང་རྟོག་པ་ཞེས་བྱ་བའི་ཐ་ཚིག་གོ་༎
 sā punaḥ kiṃ kuśalākuśalāvyākṛtety ata āha |	དེ་ཡང་ཅི་དགེ་བའམ་མི་དགེ་བའམ་ལུང་དུ་མ་བསྟན་པ་ཞིག་ཅེ་ན་། དེའི་ཕྱིར་།
 kuśalākuśalādvayā || 8d	དགེ་དང་མི་དགེ་གཉི་ག་མིན་༎
 kuśalākuśalādvayety avyākṛtāpi |	ཞེས་བྱ་བ་སྨོས་སོ་༎ དགེ་བ་དང་མི་དགེ་བ་དང་། གཉི་ག་མིན་ཞེས་བྱ་བ་ལུང་དུ་མ་བསྟན་པའང་མ་ཡིན་ཏེ་།
 alobhādveṣāmohaiḥ saṃprayuktā kuśalā |	མ་ཆགས་པ་དང་ཞེ་སྡང་མེད་པ་དང་གཏི་མུག་མེད་པ་དང་མཚུངས་པར་ལྡན་པ་ནི་དགེ་བའོ་༎ 
 lobhadveṣamohaiḥ saṃprayuktākuśalā |	ཆགས་པ་དང་ཞེ་སྡང་དང་གཏི་མུག་དང་མཚུངས་པར་ལྡན་པ་ནི་མི་དགེ་བའོ་༎
 kuśalākuśalair asaṃprayuktādvayā na kuśalā nākuśalety arthaḥ |	དགེ་བ་དང་མི་དགེ་བ་དང་མཚུངས་པར་ལྡན་པ་མ་ཡིན་པ་ནི་གཉི་ག་མ་ཡིན་པ་སྟེ་། དགེ་བའང་མ་ཡིན་མི་དགེ་བའང་མ་ཡིན་ཞེས་བྱ་བའི་ཐ་ཚིག་གོ་༎
 sā punaḥ kīdṛśaiś caitasikaiḥ saṃprayujyate | kiyanto vā tatsaṃprayogiṇaś caitasikā ity ata āha |	དེ་ཡང་སེམས་ལས་བྱུང་བ་ཅི་འདྲ་བ་དག་དང་མཚུངས་པར་ལྡན་པ་དེ་དང་མཚུངས་པར་ལྡན་པའི་སེམས་ལས་བྱུང་བ་ནི་ཅི་སྙེད་ཅིག་ཡོད་ཅེ་ན་། དེའི་ཕྱིར་།
 sarvatragair viniyataiḥ kuśalaiś caitasair asau |	ཀུན་དུ་འགྲོ་བ་བྱེ་བྲག་ངེས་༎
 saṃprayuktā tathā kleśair upakleśais trivedanā || 9	སེམས་ལས་བྱུང་བ་དགེ་བ་དང་༎ དེ་བཞིན་ཉོན་མོངས་ཉེ་ཉོན་མོངས་༎ ཚོར་བ་གསུམ་དང་དེ་མཚུངས་ལྡན་༎
 ya ete sarvatragādaya uddiṣṭās te na vijñāyanta ity atas tatpradarśanārtham āha |	ཞེས་བྱ་བ་སྨོས་སོ་༎ ཀུན་དུ་འགྲོ་བ་ལ་སོགས་པ་གང་བསྟན་པ་དེ་དག་མི་ཤེས་ཏེ་། དེ་བས་ན་དེ་རབ་ཏུ་བསྟན་པའི་ཕྱིར་།
 adyāḥ sparśādayaḥ | 10a	དང་བོའི་རེག་ལ་སོགས་པ་དང་ཞེས་བྱ་བ་སྨོས་སོ་༎ ཐོག་མར་བཤད་པས་དང་པོ་སྟེ་༎
 ādau nirdiṣṭatvād ādyāḥ sarvatragā ity arthaḥ | tathā hi | sadāsparśamanaskāravitsaṃjñācetanānvitam (3cd)	འདི་ལྟར་ཀུན་དུ་འགྲོ་བ་དང་༎ རྟག་ཏུ་རེག་དང་ཡིད་བྱེད་དང་༎ རེག་དང་འདུ་ཤེས་སེམས་པར་ལྡན་༎
 iti prathamato nirdiṣṭāḥ |	ཞེས་བྱ་བ་ཐོག་མ་ཉིད་དུ་བཤད་པའོ་༎
 sparśa eṣām ādir iti sparśādayaḥ |	དེ་དག་གི་དང་པོ་ནི་རེག་པ་ཡིན་པས་རེག་པ་ལ་སོགས་པའོ་༎
